load data
create model
Namespace(batch_size=100, test_batch_size=100, epochs=2000, lr=0.0005, early_stopping_epochs=50, warmup=100, no_cuda=False, seed=14, z1_size=40, z2_size=40, input_size=[1, 28, 28], activation=None, number_components=500, pseudoinputs_mean=0.05, pseudoinputs_std=0.01, use_training_data_init=False, model_name='hvae_2level', prior='vampprior', weighted=False, input_type='binary', flow_layers=8, flow_hidden_dim=128, S=5000, MB=100, dataset_name='static_mnist', dynamic_binarization=False, cuda=True, model_signature='2026-01-21 11:01:41')
perform experiment
beta: 0.01
/root/vae_vampprior/models/Model.py:41: UserWarning: The torch.cuda.*DtypeTensor constructors are no longer recommended. It's best to use methods such as torch.tensor(data, dtype=*, device='cuda') to create tensors. (Triggered internally at /pytorch/torch/csrc/tensor/python_tensor.cpp:78.)
  eps = torch.cuda.FloatTensor(std.size()).normal_()
/root/vae_vampprior/utils/optimizer.py:75: UserWarning: This overload of add_ is deprecated:
	add_(Number alpha, Tensor other)
Consider using one of the following signatures instead:
	add_(Tensor other, *, Number alpha = 1) (Triggered internally at /pytorch/torch/csrc/utils/python_arg_parser.cpp:1805.)
  exp_avg.mul_(beta1).add_(1 - beta1, grad)
Epoch: 1/2000, Time elapsed: 23.86s
* Train loss: 108.24   (RE: 106.43, KL: 181.30)
o Val.  loss: 248.78   (RE: 59.72, KL: 189.06)
--> Early stopping: 0/50 (BEST: 100000.00)

->model saved<-
beta: 0.02
Epoch: 2/2000, Time elapsed: 23.63s
* Train loss: 55.19   (RE: 51.44, KL: 187.72)
o Val.  loss: 234.13   (RE: 46.52, KL: 187.61)
--> Early stopping: 0/50 (BEST: 248.78)

->model saved<-
beta: 0.03
Epoch: 3/2000, Time elapsed: 23.63s
* Train loss: 48.10   (RE: 42.76, KL: 177.85)
o Val.  loss: 215.59   (RE: 41.53, KL: 174.06)
--> Early stopping: 0/50 (BEST: 234.13)

->model saved<-
beta: 0.04
Epoch: 4/2000, Time elapsed: 23.93s
* Train loss: 45.98   (RE: 39.38, KL: 165.06)
o Val.  loss: 203.99   (RE: 39.72, KL: 164.27)
--> Early stopping: 0/50 (BEST: 215.59)

->model saved<-
beta: 0.05
Epoch: 5/2000, Time elapsed: 23.01s
* Train loss: 45.27   (RE: 37.68, KL: 151.88)
o Val.  loss: 185.39   (RE: 38.75, KL: 146.65)
--> Early stopping: 0/50 (BEST: 203.99)

->model saved<-
beta: 0.06
Epoch: 6/2000, Time elapsed: 23.36s
* Train loss: 44.97   (RE: 36.64, KL: 138.86)
o Val.  loss: 178.10   (RE: 37.90, KL: 140.20)
--> Early stopping: 0/50 (BEST: 185.39)

->model saved<-
beta: 0.07
Epoch: 7/2000, Time elapsed: 23.34s
* Train loss: 45.02   (RE: 35.73, KL: 132.72)
o Val.  loss: 170.35   (RE: 37.52, KL: 132.83)
--> Early stopping: 0/50 (BEST: 178.10)

->model saved<-
beta: 0.08
Epoch: 8/2000, Time elapsed: 23.93s
* Train loss: 45.25   (RE: 35.04, KL: 127.62)
o Val.  loss: 164.84   (RE: 37.18, KL: 127.66)
--> Early stopping: 0/50 (BEST: 170.35)

->model saved<-
beta: 0.09
Epoch: 9/2000, Time elapsed: 23.93s
* Train loss: 45.68   (RE: 34.58, KL: 123.39)
o Val.  loss: 160.10   (RE: 36.93, KL: 123.17)
--> Early stopping: 0/50 (BEST: 164.84)

->model saved<-
beta: 0.1
Epoch: 10/2000, Time elapsed: 23.96s
* Train loss: 46.14   (RE: 34.19, KL: 119.53)
o Val.  loss: 156.88   (RE: 36.93, KL: 119.96)
--> Early stopping: 0/50 (BEST: 160.10)

->model saved<-
beta: 0.11
Epoch: 11/2000, Time elapsed: 24.38s
* Train loss: 46.70   (RE: 33.92, KL: 116.20)
o Val.  loss: 152.39   (RE: 36.86, KL: 115.52)
--> Early stopping: 0/50 (BEST: 156.88)

->model saved<-
beta: 0.12
Epoch: 12/2000, Time elapsed: 23.53s
* Train loss: 47.31   (RE: 33.76, KL: 112.95)
o Val.  loss: 149.37   (RE: 36.87, KL: 112.50)
--> Early stopping: 0/50 (BEST: 152.39)

->model saved<-
beta: 0.13
Epoch: 13/2000, Time elapsed: 23.89s
* Train loss: 47.93   (RE: 33.63, KL: 110.05)
o Val.  loss: 146.78   (RE: 36.78, KL: 110.00)
--> Early stopping: 0/50 (BEST: 149.37)

->model saved<-
beta: 0.14
Epoch: 14/2000, Time elapsed: 23.97s
* Train loss: 48.64   (RE: 33.59, KL: 107.44)
o Val.  loss: 143.95   (RE: 37.18, KL: 106.77)
--> Early stopping: 0/50 (BEST: 146.78)

->model saved<-
beta: 0.15
Epoch: 15/2000, Time elapsed: 23.80s
* Train loss: 49.28   (RE: 33.53, KL: 104.96)
o Val.  loss: 141.74   (RE: 36.92, KL: 104.82)
--> Early stopping: 0/50 (BEST: 143.95)

->model saved<-
beta: 0.16
Epoch: 16/2000, Time elapsed: 24.00s
* Train loss: 49.98   (RE: 33.56, KL: 102.58)
o Val.  loss: 139.87   (RE: 37.25, KL: 102.62)
--> Early stopping: 0/50 (BEST: 141.74)

->model saved<-
beta: 0.17
Epoch: 17/2000, Time elapsed: 24.15s
* Train loss: 50.66   (RE: 33.60, KL: 100.37)
o Val.  loss: 137.70   (RE: 37.25, KL: 100.45)
--> Early stopping: 0/50 (BEST: 139.87)

->model saved<-
beta: 0.18
Epoch: 18/2000, Time elapsed: 24.07s
* Train loss: 51.37   (RE: 33.68, KL: 98.29)
o Val.  loss: 136.71   (RE: 37.40, KL: 99.30)
--> Early stopping: 0/50 (BEST: 137.70)

->model saved<-
beta: 0.19
Epoch: 19/2000, Time elapsed: 23.14s
* Train loss: 52.07   (RE: 33.76, KL: 96.36)
o Val.  loss: 134.63   (RE: 37.68, KL: 96.95)
--> Early stopping: 0/50 (BEST: 136.71)

->model saved<-
beta: 0.2
Epoch: 20/2000, Time elapsed: 23.87s
* Train loss: 52.75   (RE: 33.87, KL: 94.41)
o Val.  loss: 132.70   (RE: 37.82, KL: 94.89)
--> Early stopping: 0/50 (BEST: 134.63)

->model saved<-
beta: 0.21
Epoch: 21/2000, Time elapsed: 24.18s
* Train loss: 53.43   (RE: 33.99, KL: 92.59)
o Val.  loss: 131.25   (RE: 38.16, KL: 93.09)
--> Early stopping: 0/50 (BEST: 132.70)

->model saved<-
beta: 0.22
Epoch: 22/2000, Time elapsed: 24.14s
* Train loss: 54.14   (RE: 34.15, KL: 90.90)
o Val.  loss: 129.74   (RE: 38.25, KL: 91.49)
--> Early stopping: 0/50 (BEST: 131.25)

->model saved<-
beta: 0.23
Epoch: 23/2000, Time elapsed: 24.02s
* Train loss: 54.83   (RE: 34.30, KL: 89.26)
o Val.  loss: 128.73   (RE: 38.29, KL: 90.45)
--> Early stopping: 0/50 (BEST: 129.74)

->model saved<-
beta: 0.24
Epoch: 24/2000, Time elapsed: 23.79s
* Train loss: 55.50   (RE: 34.46, KL: 87.63)
o Val.  loss: 126.44   (RE: 38.62, KL: 87.81)
--> Early stopping: 0/50 (BEST: 128.73)

->model saved<-
beta: 0.25
Epoch: 25/2000, Time elapsed: 23.60s
* Train loss: 56.16   (RE: 34.64, KL: 86.08)
o Val.  loss: 125.77   (RE: 38.89, KL: 86.89)
--> Early stopping: 0/50 (BEST: 126.44)

->model saved<-
beta: 0.26
Epoch: 26/2000, Time elapsed: 23.65s
* Train loss: 56.83   (RE: 34.83, KL: 84.63)
o Val.  loss: 124.76   (RE: 39.01, KL: 85.76)
--> Early stopping: 0/50 (BEST: 125.77)

->model saved<-
beta: 0.27
Epoch: 27/2000, Time elapsed: 24.30s
* Train loss: 57.51   (RE: 35.03, KL: 83.26)
o Val.  loss: 122.54   (RE: 39.34, KL: 83.20)
--> Early stopping: 0/50 (BEST: 124.76)

->model saved<-
beta: 0.28
Epoch: 28/2000, Time elapsed: 24.08s
* Train loss: 58.17   (RE: 35.25, KL: 81.85)
o Val.  loss: 122.26   (RE: 39.54, KL: 82.72)
--> Early stopping: 0/50 (BEST: 122.54)

->model saved<-
beta: 0.29
Epoch: 29/2000, Time elapsed: 22.66s
* Train loss: 58.82   (RE: 35.47, KL: 80.51)
o Val.  loss: 121.22   (RE: 39.60, KL: 81.62)
--> Early stopping: 0/50 (BEST: 122.26)

->model saved<-
beta: 0.3
Epoch: 30/2000, Time elapsed: 24.18s
* Train loss: 59.47   (RE: 35.70, KL: 79.26)
o Val.  loss: 119.73   (RE: 40.28, KL: 79.46)
--> Early stopping: 0/50 (BEST: 121.22)

->model saved<-
beta: 0.31
Epoch: 31/2000, Time elapsed: 23.75s
* Train loss: 60.13   (RE: 35.94, KL: 78.02)
o Val.  loss: 118.23   (RE: 40.83, KL: 77.40)
--> Early stopping: 0/50 (BEST: 119.73)

->model saved<-
beta: 0.32
Epoch: 32/2000, Time elapsed: 21.84s
* Train loss: 60.74   (RE: 36.16, KL: 76.83)
o Val.  loss: 117.83   (RE: 40.55, KL: 77.28)
--> Early stopping: 0/50 (BEST: 118.23)

->model saved<-
beta: 0.33
Epoch: 33/2000, Time elapsed: 23.32s
* Train loss: 61.39   (RE: 36.40, KL: 75.70)
o Val.  loss: 116.75   (RE: 40.90, KL: 75.85)
--> Early stopping: 0/50 (BEST: 117.83)

->model saved<-
beta: 0.34
Epoch: 34/2000, Time elapsed: 23.77s
* Train loss: 62.01   (RE: 36.67, KL: 74.52)
o Val.  loss: 116.58   (RE: 40.97, KL: 75.61)
--> Early stopping: 0/50 (BEST: 116.75)

->model saved<-
beta: 0.35
Epoch: 35/2000, Time elapsed: 23.38s
* Train loss: 62.62   (RE: 36.93, KL: 73.41)
o Val.  loss: 116.02   (RE: 41.26, KL: 74.76)
--> Early stopping: 0/50 (BEST: 116.58)

->model saved<-
beta: 0.36
Epoch: 36/2000, Time elapsed: 23.06s
* Train loss: 63.22   (RE: 37.17, KL: 72.35)
o Val.  loss: 114.41   (RE: 41.82, KL: 72.59)
--> Early stopping: 0/50 (BEST: 116.02)

->model saved<-
beta: 0.37
Epoch: 37/2000, Time elapsed: 23.26s
* Train loss: 63.86   (RE: 37.48, KL: 71.29)
o Val.  loss: 114.02   (RE: 41.71, KL: 72.31)
--> Early stopping: 0/50 (BEST: 114.41)

->model saved<-
beta: 0.38
Epoch: 38/2000, Time elapsed: 23.82s
* Train loss: 64.44   (RE: 37.74, KL: 70.26)
o Val.  loss: 113.20   (RE: 42.22, KL: 70.98)
--> Early stopping: 0/50 (BEST: 114.02)

->model saved<-
beta: 0.39
Epoch: 39/2000, Time elapsed: 23.65s
* Train loss: 65.02   (RE: 38.00, KL: 69.27)
o Val.  loss: 112.51   (RE: 42.42, KL: 70.09)
--> Early stopping: 0/50 (BEST: 113.20)

->model saved<-
beta: 0.4
Epoch: 40/2000, Time elapsed: 23.57s
* Train loss: 65.60   (RE: 38.29, KL: 68.28)
o Val.  loss: 112.43   (RE: 42.30, KL: 70.13)
--> Early stopping: 0/50 (BEST: 112.51)

->model saved<-
beta: 0.41
Epoch: 41/2000, Time elapsed: 23.36s
* Train loss: 66.18   (RE: 38.56, KL: 67.36)
o Val.  loss: 111.30   (RE: 43.06, KL: 68.24)
--> Early stopping: 0/50 (BEST: 112.43)

->model saved<-
beta: 0.42
Epoch: 42/2000, Time elapsed: 23.34s
* Train loss: 66.76   (RE: 38.86, KL: 66.42)
o Val.  loss: 110.80   (RE: 43.31, KL: 67.49)
--> Early stopping: 0/50 (BEST: 111.30)

->model saved<-
beta: 0.43
Epoch: 43/2000, Time elapsed: 23.80s
* Train loss: 67.31   (RE: 39.13, KL: 65.52)
o Val.  loss: 109.58   (RE: 43.78, KL: 65.80)
--> Early stopping: 0/50 (BEST: 110.80)

->model saved<-
beta: 0.44
Epoch: 44/2000, Time elapsed: 23.64s
* Train loss: 67.89   (RE: 39.45, KL: 64.64)
o Val.  loss: 108.81   (RE: 44.25, KL: 64.56)
--> Early stopping: 0/50 (BEST: 109.58)

->model saved<-
beta: 0.45
Epoch: 45/2000, Time elapsed: 23.32s
* Train loss: 68.41   (RE: 39.71, KL: 63.78)
o Val.  loss: 108.58   (RE: 44.31, KL: 64.27)
--> Early stopping: 0/50 (BEST: 108.81)

->model saved<-
beta: 0.46
Epoch: 46/2000, Time elapsed: 23.66s
* Train loss: 68.95   (RE: 40.02, KL: 62.91)
o Val.  loss: 107.99   (RE: 44.61, KL: 63.38)
--> Early stopping: 0/50 (BEST: 108.58)

->model saved<-
beta: 0.47
Epoch: 47/2000, Time elapsed: 23.32s
* Train loss: 69.51   (RE: 40.33, KL: 62.09)
o Val.  loss: 107.83   (RE: 44.83, KL: 63.00)
--> Early stopping: 0/50 (BEST: 107.99)

->model saved<-
beta: 0.48
Epoch: 48/2000, Time elapsed: 23.96s
* Train loss: 70.05   (RE: 40.61, KL: 61.33)
o Val.  loss: 106.91   (RE: 45.45, KL: 61.46)
--> Early stopping: 0/50 (BEST: 107.83)

->model saved<-
beta: 0.49
Epoch: 49/2000, Time elapsed: 23.71s
* Train loss: 70.56   (RE: 40.92, KL: 60.50)
o Val.  loss: 106.74   (RE: 45.45, KL: 61.29)
--> Early stopping: 0/50 (BEST: 106.91)

->model saved<-
beta: 0.5
Epoch: 50/2000, Time elapsed: 23.71s
* Train loss: 71.07   (RE: 41.21, KL: 59.71)
o Val.  loss: 105.98   (RE: 45.75, KL: 60.23)
--> Early stopping: 0/50 (BEST: 106.74)

->model saved<-
beta: 0.51
Epoch: 51/2000, Time elapsed: 23.43s
* Train loss: 71.59   (RE: 41.56, KL: 58.90)
o Val.  loss: 105.75   (RE: 46.10, KL: 59.65)
--> Early stopping: 0/50 (BEST: 105.98)

->model saved<-
beta: 0.52
Epoch: 52/2000, Time elapsed: 23.10s
* Train loss: 72.11   (RE: 41.84, KL: 58.21)
o Val.  loss: 104.82   (RE: 46.50, KL: 58.31)
--> Early stopping: 0/50 (BEST: 105.75)

->model saved<-
beta: 0.53
Epoch: 53/2000, Time elapsed: 23.98s
* Train loss: 72.63   (RE: 42.18, KL: 57.45)
o Val.  loss: 104.65   (RE: 46.80, KL: 57.85)
--> Early stopping: 0/50 (BEST: 104.82)

->model saved<-
beta: 0.54
Epoch: 54/2000, Time elapsed: 23.80s
* Train loss: 73.11   (RE: 42.45, KL: 56.77)
o Val.  loss: 104.36   (RE: 47.07, KL: 57.29)
--> Early stopping: 0/50 (BEST: 104.65)

->model saved<-
beta: 0.55
Epoch: 55/2000, Time elapsed: 23.97s
* Train loss: 73.61   (RE: 42.79, KL: 56.03)
o Val.  loss: 104.00   (RE: 46.99, KL: 57.01)
--> Early stopping: 0/50 (BEST: 104.36)

->model saved<-
beta: 0.56
Epoch: 56/2000, Time elapsed: 23.55s
* Train loss: 74.08   (RE: 43.09, KL: 55.34)
o Val.  loss: 103.24   (RE: 47.95, KL: 55.29)
--> Early stopping: 0/50 (BEST: 104.00)

->model saved<-
beta: 0.57
Epoch: 57/2000, Time elapsed: 23.87s
* Train loss: 74.57   (RE: 43.42, KL: 54.65)
o Val.  loss: 103.13   (RE: 47.79, KL: 55.34)
--> Early stopping: 0/50 (BEST: 103.24)

->model saved<-
beta: 0.58
Epoch: 58/2000, Time elapsed: 23.49s
* Train loss: 75.06   (RE: 43.77, KL: 53.93)
o Val.  loss: 102.94   (RE: 48.00, KL: 54.94)
--> Early stopping: 0/50 (BEST: 103.13)

->model saved<-
beta: 0.59
Epoch: 59/2000, Time elapsed: 24.66s
* Train loss: 75.54   (RE: 44.07, KL: 53.35)
o Val.  loss: 102.30   (RE: 48.84, KL: 53.46)
--> Early stopping: 0/50 (BEST: 102.94)

->model saved<-
beta: 0.6
Epoch: 60/2000, Time elapsed: 23.66s
* Train loss: 76.05   (RE: 44.42, KL: 52.71)
o Val.  loss: 102.19   (RE: 48.44, KL: 53.75)
--> Early stopping: 0/50 (BEST: 102.30)

->model saved<-
beta: 0.61
Epoch: 61/2000, Time elapsed: 23.41s
* Train loss: 76.47   (RE: 44.72, KL: 52.04)
o Val.  loss: 101.88   (RE: 49.00, KL: 52.88)
--> Early stopping: 0/50 (BEST: 102.19)

->model saved<-
beta: 0.62
Epoch: 62/2000, Time elapsed: 23.64s
* Train loss: 76.90   (RE: 45.04, KL: 51.40)
o Val.  loss: 101.69   (RE: 49.27, KL: 52.42)
--> Early stopping: 0/50 (BEST: 101.88)

->model saved<-
beta: 0.63
Epoch: 63/2000, Time elapsed: 24.08s
* Train loss: 77.37   (RE: 45.35, KL: 50.83)
o Val.  loss: 100.87   (RE: 49.64, KL: 51.23)
--> Early stopping: 0/50 (BEST: 101.69)

->model saved<-
beta: 0.64
Epoch: 64/2000, Time elapsed: 24.70s
* Train loss: 77.79   (RE: 45.69, KL: 50.16)
o Val.  loss: 100.87   (RE: 49.97, KL: 50.90)
--> Early stopping: 0/50 (BEST: 100.87)

beta: 0.65
Epoch: 65/2000, Time elapsed: 23.17s
* Train loss: 78.22   (RE: 46.02, KL: 49.54)
o Val.  loss: 100.63   (RE: 50.19, KL: 50.44)
--> Early stopping: 0/50 (BEST: 100.87)

->model saved<-
beta: 0.66
Epoch: 66/2000, Time elapsed: 23.39s
* Train loss: 78.67   (RE: 46.34, KL: 48.99)
o Val.  loss: 100.27   (RE: 50.85, KL: 49.42)
--> Early stopping: 0/50 (BEST: 100.63)

->model saved<-
beta: 0.67
Epoch: 67/2000, Time elapsed: 24.11s
* Train loss: 79.10   (RE: 46.67, KL: 48.39)
o Val.  loss: 99.90   (RE: 50.87, KL: 49.03)
--> Early stopping: 0/50 (BEST: 100.27)

->model saved<-
beta: 0.68
Epoch: 68/2000, Time elapsed: 23.57s
* Train loss: 79.51   (RE: 47.01, KL: 47.79)
o Val.  loss: 99.79   (RE: 50.93, KL: 48.86)
--> Early stopping: 0/50 (BEST: 99.90)

->model saved<-
beta: 0.69
Epoch: 69/2000, Time elapsed: 23.90s
* Train loss: 79.97   (RE: 47.35, KL: 47.28)
o Val.  loss: 99.26   (RE: 51.63, KL: 47.63)
--> Early stopping: 0/50 (BEST: 99.79)

->model saved<-
beta: 0.7
Epoch: 70/2000, Time elapsed: 24.09s
* Train loss: 80.36   (RE: 47.66, KL: 46.71)
o Val.  loss: 99.13   (RE: 51.87, KL: 47.26)
--> Early stopping: 0/50 (BEST: 99.26)

->model saved<-
beta: 0.71
Epoch: 71/2000, Time elapsed: 22.55s
* Train loss: 80.75   (RE: 47.97, KL: 46.18)
o Val.  loss: 99.24   (RE: 51.86, KL: 47.38)
--> Early stopping: 0/50 (BEST: 99.13)

beta: 0.72
Epoch: 72/2000, Time elapsed: 24.63s
* Train loss: 81.17   (RE: 48.33, KL: 45.61)
o Val.  loss: 98.59   (RE: 52.34, KL: 46.26)
--> Early stopping: 0/50 (BEST: 99.13)

->model saved<-
beta: 0.73
Epoch: 73/2000, Time elapsed: 24.09s
* Train loss: 81.54   (RE: 48.59, KL: 45.14)
o Val.  loss: 98.54   (RE: 52.36, KL: 46.18)
--> Early stopping: 0/50 (BEST: 98.59)

->model saved<-
beta: 0.74
Epoch: 74/2000, Time elapsed: 23.31s
* Train loss: 81.94   (RE: 48.95, KL: 44.57)
o Val.  loss: 98.15   (RE: 52.95, KL: 45.20)
--> Early stopping: 0/50 (BEST: 98.54)

->model saved<-
beta: 0.75
Epoch: 75/2000, Time elapsed: 24.83s
* Train loss: 82.33   (RE: 49.29, KL: 44.05)
o Val.  loss: 97.88   (RE: 53.45, KL: 44.43)
--> Early stopping: 0/50 (BEST: 98.15)

->model saved<-
beta: 0.76
Epoch: 76/2000, Time elapsed: 23.93s
* Train loss: 82.73   (RE: 49.62, KL: 43.56)
o Val.  loss: 97.83   (RE: 53.40, KL: 44.44)
--> Early stopping: 0/50 (BEST: 97.88)

->model saved<-
beta: 0.77
Epoch: 77/2000, Time elapsed: 23.56s
* Train loss: 83.10   (RE: 49.93, KL: 43.08)
o Val.  loss: 97.65   (RE: 54.04, KL: 43.60)
--> Early stopping: 0/50 (BEST: 97.83)

->model saved<-
beta: 0.78
Epoch: 78/2000, Time elapsed: 23.74s
* Train loss: 83.45   (RE: 50.25, KL: 42.56)
o Val.  loss: 97.16   (RE: 54.41, KL: 42.75)
--> Early stopping: 0/50 (BEST: 97.65)

->model saved<-
beta: 0.79
Epoch: 79/2000, Time elapsed: 23.56s
* Train loss: 83.82   (RE: 50.57, KL: 42.08)
o Val.  loss: 97.12   (RE: 54.45, KL: 42.67)
--> Early stopping: 0/50 (BEST: 97.16)

->model saved<-
beta: 0.8
Epoch: 80/2000, Time elapsed: 23.88s
* Train loss: 84.20   (RE: 50.91, KL: 41.61)
o Val.  loss: 96.86   (RE: 55.11, KL: 41.75)
--> Early stopping: 0/50 (BEST: 97.12)

->model saved<-
beta: 0.81
Epoch: 81/2000, Time elapsed: 23.45s
* Train loss: 84.53   (RE: 51.20, KL: 41.15)
o Val.  loss: 96.98   (RE: 54.89, KL: 42.09)
--> Early stopping: 0/50 (BEST: 96.86)

beta: 0.82
Epoch: 82/2000, Time elapsed: 23.12s
* Train loss: 84.88   (RE: 51.54, KL: 40.67)
o Val.  loss: 96.72   (RE: 55.63, KL: 41.09)
--> Early stopping: 0/50 (BEST: 96.86)

->model saved<-
beta: 0.83
Epoch: 83/2000, Time elapsed: 22.59s
* Train loss: 85.25   (RE: 51.86, KL: 40.22)
o Val.  loss: 96.65   (RE: 55.54, KL: 41.11)
--> Early stopping: 0/50 (BEST: 96.72)

->model saved<-
beta: 0.84
Epoch: 84/2000, Time elapsed: 23.15s
* Train loss: 85.55   (RE: 52.18, KL: 39.72)
o Val.  loss: 96.38   (RE: 55.60, KL: 40.78)
--> Early stopping: 0/50 (BEST: 96.65)

->model saved<-
beta: 0.85
Epoch: 85/2000, Time elapsed: 23.62s
* Train loss: 85.95   (RE: 52.53, KL: 39.31)
o Val.  loss: 96.32   (RE: 56.46, KL: 39.86)
--> Early stopping: 0/50 (BEST: 96.38)

->model saved<-
beta: 0.86
Epoch: 86/2000, Time elapsed: 23.35s
* Train loss: 86.27   (RE: 52.83, KL: 38.88)
o Val.  loss: 96.12   (RE: 56.73, KL: 39.38)
--> Early stopping: 0/50 (BEST: 96.32)

->model saved<-
beta: 0.87
Epoch: 87/2000, Time elapsed: 23.62s
* Train loss: 86.60   (RE: 53.13, KL: 38.47)
o Val.  loss: 95.84   (RE: 56.59, KL: 39.25)
--> Early stopping: 0/50 (BEST: 96.12)

->model saved<-
beta: 0.88
Epoch: 88/2000, Time elapsed: 23.63s
* Train loss: 86.94   (RE: 53.48, KL: 38.02)
o Val.  loss: 95.72   (RE: 57.07, KL: 38.66)
--> Early stopping: 0/50 (BEST: 95.84)

->model saved<-
beta: 0.89
Epoch: 89/2000, Time elapsed: 23.61s
* Train loss: 87.24   (RE: 53.77, KL: 37.61)
o Val.  loss: 95.78   (RE: 57.40, KL: 38.38)
--> Early stopping: 0/50 (BEST: 95.72)

beta: 0.9
Epoch: 90/2000, Time elapsed: 23.55s
* Train loss: 87.59   (RE: 54.11, KL: 37.20)
o Val.  loss: 95.39   (RE: 57.82, KL: 37.58)
--> Early stopping: 0/50 (BEST: 95.72)

->model saved<-
beta: 0.91
Epoch: 91/2000, Time elapsed: 23.84s
* Train loss: 87.87   (RE: 54.38, KL: 36.80)
o Val.  loss: 95.40   (RE: 58.25, KL: 37.15)
--> Early stopping: 0/50 (BEST: 95.39)

beta: 0.92
Epoch: 92/2000, Time elapsed: 23.95s
* Train loss: 88.18   (RE: 54.68, KL: 36.42)
o Val.  loss: 95.17   (RE: 58.30, KL: 36.87)
--> Early stopping: 0/50 (BEST: 95.39)

->model saved<-
beta: 0.93
Epoch: 93/2000, Time elapsed: 23.20s
* Train loss: 88.49   (RE: 55.00, KL: 36.00)
o Val.  loss: 95.21   (RE: 58.77, KL: 36.44)
--> Early stopping: 0/50 (BEST: 95.17)

beta: 0.94
Epoch: 94/2000, Time elapsed: 22.15s
* Train loss: 88.80   (RE: 55.32, KL: 35.61)
o Val.  loss: 95.05   (RE: 58.97, KL: 36.08)
--> Early stopping: 0/50 (BEST: 95.17)

->model saved<-
beta: 0.95
Epoch: 95/2000, Time elapsed: 23.36s
* Train loss: 89.11   (RE: 55.62, KL: 35.25)
o Val.  loss: 94.92   (RE: 59.21, KL: 35.72)
--> Early stopping: 0/50 (BEST: 95.05)

->model saved<-
beta: 0.96
Epoch: 96/2000, Time elapsed: 24.42s
* Train loss: 89.40   (RE: 55.92, KL: 34.87)
o Val.  loss: 94.87   (RE: 59.72, KL: 35.15)
--> Early stopping: 0/50 (BEST: 94.92)

->model saved<-
beta: 0.97
Epoch: 97/2000, Time elapsed: 23.04s
* Train loss: 89.68   (RE: 56.21, KL: 34.51)
o Val.  loss: 94.82   (RE: 59.87, KL: 34.95)
--> Early stopping: 0/50 (BEST: 94.87)

->model saved<-
beta: 0.98
Epoch: 98/2000, Time elapsed: 23.25s
* Train loss: 89.93   (RE: 56.46, KL: 34.16)
o Val.  loss: 94.61   (RE: 60.09, KL: 34.51)
--> Early stopping: 0/50 (BEST: 94.82)

->model saved<-
beta: 0.99
Epoch: 99/2000, Time elapsed: 23.64s
* Train loss: 90.28   (RE: 56.80, KL: 33.81)
o Val.  loss: 94.60   (RE: 60.28, KL: 34.32)
--> Early stopping: 0/50 (BEST: 94.61)

->model saved<-
beta: 1.0
Epoch: 100/2000, Time elapsed: 24.08s
* Train loss: 90.53   (RE: 57.09, KL: 33.44)
o Val.  loss: 94.65   (RE: 60.17, KL: 34.49)
--> Early stopping: 0/50 (BEST: 94.60)

beta: 1.0
Epoch: 101/2000, Time elapsed: 23.95s
* Train loss: 90.46   (RE: 57.18, KL: 33.28)
o Val.  loss: 94.45   (RE: 60.82, KL: 33.63)
--> Early stopping: 1/50 (BEST: 94.60)

->model saved<-
beta: 1.0
Epoch: 102/2000, Time elapsed: 23.33s
* Train loss: 90.40   (RE: 57.26, KL: 33.14)
o Val.  loss: 94.40   (RE: 60.88, KL: 33.52)
--> Early stopping: 0/50 (BEST: 94.45)

->model saved<-
beta: 1.0
Epoch: 103/2000, Time elapsed: 23.44s
* Train loss: 90.31   (RE: 57.29, KL: 33.02)
o Val.  loss: 94.20   (RE: 60.58, KL: 33.62)
--> Early stopping: 0/50 (BEST: 94.40)

->model saved<-
beta: 1.0
Epoch: 104/2000, Time elapsed: 23.39s
* Train loss: 90.28   (RE: 57.38, KL: 32.90)
o Val.  loss: 94.18   (RE: 60.55, KL: 33.62)
--> Early stopping: 0/50 (BEST: 94.20)

->model saved<-
beta: 1.0
Epoch: 105/2000, Time elapsed: 23.59s
* Train loss: 90.24   (RE: 57.43, KL: 32.81)
o Val.  loss: 94.20   (RE: 60.88, KL: 33.32)
--> Early stopping: 0/50 (BEST: 94.18)

beta: 1.0
Epoch: 106/2000, Time elapsed: 22.72s
* Train loss: 90.18   (RE: 57.43, KL: 32.75)
o Val.  loss: 94.09   (RE: 61.10, KL: 32.99)
--> Early stopping: 1/50 (BEST: 94.18)

->model saved<-
beta: 1.0
Epoch: 107/2000, Time elapsed: 23.71s
* Train loss: 90.08   (RE: 57.44, KL: 32.63)
o Val.  loss: 94.05   (RE: 61.11, KL: 32.93)
--> Early stopping: 0/50 (BEST: 94.09)

->model saved<-
beta: 1.0
Epoch: 108/2000, Time elapsed: 21.82s
* Train loss: 90.03   (RE: 57.48, KL: 32.55)
o Val.  loss: 94.09   (RE: 60.90, KL: 33.19)
--> Early stopping: 0/50 (BEST: 94.05)

beta: 1.0
Epoch: 109/2000, Time elapsed: 23.76s
* Train loss: 90.01   (RE: 57.54, KL: 32.47)
o Val.  loss: 94.02   (RE: 61.28, KL: 32.74)
--> Early stopping: 1/50 (BEST: 94.05)

->model saved<-
beta: 1.0
Epoch: 110/2000, Time elapsed: 23.79s
* Train loss: 89.90   (RE: 57.50, KL: 32.40)
o Val.  loss: 93.96   (RE: 61.06, KL: 32.90)
--> Early stopping: 0/50 (BEST: 94.02)

->model saved<-
beta: 1.0
Epoch: 111/2000, Time elapsed: 23.40s
* Train loss: 89.85   (RE: 57.50, KL: 32.35)
o Val.  loss: 93.95   (RE: 60.96, KL: 32.99)
--> Early stopping: 0/50 (BEST: 93.96)

->model saved<-
beta: 1.0
Epoch: 112/2000, Time elapsed: 24.00s
* Train loss: 89.81   (RE: 57.56, KL: 32.25)
o Val.  loss: 93.75   (RE: 61.24, KL: 32.52)
--> Early stopping: 0/50 (BEST: 93.95)

->model saved<-
beta: 1.0
Epoch: 113/2000, Time elapsed: 23.41s
* Train loss: 89.77   (RE: 57.57, KL: 32.21)
o Val.  loss: 93.67   (RE: 61.00, KL: 32.68)
--> Early stopping: 0/50 (BEST: 93.75)

->model saved<-
beta: 1.0
Epoch: 114/2000, Time elapsed: 22.53s
* Train loss: 89.72   (RE: 57.58, KL: 32.14)
o Val.  loss: 93.82   (RE: 61.44, KL: 32.39)
--> Early stopping: 0/50 (BEST: 93.67)

beta: 1.0
Epoch: 115/2000, Time elapsed: 22.69s
* Train loss: 89.66   (RE: 57.61, KL: 32.05)
o Val.  loss: 93.64   (RE: 60.83, KL: 32.81)
--> Early stopping: 1/50 (BEST: 93.67)

->model saved<-
beta: 1.0
Epoch: 116/2000, Time elapsed: 23.19s
* Train loss: 89.60   (RE: 57.58, KL: 32.02)
o Val.  loss: 93.60   (RE: 61.39, KL: 32.21)
--> Early stopping: 0/50 (BEST: 93.64)

->model saved<-
beta: 1.0
Epoch: 117/2000, Time elapsed: 23.07s
* Train loss: 89.53   (RE: 57.59, KL: 31.93)
o Val.  loss: 93.61   (RE: 61.04, KL: 32.56)
--> Early stopping: 0/50 (BEST: 93.60)

beta: 1.0
Epoch: 118/2000, Time elapsed: 23.03s
* Train loss: 89.48   (RE: 57.57, KL: 31.91)
o Val.  loss: 93.59   (RE: 61.28, KL: 32.31)
--> Early stopping: 1/50 (BEST: 93.60)

->model saved<-
beta: 1.0
Epoch: 119/2000, Time elapsed: 22.94s
* Train loss: 89.46   (RE: 57.60, KL: 31.86)
o Val.  loss: 93.49   (RE: 61.23, KL: 32.26)
--> Early stopping: 0/50 (BEST: 93.59)

->model saved<-
beta: 1.0
Epoch: 120/2000, Time elapsed: 23.65s
* Train loss: 89.41   (RE: 57.58, KL: 31.83)
o Val.  loss: 93.55   (RE: 61.49, KL: 32.06)
--> Early stopping: 0/50 (BEST: 93.49)

beta: 1.0
Epoch: 121/2000, Time elapsed: 23.57s
* Train loss: 89.34   (RE: 57.61, KL: 31.73)
o Val.  loss: 93.49   (RE: 60.94, KL: 32.55)
--> Early stopping: 1/50 (BEST: 93.49)

->model saved<-
beta: 1.0
Epoch: 122/2000, Time elapsed: 23.50s
* Train loss: 89.26   (RE: 57.57, KL: 31.69)
o Val.  loss: 93.32   (RE: 61.03, KL: 32.30)
--> Early stopping: 0/50 (BEST: 93.49)

->model saved<-
beta: 1.0
Epoch: 123/2000, Time elapsed: 24.83s
* Train loss: 89.22   (RE: 57.58, KL: 31.64)
o Val.  loss: 93.47   (RE: 61.30, KL: 32.17)
--> Early stopping: 0/50 (BEST: 93.32)

beta: 1.0
Epoch: 124/2000, Time elapsed: 23.91s
* Train loss: 89.20   (RE: 57.59, KL: 31.62)
o Val.  loss: 93.39   (RE: 61.09, KL: 32.30)
--> Early stopping: 1/50 (BEST: 93.32)

beta: 1.0
Epoch: 125/2000, Time elapsed: 22.90s
* Train loss: 89.14   (RE: 57.56, KL: 31.59)
o Val.  loss: 93.28   (RE: 60.87, KL: 32.41)
--> Early stopping: 2/50 (BEST: 93.32)

->model saved<-
beta: 1.0
Epoch: 126/2000, Time elapsed: 23.85s
* Train loss: 89.11   (RE: 57.58, KL: 31.54)
o Val.  loss: 93.22   (RE: 60.78, KL: 32.43)
--> Early stopping: 0/50 (BEST: 93.28)

->model saved<-
beta: 1.0
Epoch: 127/2000, Time elapsed: 23.53s
* Train loss: 89.02   (RE: 57.57, KL: 31.45)
o Val.  loss: 93.26   (RE: 61.07, KL: 32.19)
--> Early stopping: 0/50 (BEST: 93.22)

beta: 1.0
Epoch: 128/2000, Time elapsed: 23.69s
* Train loss: 88.99   (RE: 57.55, KL: 31.44)
o Val.  loss: 93.15   (RE: 60.96, KL: 32.19)
--> Early stopping: 1/50 (BEST: 93.22)

->model saved<-
beta: 1.0
Epoch: 129/2000, Time elapsed: 23.16s
* Train loss: 88.97   (RE: 57.54, KL: 31.43)
o Val.  loss: 93.25   (RE: 61.42, KL: 31.83)
--> Early stopping: 0/50 (BEST: 93.15)

beta: 1.0
Epoch: 130/2000, Time elapsed: 23.24s
* Train loss: 88.92   (RE: 57.56, KL: 31.36)
o Val.  loss: 93.23   (RE: 61.06, KL: 32.17)
--> Early stopping: 1/50 (BEST: 93.15)

beta: 1.0
Epoch: 131/2000, Time elapsed: 23.46s
* Train loss: 88.87   (RE: 57.53, KL: 31.34)
o Val.  loss: 93.23   (RE: 61.42, KL: 31.81)
--> Early stopping: 2/50 (BEST: 93.15)

beta: 1.0
Epoch: 132/2000, Time elapsed: 23.73s
* Train loss: 88.81   (RE: 57.51, KL: 31.30)
o Val.  loss: 93.04   (RE: 61.16, KL: 31.88)
--> Early stopping: 3/50 (BEST: 93.15)

->model saved<-
beta: 1.0
Epoch: 133/2000, Time elapsed: 23.83s
* Train loss: 88.77   (RE: 57.52, KL: 31.25)
o Val.  loss: 93.17   (RE: 61.33, KL: 31.83)
--> Early stopping: 0/50 (BEST: 93.04)

beta: 1.0
Epoch: 134/2000, Time elapsed: 23.99s
* Train loss: 88.72   (RE: 57.51, KL: 31.21)
o Val.  loss: 93.12   (RE: 61.35, KL: 31.76)
--> Early stopping: 1/50 (BEST: 93.04)

beta: 1.0
Epoch: 135/2000, Time elapsed: 23.39s
* Train loss: 88.72   (RE: 57.50, KL: 31.21)
o Val.  loss: 93.17   (RE: 61.58, KL: 31.60)
--> Early stopping: 2/50 (BEST: 93.04)

beta: 1.0
Epoch: 136/2000, Time elapsed: 23.74s
* Train loss: 88.64   (RE: 57.52, KL: 31.11)
o Val.  loss: 93.00   (RE: 61.20, KL: 31.79)
--> Early stopping: 3/50 (BEST: 93.04)

->model saved<-
beta: 1.0
Epoch: 137/2000, Time elapsed: 23.37s
* Train loss: 88.61   (RE: 57.49, KL: 31.12)
o Val.  loss: 93.09   (RE: 61.22, KL: 31.87)
--> Early stopping: 0/50 (BEST: 93.00)

beta: 1.0
Epoch: 138/2000, Time elapsed: 23.53s
* Train loss: 88.55   (RE: 57.48, KL: 31.06)
o Val.  loss: 92.91   (RE: 61.38, KL: 31.53)
--> Early stopping: 1/50 (BEST: 93.00)

->model saved<-
beta: 1.0
Epoch: 139/2000, Time elapsed: 24.23s
* Train loss: 88.54   (RE: 57.46, KL: 31.08)
o Val.  loss: 92.87   (RE: 61.47, KL: 31.40)
--> Early stopping: 0/50 (BEST: 92.91)

->model saved<-
beta: 1.0
Epoch: 140/2000, Time elapsed: 21.95s
* Train loss: 88.49   (RE: 57.45, KL: 31.05)
o Val.  loss: 92.88   (RE: 61.36, KL: 31.52)
--> Early stopping: 0/50 (BEST: 92.87)

beta: 1.0
Epoch: 141/2000, Time elapsed: 23.82s
* Train loss: 88.45   (RE: 57.43, KL: 31.02)
o Val.  loss: 92.84   (RE: 61.12, KL: 31.72)
--> Early stopping: 1/50 (BEST: 92.87)

->model saved<-
beta: 1.0
Epoch: 142/2000, Time elapsed: 23.32s
* Train loss: 88.43   (RE: 57.45, KL: 30.98)
o Val.  loss: 92.80   (RE: 61.39, KL: 31.40)
--> Early stopping: 0/50 (BEST: 92.84)

->model saved<-
beta: 1.0
Epoch: 143/2000, Time elapsed: 23.67s
* Train loss: 88.36   (RE: 57.41, KL: 30.94)
o Val.  loss: 92.87   (RE: 61.29, KL: 31.58)
--> Early stopping: 0/50 (BEST: 92.80)

beta: 1.0
Epoch: 144/2000, Time elapsed: 23.86s
* Train loss: 88.32   (RE: 57.39, KL: 30.93)
o Val.  loss: 92.77   (RE: 61.23, KL: 31.55)
--> Early stopping: 1/50 (BEST: 92.80)

->model saved<-
beta: 1.0
Epoch: 145/2000, Time elapsed: 23.55s
* Train loss: 88.32   (RE: 57.43, KL: 30.89)
o Val.  loss: 92.79   (RE: 61.34, KL: 31.46)
--> Early stopping: 0/50 (BEST: 92.77)

beta: 1.0
Epoch: 146/2000, Time elapsed: 23.64s
* Train loss: 88.27   (RE: 57.40, KL: 30.86)
o Val.  loss: 92.68   (RE: 61.51, KL: 31.17)
--> Early stopping: 1/50 (BEST: 92.77)

->model saved<-
beta: 1.0
Epoch: 147/2000, Time elapsed: 23.96s
* Train loss: 88.19   (RE: 57.34, KL: 30.85)
o Val.  loss: 92.75   (RE: 61.28, KL: 31.47)
--> Early stopping: 0/50 (BEST: 92.68)

beta: 1.0
Epoch: 148/2000, Time elapsed: 22.83s
* Train loss: 88.17   (RE: 57.32, KL: 30.85)
o Val.  loss: 92.71   (RE: 61.18, KL: 31.53)
--> Early stopping: 1/50 (BEST: 92.68)

beta: 1.0
Epoch: 149/2000, Time elapsed: 21.99s
* Train loss: 88.16   (RE: 57.36, KL: 30.80)
o Val.  loss: 92.78   (RE: 61.25, KL: 31.53)
--> Early stopping: 2/50 (BEST: 92.68)

beta: 1.0
Epoch: 150/2000, Time elapsed: 21.87s
* Train loss: 88.09   (RE: 57.33, KL: 30.76)
o Val.  loss: 92.61   (RE: 61.28, KL: 31.33)
--> Early stopping: 3/50 (BEST: 92.68)

->model saved<-
beta: 1.0
Epoch: 151/2000, Time elapsed: 22.56s
* Train loss: 88.05   (RE: 57.31, KL: 30.74)
o Val.  loss: 92.71   (RE: 61.24, KL: 31.47)
--> Early stopping: 0/50 (BEST: 92.61)

beta: 1.0
Epoch: 152/2000, Time elapsed: 23.77s
* Train loss: 88.02   (RE: 57.28, KL: 30.74)
o Val.  loss: 92.70   (RE: 61.41, KL: 31.29)
--> Early stopping: 1/50 (BEST: 92.61)

beta: 1.0
Epoch: 153/2000, Time elapsed: 24.16s
* Train loss: 87.99   (RE: 57.28, KL: 30.71)
o Val.  loss: 92.63   (RE: 61.45, KL: 31.18)
--> Early stopping: 2/50 (BEST: 92.61)

beta: 1.0
Epoch: 154/2000, Time elapsed: 21.75s
* Train loss: 87.98   (RE: 57.29, KL: 30.69)
o Val.  loss: 92.53   (RE: 61.43, KL: 31.10)
--> Early stopping: 3/50 (BEST: 92.61)

->model saved<-
beta: 1.0
Epoch: 155/2000, Time elapsed: 20.29s
* Train loss: 87.88   (RE: 57.24, KL: 30.64)
o Val.  loss: 92.55   (RE: 61.31, KL: 31.24)
--> Early stopping: 0/50 (BEST: 92.53)

beta: 1.0
Epoch: 156/2000, Time elapsed: 21.73s
* Train loss: 87.88   (RE: 57.21, KL: 30.68)
o Val.  loss: 92.55   (RE: 61.49, KL: 31.06)
--> Early stopping: 1/50 (BEST: 92.53)

beta: 1.0
Epoch: 157/2000, Time elapsed: 21.94s
* Train loss: 87.84   (RE: 57.22, KL: 30.62)
o Val.  loss: 92.46   (RE: 61.33, KL: 31.14)
--> Early stopping: 2/50 (BEST: 92.53)

->model saved<-
beta: 1.0
Epoch: 158/2000, Time elapsed: 23.50s
* Train loss: 87.85   (RE: 57.22, KL: 30.63)
o Val.  loss: 92.54   (RE: 61.37, KL: 31.18)
--> Early stopping: 0/50 (BEST: 92.46)

beta: 1.0
Epoch: 159/2000, Time elapsed: 23.60s
* Train loss: 87.78   (RE: 57.19, KL: 30.58)
o Val.  loss: 92.53   (RE: 61.31, KL: 31.21)
--> Early stopping: 1/50 (BEST: 92.46)

beta: 1.0
Epoch: 160/2000, Time elapsed: 23.63s
* Train loss: 87.74   (RE: 57.15, KL: 30.58)
o Val.  loss: 92.47   (RE: 61.36, KL: 31.11)
--> Early stopping: 2/50 (BEST: 92.46)

beta: 1.0
Epoch: 161/2000, Time elapsed: 23.51s
* Train loss: 87.73   (RE: 57.17, KL: 30.57)
o Val.  loss: 92.61   (RE: 61.52, KL: 31.09)
--> Early stopping: 3/50 (BEST: 92.46)

beta: 1.0
Epoch: 162/2000, Time elapsed: 22.98s
* Train loss: 87.69   (RE: 57.15, KL: 30.53)
o Val.  loss: 92.54   (RE: 61.41, KL: 31.13)
--> Early stopping: 4/50 (BEST: 92.46)

beta: 1.0
Epoch: 163/2000, Time elapsed: 22.47s
* Train loss: 87.63   (RE: 57.12, KL: 30.51)
o Val.  loss: 92.38   (RE: 61.43, KL: 30.95)
--> Early stopping: 5/50 (BEST: 92.46)

->model saved<-
beta: 1.0
Epoch: 164/2000, Time elapsed: 22.58s
* Train loss: 87.62   (RE: 57.09, KL: 30.53)
o Val.  loss: 92.46   (RE: 61.43, KL: 31.03)
--> Early stopping: 0/50 (BEST: 92.38)

beta: 1.0
Epoch: 165/2000, Time elapsed: 24.05s
* Train loss: 87.58   (RE: 57.10, KL: 30.48)
o Val.  loss: 92.36   (RE: 61.19, KL: 31.16)
--> Early stopping: 1/50 (BEST: 92.38)

->model saved<-
beta: 1.0
Epoch: 166/2000, Time elapsed: 23.78s
* Train loss: 87.52   (RE: 57.08, KL: 30.45)
o Val.  loss: 92.50   (RE: 61.21, KL: 31.29)
--> Early stopping: 0/50 (BEST: 92.36)

beta: 1.0
Epoch: 167/2000, Time elapsed: 23.47s
* Train loss: 87.55   (RE: 57.06, KL: 30.49)
o Val.  loss: 92.34   (RE: 61.10, KL: 31.24)
--> Early stopping: 1/50 (BEST: 92.36)

->model saved<-
beta: 1.0
Epoch: 168/2000, Time elapsed: 22.50s
* Train loss: 87.49   (RE: 57.03, KL: 30.47)
o Val.  loss: 92.37   (RE: 61.25, KL: 31.12)
--> Early stopping: 0/50 (BEST: 92.34)

beta: 1.0
Epoch: 169/2000, Time elapsed: 23.58s
* Train loss: 87.49   (RE: 57.07, KL: 30.43)
o Val.  loss: 92.50   (RE: 61.29, KL: 31.21)
--> Early stopping: 1/50 (BEST: 92.34)

beta: 1.0
Epoch: 170/2000, Time elapsed: 23.57s
* Train loss: 87.42   (RE: 56.99, KL: 30.43)
o Val.  loss: 92.44   (RE: 61.52, KL: 30.92)
--> Early stopping: 2/50 (BEST: 92.34)

beta: 1.0
Epoch: 171/2000, Time elapsed: 23.86s
* Train loss: 87.39   (RE: 57.00, KL: 30.39)
o Val.  loss: 92.30   (RE: 61.24, KL: 31.06)
--> Early stopping: 3/50 (BEST: 92.34)

->model saved<-
beta: 1.0
Epoch: 172/2000, Time elapsed: 23.52s
* Train loss: 87.38   (RE: 57.02, KL: 30.37)
o Val.  loss: 92.39   (RE: 61.18, KL: 31.21)
--> Early stopping: 0/50 (BEST: 92.30)

beta: 1.0
Epoch: 173/2000, Time elapsed: 23.22s
* Train loss: 87.35   (RE: 56.97, KL: 30.38)
o Val.  loss: 92.29   (RE: 61.48, KL: 30.81)
--> Early stopping: 1/50 (BEST: 92.30)

->model saved<-
beta: 1.0
Epoch: 174/2000, Time elapsed: 22.46s
* Train loss: 87.31   (RE: 56.94, KL: 30.37)
o Val.  loss: 92.23   (RE: 60.91, KL: 31.33)
--> Early stopping: 0/50 (BEST: 92.29)

->model saved<-
beta: 1.0
Epoch: 175/2000, Time elapsed: 22.51s
* Train loss: 87.28   (RE: 56.94, KL: 30.34)
o Val.  loss: 92.28   (RE: 61.25, KL: 31.02)
--> Early stopping: 0/50 (BEST: 92.23)

beta: 1.0
Epoch: 176/2000, Time elapsed: 23.44s
* Train loss: 87.25   (RE: 56.93, KL: 30.32)
o Val.  loss: 92.19   (RE: 61.26, KL: 30.92)
--> Early stopping: 1/50 (BEST: 92.23)

->model saved<-
beta: 1.0
Epoch: 177/2000, Time elapsed: 22.04s
* Train loss: 87.21   (RE: 56.91, KL: 30.30)
o Val.  loss: 92.23   (RE: 61.09, KL: 31.13)
--> Early stopping: 0/50 (BEST: 92.19)

beta: 1.0
Epoch: 178/2000, Time elapsed: 20.93s
* Train loss: 87.19   (RE: 56.87, KL: 30.32)
o Val.  loss: 92.06   (RE: 61.41, KL: 30.65)
--> Early stopping: 1/50 (BEST: 92.19)

->model saved<-
beta: 1.0
Epoch: 179/2000, Time elapsed: 21.48s
* Train loss: 87.14   (RE: 56.87, KL: 30.27)
o Val.  loss: 92.11   (RE: 61.42, KL: 30.69)
--> Early stopping: 0/50 (BEST: 92.06)

beta: 1.0
Epoch: 180/2000, Time elapsed: 22.47s
* Train loss: 87.13   (RE: 56.84, KL: 30.29)
o Val.  loss: 92.16   (RE: 61.28, KL: 30.88)
--> Early stopping: 1/50 (BEST: 92.06)

beta: 1.0
Epoch: 181/2000, Time elapsed: 23.50s
* Train loss: 87.12   (RE: 56.84, KL: 30.28)
o Val.  loss: 92.38   (RE: 61.17, KL: 31.21)
--> Early stopping: 2/50 (BEST: 92.06)

beta: 1.0
Epoch: 182/2000, Time elapsed: 22.88s
* Train loss: 87.07   (RE: 56.82, KL: 30.26)
o Val.  loss: 92.28   (RE: 61.37, KL: 30.90)
--> Early stopping: 3/50 (BEST: 92.06)

beta: 1.0
Epoch: 183/2000, Time elapsed: 23.67s
* Train loss: 87.06   (RE: 56.81, KL: 30.25)
o Val.  loss: 92.14   (RE: 61.25, KL: 30.89)
--> Early stopping: 4/50 (BEST: 92.06)

beta: 1.0
Epoch: 184/2000, Time elapsed: 23.26s
* Train loss: 87.01   (RE: 56.75, KL: 30.26)
o Val.  loss: 92.20   (RE: 61.20, KL: 31.00)
--> Early stopping: 5/50 (BEST: 92.06)

beta: 1.0
Epoch: 185/2000, Time elapsed: 23.63s
* Train loss: 87.01   (RE: 56.78, KL: 30.23)
o Val.  loss: 92.27   (RE: 61.01, KL: 31.27)
--> Early stopping: 6/50 (BEST: 92.06)

beta: 1.0
Epoch: 186/2000, Time elapsed: 23.11s
* Train loss: 86.97   (RE: 56.75, KL: 30.21)
o Val.  loss: 92.08   (RE: 61.24, KL: 30.85)
--> Early stopping: 7/50 (BEST: 92.06)

beta: 1.0
Epoch: 187/2000, Time elapsed: 24.04s
* Train loss: 86.94   (RE: 56.75, KL: 30.19)
o Val.  loss: 92.01   (RE: 61.43, KL: 30.58)
--> Early stopping: 8/50 (BEST: 92.06)

->model saved<-
beta: 1.0
Epoch: 188/2000, Time elapsed: 23.16s
* Train loss: 86.88   (RE: 56.70, KL: 30.18)
o Val.  loss: 92.15   (RE: 61.08, KL: 31.07)
--> Early stopping: 0/50 (BEST: 92.01)

beta: 1.0
Epoch: 189/2000, Time elapsed: 22.94s
* Train loss: 86.90   (RE: 56.72, KL: 30.18)
o Val.  loss: 92.18   (RE: 61.27, KL: 30.91)
--> Early stopping: 1/50 (BEST: 92.01)

beta: 1.0
Epoch: 190/2000, Time elapsed: 23.70s
* Train loss: 86.85   (RE: 56.68, KL: 30.17)
o Val.  loss: 92.11   (RE: 61.16, KL: 30.95)
--> Early stopping: 2/50 (BEST: 92.01)

beta: 1.0
Epoch: 191/2000, Time elapsed: 23.63s
* Train loss: 86.82   (RE: 56.67, KL: 30.15)
o Val.  loss: 92.21   (RE: 61.21, KL: 31.00)
--> Early stopping: 3/50 (BEST: 92.01)

beta: 1.0
Epoch: 192/2000, Time elapsed: 24.04s
* Train loss: 86.84   (RE: 56.67, KL: 30.18)
o Val.  loss: 91.98   (RE: 61.10, KL: 30.88)
--> Early stopping: 4/50 (BEST: 92.01)

->model saved<-
beta: 1.0
Epoch: 193/2000, Time elapsed: 23.60s
* Train loss: 86.81   (RE: 56.68, KL: 30.13)
o Val.  loss: 92.14   (RE: 61.29, KL: 30.85)
--> Early stopping: 0/50 (BEST: 91.98)

beta: 1.0
Epoch: 194/2000, Time elapsed: 22.72s
* Train loss: 86.75   (RE: 56.65, KL: 30.11)
o Val.  loss: 92.03   (RE: 61.34, KL: 30.69)
--> Early stopping: 1/50 (BEST: 91.98)

beta: 1.0
Epoch: 195/2000, Time elapsed: 23.72s
* Train loss: 86.75   (RE: 56.64, KL: 30.11)
o Val.  loss: 92.14   (RE: 61.27, KL: 30.86)
--> Early stopping: 2/50 (BEST: 91.98)

beta: 1.0
Epoch: 196/2000, Time elapsed: 23.44s
* Train loss: 86.69   (RE: 56.62, KL: 30.08)
o Val.  loss: 92.08   (RE: 61.68, KL: 30.39)
--> Early stopping: 3/50 (BEST: 91.98)

beta: 1.0
Epoch: 197/2000, Time elapsed: 23.54s
* Train loss: 86.66   (RE: 56.56, KL: 30.10)
o Val.  loss: 92.04   (RE: 61.22, KL: 30.82)
--> Early stopping: 4/50 (BEST: 91.98)

beta: 1.0
Epoch: 198/2000, Time elapsed: 23.00s
* Train loss: 86.67   (RE: 56.58, KL: 30.09)
o Val.  loss: 92.03   (RE: 61.37, KL: 30.66)
--> Early stopping: 5/50 (BEST: 91.98)

beta: 1.0
Epoch: 199/2000, Time elapsed: 23.79s
* Train loss: 86.64   (RE: 56.56, KL: 30.07)
o Val.  loss: 92.10   (RE: 61.51, KL: 30.59)
--> Early stopping: 6/50 (BEST: 91.98)

beta: 1.0
Epoch: 200/2000, Time elapsed: 22.67s
* Train loss: 86.60   (RE: 56.53, KL: 30.08)
o Val.  loss: 92.09   (RE: 61.43, KL: 30.65)
--> Early stopping: 7/50 (BEST: 91.98)

beta: 1.0
Epoch: 201/2000, Time elapsed: 23.44s
* Train loss: 86.59   (RE: 56.52, KL: 30.07)
o Val.  loss: 92.01   (RE: 61.41, KL: 30.59)
--> Early stopping: 8/50 (BEST: 91.98)

beta: 1.0
Epoch: 202/2000, Time elapsed: 22.43s
* Train loss: 86.56   (RE: 56.51, KL: 30.05)
o Val.  loss: 91.96   (RE: 61.25, KL: 30.72)
--> Early stopping: 9/50 (BEST: 91.98)

->model saved<-
beta: 1.0
Epoch: 203/2000, Time elapsed: 23.43s
* Train loss: 86.54   (RE: 56.49, KL: 30.05)
o Val.  loss: 91.94   (RE: 61.20, KL: 30.74)
--> Early stopping: 0/50 (BEST: 91.96)

->model saved<-
beta: 1.0
Epoch: 204/2000, Time elapsed: 23.43s
* Train loss: 86.51   (RE: 56.45, KL: 30.06)
o Val.  loss: 91.96   (RE: 61.39, KL: 30.57)
--> Early stopping: 0/50 (BEST: 91.94)

beta: 1.0
Epoch: 205/2000, Time elapsed: 23.37s
* Train loss: 86.50   (RE: 56.48, KL: 30.02)
o Val.  loss: 91.94   (RE: 61.03, KL: 30.92)
--> Early stopping: 1/50 (BEST: 91.94)

beta: 1.0
Epoch: 206/2000, Time elapsed: 23.58s
* Train loss: 86.46   (RE: 56.46, KL: 30.00)
o Val.  loss: 92.20   (RE: 61.36, KL: 30.84)
--> Early stopping: 2/50 (BEST: 91.94)

beta: 1.0
Epoch: 207/2000, Time elapsed: 23.10s
* Train loss: 86.45   (RE: 56.44, KL: 30.01)
o Val.  loss: 92.07   (RE: 61.13, KL: 30.94)
--> Early stopping: 3/50 (BEST: 91.94)

beta: 1.0
Epoch: 208/2000, Time elapsed: 19.76s
* Train loss: 86.43   (RE: 56.44, KL: 30.00)
o Val.  loss: 92.05   (RE: 61.24, KL: 30.81)
--> Early stopping: 4/50 (BEST: 91.94)

beta: 1.0
Epoch: 209/2000, Time elapsed: 22.50s
* Train loss: 86.44   (RE: 56.42, KL: 30.02)
o Val.  loss: 91.99   (RE: 61.27, KL: 30.73)
--> Early stopping: 5/50 (BEST: 91.94)

beta: 1.0
Epoch: 210/2000, Time elapsed: 23.22s
* Train loss: 86.36   (RE: 56.38, KL: 29.98)
o Val.  loss: 92.09   (RE: 61.15, KL: 30.94)
--> Early stopping: 6/50 (BEST: 91.94)

beta: 1.0
Epoch: 211/2000, Time elapsed: 23.63s
* Train loss: 86.36   (RE: 56.39, KL: 29.97)
o Val.  loss: 92.02   (RE: 60.95, KL: 31.08)
--> Early stopping: 7/50 (BEST: 91.94)

beta: 1.0
Epoch: 212/2000, Time elapsed: 23.60s
* Train loss: 86.34   (RE: 56.36, KL: 29.99)
o Val.  loss: 92.00   (RE: 61.31, KL: 30.69)
--> Early stopping: 8/50 (BEST: 91.94)

beta: 1.0
Epoch: 213/2000, Time elapsed: 23.99s
* Train loss: 86.32   (RE: 56.34, KL: 29.97)
o Val.  loss: 91.86   (RE: 61.22, KL: 30.64)
--> Early stopping: 9/50 (BEST: 91.94)

->model saved<-
beta: 1.0
Epoch: 214/2000, Time elapsed: 23.84s
* Train loss: 86.28   (RE: 56.33, KL: 29.95)
o Val.  loss: 91.97   (RE: 61.24, KL: 30.73)
--> Early stopping: 0/50 (BEST: 91.86)

beta: 1.0
Epoch: 215/2000, Time elapsed: 23.17s
* Train loss: 86.23   (RE: 56.29, KL: 29.95)
o Val.  loss: 91.95   (RE: 61.24, KL: 30.70)
--> Early stopping: 1/50 (BEST: 91.86)

beta: 1.0
Epoch: 216/2000, Time elapsed: 23.51s
* Train loss: 86.23   (RE: 56.26, KL: 29.97)
o Val.  loss: 92.00   (RE: 61.38, KL: 30.62)
--> Early stopping: 2/50 (BEST: 91.86)

beta: 1.0
Epoch: 217/2000, Time elapsed: 22.85s
* Train loss: 86.21   (RE: 56.26, KL: 29.96)
o Val.  loss: 91.87   (RE: 61.28, KL: 30.59)
--> Early stopping: 3/50 (BEST: 91.86)

beta: 1.0
Epoch: 218/2000, Time elapsed: 22.98s
* Train loss: 86.20   (RE: 56.25, KL: 29.95)
o Val.  loss: 91.84   (RE: 61.27, KL: 30.57)
--> Early stopping: 4/50 (BEST: 91.86)

->model saved<-
beta: 1.0
Epoch: 219/2000, Time elapsed: 24.54s
* Train loss: 86.17   (RE: 56.21, KL: 29.96)
o Val.  loss: 91.99   (RE: 61.26, KL: 30.73)
--> Early stopping: 0/50 (BEST: 91.84)

beta: 1.0
Epoch: 220/2000, Time elapsed: 23.06s
* Train loss: 86.16   (RE: 56.24, KL: 29.92)
o Val.  loss: 91.97   (RE: 61.16, KL: 30.81)
--> Early stopping: 1/50 (BEST: 91.84)

beta: 1.0
Epoch: 221/2000, Time elapsed: 22.28s
* Train loss: 86.16   (RE: 56.22, KL: 29.95)
o Val.  loss: 92.01   (RE: 61.17, KL: 30.84)
--> Early stopping: 2/50 (BEST: 91.84)

beta: 1.0
Epoch: 222/2000, Time elapsed: 22.83s
* Train loss: 86.13   (RE: 56.21, KL: 29.92)
o Val.  loss: 91.94   (RE: 61.23, KL: 30.71)
--> Early stopping: 3/50 (BEST: 91.84)

beta: 1.0
Epoch: 223/2000, Time elapsed: 22.96s
* Train loss: 86.12   (RE: 56.20, KL: 29.92)
o Val.  loss: 91.86   (RE: 61.27, KL: 30.59)
--> Early stopping: 4/50 (BEST: 91.84)

beta: 1.0
Epoch: 224/2000, Time elapsed: 23.79s
* Train loss: 86.07   (RE: 56.16, KL: 29.91)
o Val.  loss: 91.98   (RE: 61.38, KL: 30.60)
--> Early stopping: 5/50 (BEST: 91.84)

beta: 1.0
Epoch: 225/2000, Time elapsed: 23.39s
* Train loss: 86.03   (RE: 56.15, KL: 29.88)
o Val.  loss: 91.91   (RE: 61.32, KL: 30.59)
--> Early stopping: 6/50 (BEST: 91.84)

beta: 1.0
Epoch: 226/2000, Time elapsed: 23.78s
* Train loss: 86.02   (RE: 56.12, KL: 29.90)
o Val.  loss: 91.91   (RE: 61.27, KL: 30.64)
--> Early stopping: 7/50 (BEST: 91.84)

beta: 1.0
Epoch: 227/2000, Time elapsed: 23.27s
* Train loss: 85.99   (RE: 56.12, KL: 29.87)
o Val.  loss: 91.94   (RE: 61.29, KL: 30.65)
--> Early stopping: 8/50 (BEST: 91.84)

beta: 1.0
Epoch: 228/2000, Time elapsed: 23.86s
* Train loss: 85.99   (RE: 56.12, KL: 29.88)
o Val.  loss: 91.91   (RE: 61.48, KL: 30.43)
--> Early stopping: 9/50 (BEST: 91.84)

beta: 1.0
Epoch: 229/2000, Time elapsed: 23.67s
* Train loss: 86.00   (RE: 56.11, KL: 29.88)
o Val.  loss: 91.88   (RE: 61.40, KL: 30.47)
--> Early stopping: 10/50 (BEST: 91.84)

beta: 1.0
Epoch: 230/2000, Time elapsed: 24.13s
* Train loss: 85.94   (RE: 56.07, KL: 29.87)
o Val.  loss: 91.98   (RE: 61.50, KL: 30.48)
--> Early stopping: 11/50 (BEST: 91.84)

beta: 1.0
Epoch: 231/2000, Time elapsed: 23.72s
* Train loss: 85.94   (RE: 56.09, KL: 29.85)
o Val.  loss: 91.90   (RE: 61.35, KL: 30.55)
--> Early stopping: 12/50 (BEST: 91.84)

beta: 1.0
Epoch: 232/2000, Time elapsed: 23.47s
* Train loss: 85.94   (RE: 56.06, KL: 29.88)
o Val.  loss: 91.92   (RE: 61.25, KL: 30.67)
--> Early stopping: 13/50 (BEST: 91.84)

beta: 1.0
Epoch: 233/2000, Time elapsed: 23.54s
* Train loss: 85.89   (RE: 56.05, KL: 29.85)
o Val.  loss: 91.97   (RE: 61.45, KL: 30.52)
--> Early stopping: 14/50 (BEST: 91.84)

beta: 1.0
Epoch: 234/2000, Time elapsed: 23.40s
* Train loss: 85.90   (RE: 56.06, KL: 29.84)
o Val.  loss: 91.87   (RE: 61.27, KL: 30.59)
--> Early stopping: 15/50 (BEST: 91.84)

beta: 1.0
Epoch: 235/2000, Time elapsed: 23.47s
* Train loss: 85.87   (RE: 56.02, KL: 29.85)
o Val.  loss: 91.97   (RE: 61.33, KL: 30.64)
--> Early stopping: 16/50 (BEST: 91.84)

beta: 1.0
Epoch: 236/2000, Time elapsed: 23.68s
* Train loss: 85.82   (RE: 55.98, KL: 29.84)
o Val.  loss: 91.97   (RE: 61.28, KL: 30.69)
--> Early stopping: 17/50 (BEST: 91.84)

beta: 1.0
Epoch: 237/2000, Time elapsed: 22.73s
* Train loss: 85.81   (RE: 55.98, KL: 29.84)
o Val.  loss: 91.94   (RE: 61.39, KL: 30.55)
--> Early stopping: 18/50 (BEST: 91.84)

beta: 1.0
Epoch: 238/2000, Time elapsed: 22.87s
* Train loss: 85.76   (RE: 55.95, KL: 29.81)
o Val.  loss: 92.03   (RE: 61.42, KL: 30.61)
--> Early stopping: 19/50 (BEST: 91.84)

beta: 1.0
Epoch: 239/2000, Time elapsed: 23.10s
* Train loss: 85.77   (RE: 55.93, KL: 29.84)
o Val.  loss: 92.04   (RE: 61.41, KL: 30.63)
--> Early stopping: 20/50 (BEST: 91.84)

beta: 1.0
Epoch: 240/2000, Time elapsed: 23.77s
* Train loss: 85.76   (RE: 55.93, KL: 29.83)
o Val.  loss: 91.85   (RE: 61.32, KL: 30.53)
--> Early stopping: 21/50 (BEST: 91.84)

beta: 1.0
Epoch: 241/2000, Time elapsed: 23.85s
* Train loss: 85.75   (RE: 55.93, KL: 29.81)
o Val.  loss: 91.95   (RE: 61.24, KL: 30.71)
--> Early stopping: 22/50 (BEST: 91.84)

beta: 1.0
Epoch: 242/2000, Time elapsed: 23.57s
* Train loss: 85.70   (RE: 55.90, KL: 29.80)
o Val.  loss: 91.98   (RE: 61.29, KL: 30.68)
--> Early stopping: 23/50 (BEST: 91.84)

beta: 1.0
Epoch: 243/2000, Time elapsed: 23.58s
* Train loss: 85.72   (RE: 55.90, KL: 29.82)
o Val.  loss: 91.87   (RE: 61.34, KL: 30.53)
--> Early stopping: 24/50 (BEST: 91.84)

beta: 1.0
Epoch: 244/2000, Time elapsed: 23.18s
* Train loss: 85.68   (RE: 55.89, KL: 29.79)
o Val.  loss: 92.09   (RE: 61.24, KL: 30.85)
--> Early stopping: 25/50 (BEST: 91.84)

beta: 1.0
Epoch: 245/2000, Time elapsed: 22.05s
* Train loss: 85.65   (RE: 55.86, KL: 29.79)
o Val.  loss: 91.85   (RE: 61.20, KL: 30.64)
--> Early stopping: 26/50 (BEST: 91.84)

beta: 1.0
Epoch: 246/2000, Time elapsed: 22.76s
* Train loss: 85.63   (RE: 55.84, KL: 29.79)
o Val.  loss: 92.00   (RE: 61.56, KL: 30.44)
--> Early stopping: 27/50 (BEST: 91.84)

beta: 1.0
Epoch: 247/2000, Time elapsed: 22.27s
* Train loss: 85.62   (RE: 55.83, KL: 29.78)
o Val.  loss: 91.91   (RE: 61.41, KL: 30.50)
--> Early stopping: 28/50 (BEST: 91.84)

beta: 1.0
Epoch: 248/2000, Time elapsed: 22.01s
* Train loss: 85.60   (RE: 55.83, KL: 29.76)
o Val.  loss: 91.99   (RE: 61.21, KL: 30.78)
--> Early stopping: 29/50 (BEST: 91.84)

beta: 1.0
Epoch: 249/2000, Time elapsed: 22.32s
* Train loss: 85.58   (RE: 55.79, KL: 29.80)
o Val.  loss: 91.91   (RE: 61.29, KL: 30.62)
--> Early stopping: 30/50 (BEST: 91.84)

beta: 1.0
Epoch: 250/2000, Time elapsed: 22.32s
* Train loss: 85.57   (RE: 55.78, KL: 29.78)
o Val.  loss: 91.86   (RE: 61.45, KL: 30.40)
--> Early stopping: 31/50 (BEST: 91.84)

beta: 1.0
Epoch: 251/2000, Time elapsed: 22.61s
* Train loss: 85.54   (RE: 55.75, KL: 29.79)
o Val.  loss: 92.05   (RE: 61.49, KL: 30.56)
--> Early stopping: 32/50 (BEST: 91.84)

beta: 1.0
Epoch: 252/2000, Time elapsed: 22.00s
* Train loss: 85.54   (RE: 55.79, KL: 29.74)
o Val.  loss: 91.87   (RE: 61.37, KL: 30.50)
--> Early stopping: 33/50 (BEST: 91.84)

beta: 1.0
Epoch: 253/2000, Time elapsed: 22.17s
* Train loss: 85.52   (RE: 55.76, KL: 29.76)
o Val.  loss: 91.91   (RE: 61.38, KL: 30.53)
--> Early stopping: 34/50 (BEST: 91.84)

beta: 1.0
Epoch: 254/2000, Time elapsed: 22.67s
* Train loss: 85.49   (RE: 55.72, KL: 29.77)
o Val.  loss: 92.00   (RE: 61.62, KL: 30.38)
--> Early stopping: 35/50 (BEST: 91.84)

beta: 1.0
Epoch: 255/2000, Time elapsed: 22.26s
* Train loss: 85.48   (RE: 55.73, KL: 29.75)
o Val.  loss: 91.91   (RE: 61.46, KL: 30.45)
--> Early stopping: 36/50 (BEST: 91.84)

beta: 1.0
Epoch: 256/2000, Time elapsed: 22.02s
* Train loss: 85.47   (RE: 55.72, KL: 29.75)
o Val.  loss: 91.96   (RE: 61.34, KL: 30.62)
--> Early stopping: 37/50 (BEST: 91.84)

beta: 1.0
Epoch: 257/2000, Time elapsed: 22.13s
* Train loss: 85.43   (RE: 55.71, KL: 29.73)
o Val.  loss: 91.99   (RE: 61.36, KL: 30.63)
--> Early stopping: 38/50 (BEST: 91.84)

beta: 1.0
Epoch: 258/2000, Time elapsed: 21.71s
* Train loss: 85.40   (RE: 55.67, KL: 29.73)
o Val.  loss: 92.00   (RE: 61.71, KL: 30.29)
--> Early stopping: 39/50 (BEST: 91.84)

beta: 1.0
Epoch: 259/2000, Time elapsed: 21.32s
* Train loss: 85.39   (RE: 55.65, KL: 29.74)
o Val.  loss: 91.85   (RE: 61.37, KL: 30.48)
--> Early stopping: 40/50 (BEST: 91.84)

beta: 1.0
Epoch: 260/2000, Time elapsed: 21.37s
* Train loss: 85.39   (RE: 55.65, KL: 29.74)
o Val.  loss: 91.90   (RE: 61.26, KL: 30.64)
--> Early stopping: 41/50 (BEST: 91.84)

beta: 1.0
Epoch: 261/2000, Time elapsed: 22.45s
* Train loss: 85.39   (RE: 55.65, KL: 29.74)
o Val.  loss: 91.99   (RE: 61.53, KL: 30.46)
--> Early stopping: 42/50 (BEST: 91.84)

beta: 1.0
Epoch: 262/2000, Time elapsed: 22.33s
* Train loss: 85.35   (RE: 55.64, KL: 29.71)
o Val.  loss: 91.95   (RE: 61.24, KL: 30.71)
--> Early stopping: 43/50 (BEST: 91.84)

beta: 1.0
Epoch: 263/2000, Time elapsed: 21.62s
* Train loss: 85.34   (RE: 55.63, KL: 29.71)
o Val.  loss: 91.93   (RE: 61.26, KL: 30.67)
--> Early stopping: 44/50 (BEST: 91.84)

beta: 1.0
Epoch: 264/2000, Time elapsed: 22.22s
* Train loss: 85.34   (RE: 55.60, KL: 29.73)
o Val.  loss: 91.88   (RE: 61.26, KL: 30.62)
--> Early stopping: 45/50 (BEST: 91.84)

beta: 1.0
Epoch: 265/2000, Time elapsed: 22.49s
* Train loss: 85.30   (RE: 55.57, KL: 29.73)
o Val.  loss: 91.87   (RE: 61.51, KL: 30.36)
--> Early stopping: 46/50 (BEST: 91.84)

beta: 1.0
Epoch: 266/2000, Time elapsed: 22.21s
* Train loss: 85.25   (RE: 55.55, KL: 29.71)
o Val.  loss: 91.91   (RE: 61.58, KL: 30.32)
--> Early stopping: 47/50 (BEST: 91.84)

beta: 1.0
Epoch: 267/2000, Time elapsed: 22.47s
* Train loss: 85.30   (RE: 55.59, KL: 29.72)
o Val.  loss: 91.96   (RE: 61.12, KL: 30.84)
--> Early stopping: 48/50 (BEST: 91.84)

beta: 1.0
Epoch: 268/2000, Time elapsed: 22.03s
* Train loss: 85.25   (RE: 55.53, KL: 29.72)
o Val.  loss: 91.88   (RE: 61.49, KL: 30.39)
--> Early stopping: 49/50 (BEST: 91.84)

beta: 1.0
Epoch: 269/2000, Time elapsed: 22.19s
* Train loss: 85.23   (RE: 55.53, KL: 29.69)
o Val.  loss: 91.99   (RE: 61.32, KL: 30.67)
--> Early stopping: 50/50 (BEST: 91.84)

Test lower-bound value 91.13 in time: 0.26s
Train lower-bound value 0.00 in time: 0.00s
0.00%
1.00%
2.00%
3.00%
4.00%
5.00%
6.00%
7.00%
8.00%
9.00%
10.00%
11.00%
12.00%
13.00%
14.00%
15.00%
16.00%
17.00%
18.00%
19.00%
20.00%
21.00%
22.00%
23.00%
24.00%
25.00%
26.00%
27.00%
28.00%
29.00%
30.00%
31.00%
32.00%
33.00%
34.00%
35.00%
36.00%
37.00%
38.00%
39.00%
40.00%
41.00%
42.00%
43.00%
44.00%
45.00%
46.00%
47.00%
48.00%
49.00%
50.00%
51.00%
52.00%
53.00%
54.00%
55.00%
56.00%
57.00%
58.00%
59.00%
60.00%
61.00%
62.00%
63.00%
64.00%
65.00%
66.00%
67.00%
68.00%
69.00%
70.00%
71.00%
72.00%
73.00%
74.00%
75.00%
76.00%
77.00%
78.00%
79.00%
80.00%
81.00%
82.00%
83.00%
84.00%
85.00%
86.00%
87.00%
88.00%
89.00%
90.00%
91.00%
92.00%
93.00%
94.00%
95.00%
96.00%
97.00%
98.00%
99.00%
Test log_likelihood value 84.95 in time: 1101.05s
Train log_likelihood value 0.00 in time: 0.00s
FINAL EVALUATION ON TEST SET
LogL (TEST): 84.95
LogL (TRAIN): 0.00
ELBO (TEST): 91.13
ELBO (TRAIN): 0.00
Loss: 91.08
RE: 60.69
KL: 30.39
 Training finished in 122.97 minutes. Log saved to: snapshots/2026-01-21 11:01:41_static_mnist_hvae_2level_vampprior_K500_weightedFalse_z1_40_seed14/eval_results/runtime.txt
-=-=-=-=-=-=-=-=-=-=-=-=-=-=-=-=-=-=-=-=-=-=-=-=-=-=-=-=-=-=-=-=-=-=-=-=-=-=-=-=-=-=-=-=-=-=-=-=-=-=-=-=-=-=-=-
