load data
create model
Namespace(batch_size=100, test_batch_size=100, epochs=2000, lr=0.0005, early_stopping_epochs=50, warmup=100, no_cuda=False, seed=420, z1_size=40, z2_size=40, input_size=[1, 28, 28], activation=None, number_components=500, pseudoinputs_mean=0.05, pseudoinputs_std=0.01, use_training_data_init=False, model_name='hvae_2level', prior='standard', weighted=True, input_type='binary', flow_layers=8, flow_hidden_dim=128, S=5000, MB=100, dataset_name='static_mnist', dynamic_binarization=False, cuda=True, model_signature='2026-01-22 00:25:10')
perform experiment
beta: 0.01
/root/vae_vampprior/models/Model.py:41: UserWarning: The torch.cuda.*DtypeTensor constructors are no longer recommended. It's best to use methods such as torch.tensor(data, dtype=*, device='cuda') to create tensors. (Triggered internally at /pytorch/torch/csrc/tensor/python_tensor.cpp:78.)
  eps = torch.cuda.FloatTensor(std.size()).normal_()
/root/vae_vampprior/utils/optimizer.py:75: UserWarning: This overload of add_ is deprecated:
	add_(Number alpha, Tensor other)
Consider using one of the following signatures instead:
	add_(Tensor other, *, Number alpha = 1) (Triggered internally at /pytorch/torch/csrc/utils/python_arg_parser.cpp:1805.)
  exp_avg.mul_(beta1).add_(1 - beta1, grad)
Epoch: 1/2000, Time elapsed: 18.43s
* Train loss: 108.95   (RE: 106.80, KL: 214.30)
o Val.  loss: 284.57   (RE: 59.79, KL: 224.78)
--> Early stopping: 0/50 (BEST: 100000.00)

->model saved<-
beta: 0.02
Epoch: 2/2000, Time elapsed: 18.98s
* Train loss: 55.28   (RE: 50.90, KL: 218.80)
o Val.  loss: 260.05   (RE: 45.74, KL: 214.31)
--> Early stopping: 0/50 (BEST: 284.57)

->model saved<-
beta: 0.03
Epoch: 3/2000, Time elapsed: 20.02s
* Train loss: 48.42   (RE: 42.39, KL: 201.19)
o Val.  loss: 239.07   (RE: 41.10, KL: 197.96)
--> Early stopping: 0/50 (BEST: 260.05)

->model saved<-
beta: 0.04
Epoch: 4/2000, Time elapsed: 19.89s
* Train loss: 46.45   (RE: 39.00, KL: 186.36)
o Val.  loss: 221.94   (RE: 39.32, KL: 182.62)
--> Early stopping: 0/50 (BEST: 239.07)

->model saved<-
beta: 0.05
Epoch: 5/2000, Time elapsed: 20.41s
* Train loss: 45.77   (RE: 37.45, KL: 166.47)
o Val.  loss: 198.61   (RE: 38.61, KL: 159.99)
--> Early stopping: 0/50 (BEST: 221.94)

->model saved<-
beta: 0.06
Epoch: 6/2000, Time elapsed: 20.47s
* Train loss: 45.54   (RE: 36.34, KL: 153.34)
o Val.  loss: 188.87   (RE: 37.86, KL: 151.01)
--> Early stopping: 0/50 (BEST: 198.61)

->model saved<-
beta: 0.07
Epoch: 7/2000, Time elapsed: 20.53s
* Train loss: 45.66   (RE: 35.42, KL: 146.28)
o Val.  loss: 183.48   (RE: 37.30, KL: 146.18)
--> Early stopping: 0/50 (BEST: 188.87)

->model saved<-
beta: 0.08
Epoch: 8/2000, Time elapsed: 20.05s
* Train loss: 46.00   (RE: 34.76, KL: 140.52)
o Val.  loss: 176.81   (RE: 37.16, KL: 139.65)
--> Early stopping: 0/50 (BEST: 183.48)

->model saved<-
beta: 0.09
Epoch: 9/2000, Time elapsed: 19.04s
* Train loss: 46.48   (RE: 34.29, KL: 135.48)
o Val.  loss: 172.13   (RE: 37.06, KL: 135.07)
--> Early stopping: 0/50 (BEST: 176.81)

->model saved<-
beta: 0.1
Epoch: 10/2000, Time elapsed: 19.16s
* Train loss: 47.07   (RE: 33.96, KL: 131.14)
o Val.  loss: 166.56   (RE: 36.97, KL: 129.59)
--> Early stopping: 0/50 (BEST: 172.13)

->model saved<-
beta: 0.11
Epoch: 11/2000, Time elapsed: 19.58s
* Train loss: 47.74   (RE: 33.73, KL: 127.31)
o Val.  loss: 164.46   (RE: 36.67, KL: 127.79)
--> Early stopping: 0/50 (BEST: 166.56)

->model saved<-
beta: 0.12
Epoch: 12/2000, Time elapsed: 18.99s
* Train loss: 48.37   (RE: 33.53, KL: 123.71)
o Val.  loss: 160.47   (RE: 36.81, KL: 123.66)
--> Early stopping: 0/50 (BEST: 164.46)

->model saved<-
beta: 0.13
Epoch: 13/2000, Time elapsed: 20.56s
* Train loss: 49.09   (RE: 33.44, KL: 120.36)
o Val.  loss: 157.50   (RE: 36.90, KL: 120.59)
--> Early stopping: 0/50 (BEST: 160.47)

->model saved<-
beta: 0.14
Epoch: 14/2000, Time elapsed: 19.12s
* Train loss: 49.80   (RE: 33.37, KL: 117.36)
o Val.  loss: 154.06   (RE: 37.19, KL: 116.88)
--> Early stopping: 0/50 (BEST: 157.50)

->model saved<-
beta: 0.15
Epoch: 15/2000, Time elapsed: 19.55s
* Train loss: 50.53   (RE: 33.34, KL: 114.63)
o Val.  loss: 151.87   (RE: 37.29, KL: 114.59)
--> Early stopping: 0/50 (BEST: 154.06)

->model saved<-
beta: 0.16
Epoch: 16/2000, Time elapsed: 19.99s
* Train loss: 51.26   (RE: 33.34, KL: 112.00)
o Val.  loss: 149.07   (RE: 37.24, KL: 111.82)
--> Early stopping: 0/50 (BEST: 151.87)

->model saved<-
beta: 0.17
Epoch: 17/2000, Time elapsed: 19.83s
* Train loss: 52.01   (RE: 33.41, KL: 109.44)
o Val.  loss: 147.56   (RE: 37.46, KL: 110.11)
--> Early stopping: 0/50 (BEST: 149.07)

->model saved<-
beta: 0.18
Epoch: 18/2000, Time elapsed: 19.16s
* Train loss: 52.78   (RE: 33.48, KL: 107.20)
o Val.  loss: 144.96   (RE: 37.49, KL: 107.47)
--> Early stopping: 0/50 (BEST: 147.56)

->model saved<-
beta: 0.19
Epoch: 19/2000, Time elapsed: 19.29s
* Train loss: 53.51   (RE: 33.58, KL: 104.92)
o Val.  loss: 142.63   (RE: 37.77, KL: 104.87)
--> Early stopping: 0/50 (BEST: 144.96)

->model saved<-
beta: 0.2
Epoch: 20/2000, Time elapsed: 19.64s
* Train loss: 54.29   (RE: 33.71, KL: 102.89)
o Val.  loss: 141.08   (RE: 38.01, KL: 103.07)
--> Early stopping: 0/50 (BEST: 142.63)

->model saved<-
beta: 0.21
Epoch: 21/2000, Time elapsed: 19.09s
* Train loss: 55.01   (RE: 33.83, KL: 100.85)
o Val.  loss: 138.94   (RE: 38.31, KL: 100.63)
--> Early stopping: 0/50 (BEST: 141.08)

->model saved<-
beta: 0.22
Epoch: 22/2000, Time elapsed: 20.08s
* Train loss: 55.74   (RE: 33.96, KL: 98.98)
o Val.  loss: 137.79   (RE: 38.56, KL: 99.23)
--> Early stopping: 0/50 (BEST: 138.94)

->model saved<-
beta: 0.23
Epoch: 23/2000, Time elapsed: 19.75s
* Train loss: 56.49   (RE: 34.13, KL: 97.20)
o Val.  loss: 135.48   (RE: 39.08, KL: 96.41)
--> Early stopping: 0/50 (BEST: 137.79)

->model saved<-
beta: 0.24
Epoch: 24/2000, Time elapsed: 19.94s
* Train loss: 57.21   (RE: 34.31, KL: 95.41)
o Val.  loss: 134.96   (RE: 38.81, KL: 96.14)
--> Early stopping: 0/50 (BEST: 135.48)

->model saved<-
beta: 0.25
Epoch: 25/2000, Time elapsed: 19.52s
* Train loss: 57.95   (RE: 34.50, KL: 93.78)
o Val.  loss: 133.40   (RE: 39.06, KL: 94.34)
--> Early stopping: 0/50 (BEST: 134.96)

->model saved<-
beta: 0.26
Epoch: 26/2000, Time elapsed: 19.55s
* Train loss: 58.65   (RE: 34.69, KL: 92.16)
o Val.  loss: 131.17   (RE: 39.58, KL: 91.59)
--> Early stopping: 0/50 (BEST: 133.40)

->model saved<-
beta: 0.27
Epoch: 27/2000, Time elapsed: 19.77s
* Train loss: 59.35   (RE: 34.88, KL: 90.63)
o Val.  loss: 130.51   (RE: 39.67, KL: 90.84)
--> Early stopping: 0/50 (BEST: 131.17)

->model saved<-
beta: 0.28
Epoch: 28/2000, Time elapsed: 19.22s
* Train loss: 60.09   (RE: 35.12, KL: 89.19)
o Val.  loss: 129.02   (RE: 39.95, KL: 89.07)
--> Early stopping: 0/50 (BEST: 130.51)

->model saved<-
beta: 0.29
Epoch: 29/2000, Time elapsed: 19.83s
* Train loss: 60.75   (RE: 35.33, KL: 87.66)
o Val.  loss: 127.89   (RE: 40.32, KL: 87.57)
--> Early stopping: 0/50 (BEST: 129.02)

->model saved<-
beta: 0.3
Epoch: 30/2000, Time elapsed: 18.25s
* Train loss: 61.44   (RE: 35.56, KL: 86.28)
o Val.  loss: 126.37   (RE: 40.79, KL: 85.58)
--> Early stopping: 0/50 (BEST: 127.89)

->model saved<-
beta: 0.31
Epoch: 31/2000, Time elapsed: 19.06s
* Train loss: 62.13   (RE: 35.79, KL: 84.98)
o Val.  loss: 126.02   (RE: 40.54, KL: 85.48)
--> Early stopping: 0/50 (BEST: 126.37)

->model saved<-
beta: 0.32
Epoch: 32/2000, Time elapsed: 19.34s
* Train loss: 62.78   (RE: 36.02, KL: 83.61)
o Val.  loss: 125.02   (RE: 40.93, KL: 84.09)
--> Early stopping: 0/50 (BEST: 126.02)

->model saved<-
beta: 0.33
Epoch: 33/2000, Time elapsed: 18.97s
* Train loss: 63.47   (RE: 36.28, KL: 82.38)
o Val.  loss: 124.07   (RE: 41.50, KL: 82.57)
--> Early stopping: 0/50 (BEST: 125.02)

->model saved<-
beta: 0.34
Epoch: 34/2000, Time elapsed: 19.61s
* Train loss: 64.13   (RE: 36.52, KL: 81.22)
o Val.  loss: 123.03   (RE: 41.41, KL: 81.61)
--> Early stopping: 0/50 (BEST: 124.07)

->model saved<-
beta: 0.35
Epoch: 35/2000, Time elapsed: 19.07s
* Train loss: 64.80   (RE: 36.80, KL: 79.99)
o Val.  loss: 122.13   (RE: 41.78, KL: 80.36)
--> Early stopping: 0/50 (BEST: 123.03)

->model saved<-
beta: 0.36
Epoch: 36/2000, Time elapsed: 18.80s
* Train loss: 65.42   (RE: 37.06, KL: 78.79)
o Val.  loss: 121.91   (RE: 41.88, KL: 80.04)
--> Early stopping: 0/50 (BEST: 122.13)

->model saved<-
beta: 0.37
Epoch: 37/2000, Time elapsed: 19.34s
* Train loss: 66.09   (RE: 37.36, KL: 77.66)
o Val.  loss: 120.61   (RE: 42.24, KL: 78.37)
--> Early stopping: 0/50 (BEST: 121.91)

->model saved<-
beta: 0.38
Epoch: 38/2000, Time elapsed: 19.67s
* Train loss: 66.73   (RE: 37.64, KL: 76.56)
o Val.  loss: 119.70   (RE: 42.44, KL: 77.26)
--> Early stopping: 0/50 (BEST: 120.61)

->model saved<-
beta: 0.39
Epoch: 39/2000, Time elapsed: 20.16s
* Train loss: 67.36   (RE: 37.92, KL: 75.50)
o Val.  loss: 118.69   (RE: 43.11, KL: 75.57)
--> Early stopping: 0/50 (BEST: 119.70)

->model saved<-
beta: 0.4
Epoch: 40/2000, Time elapsed: 19.36s
* Train loss: 67.98   (RE: 38.19, KL: 74.47)
o Val.  loss: 117.87   (RE: 43.18, KL: 74.69)
--> Early stopping: 0/50 (BEST: 118.69)

->model saved<-
beta: 0.41
Epoch: 41/2000, Time elapsed: 18.97s
* Train loss: 68.61   (RE: 38.50, KL: 73.45)
o Val.  loss: 117.50   (RE: 43.49, KL: 74.01)
--> Early stopping: 0/50 (BEST: 117.87)

->model saved<-
beta: 0.42
Epoch: 42/2000, Time elapsed: 19.89s
* Train loss: 69.22   (RE: 38.79, KL: 72.44)
o Val.  loss: 116.33   (RE: 44.08, KL: 72.25)
--> Early stopping: 0/50 (BEST: 117.50)

->model saved<-
beta: 0.43
Epoch: 43/2000, Time elapsed: 19.78s
* Train loss: 69.83   (RE: 39.08, KL: 71.53)
o Val.  loss: 116.38   (RE: 43.81, KL: 72.56)
--> Early stopping: 0/50 (BEST: 116.33)

beta: 0.44
Epoch: 44/2000, Time elapsed: 19.53s
* Train loss: 70.43   (RE: 39.37, KL: 70.59)
o Val.  loss: 115.31   (RE: 44.36, KL: 70.96)
--> Early stopping: 0/50 (BEST: 116.33)

->model saved<-
beta: 0.45
Epoch: 45/2000, Time elapsed: 19.77s
* Train loss: 71.02   (RE: 39.70, KL: 69.62)
o Val.  loss: 114.92   (RE: 44.36, KL: 70.56)
--> Early stopping: 0/50 (BEST: 115.31)

->model saved<-
beta: 0.46
Epoch: 46/2000, Time elapsed: 19.61s
* Train loss: 71.57   (RE: 39.98, KL: 68.67)
o Val.  loss: 113.90   (RE: 45.15, KL: 68.75)
--> Early stopping: 0/50 (BEST: 114.92)

->model saved<-
beta: 0.47
Epoch: 47/2000, Time elapsed: 19.99s
* Train loss: 72.17   (RE: 40.31, KL: 67.77)
o Val.  loss: 113.56   (RE: 45.30, KL: 68.26)
--> Early stopping: 0/50 (BEST: 113.90)

->model saved<-
beta: 0.48
Epoch: 48/2000, Time elapsed: 19.40s
* Train loss: 72.78   (RE: 40.68, KL: 66.88)
o Val.  loss: 112.66   (RE: 45.65, KL: 67.01)
--> Early stopping: 0/50 (BEST: 113.56)

->model saved<-
beta: 0.49
Epoch: 49/2000, Time elapsed: 19.95s
* Train loss: 73.31   (RE: 40.96, KL: 66.03)
o Val.  loss: 112.41   (RE: 45.99, KL: 66.42)
--> Early stopping: 0/50 (BEST: 112.66)

->model saved<-
beta: 0.5
Epoch: 50/2000, Time elapsed: 19.63s
* Train loss: 73.89   (RE: 41.27, KL: 65.23)
o Val.  loss: 111.26   (RE: 46.37, KL: 64.89)
--> Early stopping: 0/50 (BEST: 112.41)

->model saved<-
beta: 0.51
Epoch: 51/2000, Time elapsed: 19.76s
* Train loss: 74.43   (RE: 41.62, KL: 64.34)
o Val.  loss: 111.06   (RE: 46.54, KL: 64.52)
--> Early stopping: 0/50 (BEST: 111.26)

->model saved<-
beta: 0.52
Epoch: 52/2000, Time elapsed: 19.46s
* Train loss: 74.99   (RE: 41.95, KL: 63.54)
o Val.  loss: 110.63   (RE: 46.93, KL: 63.70)
--> Early stopping: 0/50 (BEST: 111.06)

->model saved<-
beta: 0.53
Epoch: 53/2000, Time elapsed: 19.89s
* Train loss: 75.52   (RE: 42.25, KL: 62.76)
o Val.  loss: 110.01   (RE: 47.38, KL: 62.63)
--> Early stopping: 0/50 (BEST: 110.63)

->model saved<-
beta: 0.54
Epoch: 54/2000, Time elapsed: 19.74s
* Train loss: 76.07   (RE: 42.60, KL: 61.98)
o Val.  loss: 109.25   (RE: 47.61, KL: 61.64)
--> Early stopping: 0/50 (BEST: 110.01)

->model saved<-
beta: 0.55
Epoch: 55/2000, Time elapsed: 19.99s
* Train loss: 76.55   (RE: 42.91, KL: 61.16)
o Val.  loss: 109.30   (RE: 47.59, KL: 61.71)
--> Early stopping: 0/50 (BEST: 109.25)

beta: 0.56
Epoch: 56/2000, Time elapsed: 20.16s
* Train loss: 77.09   (RE: 43.26, KL: 60.40)
o Val.  loss: 108.75   (RE: 47.95, KL: 60.80)
--> Early stopping: 0/50 (BEST: 109.25)

->model saved<-
beta: 0.57
Epoch: 57/2000, Time elapsed: 20.18s
* Train loss: 77.59   (RE: 43.58, KL: 59.66)
o Val.  loss: 108.18   (RE: 48.43, KL: 59.75)
--> Early stopping: 0/50 (BEST: 108.75)

->model saved<-
beta: 0.58
Epoch: 58/2000, Time elapsed: 19.91s
* Train loss: 78.10   (RE: 43.92, KL: 58.93)
o Val.  loss: 107.83   (RE: 48.60, KL: 59.22)
--> Early stopping: 0/50 (BEST: 108.18)

->model saved<-
beta: 0.59
Epoch: 59/2000, Time elapsed: 19.32s
* Train loss: 78.59   (RE: 44.25, KL: 58.21)
o Val.  loss: 107.29   (RE: 49.06, KL: 58.22)
--> Early stopping: 0/50 (BEST: 107.83)

->model saved<-
beta: 0.6
Epoch: 60/2000, Time elapsed: 20.16s
* Train loss: 79.12   (RE: 44.65, KL: 57.45)
o Val.  loss: 106.97   (RE: 49.39, KL: 57.58)
--> Early stopping: 0/50 (BEST: 107.29)

->model saved<-
beta: 0.61
Epoch: 61/2000, Time elapsed: 19.66s
* Train loss: 79.62   (RE: 45.00, KL: 56.75)
o Val.  loss: 106.60   (RE: 49.33, KL: 57.27)
--> Early stopping: 0/50 (BEST: 106.97)

->model saved<-
beta: 0.62
Epoch: 62/2000, Time elapsed: 20.03s
* Train loss: 80.08   (RE: 45.30, KL: 56.10)
o Val.  loss: 106.22   (RE: 49.98, KL: 56.24)
--> Early stopping: 0/50 (BEST: 106.60)

->model saved<-
beta: 0.63
Epoch: 63/2000, Time elapsed: 19.61s
* Train loss: 80.54   (RE: 45.68, KL: 55.35)
o Val.  loss: 105.97   (RE: 50.34, KL: 55.63)
--> Early stopping: 0/50 (BEST: 106.22)

->model saved<-
beta: 0.64
Epoch: 64/2000, Time elapsed: 20.21s
* Train loss: 81.03   (RE: 46.01, KL: 54.72)
o Val.  loss: 105.45   (RE: 50.70, KL: 54.75)
--> Early stopping: 0/50 (BEST: 105.97)

->model saved<-
beta: 0.65
Epoch: 65/2000, Time elapsed: 19.52s
* Train loss: 81.50   (RE: 46.36, KL: 54.05)
o Val.  loss: 104.79   (RE: 51.20, KL: 53.59)
--> Early stopping: 0/50 (BEST: 105.45)

->model saved<-
beta: 0.66
Epoch: 66/2000, Time elapsed: 19.45s
* Train loss: 81.95   (RE: 46.70, KL: 53.40)
o Val.  loss: 104.85   (RE: 51.42, KL: 53.42)
--> Early stopping: 0/50 (BEST: 104.79)

beta: 0.67
Epoch: 67/2000, Time elapsed: 19.44s
* Train loss: 82.39   (RE: 47.06, KL: 52.73)
o Val.  loss: 104.46   (RE: 51.48, KL: 52.99)
--> Early stopping: 0/50 (BEST: 104.79)

->model saved<-
beta: 0.68
Epoch: 68/2000, Time elapsed: 19.89s
* Train loss: 82.82   (RE: 47.42, KL: 52.06)
o Val.  loss: 104.08   (RE: 51.84, KL: 52.24)
--> Early stopping: 0/50 (BEST: 104.46)

->model saved<-
beta: 0.69
Epoch: 69/2000, Time elapsed: 18.60s
* Train loss: 83.25   (RE: 47.77, KL: 51.42)
o Val.  loss: 103.79   (RE: 52.17, KL: 51.62)
--> Early stopping: 0/50 (BEST: 104.08)

->model saved<-
beta: 0.7
Epoch: 70/2000, Time elapsed: 19.98s
* Train loss: 83.71   (RE: 48.14, KL: 50.81)
o Val.  loss: 103.43   (RE: 52.28, KL: 51.15)
--> Early stopping: 0/50 (BEST: 103.79)

->model saved<-
beta: 0.71
Epoch: 71/2000, Time elapsed: 19.86s
* Train loss: 84.14   (RE: 48.50, KL: 50.21)
o Val.  loss: 103.16   (RE: 52.84, KL: 50.32)
--> Early stopping: 0/50 (BEST: 103.43)

->model saved<-
beta: 0.72
Epoch: 72/2000, Time elapsed: 20.02s
* Train loss: 84.53   (RE: 48.81, KL: 49.61)
o Val.  loss: 102.93   (RE: 53.38, KL: 49.55)
--> Early stopping: 0/50 (BEST: 103.16)

->model saved<-
beta: 0.73
Epoch: 73/2000, Time elapsed: 20.06s
* Train loss: 84.95   (RE: 49.22, KL: 48.95)
o Val.  loss: 102.53   (RE: 53.09, KL: 49.44)
--> Early stopping: 0/50 (BEST: 102.93)

->model saved<-
beta: 0.74
Epoch: 74/2000, Time elapsed: 20.24s
* Train loss: 85.41   (RE: 49.58, KL: 48.43)
o Val.  loss: 102.14   (RE: 53.82, KL: 48.32)
--> Early stopping: 0/50 (BEST: 102.53)

->model saved<-
beta: 0.75
Epoch: 75/2000, Time elapsed: 20.18s
* Train loss: 85.78   (RE: 49.93, KL: 47.80)
o Val.  loss: 101.97   (RE: 54.26, KL: 47.71)
--> Early stopping: 0/50 (BEST: 102.14)

->model saved<-
beta: 0.76
Epoch: 76/2000, Time elapsed: 19.37s
* Train loss: 86.17   (RE: 50.26, KL: 47.25)
o Val.  loss: 101.77   (RE: 54.64, KL: 47.14)
--> Early stopping: 0/50 (BEST: 101.97)

->model saved<-
beta: 0.77
Epoch: 77/2000, Time elapsed: 19.91s
* Train loss: 86.55   (RE: 50.63, KL: 46.66)
o Val.  loss: 101.61   (RE: 54.79, KL: 46.82)
--> Early stopping: 0/50 (BEST: 101.77)

->model saved<-
beta: 0.78
Epoch: 78/2000, Time elapsed: 18.89s
* Train loss: 86.95   (RE: 50.99, KL: 46.10)
o Val.  loss: 101.28   (RE: 55.51, KL: 45.77)
--> Early stopping: 0/50 (BEST: 101.61)

->model saved<-
beta: 0.79
Epoch: 79/2000, Time elapsed: 19.16s
* Train loss: 87.34   (RE: 51.37, KL: 45.53)
o Val.  loss: 101.13   (RE: 55.53, KL: 45.60)
--> Early stopping: 0/50 (BEST: 101.28)

->model saved<-
beta: 0.8
Epoch: 80/2000, Time elapsed: 19.49s
* Train loss: 87.71   (RE: 51.72, KL: 44.98)
o Val.  loss: 100.96   (RE: 55.54, KL: 45.42)
--> Early stopping: 0/50 (BEST: 101.13)

->model saved<-
beta: 0.81
Epoch: 81/2000, Time elapsed: 19.72s
* Train loss: 88.07   (RE: 52.06, KL: 44.46)
o Val.  loss: 100.76   (RE: 55.91, KL: 44.86)
--> Early stopping: 0/50 (BEST: 100.96)

->model saved<-
beta: 0.82
Epoch: 82/2000, Time elapsed: 19.81s
* Train loss: 88.46   (RE: 52.43, KL: 43.94)
o Val.  loss: 100.41   (RE: 56.57, KL: 43.84)
--> Early stopping: 0/50 (BEST: 100.76)

->model saved<-
beta: 0.83
Epoch: 83/2000, Time elapsed: 19.13s
* Train loss: 88.78   (RE: 52.76, KL: 43.40)
o Val.  loss: 100.26   (RE: 56.59, KL: 43.67)
--> Early stopping: 0/50 (BEST: 100.41)

->model saved<-
beta: 0.84
Epoch: 84/2000, Time elapsed: 19.81s
* Train loss: 89.16   (RE: 53.11, KL: 42.91)
o Val.  loss: 99.94   (RE: 56.98, KL: 42.96)
--> Early stopping: 0/50 (BEST: 100.26)

->model saved<-
beta: 0.85
Epoch: 85/2000, Time elapsed: 19.92s
* Train loss: 89.49   (RE: 53.48, KL: 42.36)
o Val.  loss: 99.84   (RE: 57.47, KL: 42.36)
--> Early stopping: 0/50 (BEST: 99.94)

->model saved<-
beta: 0.86
Epoch: 86/2000, Time elapsed: 20.24s
* Train loss: 89.83   (RE: 53.81, KL: 41.88)
o Val.  loss: 99.75   (RE: 57.97, KL: 41.78)
--> Early stopping: 0/50 (BEST: 99.84)

->model saved<-
beta: 0.87
Epoch: 87/2000, Time elapsed: 20.11s
* Train loss: 90.17   (RE: 54.17, KL: 41.37)
o Val.  loss: 99.63   (RE: 58.21, KL: 41.43)
--> Early stopping: 0/50 (BEST: 99.75)

->model saved<-
beta: 0.88
Epoch: 88/2000, Time elapsed: 20.23s
* Train loss: 90.51   (RE: 54.55, KL: 40.87)
o Val.  loss: 99.27   (RE: 58.20, KL: 41.06)
--> Early stopping: 0/50 (BEST: 99.63)

->model saved<-
beta: 0.89
Epoch: 89/2000, Time elapsed: 19.89s
* Train loss: 90.85   (RE: 54.88, KL: 40.41)
o Val.  loss: 99.16   (RE: 58.61, KL: 40.55)
--> Early stopping: 0/50 (BEST: 99.27)

->model saved<-
beta: 0.9
Epoch: 90/2000, Time elapsed: 19.44s
* Train loss: 91.17   (RE: 55.23, KL: 39.94)
o Val.  loss: 98.92   (RE: 59.13, KL: 39.79)
--> Early stopping: 0/50 (BEST: 99.16)

->model saved<-
beta: 0.91
Epoch: 91/2000, Time elapsed: 19.83s
* Train loss: 91.47   (RE: 55.55, KL: 39.47)
o Val.  loss: 98.81   (RE: 59.00, KL: 39.81)
--> Early stopping: 0/50 (BEST: 98.92)

->model saved<-
beta: 0.92
Epoch: 92/2000, Time elapsed: 20.05s
* Train loss: 91.81   (RE: 55.91, KL: 39.02)
o Val.  loss: 98.57   (RE: 59.41, KL: 39.16)
--> Early stopping: 0/50 (BEST: 98.81)

->model saved<-
beta: 0.93
Epoch: 93/2000, Time elapsed: 19.26s
* Train loss: 92.10   (RE: 56.26, KL: 38.54)
o Val.  loss: 98.63   (RE: 60.06, KL: 38.57)
--> Early stopping: 0/50 (BEST: 98.57)

beta: 0.94
Epoch: 94/2000, Time elapsed: 20.21s
* Train loss: 92.39   (RE: 56.58, KL: 38.09)
o Val.  loss: 98.26   (RE: 60.13, KL: 38.14)
--> Early stopping: 0/50 (BEST: 98.57)

->model saved<-
beta: 0.95
Epoch: 95/2000, Time elapsed: 20.16s
* Train loss: 92.66   (RE: 56.88, KL: 37.66)
o Val.  loss: 98.14   (RE: 60.42, KL: 37.72)
--> Early stopping: 0/50 (BEST: 98.26)

->model saved<-
beta: 0.96
Epoch: 96/2000, Time elapsed: 19.41s
* Train loss: 93.02   (RE: 57.27, KL: 37.25)
o Val.  loss: 98.01   (RE: 60.79, KL: 37.22)
--> Early stopping: 0/50 (BEST: 98.14)

->model saved<-
beta: 0.97
Epoch: 97/2000, Time elapsed: 19.03s
* Train loss: 93.24   (RE: 57.59, KL: 36.76)
o Val.  loss: 97.86   (RE: 61.07, KL: 36.79)
--> Early stopping: 0/50 (BEST: 98.01)

->model saved<-
beta: 0.98
Epoch: 98/2000, Time elapsed: 19.52s
* Train loss: 93.55   (RE: 57.91, KL: 36.36)
o Val.  loss: 97.82   (RE: 61.15, KL: 36.67)
--> Early stopping: 0/50 (BEST: 97.86)

->model saved<-
beta: 0.99
Epoch: 99/2000, Time elapsed: 20.14s
* Train loss: 93.84   (RE: 58.23, KL: 35.97)
o Val.  loss: 97.62   (RE: 61.55, KL: 36.07)
--> Early stopping: 0/50 (BEST: 97.82)

->model saved<-
beta: 1.0
Epoch: 100/2000, Time elapsed: 19.57s
* Train loss: 94.12   (RE: 58.55, KL: 35.57)
o Val.  loss: 97.61   (RE: 62.16, KL: 35.45)
--> Early stopping: 0/50 (BEST: 97.62)

->model saved<-
beta: 1.0
Epoch: 101/2000, Time elapsed: 19.91s
* Train loss: 93.99   (RE: 58.69, KL: 35.30)
o Val.  loss: 97.43   (RE: 61.75, KL: 35.68)
--> Early stopping: 0/50 (BEST: 97.61)

->model saved<-
beta: 1.0
Epoch: 102/2000, Time elapsed: 20.27s
* Train loss: 93.93   (RE: 58.78, KL: 35.15)
o Val.  loss: 97.30   (RE: 61.97, KL: 35.33)
--> Early stopping: 0/50 (BEST: 97.43)

->model saved<-
beta: 1.0
Epoch: 103/2000, Time elapsed: 19.87s
* Train loss: 93.81   (RE: 58.82, KL: 34.99)
o Val.  loss: 97.29   (RE: 62.25, KL: 35.03)
--> Early stopping: 0/50 (BEST: 97.30)

->model saved<-
beta: 1.0
Epoch: 104/2000, Time elapsed: 19.88s
* Train loss: 93.73   (RE: 58.92, KL: 34.81)
o Val.  loss: 97.12   (RE: 62.21, KL: 34.91)
--> Early stopping: 0/50 (BEST: 97.29)

->model saved<-
beta: 1.0
Epoch: 105/2000, Time elapsed: 19.61s
* Train loss: 93.64   (RE: 58.96, KL: 34.68)
o Val.  loss: 97.04   (RE: 62.34, KL: 34.71)
--> Early stopping: 0/50 (BEST: 97.12)

->model saved<-
beta: 1.0
Epoch: 106/2000, Time elapsed: 19.91s
* Train loss: 93.55   (RE: 59.01, KL: 34.54)
o Val.  loss: 96.97   (RE: 62.36, KL: 34.61)
--> Early stopping: 0/50 (BEST: 97.04)

->model saved<-
beta: 1.0
Epoch: 107/2000, Time elapsed: 20.03s
* Train loss: 93.53   (RE: 59.06, KL: 34.48)
o Val.  loss: 96.81   (RE: 62.20, KL: 34.61)
--> Early stopping: 0/50 (BEST: 96.97)

->model saved<-
beta: 1.0
Epoch: 108/2000, Time elapsed: 19.86s
* Train loss: 93.40   (RE: 59.06, KL: 34.33)
o Val.  loss: 96.87   (RE: 62.46, KL: 34.42)
--> Early stopping: 0/50 (BEST: 96.81)

beta: 1.0
Epoch: 109/2000, Time elapsed: 19.87s
* Train loss: 93.29   (RE: 59.12, KL: 34.17)
o Val.  loss: 96.72   (RE: 62.51, KL: 34.21)
--> Early stopping: 1/50 (BEST: 96.81)

->model saved<-
beta: 1.0
Epoch: 110/2000, Time elapsed: 20.27s
* Train loss: 93.24   (RE: 59.14, KL: 34.10)
o Val.  loss: 96.63   (RE: 62.06, KL: 34.57)
--> Early stopping: 0/50 (BEST: 96.72)

->model saved<-
beta: 1.0
Epoch: 111/2000, Time elapsed: 18.66s
* Train loss: 93.13   (RE: 59.14, KL: 33.98)
o Val.  loss: 96.57   (RE: 62.53, KL: 34.04)
--> Early stopping: 0/50 (BEST: 96.63)

->model saved<-
beta: 1.0
Epoch: 112/2000, Time elapsed: 20.53s
* Train loss: 93.05   (RE: 59.19, KL: 33.85)
o Val.  loss: 96.58   (RE: 62.54, KL: 34.05)
--> Early stopping: 0/50 (BEST: 96.57)

beta: 1.0
Epoch: 113/2000, Time elapsed: 19.49s
* Train loss: 92.98   (RE: 59.20, KL: 33.78)
o Val.  loss: 96.31   (RE: 62.49, KL: 33.82)
--> Early stopping: 1/50 (BEST: 96.57)

->model saved<-
beta: 1.0
Epoch: 114/2000, Time elapsed: 19.08s
* Train loss: 92.90   (RE: 59.22, KL: 33.67)
o Val.  loss: 96.30   (RE: 62.64, KL: 33.66)
--> Early stopping: 0/50 (BEST: 96.31)

->model saved<-
beta: 1.0
Epoch: 115/2000, Time elapsed: 20.17s
* Train loss: 92.83   (RE: 59.24, KL: 33.59)
o Val.  loss: 96.27   (RE: 62.65, KL: 33.62)
--> Early stopping: 0/50 (BEST: 96.30)

->model saved<-
beta: 1.0
Epoch: 116/2000, Time elapsed: 20.15s
* Train loss: 92.75   (RE: 59.24, KL: 33.51)
o Val.  loss: 96.19   (RE: 62.69, KL: 33.50)
--> Early stopping: 0/50 (BEST: 96.27)

->model saved<-
beta: 1.0
Epoch: 117/2000, Time elapsed: 19.82s
* Train loss: 92.63   (RE: 59.18, KL: 33.45)
o Val.  loss: 96.22   (RE: 62.59, KL: 33.64)
--> Early stopping: 0/50 (BEST: 96.19)

beta: 1.0
Epoch: 118/2000, Time elapsed: 20.34s
* Train loss: 92.57   (RE: 59.22, KL: 33.35)
o Val.  loss: 96.07   (RE: 62.69, KL: 33.38)
--> Early stopping: 1/50 (BEST: 96.19)

->model saved<-
beta: 1.0
Epoch: 119/2000, Time elapsed: 19.43s
* Train loss: 92.53   (RE: 59.22, KL: 33.31)
o Val.  loss: 96.05   (RE: 62.74, KL: 33.32)
--> Early stopping: 0/50 (BEST: 96.07)

->model saved<-
beta: 1.0
Epoch: 120/2000, Time elapsed: 20.14s
* Train loss: 92.44   (RE: 59.27, KL: 33.17)
o Val.  loss: 95.98   (RE: 62.79, KL: 33.18)
--> Early stopping: 0/50 (BEST: 96.05)

->model saved<-
beta: 1.0
Epoch: 121/2000, Time elapsed: 20.03s
* Train loss: 92.38   (RE: 59.27, KL: 33.11)
o Val.  loss: 96.03   (RE: 62.66, KL: 33.37)
--> Early stopping: 0/50 (BEST: 95.98)

beta: 1.0
Epoch: 122/2000, Time elapsed: 19.80s
* Train loss: 92.31   (RE: 59.25, KL: 33.06)
o Val.  loss: 95.80   (RE: 62.76, KL: 33.04)
--> Early stopping: 1/50 (BEST: 95.98)

->model saved<-
beta: 1.0
Epoch: 123/2000, Time elapsed: 20.47s
* Train loss: 92.23   (RE: 59.27, KL: 32.96)
o Val.  loss: 95.72   (RE: 62.35, KL: 33.37)
--> Early stopping: 0/50 (BEST: 95.80)

->model saved<-
beta: 1.0
Epoch: 124/2000, Time elapsed: 19.65s
* Train loss: 92.13   (RE: 59.23, KL: 32.91)
o Val.  loss: 95.71   (RE: 62.67, KL: 33.04)
--> Early stopping: 0/50 (BEST: 95.72)

->model saved<-
beta: 1.0
Epoch: 125/2000, Time elapsed: 19.51s
* Train loss: 92.11   (RE: 59.26, KL: 32.85)
o Val.  loss: 95.74   (RE: 62.58, KL: 33.16)
--> Early stopping: 0/50 (BEST: 95.71)

beta: 1.0
Epoch: 126/2000, Time elapsed: 19.68s
* Train loss: 92.03   (RE: 59.27, KL: 32.76)
o Val.  loss: 95.51   (RE: 62.78, KL: 32.73)
--> Early stopping: 1/50 (BEST: 95.71)

->model saved<-
beta: 1.0
Epoch: 127/2000, Time elapsed: 19.28s
* Train loss: 91.95   (RE: 59.25, KL: 32.71)
o Val.  loss: 95.55   (RE: 62.56, KL: 32.99)
--> Early stopping: 0/50 (BEST: 95.51)

beta: 1.0
Epoch: 128/2000, Time elapsed: 20.04s
* Train loss: 91.93   (RE: 59.25, KL: 32.68)
o Val.  loss: 95.54   (RE: 62.66, KL: 32.89)
--> Early stopping: 1/50 (BEST: 95.51)

beta: 1.0
Epoch: 129/2000, Time elapsed: 19.49s
* Train loss: 91.84   (RE: 59.21, KL: 32.62)
o Val.  loss: 95.58   (RE: 62.93, KL: 32.65)
--> Early stopping: 2/50 (BEST: 95.51)

beta: 1.0
Epoch: 130/2000, Time elapsed: 19.73s
* Train loss: 91.81   (RE: 59.26, KL: 32.55)
o Val.  loss: 95.50   (RE: 62.95, KL: 32.55)
--> Early stopping: 3/50 (BEST: 95.51)

->model saved<-
beta: 1.0
Epoch: 131/2000, Time elapsed: 19.70s
* Train loss: 91.72   (RE: 59.22, KL: 32.50)
o Val.  loss: 95.47   (RE: 62.95, KL: 32.53)
--> Early stopping: 0/50 (BEST: 95.50)

->model saved<-
beta: 1.0
Epoch: 132/2000, Time elapsed: 19.89s
* Train loss: 91.65   (RE: 59.25, KL: 32.40)
o Val.  loss: 95.23   (RE: 62.69, KL: 32.54)
--> Early stopping: 0/50 (BEST: 95.47)

->model saved<-
beta: 1.0
Epoch: 133/2000, Time elapsed: 19.61s
* Train loss: 91.59   (RE: 59.24, KL: 32.35)
o Val.  loss: 95.33   (RE: 62.55, KL: 32.77)
--> Early stopping: 0/50 (BEST: 95.23)

beta: 1.0
Epoch: 134/2000, Time elapsed: 20.08s
* Train loss: 91.54   (RE: 59.23, KL: 32.30)
o Val.  loss: 95.21   (RE: 62.83, KL: 32.38)
--> Early stopping: 1/50 (BEST: 95.23)

->model saved<-
beta: 1.0
Epoch: 135/2000, Time elapsed: 19.86s
* Train loss: 91.47   (RE: 59.21, KL: 32.26)
o Val.  loss: 95.22   (RE: 62.78, KL: 32.45)
--> Early stopping: 0/50 (BEST: 95.21)

beta: 1.0
Epoch: 136/2000, Time elapsed: 19.91s
* Train loss: 91.42   (RE: 59.21, KL: 32.22)
o Val.  loss: 95.20   (RE: 62.84, KL: 32.36)
--> Early stopping: 1/50 (BEST: 95.21)

->model saved<-
beta: 1.0
Epoch: 137/2000, Time elapsed: 20.16s
* Train loss: 91.34   (RE: 59.20, KL: 32.14)
o Val.  loss: 95.05   (RE: 62.65, KL: 32.40)
--> Early stopping: 0/50 (BEST: 95.20)

->model saved<-
beta: 1.0
Epoch: 138/2000, Time elapsed: 19.34s
* Train loss: 91.29   (RE: 59.20, KL: 32.09)
o Val.  loss: 95.03   (RE: 62.70, KL: 32.33)
--> Early stopping: 0/50 (BEST: 95.05)

->model saved<-
beta: 1.0
Epoch: 139/2000, Time elapsed: 20.05s
* Train loss: 91.24   (RE: 59.17, KL: 32.07)
o Val.  loss: 95.03   (RE: 62.72, KL: 32.31)
--> Early stopping: 0/50 (BEST: 95.03)

beta: 1.0
Epoch: 140/2000, Time elapsed: 20.06s
* Train loss: 91.18   (RE: 59.15, KL: 32.03)
o Val.  loss: 95.07   (RE: 62.90, KL: 32.17)
--> Early stopping: 1/50 (BEST: 95.03)

beta: 1.0
Epoch: 141/2000, Time elapsed: 20.12s
* Train loss: 91.12   (RE: 59.14, KL: 31.98)
o Val.  loss: 95.08   (RE: 62.81, KL: 32.26)
--> Early stopping: 2/50 (BEST: 95.03)

beta: 1.0
Epoch: 142/2000, Time elapsed: 19.93s
* Train loss: 91.08   (RE: 59.13, KL: 31.94)
o Val.  loss: 94.99   (RE: 62.82, KL: 32.16)
--> Early stopping: 3/50 (BEST: 95.03)

->model saved<-
beta: 1.0
Epoch: 143/2000, Time elapsed: 19.96s
* Train loss: 90.97   (RE: 59.12, KL: 31.86)
o Val.  loss: 94.87   (RE: 62.95, KL: 31.91)
--> Early stopping: 0/50 (BEST: 94.99)

->model saved<-
beta: 1.0
Epoch: 144/2000, Time elapsed: 19.93s
* Train loss: 90.94   (RE: 59.13, KL: 31.82)
o Val.  loss: 94.87   (RE: 62.80, KL: 32.07)
--> Early stopping: 0/50 (BEST: 94.87)

beta: 1.0
Epoch: 145/2000, Time elapsed: 20.46s
* Train loss: 90.90   (RE: 59.11, KL: 31.79)
o Val.  loss: 94.85   (RE: 62.69, KL: 32.16)
--> Early stopping: 1/50 (BEST: 94.87)

->model saved<-
beta: 1.0
Epoch: 146/2000, Time elapsed: 19.13s
* Train loss: 90.84   (RE: 59.09, KL: 31.75)
o Val.  loss: 94.67   (RE: 62.71, KL: 31.96)
--> Early stopping: 0/50 (BEST: 94.85)

->model saved<-
beta: 1.0
Epoch: 147/2000, Time elapsed: 20.00s
* Train loss: 90.79   (RE: 59.10, KL: 31.69)
o Val.  loss: 94.73   (RE: 62.79, KL: 31.93)
--> Early stopping: 0/50 (BEST: 94.67)

beta: 1.0
Epoch: 148/2000, Time elapsed: 19.16s
* Train loss: 90.72   (RE: 59.06, KL: 31.66)
o Val.  loss: 94.55   (RE: 63.03, KL: 31.52)
--> Early stopping: 1/50 (BEST: 94.67)

->model saved<-
beta: 1.0
Epoch: 149/2000, Time elapsed: 19.88s
* Train loss: 90.66   (RE: 59.05, KL: 31.62)
o Val.  loss: 94.69   (RE: 62.97, KL: 31.72)
--> Early stopping: 0/50 (BEST: 94.55)

beta: 1.0
Epoch: 150/2000, Time elapsed: 20.35s
* Train loss: 90.63   (RE: 59.05, KL: 31.58)
o Val.  loss: 94.78   (RE: 62.81, KL: 31.97)
--> Early stopping: 1/50 (BEST: 94.55)

beta: 1.0
Epoch: 151/2000, Time elapsed: 20.11s
* Train loss: 90.56   (RE: 59.01, KL: 31.55)
o Val.  loss: 94.69   (RE: 63.17, KL: 31.52)
--> Early stopping: 2/50 (BEST: 94.55)

beta: 1.0
Epoch: 152/2000, Time elapsed: 20.10s
* Train loss: 90.52   (RE: 58.98, KL: 31.54)
o Val.  loss: 94.56   (RE: 62.94, KL: 31.62)
--> Early stopping: 3/50 (BEST: 94.55)

beta: 1.0
Epoch: 153/2000, Time elapsed: 19.06s
* Train loss: 90.48   (RE: 58.98, KL: 31.50)
o Val.  loss: 94.55   (RE: 62.80, KL: 31.76)
--> Early stopping: 4/50 (BEST: 94.55)

beta: 1.0
Epoch: 154/2000, Time elapsed: 19.19s
* Train loss: 90.41   (RE: 58.96, KL: 31.45)
o Val.  loss: 94.52   (RE: 62.61, KL: 31.91)
--> Early stopping: 5/50 (BEST: 94.55)

->model saved<-
beta: 1.0
Epoch: 155/2000, Time elapsed: 20.11s
* Train loss: 90.37   (RE: 58.94, KL: 31.43)
o Val.  loss: 94.39   (RE: 62.79, KL: 31.60)
--> Early stopping: 0/50 (BEST: 94.52)

->model saved<-
beta: 1.0
Epoch: 156/2000, Time elapsed: 20.17s
* Train loss: 90.35   (RE: 58.94, KL: 31.40)
o Val.  loss: 94.38   (RE: 62.75, KL: 31.63)
--> Early stopping: 0/50 (BEST: 94.39)

->model saved<-
beta: 1.0
Epoch: 157/2000, Time elapsed: 19.89s
* Train loss: 90.26   (RE: 58.90, KL: 31.37)
o Val.  loss: 94.41   (RE: 62.84, KL: 31.56)
--> Early stopping: 0/50 (BEST: 94.38)

beta: 1.0
Epoch: 158/2000, Time elapsed: 19.77s
* Train loss: 90.21   (RE: 58.90, KL: 31.31)
o Val.  loss: 94.35   (RE: 62.79, KL: 31.56)
--> Early stopping: 1/50 (BEST: 94.38)

->model saved<-
beta: 1.0
Epoch: 159/2000, Time elapsed: 19.64s
* Train loss: 90.21   (RE: 58.90, KL: 31.31)
o Val.  loss: 94.31   (RE: 63.00, KL: 31.31)
--> Early stopping: 0/50 (BEST: 94.35)

->model saved<-
beta: 1.0
Epoch: 160/2000, Time elapsed: 20.38s
* Train loss: 90.13   (RE: 58.88, KL: 31.25)
o Val.  loss: 94.29   (RE: 62.66, KL: 31.63)
--> Early stopping: 0/50 (BEST: 94.31)

->model saved<-
beta: 1.0
Epoch: 161/2000, Time elapsed: 21.40s
* Train loss: 90.07   (RE: 58.83, KL: 31.24)
o Val.  loss: 94.17   (RE: 62.78, KL: 31.40)
--> Early stopping: 0/50 (BEST: 94.29)

->model saved<-
beta: 1.0
Epoch: 162/2000, Time elapsed: 20.37s
* Train loss: 90.03   (RE: 58.83, KL: 31.20)
o Val.  loss: 94.41   (RE: 62.90, KL: 31.51)
--> Early stopping: 0/50 (BEST: 94.17)

beta: 1.0
Epoch: 163/2000, Time elapsed: 19.62s
* Train loss: 89.99   (RE: 58.80, KL: 31.19)
o Val.  loss: 94.16   (RE: 62.73, KL: 31.43)
--> Early stopping: 1/50 (BEST: 94.17)

->model saved<-
beta: 1.0
Epoch: 164/2000, Time elapsed: 20.23s
* Train loss: 89.95   (RE: 58.76, KL: 31.19)
o Val.  loss: 94.23   (RE: 62.80, KL: 31.43)
--> Early stopping: 0/50 (BEST: 94.16)

beta: 1.0
Epoch: 165/2000, Time elapsed: 19.95s
* Train loss: 89.91   (RE: 58.75, KL: 31.16)
o Val.  loss: 94.04   (RE: 62.88, KL: 31.17)
--> Early stopping: 1/50 (BEST: 94.16)

->model saved<-
beta: 1.0
Epoch: 166/2000, Time elapsed: 20.81s
* Train loss: 89.86   (RE: 58.73, KL: 31.13)
o Val.  loss: 94.13   (RE: 62.81, KL: 31.32)
--> Early stopping: 0/50 (BEST: 94.04)

beta: 1.0
Epoch: 167/2000, Time elapsed: 19.88s
* Train loss: 89.82   (RE: 58.73, KL: 31.09)
o Val.  loss: 94.19   (RE: 62.59, KL: 31.61)
--> Early stopping: 1/50 (BEST: 94.04)

beta: 1.0
Epoch: 168/2000, Time elapsed: 19.92s
* Train loss: 89.77   (RE: 58.70, KL: 31.07)
o Val.  loss: 94.05   (RE: 62.90, KL: 31.16)
--> Early stopping: 2/50 (BEST: 94.04)

beta: 1.0
Epoch: 169/2000, Time elapsed: 21.20s
* Train loss: 89.70   (RE: 58.67, KL: 31.03)
o Val.  loss: 94.07   (RE: 62.55, KL: 31.52)
--> Early stopping: 3/50 (BEST: 94.04)

beta: 1.0
Epoch: 170/2000, Time elapsed: 20.02s
* Train loss: 89.70   (RE: 58.68, KL: 31.01)
o Val.  loss: 93.98   (RE: 62.90, KL: 31.08)
--> Early stopping: 4/50 (BEST: 94.04)

->model saved<-
beta: 1.0
Epoch: 171/2000, Time elapsed: 20.15s
* Train loss: 89.62   (RE: 58.64, KL: 30.98)
o Val.  loss: 94.04   (RE: 62.72, KL: 31.32)
--> Early stopping: 0/50 (BEST: 93.98)

beta: 1.0
Epoch: 172/2000, Time elapsed: 19.80s
* Train loss: 89.60   (RE: 58.64, KL: 30.96)
o Val.  loss: 94.15   (RE: 62.84, KL: 31.31)
--> Early stopping: 1/50 (BEST: 93.98)

beta: 1.0
Epoch: 173/2000, Time elapsed: 19.07s
* Train loss: 89.54   (RE: 58.60, KL: 30.94)
o Val.  loss: 93.93   (RE: 63.02, KL: 30.92)
--> Early stopping: 2/50 (BEST: 93.98)

->model saved<-
beta: 1.0
Epoch: 174/2000, Time elapsed: 19.71s
* Train loss: 89.53   (RE: 58.60, KL: 30.94)
o Val.  loss: 93.94   (RE: 62.74, KL: 31.20)
--> Early stopping: 0/50 (BEST: 93.93)

beta: 1.0
Epoch: 175/2000, Time elapsed: 20.08s
* Train loss: 89.48   (RE: 58.59, KL: 30.89)
o Val.  loss: 93.96   (RE: 62.65, KL: 31.30)
--> Early stopping: 1/50 (BEST: 93.93)

beta: 1.0
Epoch: 176/2000, Time elapsed: 19.16s
* Train loss: 89.43   (RE: 58.55, KL: 30.88)
o Val.  loss: 93.84   (RE: 62.81, KL: 31.04)
--> Early stopping: 2/50 (BEST: 93.93)

->model saved<-
beta: 1.0
Epoch: 177/2000, Time elapsed: 20.11s
* Train loss: 89.41   (RE: 58.53, KL: 30.88)
o Val.  loss: 94.11   (RE: 62.79, KL: 31.32)
--> Early stopping: 0/50 (BEST: 93.84)

beta: 1.0
Epoch: 178/2000, Time elapsed: 20.19s
* Train loss: 89.35   (RE: 58.48, KL: 30.87)
o Val.  loss: 93.92   (RE: 63.03, KL: 30.89)
--> Early stopping: 1/50 (BEST: 93.84)

beta: 1.0
Epoch: 179/2000, Time elapsed: 19.54s
* Train loss: 89.32   (RE: 58.51, KL: 30.81)
o Val.  loss: 93.92   (RE: 62.84, KL: 31.07)
--> Early stopping: 2/50 (BEST: 93.84)

beta: 1.0
Epoch: 180/2000, Time elapsed: 19.93s
* Train loss: 89.30   (RE: 58.48, KL: 30.82)
o Val.  loss: 93.90   (RE: 62.91, KL: 30.99)
--> Early stopping: 3/50 (BEST: 93.84)

beta: 1.0
Epoch: 181/2000, Time elapsed: 20.04s
* Train loss: 89.23   (RE: 58.43, KL: 30.81)
o Val.  loss: 93.95   (RE: 62.52, KL: 31.43)
--> Early stopping: 4/50 (BEST: 93.84)

beta: 1.0
Epoch: 182/2000, Time elapsed: 19.97s
* Train loss: 89.20   (RE: 58.43, KL: 30.77)
o Val.  loss: 93.98   (RE: 62.88, KL: 31.10)
--> Early stopping: 5/50 (BEST: 93.84)

beta: 1.0
Epoch: 183/2000, Time elapsed: 19.68s
* Train loss: 89.16   (RE: 58.37, KL: 30.79)
o Val.  loss: 94.02   (RE: 62.78, KL: 31.24)
--> Early stopping: 6/50 (BEST: 93.84)

beta: 1.0
Epoch: 184/2000, Time elapsed: 19.26s
* Train loss: 89.12   (RE: 58.38, KL: 30.74)
o Val.  loss: 94.01   (RE: 62.80, KL: 31.20)
--> Early stopping: 7/50 (BEST: 93.84)

beta: 1.0
Epoch: 185/2000, Time elapsed: 19.83s
* Train loss: 89.10   (RE: 58.37, KL: 30.72)
o Val.  loss: 93.80   (RE: 62.93, KL: 30.87)
--> Early stopping: 8/50 (BEST: 93.84)

->model saved<-
beta: 1.0
Epoch: 186/2000, Time elapsed: 19.63s
* Train loss: 89.05   (RE: 58.36, KL: 30.69)
o Val.  loss: 93.85   (RE: 62.81, KL: 31.04)
--> Early stopping: 0/50 (BEST: 93.80)

beta: 1.0
Epoch: 187/2000, Time elapsed: 19.77s
* Train loss: 89.05   (RE: 58.32, KL: 30.73)
o Val.  loss: 93.66   (RE: 62.68, KL: 30.98)
--> Early stopping: 1/50 (BEST: 93.80)

->model saved<-
beta: 1.0
Epoch: 188/2000, Time elapsed: 20.06s
* Train loss: 88.98   (RE: 58.29, KL: 30.69)
o Val.  loss: 93.73   (RE: 62.91, KL: 30.82)
--> Early stopping: 0/50 (BEST: 93.66)

beta: 1.0
Epoch: 189/2000, Time elapsed: 20.27s
* Train loss: 88.93   (RE: 58.27, KL: 30.66)
o Val.  loss: 93.81   (RE: 62.77, KL: 31.04)
--> Early stopping: 1/50 (BEST: 93.66)

beta: 1.0
Epoch: 190/2000, Time elapsed: 20.28s
* Train loss: 88.94   (RE: 58.28, KL: 30.66)
o Val.  loss: 93.67   (RE: 62.70, KL: 30.97)
--> Early stopping: 2/50 (BEST: 93.66)

beta: 1.0
Epoch: 191/2000, Time elapsed: 20.00s
* Train loss: 88.91   (RE: 58.28, KL: 30.64)
o Val.  loss: 93.63   (RE: 62.63, KL: 31.00)
--> Early stopping: 3/50 (BEST: 93.66)

->model saved<-
beta: 1.0
Epoch: 192/2000, Time elapsed: 19.37s
* Train loss: 88.83   (RE: 58.20, KL: 30.63)
o Val.  loss: 93.73   (RE: 62.70, KL: 31.03)
--> Early stopping: 0/50 (BEST: 93.63)

beta: 1.0
Epoch: 193/2000, Time elapsed: 21.02s
* Train loss: 88.81   (RE: 58.19, KL: 30.61)
o Val.  loss: 93.60   (RE: 62.84, KL: 30.76)
--> Early stopping: 1/50 (BEST: 93.63)

->model saved<-
beta: 1.0
Epoch: 194/2000, Time elapsed: 19.75s
* Train loss: 88.77   (RE: 58.18, KL: 30.60)
o Val.  loss: 93.80   (RE: 62.88, KL: 30.92)
--> Early stopping: 0/50 (BEST: 93.60)

beta: 1.0
Epoch: 195/2000, Time elapsed: 19.44s
* Train loss: 88.72   (RE: 58.12, KL: 30.60)
o Val.  loss: 93.69   (RE: 62.80, KL: 30.89)
--> Early stopping: 1/50 (BEST: 93.60)

beta: 1.0
Epoch: 196/2000, Time elapsed: 19.36s
* Train loss: 88.71   (RE: 58.15, KL: 30.56)
o Val.  loss: 93.62   (RE: 62.68, KL: 30.94)
--> Early stopping: 2/50 (BEST: 93.60)

beta: 1.0
Epoch: 197/2000, Time elapsed: 19.99s
* Train loss: 88.70   (RE: 58.15, KL: 30.55)
o Val.  loss: 93.72   (RE: 62.79, KL: 30.92)
--> Early stopping: 3/50 (BEST: 93.60)

beta: 1.0
Epoch: 198/2000, Time elapsed: 20.07s
* Train loss: 88.66   (RE: 58.11, KL: 30.54)
o Val.  loss: 93.55   (RE: 62.98, KL: 30.56)
--> Early stopping: 4/50 (BEST: 93.60)

->model saved<-
beta: 1.0
Epoch: 199/2000, Time elapsed: 19.99s
* Train loss: 88.63   (RE: 58.11, KL: 30.52)
o Val.  loss: 93.66   (RE: 62.81, KL: 30.85)
--> Early stopping: 0/50 (BEST: 93.55)

beta: 1.0
Epoch: 200/2000, Time elapsed: 20.08s
* Train loss: 88.60   (RE: 58.08, KL: 30.52)
o Val.  loss: 93.75   (RE: 62.81, KL: 30.93)
--> Early stopping: 1/50 (BEST: 93.55)

beta: 1.0
Epoch: 201/2000, Time elapsed: 19.86s
* Train loss: 88.57   (RE: 58.07, KL: 30.50)
o Val.  loss: 93.60   (RE: 62.88, KL: 30.71)
--> Early stopping: 2/50 (BEST: 93.55)

beta: 1.0
Epoch: 202/2000, Time elapsed: 19.17s
* Train loss: 88.51   (RE: 58.04, KL: 30.47)
o Val.  loss: 93.54   (RE: 62.69, KL: 30.86)
--> Early stopping: 3/50 (BEST: 93.55)

->model saved<-
beta: 1.0
Epoch: 203/2000, Time elapsed: 19.75s
* Train loss: 88.47   (RE: 58.00, KL: 30.48)
o Val.  loss: 93.54   (RE: 62.74, KL: 30.80)
--> Early stopping: 0/50 (BEST: 93.54)

beta: 1.0
Epoch: 204/2000, Time elapsed: 20.01s
* Train loss: 88.44   (RE: 57.98, KL: 30.46)
o Val.  loss: 93.55   (RE: 62.83, KL: 30.72)
--> Early stopping: 1/50 (BEST: 93.54)

beta: 1.0
Epoch: 205/2000, Time elapsed: 19.89s
* Train loss: 88.44   (RE: 57.95, KL: 30.48)
o Val.  loss: 93.65   (RE: 62.63, KL: 31.02)
--> Early stopping: 2/50 (BEST: 93.54)

beta: 1.0
Epoch: 206/2000, Time elapsed: 20.27s
* Train loss: 88.38   (RE: 57.92, KL: 30.46)
o Val.  loss: 93.55   (RE: 62.71, KL: 30.83)
--> Early stopping: 3/50 (BEST: 93.54)

beta: 1.0
Epoch: 207/2000, Time elapsed: 20.22s
* Train loss: 88.37   (RE: 57.91, KL: 30.46)
o Val.  loss: 93.66   (RE: 62.99, KL: 30.67)
--> Early stopping: 4/50 (BEST: 93.54)

beta: 1.0
Epoch: 208/2000, Time elapsed: 19.84s
* Train loss: 88.31   (RE: 57.88, KL: 30.42)
o Val.  loss: 93.61   (RE: 62.68, KL: 30.92)
--> Early stopping: 5/50 (BEST: 93.54)

beta: 1.0
Epoch: 209/2000, Time elapsed: 20.47s
* Train loss: 88.29   (RE: 57.87, KL: 30.42)
o Val.  loss: 93.51   (RE: 62.81, KL: 30.70)
--> Early stopping: 6/50 (BEST: 93.54)

->model saved<-
beta: 1.0
Epoch: 210/2000, Time elapsed: 20.20s
* Train loss: 88.28   (RE: 57.87, KL: 30.41)
o Val.  loss: 93.51   (RE: 62.75, KL: 30.76)
--> Early stopping: 0/50 (BEST: 93.51)

beta: 1.0
Epoch: 211/2000, Time elapsed: 20.04s
* Train loss: 88.27   (RE: 57.87, KL: 30.40)
o Val.  loss: 93.55   (RE: 62.66, KL: 30.90)
--> Early stopping: 1/50 (BEST: 93.51)

beta: 1.0
Epoch: 212/2000, Time elapsed: 19.23s
* Train loss: 88.22   (RE: 57.82, KL: 30.40)
o Val.  loss: 93.66   (RE: 62.74, KL: 30.93)
--> Early stopping: 2/50 (BEST: 93.51)

beta: 1.0
Epoch: 213/2000, Time elapsed: 19.75s
* Train loss: 88.17   (RE: 57.76, KL: 30.41)
o Val.  loss: 93.49   (RE: 62.71, KL: 30.78)
--> Early stopping: 3/50 (BEST: 93.51)

->model saved<-
beta: 1.0
Epoch: 214/2000, Time elapsed: 20.18s
* Train loss: 88.14   (RE: 57.77, KL: 30.37)
o Val.  loss: 93.47   (RE: 62.85, KL: 30.62)
--> Early stopping: 0/50 (BEST: 93.49)

->model saved<-
beta: 1.0
Epoch: 215/2000, Time elapsed: 18.86s
* Train loss: 88.14   (RE: 57.78, KL: 30.35)
o Val.  loss: 93.47   (RE: 62.86, KL: 30.61)
--> Early stopping: 0/50 (BEST: 93.47)

beta: 1.0
Epoch: 216/2000, Time elapsed: 18.08s
* Train loss: 88.08   (RE: 57.74, KL: 30.35)
o Val.  loss: 93.61   (RE: 62.83, KL: 30.78)
--> Early stopping: 1/50 (BEST: 93.47)

beta: 1.0
Epoch: 217/2000, Time elapsed: 19.16s
* Train loss: 88.08   (RE: 57.71, KL: 30.37)
o Val.  loss: 93.36   (RE: 62.64, KL: 30.71)
--> Early stopping: 2/50 (BEST: 93.47)

->model saved<-
beta: 1.0
Epoch: 218/2000, Time elapsed: 19.15s
* Train loss: 88.02   (RE: 57.70, KL: 30.32)
o Val.  loss: 93.45   (RE: 62.73, KL: 30.72)
--> Early stopping: 0/50 (BEST: 93.36)

beta: 1.0
Epoch: 219/2000, Time elapsed: 20.22s
* Train loss: 88.01   (RE: 57.68, KL: 30.33)
o Val.  loss: 93.50   (RE: 62.98, KL: 30.52)
--> Early stopping: 1/50 (BEST: 93.36)

beta: 1.0
Epoch: 220/2000, Time elapsed: 19.02s
* Train loss: 87.99   (RE: 57.66, KL: 30.33)
o Val.  loss: 93.60   (RE: 62.76, KL: 30.84)
--> Early stopping: 2/50 (BEST: 93.36)

beta: 1.0
Epoch: 221/2000, Time elapsed: 18.96s
* Train loss: 87.98   (RE: 57.65, KL: 30.33)
o Val.  loss: 93.56   (RE: 62.89, KL: 30.66)
--> Early stopping: 3/50 (BEST: 93.36)

beta: 1.0
Epoch: 222/2000, Time elapsed: 19.04s
* Train loss: 87.92   (RE: 57.60, KL: 30.33)
o Val.  loss: 93.54   (RE: 62.92, KL: 30.62)
--> Early stopping: 4/50 (BEST: 93.36)

beta: 1.0
Epoch: 223/2000, Time elapsed: 19.31s
* Train loss: 87.88   (RE: 57.59, KL: 30.29)
o Val.  loss: 93.49   (RE: 62.83, KL: 30.66)
--> Early stopping: 5/50 (BEST: 93.36)

beta: 1.0
Epoch: 224/2000, Time elapsed: 19.06s
* Train loss: 87.89   (RE: 57.58, KL: 30.30)
o Val.  loss: 93.50   (RE: 62.56, KL: 30.93)
--> Early stopping: 6/50 (BEST: 93.36)

beta: 1.0
Epoch: 225/2000, Time elapsed: 19.55s
* Train loss: 87.86   (RE: 57.57, KL: 30.29)
o Val.  loss: 93.53   (RE: 62.82, KL: 30.71)
--> Early stopping: 7/50 (BEST: 93.36)

beta: 1.0
Epoch: 226/2000, Time elapsed: 19.36s
* Train loss: 87.84   (RE: 57.55, KL: 30.29)
o Val.  loss: 93.50   (RE: 63.00, KL: 30.50)
--> Early stopping: 8/50 (BEST: 93.36)

beta: 1.0
Epoch: 227/2000, Time elapsed: 19.08s
* Train loss: 87.80   (RE: 57.54, KL: 30.26)
o Val.  loss: 93.42   (RE: 62.66, KL: 30.76)
--> Early stopping: 9/50 (BEST: 93.36)

beta: 1.0
Epoch: 228/2000, Time elapsed: 19.24s
* Train loss: 87.79   (RE: 57.53, KL: 30.26)
o Val.  loss: 93.61   (RE: 62.74, KL: 30.86)
--> Early stopping: 10/50 (BEST: 93.36)

beta: 1.0
Epoch: 229/2000, Time elapsed: 19.09s
* Train loss: 87.75   (RE: 57.49, KL: 30.26)
o Val.  loss: 93.45   (RE: 62.78, KL: 30.67)
--> Early stopping: 11/50 (BEST: 93.36)

beta: 1.0
Epoch: 230/2000, Time elapsed: 19.12s
* Train loss: 87.73   (RE: 57.49, KL: 30.24)
o Val.  loss: 93.41   (RE: 62.91, KL: 30.49)
--> Early stopping: 12/50 (BEST: 93.36)

beta: 1.0
Epoch: 231/2000, Time elapsed: 18.98s
* Train loss: 87.71   (RE: 57.48, KL: 30.23)
o Val.  loss: 93.55   (RE: 62.84, KL: 30.71)
--> Early stopping: 13/50 (BEST: 93.36)

beta: 1.0
Epoch: 232/2000, Time elapsed: 19.15s
* Train loss: 87.69   (RE: 57.47, KL: 30.22)
o Val.  loss: 93.45   (RE: 62.82, KL: 30.63)
--> Early stopping: 14/50 (BEST: 93.36)

beta: 1.0
Epoch: 233/2000, Time elapsed: 19.09s
* Train loss: 87.66   (RE: 57.44, KL: 30.22)
o Val.  loss: 93.34   (RE: 62.83, KL: 30.52)
--> Early stopping: 15/50 (BEST: 93.36)

->model saved<-
beta: 1.0
Epoch: 234/2000, Time elapsed: 19.28s
* Train loss: 87.62   (RE: 57.42, KL: 30.21)
o Val.  loss: 93.47   (RE: 62.71, KL: 30.77)
--> Early stopping: 0/50 (BEST: 93.34)

beta: 1.0
Epoch: 235/2000, Time elapsed: 19.47s
* Train loss: 87.61   (RE: 57.38, KL: 30.23)
o Val.  loss: 93.57   (RE: 62.61, KL: 30.97)
--> Early stopping: 1/50 (BEST: 93.34)

beta: 1.0
Epoch: 236/2000, Time elapsed: 19.21s
* Train loss: 87.60   (RE: 57.38, KL: 30.22)
o Val.  loss: 93.47   (RE: 62.73, KL: 30.73)
--> Early stopping: 2/50 (BEST: 93.34)

beta: 1.0
Epoch: 237/2000, Time elapsed: 18.96s
* Train loss: 87.57   (RE: 57.39, KL: 30.19)
o Val.  loss: 93.41   (RE: 62.90, KL: 30.51)
--> Early stopping: 3/50 (BEST: 93.34)

beta: 1.0
Epoch: 238/2000, Time elapsed: 18.98s
* Train loss: 87.50   (RE: 57.33, KL: 30.17)
o Val.  loss: 93.43   (RE: 62.69, KL: 30.74)
--> Early stopping: 4/50 (BEST: 93.34)

beta: 1.0
Epoch: 239/2000, Time elapsed: 19.09s
* Train loss: 87.51   (RE: 57.31, KL: 30.20)
o Val.  loss: 93.49   (RE: 62.68, KL: 30.82)
--> Early stopping: 5/50 (BEST: 93.34)

beta: 1.0
Epoch: 240/2000, Time elapsed: 19.34s
* Train loss: 87.49   (RE: 57.31, KL: 30.17)
o Val.  loss: 93.49   (RE: 62.92, KL: 30.57)
--> Early stopping: 6/50 (BEST: 93.34)

beta: 1.0
Epoch: 241/2000, Time elapsed: 19.26s
* Train loss: 87.45   (RE: 57.31, KL: 30.15)
o Val.  loss: 93.34   (RE: 62.68, KL: 30.66)
--> Early stopping: 7/50 (BEST: 93.34)

->model saved<-
beta: 1.0
Epoch: 242/2000, Time elapsed: 19.38s
* Train loss: 87.44   (RE: 57.26, KL: 30.18)
o Val.  loss: 93.45   (RE: 63.11, KL: 30.34)
--> Early stopping: 0/50 (BEST: 93.34)

beta: 1.0
Epoch: 243/2000, Time elapsed: 19.37s
* Train loss: 87.44   (RE: 57.27, KL: 30.17)
o Val.  loss: 93.21   (RE: 62.79, KL: 30.42)
--> Early stopping: 1/50 (BEST: 93.34)

->model saved<-
beta: 1.0
Epoch: 244/2000, Time elapsed: 19.29s
* Train loss: 87.39   (RE: 57.23, KL: 30.15)
o Val.  loss: 93.51   (RE: 62.98, KL: 30.53)
--> Early stopping: 0/50 (BEST: 93.21)

beta: 1.0
Epoch: 245/2000, Time elapsed: 19.38s
* Train loss: 87.36   (RE: 57.20, KL: 30.16)
o Val.  loss: 93.50   (RE: 62.85, KL: 30.65)
--> Early stopping: 1/50 (BEST: 93.21)

beta: 1.0
Epoch: 246/2000, Time elapsed: 19.53s
* Train loss: 87.35   (RE: 57.20, KL: 30.15)
o Val.  loss: 93.27   (RE: 62.66, KL: 30.61)
--> Early stopping: 2/50 (BEST: 93.21)

beta: 1.0
Epoch: 247/2000, Time elapsed: 19.02s
* Train loss: 87.34   (RE: 57.19, KL: 30.15)
o Val.  loss: 93.52   (RE: 62.81, KL: 30.71)
--> Early stopping: 3/50 (BEST: 93.21)

beta: 1.0
Epoch: 248/2000, Time elapsed: 19.10s
* Train loss: 87.30   (RE: 57.17, KL: 30.13)
o Val.  loss: 93.40   (RE: 62.78, KL: 30.61)
--> Early stopping: 4/50 (BEST: 93.21)

beta: 1.0
Epoch: 249/2000, Time elapsed: 19.31s
* Train loss: 87.25   (RE: 57.13, KL: 30.12)
o Val.  loss: 93.22   (RE: 62.76, KL: 30.46)
--> Early stopping: 5/50 (BEST: 93.21)

beta: 1.0
Epoch: 250/2000, Time elapsed: 19.06s
* Train loss: 87.26   (RE: 57.13, KL: 30.13)
o Val.  loss: 93.39   (RE: 62.92, KL: 30.47)
--> Early stopping: 6/50 (BEST: 93.21)

beta: 1.0
Epoch: 251/2000, Time elapsed: 19.15s
* Train loss: 87.22   (RE: 57.12, KL: 30.10)
o Val.  loss: 93.31   (RE: 62.81, KL: 30.50)
--> Early stopping: 7/50 (BEST: 93.21)

beta: 1.0
Epoch: 252/2000, Time elapsed: 20.04s
* Train loss: 87.20   (RE: 57.08, KL: 30.11)
o Val.  loss: 93.39   (RE: 62.88, KL: 30.51)
--> Early stopping: 8/50 (BEST: 93.21)

beta: 1.0
Epoch: 253/2000, Time elapsed: 19.32s
* Train loss: 87.18   (RE: 57.06, KL: 30.12)
o Val.  loss: 93.52   (RE: 62.89, KL: 30.64)
--> Early stopping: 9/50 (BEST: 93.21)

beta: 1.0
Epoch: 254/2000, Time elapsed: 19.15s
* Train loss: 87.17   (RE: 57.09, KL: 30.08)
o Val.  loss: 93.28   (RE: 62.56, KL: 30.72)
--> Early stopping: 10/50 (BEST: 93.21)

beta: 1.0
Epoch: 255/2000, Time elapsed: 19.30s
* Train loss: 87.13   (RE: 57.03, KL: 30.10)
o Val.  loss: 93.36   (RE: 62.50, KL: 30.86)
--> Early stopping: 11/50 (BEST: 93.21)

beta: 1.0
Epoch: 256/2000, Time elapsed: 19.01s
* Train loss: 87.15   (RE: 57.04, KL: 30.11)
o Val.  loss: 93.28   (RE: 62.62, KL: 30.66)
--> Early stopping: 12/50 (BEST: 93.21)

beta: 1.0
Epoch: 257/2000, Time elapsed: 19.27s
* Train loss: 87.06   (RE: 57.00, KL: 30.06)
o Val.  loss: 93.46   (RE: 62.80, KL: 30.66)
--> Early stopping: 13/50 (BEST: 93.21)

beta: 1.0
Epoch: 258/2000, Time elapsed: 19.31s
* Train loss: 87.06   (RE: 56.98, KL: 30.08)
o Val.  loss: 93.45   (RE: 62.73, KL: 30.72)
--> Early stopping: 14/50 (BEST: 93.21)

beta: 1.0
Epoch: 259/2000, Time elapsed: 19.35s
* Train loss: 87.07   (RE: 56.99, KL: 30.08)
o Val.  loss: 93.49   (RE: 62.83, KL: 30.66)
--> Early stopping: 15/50 (BEST: 93.21)

beta: 1.0
Epoch: 260/2000, Time elapsed: 19.19s
* Train loss: 87.03   (RE: 56.96, KL: 30.07)
o Val.  loss: 93.47   (RE: 62.86, KL: 30.62)
--> Early stopping: 16/50 (BEST: 93.21)

beta: 1.0
Epoch: 261/2000, Time elapsed: 19.12s
* Train loss: 87.00   (RE: 56.93, KL: 30.07)
o Val.  loss: 93.43   (RE: 63.09, KL: 30.34)
--> Early stopping: 17/50 (BEST: 93.21)

beta: 1.0
Epoch: 262/2000, Time elapsed: 19.47s
* Train loss: 86.99   (RE: 56.92, KL: 30.07)
o Val.  loss: 93.60   (RE: 63.05, KL: 30.55)
--> Early stopping: 18/50 (BEST: 93.21)

beta: 1.0
Epoch: 263/2000, Time elapsed: 19.15s
* Train loss: 87.01   (RE: 56.94, KL: 30.07)
o Val.  loss: 93.41   (RE: 62.81, KL: 30.60)
--> Early stopping: 19/50 (BEST: 93.21)

beta: 1.0
Epoch: 264/2000, Time elapsed: 19.15s
* Train loss: 86.95   (RE: 56.88, KL: 30.07)
o Val.  loss: 93.46   (RE: 62.93, KL: 30.53)
--> Early stopping: 20/50 (BEST: 93.21)

beta: 1.0
Epoch: 265/2000, Time elapsed: 19.05s
* Train loss: 86.93   (RE: 56.89, KL: 30.04)
o Val.  loss: 93.36   (RE: 62.80, KL: 30.56)
--> Early stopping: 21/50 (BEST: 93.21)

beta: 1.0
Epoch: 266/2000, Time elapsed: 19.11s
* Train loss: 86.90   (RE: 56.84, KL: 30.06)
o Val.  loss: 93.37   (RE: 62.87, KL: 30.51)
--> Early stopping: 22/50 (BEST: 93.21)

beta: 1.0
Epoch: 267/2000, Time elapsed: 19.25s
* Train loss: 86.89   (RE: 56.86, KL: 30.03)
o Val.  loss: 93.49   (RE: 62.91, KL: 30.58)
--> Early stopping: 23/50 (BEST: 93.21)

beta: 1.0
Epoch: 268/2000, Time elapsed: 19.93s
* Train loss: 86.86   (RE: 56.83, KL: 30.03)
o Val.  loss: 93.41   (RE: 62.83, KL: 30.58)
--> Early stopping: 24/50 (BEST: 93.21)

beta: 1.0
Epoch: 269/2000, Time elapsed: 19.18s
* Train loss: 86.85   (RE: 56.81, KL: 30.04)
o Val.  loss: 93.32   (RE: 62.86, KL: 30.46)
--> Early stopping: 25/50 (BEST: 93.21)

beta: 1.0
Epoch: 270/2000, Time elapsed: 19.35s
* Train loss: 86.84   (RE: 56.80, KL: 30.04)
o Val.  loss: 93.40   (RE: 62.89, KL: 30.51)
--> Early stopping: 26/50 (BEST: 93.21)

beta: 1.0
Epoch: 271/2000, Time elapsed: 19.13s
* Train loss: 86.80   (RE: 56.78, KL: 30.02)
o Val.  loss: 93.45   (RE: 62.77, KL: 30.68)
--> Early stopping: 27/50 (BEST: 93.21)

beta: 1.0
Epoch: 272/2000, Time elapsed: 19.20s
* Train loss: 86.80   (RE: 56.76, KL: 30.04)
o Val.  loss: 93.28   (RE: 62.67, KL: 30.62)
--> Early stopping: 28/50 (BEST: 93.21)

beta: 1.0
Epoch: 273/2000, Time elapsed: 19.63s
* Train loss: 86.76   (RE: 56.72, KL: 30.04)
o Val.  loss: 93.33   (RE: 62.82, KL: 30.51)
--> Early stopping: 29/50 (BEST: 93.21)

beta: 1.0
Epoch: 274/2000, Time elapsed: 18.74s
* Train loss: 86.75   (RE: 56.72, KL: 30.03)
o Val.  loss: 93.45   (RE: 62.89, KL: 30.56)
--> Early stopping: 30/50 (BEST: 93.21)

beta: 1.0
Epoch: 275/2000, Time elapsed: 19.07s
* Train loss: 86.72   (RE: 56.68, KL: 30.04)
o Val.  loss: 93.47   (RE: 62.76, KL: 30.72)
--> Early stopping: 31/50 (BEST: 93.21)

beta: 1.0
Epoch: 276/2000, Time elapsed: 19.06s
* Train loss: 86.71   (RE: 56.70, KL: 30.01)
o Val.  loss: 93.39   (RE: 62.87, KL: 30.52)
--> Early stopping: 32/50 (BEST: 93.21)

beta: 1.0
Epoch: 277/2000, Time elapsed: 19.29s
* Train loss: 86.67   (RE: 56.68, KL: 30.00)
o Val.  loss: 93.45   (RE: 62.86, KL: 30.59)
--> Early stopping: 33/50 (BEST: 93.21)

beta: 1.0
Epoch: 278/2000, Time elapsed: 19.10s
* Train loss: 86.68   (RE: 56.66, KL: 30.02)
o Val.  loss: 93.51   (RE: 62.80, KL: 30.71)
--> Early stopping: 34/50 (BEST: 93.21)

beta: 1.0
Epoch: 279/2000, Time elapsed: 19.17s
* Train loss: 86.66   (RE: 56.67, KL: 29.99)
o Val.  loss: 93.43   (RE: 62.83, KL: 30.59)
--> Early stopping: 35/50 (BEST: 93.21)

beta: 1.0
Epoch: 280/2000, Time elapsed: 18.62s
* Train loss: 86.64   (RE: 56.64, KL: 30.00)
o Val.  loss: 93.41   (RE: 62.76, KL: 30.65)
--> Early stopping: 36/50 (BEST: 93.21)

beta: 1.0
Epoch: 281/2000, Time elapsed: 19.21s
* Train loss: 86.63   (RE: 56.65, KL: 29.97)
o Val.  loss: 93.45   (RE: 63.05, KL: 30.40)
--> Early stopping: 37/50 (BEST: 93.21)

beta: 1.0
Epoch: 282/2000, Time elapsed: 18.98s
* Train loss: 86.60   (RE: 56.59, KL: 30.01)
o Val.  loss: 93.45   (RE: 62.81, KL: 30.64)
--> Early stopping: 38/50 (BEST: 93.21)

beta: 1.0
Epoch: 283/2000, Time elapsed: 19.04s
* Train loss: 86.58   (RE: 56.58, KL: 30.01)
o Val.  loss: 93.45   (RE: 62.93, KL: 30.51)
--> Early stopping: 39/50 (BEST: 93.21)

beta: 1.0
Epoch: 284/2000, Time elapsed: 19.16s
* Train loss: 86.57   (RE: 56.58, KL: 29.99)
o Val.  loss: 93.57   (RE: 62.98, KL: 30.59)
--> Early stopping: 40/50 (BEST: 93.21)

beta: 1.0
Epoch: 285/2000, Time elapsed: 19.13s
* Train loss: 86.53   (RE: 56.54, KL: 30.00)
o Val.  loss: 93.62   (RE: 63.03, KL: 30.60)
--> Early stopping: 41/50 (BEST: 93.21)

beta: 1.0
Epoch: 286/2000, Time elapsed: 19.27s
* Train loss: 86.52   (RE: 56.54, KL: 29.97)
o Val.  loss: 93.41   (RE: 62.82, KL: 30.59)
--> Early stopping: 42/50 (BEST: 93.21)

beta: 1.0
Epoch: 287/2000, Time elapsed: 19.33s
* Train loss: 86.52   (RE: 56.54, KL: 29.98)
o Val.  loss: 93.53   (RE: 62.84, KL: 30.69)
--> Early stopping: 43/50 (BEST: 93.21)

beta: 1.0
Epoch: 288/2000, Time elapsed: 19.06s
* Train loss: 86.45   (RE: 56.48, KL: 29.98)
o Val.  loss: 93.49   (RE: 63.21, KL: 30.29)
--> Early stopping: 44/50 (BEST: 93.21)

beta: 1.0
Epoch: 289/2000, Time elapsed: 19.02s
* Train loss: 86.47   (RE: 56.48, KL: 29.99)
o Val.  loss: 93.29   (RE: 62.98, KL: 30.31)
--> Early stopping: 45/50 (BEST: 93.21)

beta: 1.0
Epoch: 290/2000, Time elapsed: 18.37s
* Train loss: 86.46   (RE: 56.47, KL: 29.98)
o Val.  loss: 93.67   (RE: 62.92, KL: 30.75)
--> Early stopping: 46/50 (BEST: 93.21)

beta: 1.0
Epoch: 291/2000, Time elapsed: 19.25s
* Train loss: 86.43   (RE: 56.44, KL: 29.99)
o Val.  loss: 93.69   (RE: 63.08, KL: 30.61)
--> Early stopping: 47/50 (BEST: 93.21)

beta: 1.0
Epoch: 292/2000, Time elapsed: 18.94s
* Train loss: 86.40   (RE: 56.43, KL: 29.97)
o Val.  loss: 93.54   (RE: 62.86, KL: 30.68)
--> Early stopping: 48/50 (BEST: 93.21)

beta: 1.0
Epoch: 293/2000, Time elapsed: 19.21s
* Train loss: 86.40   (RE: 56.43, KL: 29.97)
o Val.  loss: 93.49   (RE: 62.96, KL: 30.53)
--> Early stopping: 49/50 (BEST: 93.21)

beta: 1.0
Epoch: 294/2000, Time elapsed: 19.17s
* Train loss: 86.38   (RE: 56.42, KL: 29.96)
o Val.  loss: 93.60   (RE: 62.92, KL: 30.69)
--> Early stopping: 50/50 (BEST: 93.21)

Test lower-bound value 92.53 in time: 0.21s
Train lower-bound value 0.00 in time: 0.00s
0.00%
1.00%
2.00%
3.00%
4.00%
5.00%
6.00%
7.00%
8.00%
9.00%
10.00%
11.00%
12.00%
13.00%
14.00%
15.00%
16.00%
17.00%
18.00%
19.00%
20.00%
21.00%
22.00%
23.00%
24.00%
25.00%
26.00%
27.00%
28.00%
29.00%
30.00%
31.00%
32.00%
33.00%
34.00%
35.00%
36.00%
37.00%
38.00%
39.00%
40.00%
41.00%
42.00%
43.00%
44.00%
45.00%
46.00%
47.00%
48.00%
49.00%
50.00%
51.00%
52.00%
53.00%
54.00%
55.00%
56.00%
57.00%
58.00%
59.00%
60.00%
61.00%
62.00%
63.00%
64.00%
65.00%
66.00%
67.00%
68.00%
69.00%
70.00%
71.00%
72.00%
73.00%
74.00%
75.00%
76.00%
77.00%
78.00%
79.00%
80.00%
81.00%
82.00%
83.00%
84.00%
85.00%
86.00%
87.00%
88.00%
89.00%
90.00%
91.00%
92.00%
93.00%
94.00%
95.00%
96.00%
97.00%
98.00%
99.00%
Test log_likelihood value 86.06 in time: 873.05s
Train log_likelihood value 0.00 in time: 0.00s
FINAL EVALUATION ON TEST SET
LogL (TEST): 86.06
LogL (TRAIN): 0.00
ELBO (TEST): 92.53
ELBO (TRAIN): 0.00
Loss: 92.56
RE: 62.29
KL: 30.27
 Training finished in 110.82 minutes. Log saved to: snapshots/2026-01-22 00:25:10_static_mnist_hvae_2level_standard_z1_40_seed420/eval_results/runtime.txt
-=-=-=-=-=-=-=-=-=-=-=-=-=-=-=-=-=-=-=-=-=-=-=-=-=-=-=-=-=-=-=-=-=-=-=-=-=-=-=-=-=-=-=-=-=-=-=-=-=-=-=-=-=-=-=-
