load data
create model
Namespace(batch_size=100, test_batch_size=100, epochs=2000, lr=0.0005, early_stopping_epochs=50, warmup=100, no_cuda=False, seed=69, z1_size=40, z2_size=40, input_size=[1, 28, 28], activation=None, number_components=500, pseudoinputs_mean=0.05, pseudoinputs_std=0.01, use_training_data_init=False, model_name='hvae_2level', prior='standard', weighted=True, input_type='binary', flow_layers=8, flow_hidden_dim=128, S=5000, MB=100, dataset_name='static_mnist', dynamic_binarization=False, cuda=True, model_signature='2026-01-21 20:21:10')
perform experiment
beta: 0.01
/root/vae_vampprior/models/Model.py:41: UserWarning: The torch.cuda.*DtypeTensor constructors are no longer recommended. It's best to use methods such as torch.tensor(data, dtype=*, device='cuda') to create tensors. (Triggered internally at /pytorch/torch/csrc/tensor/python_tensor.cpp:78.)
  eps = torch.cuda.FloatTensor(std.size()).normal_()
/root/vae_vampprior/utils/optimizer.py:75: UserWarning: This overload of add_ is deprecated:
	add_(Number alpha, Tensor other)
Consider using one of the following signatures instead:
	add_(Tensor other, *, Number alpha = 1) (Triggered internally at /pytorch/torch/csrc/utils/python_arg_parser.cpp:1805.)
  exp_avg.mul_(beta1).add_(1 - beta1, grad)
Epoch: 1/2000, Time elapsed: 20.22s
* Train loss: 108.33   (RE: 106.17, KL: 216.31)
o Val.  loss: 288.37   (RE: 59.60, KL: 228.78)
--> Early stopping: 0/50 (BEST: 100000.00)

->model saved<-
beta: 0.02
Epoch: 2/2000, Time elapsed: 19.58s
* Train loss: 55.09   (RE: 50.69, KL: 220.06)
o Val.  loss: 262.74   (RE: 45.36, KL: 217.37)
--> Early stopping: 0/50 (BEST: 288.37)

->model saved<-
beta: 0.03
Epoch: 3/2000, Time elapsed: 19.03s
* Train loss: 48.23   (RE: 42.20, KL: 201.18)
o Val.  loss: 236.31   (RE: 41.13, KL: 195.18)
--> Early stopping: 0/50 (BEST: 262.74)

->model saved<-
beta: 0.04
Epoch: 4/2000, Time elapsed: 19.18s
* Train loss: 46.38   (RE: 38.98, KL: 184.86)
o Val.  loss: 217.33   (RE: 39.45, KL: 177.88)
--> Early stopping: 0/50 (BEST: 236.31)

->model saved<-
beta: 0.05
Epoch: 5/2000, Time elapsed: 19.56s
* Train loss: 45.72   (RE: 37.53, KL: 163.69)
o Val.  loss: 199.38   (RE: 38.42, KL: 160.96)
--> Early stopping: 0/50 (BEST: 217.33)

->model saved<-
beta: 0.06
Epoch: 6/2000, Time elapsed: 20.04s
* Train loss: 45.57   (RE: 36.38, KL: 153.22)
o Val.  loss: 190.92   (RE: 37.89, KL: 153.03)
--> Early stopping: 0/50 (BEST: 199.38)

->model saved<-
beta: 0.07
Epoch: 7/2000, Time elapsed: 19.43s
* Train loss: 45.76   (RE: 35.51, KL: 146.39)
o Val.  loss: 182.98   (RE: 37.44, KL: 145.54)
--> Early stopping: 0/50 (BEST: 190.92)

->model saved<-
beta: 0.08
Epoch: 8/2000, Time elapsed: 19.71s
* Train loss: 46.14   (RE: 34.88, KL: 140.69)
o Val.  loss: 178.53   (RE: 37.00, KL: 141.53)
--> Early stopping: 0/50 (BEST: 182.98)

->model saved<-
beta: 0.09
Epoch: 9/2000, Time elapsed: 19.92s
* Train loss: 46.62   (RE: 34.41, KL: 135.67)
o Val.  loss: 172.95   (RE: 36.81, KL: 136.14)
--> Early stopping: 0/50 (BEST: 178.53)

->model saved<-
beta: 0.1
Epoch: 10/2000, Time elapsed: 19.64s
* Train loss: 47.17   (RE: 34.03, KL: 131.40)
o Val.  loss: 168.17   (RE: 36.89, KL: 131.28)
--> Early stopping: 0/50 (BEST: 172.95)

->model saved<-
beta: 0.11
Epoch: 11/2000, Time elapsed: 19.56s
* Train loss: 47.82   (RE: 33.80, KL: 127.44)
o Val.  loss: 163.56   (RE: 36.93, KL: 126.63)
--> Early stopping: 0/50 (BEST: 168.17)

->model saved<-
beta: 0.12
Epoch: 12/2000, Time elapsed: 19.78s
* Train loss: 48.47   (RE: 33.60, KL: 123.92)
o Val.  loss: 159.87   (RE: 37.10, KL: 122.76)
--> Early stopping: 0/50 (BEST: 163.56)

->model saved<-
beta: 0.13
Epoch: 13/2000, Time elapsed: 19.92s
* Train loss: 49.16   (RE: 33.47, KL: 120.68)
o Val.  loss: 157.84   (RE: 36.94, KL: 120.90)
--> Early stopping: 0/50 (BEST: 159.87)

->model saved<-
beta: 0.14
Epoch: 14/2000, Time elapsed: 19.11s
* Train loss: 49.88   (RE: 33.41, KL: 117.64)
o Val.  loss: 154.35   (RE: 37.20, KL: 117.15)
--> Early stopping: 0/50 (BEST: 157.84)

->model saved<-
beta: 0.15
Epoch: 15/2000, Time elapsed: 18.92s
* Train loss: 50.60   (RE: 33.39, KL: 114.75)
o Val.  loss: 151.97   (RE: 37.25, KL: 114.72)
--> Early stopping: 0/50 (BEST: 154.35)

->model saved<-
beta: 0.16
Epoch: 16/2000, Time elapsed: 19.63s
* Train loss: 51.36   (RE: 33.40, KL: 112.20)
o Val.  loss: 149.35   (RE: 37.39, KL: 111.97)
--> Early stopping: 0/50 (BEST: 151.97)

->model saved<-
beta: 0.17
Epoch: 17/2000, Time elapsed: 18.65s
* Train loss: 52.07   (RE: 33.42, KL: 109.74)
o Val.  loss: 146.72   (RE: 37.72, KL: 109.01)
--> Early stopping: 0/50 (BEST: 149.35)

->model saved<-
beta: 0.18
Epoch: 18/2000, Time elapsed: 18.78s
* Train loss: 52.85   (RE: 33.52, KL: 107.35)
o Val.  loss: 145.80   (RE: 37.72, KL: 108.08)
--> Early stopping: 0/50 (BEST: 146.72)

->model saved<-
beta: 0.19
Epoch: 19/2000, Time elapsed: 18.66s
* Train loss: 53.58   (RE: 33.59, KL: 105.22)
o Val.  loss: 143.21   (RE: 38.00, KL: 105.21)
--> Early stopping: 0/50 (BEST: 145.80)

->model saved<-
beta: 0.2
Epoch: 20/2000, Time elapsed: 20.15s
* Train loss: 54.36   (RE: 33.74, KL: 103.11)
o Val.  loss: 141.57   (RE: 38.17, KL: 103.40)
--> Early stopping: 0/50 (BEST: 143.21)

->model saved<-
beta: 0.21
Epoch: 21/2000, Time elapsed: 19.77s
* Train loss: 55.09   (RE: 33.86, KL: 101.10)
o Val.  loss: 139.38   (RE: 38.39, KL: 100.99)
--> Early stopping: 0/50 (BEST: 141.57)

->model saved<-
beta: 0.22
Epoch: 22/2000, Time elapsed: 20.47s
* Train loss: 55.83   (RE: 34.00, KL: 99.21)
o Val.  loss: 137.01   (RE: 38.79, KL: 98.22)
--> Early stopping: 0/50 (BEST: 139.38)

->model saved<-
beta: 0.23
Epoch: 23/2000, Time elapsed: 20.35s
* Train loss: 56.55   (RE: 34.16, KL: 97.37)
o Val.  loss: 136.07   (RE: 38.96, KL: 97.11)
--> Early stopping: 0/50 (BEST: 137.01)

->model saved<-
beta: 0.24
Epoch: 24/2000, Time elapsed: 18.97s
* Train loss: 57.28   (RE: 34.33, KL: 95.62)
o Val.  loss: 134.96   (RE: 38.97, KL: 95.99)
--> Early stopping: 0/50 (BEST: 136.07)

->model saved<-
beta: 0.25
Epoch: 25/2000, Time elapsed: 18.72s
* Train loss: 58.04   (RE: 34.55, KL: 93.97)
o Val.  loss: 133.12   (RE: 39.24, KL: 93.88)
--> Early stopping: 0/50 (BEST: 134.96)

->model saved<-
beta: 0.26
Epoch: 26/2000, Time elapsed: 19.82s
* Train loss: 58.73   (RE: 34.74, KL: 92.30)
o Val.  loss: 132.15   (RE: 39.52, KL: 92.63)
--> Early stopping: 0/50 (BEST: 133.12)

->model saved<-
beta: 0.27
Epoch: 27/2000, Time elapsed: 20.15s
* Train loss: 59.44   (RE: 34.94, KL: 90.76)
o Val.  loss: 131.47   (RE: 39.44, KL: 92.03)
--> Early stopping: 0/50 (BEST: 132.15)

->model saved<-
beta: 0.28
Epoch: 28/2000, Time elapsed: 20.18s
* Train loss: 60.14   (RE: 35.14, KL: 89.29)
o Val.  loss: 129.36   (RE: 40.06, KL: 89.30)
--> Early stopping: 0/50 (BEST: 131.47)

->model saved<-
beta: 0.29
Epoch: 29/2000, Time elapsed: 19.97s
* Train loss: 60.84   (RE: 35.36, KL: 87.87)
o Val.  loss: 127.82   (RE: 40.50, KL: 87.32)
--> Early stopping: 0/50 (BEST: 129.36)

->model saved<-
beta: 0.3
Epoch: 30/2000, Time elapsed: 19.85s
* Train loss: 61.52   (RE: 35.60, KL: 86.40)
o Val.  loss: 127.52   (RE: 40.57, KL: 86.95)
--> Early stopping: 0/50 (BEST: 127.82)

->model saved<-
beta: 0.31
Epoch: 31/2000, Time elapsed: 20.11s
* Train loss: 62.21   (RE: 35.85, KL: 85.05)
o Val.  loss: 126.68   (RE: 40.67, KL: 86.00)
--> Early stopping: 0/50 (BEST: 127.52)

->model saved<-
beta: 0.32
Epoch: 32/2000, Time elapsed: 20.27s
* Train loss: 62.87   (RE: 36.06, KL: 83.77)
o Val.  loss: 125.23   (RE: 40.86, KL: 84.37)
--> Early stopping: 0/50 (BEST: 126.68)

->model saved<-
beta: 0.33
Epoch: 33/2000, Time elapsed: 20.02s
* Train loss: 63.55   (RE: 36.34, KL: 82.46)
o Val.  loss: 124.36   (RE: 41.44, KL: 82.92)
--> Early stopping: 0/50 (BEST: 125.23)

->model saved<-
beta: 0.34
Epoch: 34/2000, Time elapsed: 18.85s
* Train loss: 64.22   (RE: 36.59, KL: 81.25)
o Val.  loss: 123.45   (RE: 41.43, KL: 82.02)
--> Early stopping: 0/50 (BEST: 124.36)

->model saved<-
beta: 0.35
Epoch: 35/2000, Time elapsed: 19.68s
* Train loss: 64.87   (RE: 36.86, KL: 80.04)
o Val.  loss: 121.84   (RE: 42.04, KL: 79.80)
--> Early stopping: 0/50 (BEST: 123.45)

->model saved<-
beta: 0.36
Epoch: 36/2000, Time elapsed: 20.15s
* Train loss: 65.49   (RE: 37.09, KL: 78.90)
o Val.  loss: 121.52   (RE: 42.13, KL: 79.39)
--> Early stopping: 0/50 (BEST: 121.84)

->model saved<-
beta: 0.37
Epoch: 37/2000, Time elapsed: 20.25s
* Train loss: 66.17   (RE: 37.41, KL: 77.74)
o Val.  loss: 120.76   (RE: 42.38, KL: 78.38)
--> Early stopping: 0/50 (BEST: 121.52)

->model saved<-
beta: 0.38
Epoch: 38/2000, Time elapsed: 19.66s
* Train loss: 66.77   (RE: 37.66, KL: 76.62)
o Val.  loss: 119.71   (RE: 42.82, KL: 76.90)
--> Early stopping: 0/50 (BEST: 120.76)

->model saved<-
beta: 0.39
Epoch: 39/2000, Time elapsed: 20.08s
* Train loss: 67.41   (RE: 37.96, KL: 75.51)
o Val.  loss: 119.24   (RE: 42.88, KL: 76.36)
--> Early stopping: 0/50 (BEST: 119.71)

->model saved<-
beta: 0.4
Epoch: 40/2000, Time elapsed: 20.24s
* Train loss: 68.03   (RE: 38.22, KL: 74.52)
o Val.  loss: 118.19   (RE: 43.21, KL: 74.97)
--> Early stopping: 0/50 (BEST: 119.24)

->model saved<-
beta: 0.41
Epoch: 41/2000, Time elapsed: 19.21s
* Train loss: 68.67   (RE: 38.54, KL: 73.49)
o Val.  loss: 117.56   (RE: 43.53, KL: 74.03)
--> Early stopping: 0/50 (BEST: 118.19)

->model saved<-
beta: 0.42
Epoch: 42/2000, Time elapsed: 20.17s
* Train loss: 69.25   (RE: 38.81, KL: 72.48)
o Val.  loss: 116.55   (RE: 43.76, KL: 72.79)
--> Early stopping: 0/50 (BEST: 117.56)

->model saved<-
beta: 0.43
Epoch: 43/2000, Time elapsed: 20.05s
* Train loss: 69.88   (RE: 39.12, KL: 71.53)
o Val.  loss: 116.52   (RE: 43.73, KL: 72.80)
--> Early stopping: 0/50 (BEST: 116.55)

->model saved<-
beta: 0.44
Epoch: 44/2000, Time elapsed: 19.55s
* Train loss: 70.46   (RE: 39.43, KL: 70.52)
o Val.  loss: 115.16   (RE: 44.47, KL: 70.69)
--> Early stopping: 0/50 (BEST: 116.52)

->model saved<-
beta: 0.45
Epoch: 45/2000, Time elapsed: 19.60s
* Train loss: 71.07   (RE: 39.74, KL: 69.61)
o Val.  loss: 114.69   (RE: 44.36, KL: 70.33)
--> Early stopping: 0/50 (BEST: 115.16)

->model saved<-
beta: 0.46
Epoch: 46/2000, Time elapsed: 20.14s
* Train loss: 71.64   (RE: 40.04, KL: 68.70)
o Val.  loss: 114.02   (RE: 45.12, KL: 68.90)
--> Early stopping: 0/50 (BEST: 114.69)

->model saved<-
beta: 0.47
Epoch: 47/2000, Time elapsed: 19.22s
* Train loss: 72.22   (RE: 40.35, KL: 67.82)
o Val.  loss: 113.83   (RE: 45.10, KL: 68.73)
--> Early stopping: 0/50 (BEST: 114.02)

->model saved<-
beta: 0.48
Epoch: 48/2000, Time elapsed: 19.82s
* Train loss: 72.79   (RE: 40.67, KL: 66.92)
o Val.  loss: 112.75   (RE: 45.61, KL: 67.14)
--> Early stopping: 0/50 (BEST: 113.83)

->model saved<-
beta: 0.49
Epoch: 49/2000, Time elapsed: 19.71s
* Train loss: 73.35   (RE: 41.02, KL: 65.99)
o Val.  loss: 112.39   (RE: 45.81, KL: 66.58)
--> Early stopping: 0/50 (BEST: 112.75)

->model saved<-
beta: 0.5
Epoch: 50/2000, Time elapsed: 19.95s
* Train loss: 73.92   (RE: 41.31, KL: 65.23)
o Val.  loss: 111.58   (RE: 46.26, KL: 65.33)
--> Early stopping: 0/50 (BEST: 112.39)

->model saved<-
beta: 0.51
Epoch: 51/2000, Time elapsed: 19.94s
* Train loss: 74.48   (RE: 41.66, KL: 64.34)
o Val.  loss: 111.27   (RE: 46.38, KL: 64.89)
--> Early stopping: 0/50 (BEST: 111.58)

->model saved<-
beta: 0.52
Epoch: 52/2000, Time elapsed: 19.54s
* Train loss: 74.99   (RE: 41.96, KL: 63.53)
o Val.  loss: 110.71   (RE: 46.69, KL: 64.02)
--> Early stopping: 0/50 (BEST: 111.27)

->model saved<-
beta: 0.53
Epoch: 53/2000, Time elapsed: 19.74s
* Train loss: 75.55   (RE: 42.29, KL: 62.76)
o Val.  loss: 109.80   (RE: 47.30, KL: 62.49)
--> Early stopping: 0/50 (BEST: 110.71)

->model saved<-
beta: 0.54
Epoch: 54/2000, Time elapsed: 19.83s
* Train loss: 76.09   (RE: 42.64, KL: 61.95)
o Val.  loss: 109.61   (RE: 47.59, KL: 62.02)
--> Early stopping: 0/50 (BEST: 109.80)

->model saved<-
beta: 0.55
Epoch: 55/2000, Time elapsed: 19.32s
* Train loss: 76.60   (RE: 42.98, KL: 61.14)
o Val.  loss: 109.35   (RE: 47.80, KL: 61.55)
--> Early stopping: 0/50 (BEST: 109.61)

->model saved<-
beta: 0.56
Epoch: 56/2000, Time elapsed: 19.26s
* Train loss: 77.11   (RE: 43.30, KL: 60.37)
o Val.  loss: 108.50   (RE: 48.18, KL: 60.32)
--> Early stopping: 0/50 (BEST: 109.35)

->model saved<-
beta: 0.57
Epoch: 57/2000, Time elapsed: 18.99s
* Train loss: 77.62   (RE: 43.65, KL: 59.60)
o Val.  loss: 108.22   (RE: 48.45, KL: 59.77)
--> Early stopping: 0/50 (BEST: 108.50)

->model saved<-
beta: 0.58
Epoch: 58/2000, Time elapsed: 19.49s
* Train loss: 78.14   (RE: 43.98, KL: 58.90)
o Val.  loss: 107.80   (RE: 48.58, KL: 59.22)
--> Early stopping: 0/50 (BEST: 108.22)

->model saved<-
beta: 0.59
Epoch: 59/2000, Time elapsed: 19.79s
* Train loss: 78.65   (RE: 44.33, KL: 58.18)
o Val.  loss: 107.49   (RE: 49.30, KL: 58.19)
--> Early stopping: 0/50 (BEST: 107.80)

->model saved<-
beta: 0.6
Epoch: 60/2000, Time elapsed: 19.65s
* Train loss: 79.12   (RE: 44.66, KL: 57.44)
o Val.  loss: 106.73   (RE: 49.58, KL: 57.15)
--> Early stopping: 0/50 (BEST: 107.49)

->model saved<-
beta: 0.61
Epoch: 61/2000, Time elapsed: 19.66s
* Train loss: 79.61   (RE: 45.01, KL: 56.72)
o Val.  loss: 106.61   (RE: 49.67, KL: 56.94)
--> Early stopping: 0/50 (BEST: 106.73)

->model saved<-
beta: 0.62
Epoch: 62/2000, Time elapsed: 19.23s
* Train loss: 80.11   (RE: 45.34, KL: 56.08)
o Val.  loss: 106.21   (RE: 49.96, KL: 56.25)
--> Early stopping: 0/50 (BEST: 106.61)

->model saved<-
beta: 0.63
Epoch: 63/2000, Time elapsed: 19.50s
* Train loss: 80.58   (RE: 45.71, KL: 55.35)
o Val.  loss: 105.63   (RE: 50.48, KL: 55.16)
--> Early stopping: 0/50 (BEST: 106.21)

->model saved<-
beta: 0.64
Epoch: 64/2000, Time elapsed: 19.64s
* Train loss: 81.02   (RE: 46.03, KL: 54.68)
o Val.  loss: 105.58   (RE: 50.53, KL: 55.05)
--> Early stopping: 0/50 (BEST: 105.63)

->model saved<-
beta: 0.65
Epoch: 65/2000, Time elapsed: 19.75s
* Train loss: 81.49   (RE: 46.39, KL: 53.99)
o Val.  loss: 105.54   (RE: 50.73, KL: 54.81)
--> Early stopping: 0/50 (BEST: 105.58)

->model saved<-
beta: 0.66
Epoch: 66/2000, Time elapsed: 19.45s
* Train loss: 81.97   (RE: 46.73, KL: 53.40)
o Val.  loss: 104.66   (RE: 51.14, KL: 53.52)
--> Early stopping: 0/50 (BEST: 105.54)

->model saved<-
beta: 0.67
Epoch: 67/2000, Time elapsed: 19.77s
* Train loss: 82.41   (RE: 47.09, KL: 52.70)
o Val.  loss: 104.36   (RE: 51.76, KL: 52.59)
--> Early stopping: 0/50 (BEST: 104.66)

->model saved<-
beta: 0.68
Epoch: 68/2000, Time elapsed: 19.65s
* Train loss: 82.85   (RE: 47.44, KL: 52.07)
o Val.  loss: 104.14   (RE: 51.94, KL: 52.20)
--> Early stopping: 0/50 (BEST: 104.36)

->model saved<-
beta: 0.69
Epoch: 69/2000, Time elapsed: 19.99s
* Train loss: 83.27   (RE: 47.78, KL: 51.44)
o Val.  loss: 103.68   (RE: 52.39, KL: 51.29)
--> Early stopping: 0/50 (BEST: 104.14)

->model saved<-
beta: 0.7
Epoch: 70/2000, Time elapsed: 18.75s
* Train loss: 83.70   (RE: 48.16, KL: 50.77)
o Val.  loss: 103.29   (RE: 52.73, KL: 50.57)
--> Early stopping: 0/50 (BEST: 103.68)

->model saved<-
beta: 0.71
Epoch: 71/2000, Time elapsed: 19.33s
* Train loss: 84.15   (RE: 48.52, KL: 50.19)
o Val.  loss: 103.11   (RE: 52.95, KL: 50.16)
--> Early stopping: 0/50 (BEST: 103.29)

->model saved<-
beta: 0.72
Epoch: 72/2000, Time elapsed: 19.36s
* Train loss: 84.57   (RE: 48.87, KL: 49.59)
o Val.  loss: 102.94   (RE: 53.16, KL: 49.77)
--> Early stopping: 0/50 (BEST: 103.11)

->model saved<-
beta: 0.73
Epoch: 73/2000, Time elapsed: 19.96s
* Train loss: 84.97   (RE: 49.22, KL: 48.97)
o Val.  loss: 102.50   (RE: 53.59, KL: 48.91)
--> Early stopping: 0/50 (BEST: 102.94)

->model saved<-
beta: 0.74
Epoch: 74/2000, Time elapsed: 19.97s
* Train loss: 85.37   (RE: 49.56, KL: 48.39)
o Val.  loss: 102.13   (RE: 54.15, KL: 47.99)
--> Early stopping: 0/50 (BEST: 102.50)

->model saved<-
beta: 0.75
Epoch: 75/2000, Time elapsed: 21.13s
* Train loss: 85.77   (RE: 49.94, KL: 47.78)
o Val.  loss: 102.25   (RE: 54.06, KL: 48.18)
--> Early stopping: 0/50 (BEST: 102.13)

beta: 0.76
Epoch: 76/2000, Time elapsed: 19.52s
* Train loss: 86.14   (RE: 50.27, KL: 47.19)
o Val.  loss: 101.88   (RE: 54.38, KL: 47.50)
--> Early stopping: 0/50 (BEST: 102.13)

->model saved<-
beta: 0.77
Epoch: 77/2000, Time elapsed: 19.69s
* Train loss: 86.59   (RE: 50.68, KL: 46.63)
o Val.  loss: 101.29   (RE: 55.08, KL: 46.20)
--> Early stopping: 0/50 (BEST: 101.88)

->model saved<-
beta: 0.78
Epoch: 78/2000, Time elapsed: 19.83s
* Train loss: 86.95   (RE: 51.01, KL: 46.08)
o Val.  loss: 101.43   (RE: 55.19, KL: 46.24)
--> Early stopping: 0/50 (BEST: 101.29)

beta: 0.79
Epoch: 79/2000, Time elapsed: 19.98s
* Train loss: 87.34   (RE: 51.37, KL: 45.52)
o Val.  loss: 101.20   (RE: 55.30, KL: 45.90)
--> Early stopping: 0/50 (BEST: 101.29)

->model saved<-
beta: 0.8
Epoch: 80/2000, Time elapsed: 18.14s
* Train loss: 87.68   (RE: 51.70, KL: 44.98)
o Val.  loss: 100.80   (RE: 56.04, KL: 44.77)
--> Early stopping: 0/50 (BEST: 101.20)

->model saved<-
beta: 0.81
Epoch: 81/2000, Time elapsed: 17.20s
* Train loss: 88.07   (RE: 52.09, KL: 44.43)
o Val.  loss: 100.62   (RE: 56.09, KL: 44.53)
--> Early stopping: 0/50 (BEST: 100.80)

->model saved<-
beta: 0.82
Epoch: 82/2000, Time elapsed: 18.90s
* Train loss: 88.42   (RE: 52.39, KL: 43.94)
o Val.  loss: 100.41   (RE: 56.21, KL: 44.20)
--> Early stopping: 0/50 (BEST: 100.62)

->model saved<-
beta: 0.83
Epoch: 83/2000, Time elapsed: 19.54s
* Train loss: 88.78   (RE: 52.76, KL: 43.40)
o Val.  loss: 100.28   (RE: 56.78, KL: 43.50)
--> Early stopping: 0/50 (BEST: 100.41)

->model saved<-
beta: 0.84
Epoch: 84/2000, Time elapsed: 19.31s
* Train loss: 89.17   (RE: 53.14, KL: 42.89)
o Val.  loss: 99.81   (RE: 57.47, KL: 42.34)
--> Early stopping: 0/50 (BEST: 100.28)

->model saved<-
beta: 0.85
Epoch: 85/2000, Time elapsed: 20.80s
* Train loss: 89.48   (RE: 53.51, KL: 42.32)
o Val.  loss: 99.75   (RE: 57.37, KL: 42.38)
--> Early stopping: 0/50 (BEST: 99.81)

->model saved<-
beta: 0.86
Epoch: 86/2000, Time elapsed: 20.56s
* Train loss: 89.82   (RE: 53.85, KL: 41.82)
o Val.  loss: 99.67   (RE: 57.67, KL: 42.00)
--> Early stopping: 0/50 (BEST: 99.75)

->model saved<-
beta: 0.87
Epoch: 87/2000, Time elapsed: 19.26s
* Train loss: 90.17   (RE: 54.20, KL: 41.35)
o Val.  loss: 99.40   (RE: 57.95, KL: 41.45)
--> Early stopping: 0/50 (BEST: 99.67)

->model saved<-
beta: 0.88
Epoch: 88/2000, Time elapsed: 20.08s
* Train loss: 90.52   (RE: 54.56, KL: 40.86)
o Val.  loss: 98.98   (RE: 58.58, KL: 40.40)
--> Early stopping: 0/50 (BEST: 99.40)

->model saved<-
beta: 0.89
Epoch: 89/2000, Time elapsed: 20.50s
* Train loss: 90.84   (RE: 54.92, KL: 40.35)
o Val.  loss: 98.92   (RE: 59.02, KL: 39.91)
--> Early stopping: 0/50 (BEST: 98.98)

->model saved<-
beta: 0.9
Epoch: 90/2000, Time elapsed: 19.61s
* Train loss: 91.10   (RE: 55.24, KL: 39.85)
o Val.  loss: 98.81   (RE: 59.11, KL: 39.69)
--> Early stopping: 0/50 (BEST: 98.92)

->model saved<-
beta: 0.91
Epoch: 91/2000, Time elapsed: 20.26s
* Train loss: 91.43   (RE: 55.56, KL: 39.42)
o Val.  loss: 98.65   (RE: 59.23, KL: 39.42)
--> Early stopping: 0/50 (BEST: 98.81)

->model saved<-
beta: 0.92
Epoch: 92/2000, Time elapsed: 19.25s
* Train loss: 91.75   (RE: 55.95, KL: 38.92)
o Val.  loss: 98.47   (RE: 59.40, KL: 39.08)
--> Early stopping: 0/50 (BEST: 98.65)

->model saved<-
beta: 0.93
Epoch: 93/2000, Time elapsed: 19.62s
* Train loss: 92.08   (RE: 56.26, KL: 38.52)
o Val.  loss: 98.37   (RE: 59.94, KL: 38.43)
--> Early stopping: 0/50 (BEST: 98.47)

->model saved<-
beta: 0.94
Epoch: 94/2000, Time elapsed: 17.85s
* Train loss: 92.35   (RE: 56.58, KL: 38.05)
o Val.  loss: 98.13   (RE: 60.06, KL: 38.07)
--> Early stopping: 0/50 (BEST: 98.37)

->model saved<-
beta: 0.95
Epoch: 95/2000, Time elapsed: 20.27s
* Train loss: 92.67   (RE: 56.94, KL: 37.61)
o Val.  loss: 98.18   (RE: 60.42, KL: 37.76)
--> Early stopping: 0/50 (BEST: 98.13)

beta: 0.96
Epoch: 96/2000, Time elapsed: 20.87s
* Train loss: 92.94   (RE: 57.30, KL: 37.13)
o Val.  loss: 97.97   (RE: 60.89, KL: 37.08)
--> Early stopping: 0/50 (BEST: 98.13)

->model saved<-
beta: 0.97
Epoch: 97/2000, Time elapsed: 19.31s
* Train loss: 93.21   (RE: 57.57, KL: 36.74)
o Val.  loss: 97.74   (RE: 60.87, KL: 36.87)
--> Early stopping: 0/50 (BEST: 97.97)

->model saved<-
beta: 0.98
Epoch: 98/2000, Time elapsed: 20.17s
* Train loss: 93.51   (RE: 57.91, KL: 36.32)
o Val.  loss: 97.75   (RE: 61.57, KL: 36.18)
--> Early stopping: 0/50 (BEST: 97.74)

beta: 0.99
Epoch: 99/2000, Time elapsed: 20.62s
* Train loss: 93.77   (RE: 58.26, KL: 35.87)
o Val.  loss: 97.52   (RE: 61.48, KL: 36.04)
--> Early stopping: 0/50 (BEST: 97.74)

->model saved<-
beta: 1.0
Epoch: 100/2000, Time elapsed: 19.48s
* Train loss: 94.00   (RE: 58.56, KL: 35.44)
o Val.  loss: 97.43   (RE: 61.92, KL: 35.51)
--> Early stopping: 0/50 (BEST: 97.52)

->model saved<-
beta: 1.0
Epoch: 101/2000, Time elapsed: 17.46s
* Train loss: 93.94   (RE: 58.66, KL: 35.28)
o Val.  loss: 97.41   (RE: 62.20, KL: 35.21)
--> Early stopping: 0/50 (BEST: 97.43)

->model saved<-
beta: 1.0
Epoch: 102/2000, Time elapsed: 19.14s
* Train loss: 93.86   (RE: 58.76, KL: 35.10)
o Val.  loss: 97.28   (RE: 62.14, KL: 35.15)
--> Early stopping: 0/50 (BEST: 97.41)

->model saved<-
beta: 1.0
Epoch: 103/2000, Time elapsed: 18.88s
* Train loss: 93.79   (RE: 58.86, KL: 34.93)
o Val.  loss: 97.08   (RE: 62.02, KL: 35.06)
--> Early stopping: 0/50 (BEST: 97.28)

->model saved<-
beta: 1.0
Epoch: 104/2000, Time elapsed: 19.21s
* Train loss: 93.65   (RE: 58.92, KL: 34.74)
o Val.  loss: 96.93   (RE: 62.32, KL: 34.61)
--> Early stopping: 0/50 (BEST: 97.08)

->model saved<-
beta: 1.0
Epoch: 105/2000, Time elapsed: 18.93s
* Train loss: 93.58   (RE: 58.94, KL: 34.65)
o Val.  loss: 96.93   (RE: 62.20, KL: 34.72)
--> Early stopping: 0/50 (BEST: 96.93)

->model saved<-
beta: 1.0
Epoch: 106/2000, Time elapsed: 19.12s
* Train loss: 93.48   (RE: 58.99, KL: 34.48)
o Val.  loss: 96.78   (RE: 62.35, KL: 34.43)
--> Early stopping: 0/50 (BEST: 96.93)

->model saved<-
beta: 1.0
Epoch: 107/2000, Time elapsed: 20.50s
* Train loss: 93.37   (RE: 59.03, KL: 34.34)
o Val.  loss: 96.87   (RE: 62.28, KL: 34.59)
--> Early stopping: 0/50 (BEST: 96.78)

beta: 1.0
Epoch: 108/2000, Time elapsed: 19.67s
* Train loss: 93.31   (RE: 59.11, KL: 34.21)
o Val.  loss: 96.78   (RE: 62.30, KL: 34.47)
--> Early stopping: 1/50 (BEST: 96.78)

->model saved<-
beta: 1.0
Epoch: 109/2000, Time elapsed: 19.66s
* Train loss: 93.24   (RE: 59.11, KL: 34.12)
o Val.  loss: 96.68   (RE: 62.60, KL: 34.08)
--> Early stopping: 0/50 (BEST: 96.78)

->model saved<-
beta: 1.0
Epoch: 110/2000, Time elapsed: 19.23s
* Train loss: 93.16   (RE: 59.16, KL: 34.00)
o Val.  loss: 96.60   (RE: 62.60, KL: 34.00)
--> Early stopping: 0/50 (BEST: 96.68)

->model saved<-
beta: 1.0
Epoch: 111/2000, Time elapsed: 19.37s
* Train loss: 93.04   (RE: 59.16, KL: 33.87)
o Val.  loss: 96.39   (RE: 62.45, KL: 33.93)
--> Early stopping: 0/50 (BEST: 96.60)

->model saved<-
beta: 1.0
Epoch: 112/2000, Time elapsed: 19.55s
* Train loss: 92.96   (RE: 59.19, KL: 33.77)
o Val.  loss: 96.29   (RE: 62.63, KL: 33.66)
--> Early stopping: 0/50 (BEST: 96.39)

->model saved<-
beta: 1.0
Epoch: 113/2000, Time elapsed: 20.17s
* Train loss: 92.87   (RE: 59.21, KL: 33.66)
o Val.  loss: 96.33   (RE: 62.39, KL: 33.95)
--> Early stopping: 0/50 (BEST: 96.29)

beta: 1.0
Epoch: 114/2000, Time elapsed: 19.74s
* Train loss: 92.79   (RE: 59.23, KL: 33.56)
o Val.  loss: 96.26   (RE: 62.61, KL: 33.64)
--> Early stopping: 1/50 (BEST: 96.29)

->model saved<-
beta: 1.0
Epoch: 115/2000, Time elapsed: 20.71s
* Train loss: 92.72   (RE: 59.25, KL: 33.47)
o Val.  loss: 96.29   (RE: 62.58, KL: 33.70)
--> Early stopping: 0/50 (BEST: 96.26)

beta: 1.0
Epoch: 116/2000, Time elapsed: 20.64s
* Train loss: 92.65   (RE: 59.26, KL: 33.40)
o Val.  loss: 95.97   (RE: 62.38, KL: 33.59)
--> Early stopping: 1/50 (BEST: 96.26)

->model saved<-
beta: 1.0
Epoch: 117/2000, Time elapsed: 20.37s
* Train loss: 92.57   (RE: 59.28, KL: 33.29)
o Val.  loss: 95.85   (RE: 62.49, KL: 33.36)
--> Early stopping: 0/50 (BEST: 95.97)

->model saved<-
beta: 1.0
Epoch: 118/2000, Time elapsed: 20.57s
* Train loss: 92.49   (RE: 59.27, KL: 33.22)
o Val.  loss: 95.95   (RE: 62.36, KL: 33.60)
--> Early stopping: 0/50 (BEST: 95.85)

beta: 1.0
Epoch: 119/2000, Time elapsed: 19.07s
* Train loss: 92.45   (RE: 59.28, KL: 33.16)
o Val.  loss: 95.82   (RE: 62.46, KL: 33.36)
--> Early stopping: 1/50 (BEST: 95.85)

->model saved<-
beta: 1.0
Epoch: 120/2000, Time elapsed: 19.27s
* Train loss: 92.34   (RE: 59.27, KL: 33.06)
o Val.  loss: 95.81   (RE: 62.46, KL: 33.35)
--> Early stopping: 0/50 (BEST: 95.82)

->model saved<-
beta: 1.0
Epoch: 121/2000, Time elapsed: 20.17s
* Train loss: 92.27   (RE: 59.31, KL: 32.96)
o Val.  loss: 95.80   (RE: 62.69, KL: 33.11)
--> Early stopping: 0/50 (BEST: 95.81)

->model saved<-
beta: 1.0
Epoch: 122/2000, Time elapsed: 20.20s
* Train loss: 92.23   (RE: 59.32, KL: 32.91)
o Val.  loss: 95.65   (RE: 62.86, KL: 32.80)
--> Early stopping: 0/50 (BEST: 95.80)

->model saved<-
beta: 1.0
Epoch: 123/2000, Time elapsed: 20.56s
* Train loss: 92.13   (RE: 59.32, KL: 32.81)
o Val.  loss: 95.67   (RE: 62.87, KL: 32.81)
--> Early stopping: 0/50 (BEST: 95.65)

beta: 1.0
Epoch: 124/2000, Time elapsed: 20.54s
* Train loss: 92.06   (RE: 59.33, KL: 32.74)
o Val.  loss: 95.48   (RE: 62.78, KL: 32.70)
--> Early stopping: 1/50 (BEST: 95.65)

->model saved<-
beta: 1.0
Epoch: 125/2000, Time elapsed: 19.92s
* Train loss: 91.99   (RE: 59.30, KL: 32.68)
o Val.  loss: 95.49   (RE: 62.62, KL: 32.88)
--> Early stopping: 0/50 (BEST: 95.48)

beta: 1.0
Epoch: 126/2000, Time elapsed: 19.77s
* Train loss: 91.90   (RE: 59.29, KL: 32.61)
o Val.  loss: 95.46   (RE: 62.54, KL: 32.92)
--> Early stopping: 1/50 (BEST: 95.48)

->model saved<-
beta: 1.0
Epoch: 127/2000, Time elapsed: 20.22s
* Train loss: 91.88   (RE: 59.31, KL: 32.57)
o Val.  loss: 95.37   (RE: 62.67, KL: 32.70)
--> Early stopping: 0/50 (BEST: 95.46)

->model saved<-
beta: 1.0
Epoch: 128/2000, Time elapsed: 20.81s
* Train loss: 91.80   (RE: 59.32, KL: 32.48)
o Val.  loss: 95.34   (RE: 62.63, KL: 32.71)
--> Early stopping: 0/50 (BEST: 95.37)

->model saved<-
beta: 1.0
Epoch: 129/2000, Time elapsed: 20.91s
* Train loss: 91.70   (RE: 59.29, KL: 32.41)
o Val.  loss: 95.23   (RE: 62.57, KL: 32.66)
--> Early stopping: 0/50 (BEST: 95.34)

->model saved<-
beta: 1.0
Epoch: 130/2000, Time elapsed: 20.21s
* Train loss: 91.66   (RE: 59.29, KL: 32.37)
o Val.  loss: 95.39   (RE: 62.96, KL: 32.44)
--> Early stopping: 0/50 (BEST: 95.23)

beta: 1.0
Epoch: 131/2000, Time elapsed: 20.51s
* Train loss: 91.58   (RE: 59.30, KL: 32.28)
o Val.  loss: 95.31   (RE: 62.81, KL: 32.50)
--> Early stopping: 1/50 (BEST: 95.23)

beta: 1.0
Epoch: 132/2000, Time elapsed: 19.76s
* Train loss: 91.54   (RE: 59.31, KL: 32.23)
o Val.  loss: 95.09   (RE: 62.97, KL: 32.12)
--> Early stopping: 2/50 (BEST: 95.23)

->model saved<-
beta: 1.0
Epoch: 133/2000, Time elapsed: 20.46s
* Train loss: 91.49   (RE: 59.32, KL: 32.17)
o Val.  loss: 94.93   (RE: 62.42, KL: 32.51)
--> Early stopping: 0/50 (BEST: 95.09)

->model saved<-
beta: 1.0
Epoch: 134/2000, Time elapsed: 20.66s
* Train loss: 91.38   (RE: 59.27, KL: 32.11)
o Val.  loss: 95.04   (RE: 62.66, KL: 32.37)
--> Early stopping: 0/50 (BEST: 94.93)

beta: 1.0
Epoch: 135/2000, Time elapsed: 18.84s
* Train loss: 91.34   (RE: 59.26, KL: 32.09)
o Val.  loss: 95.10   (RE: 62.85, KL: 32.25)
--> Early stopping: 1/50 (BEST: 94.93)

beta: 1.0
Epoch: 136/2000, Time elapsed: 20.54s
* Train loss: 91.29   (RE: 59.29, KL: 32.00)
o Val.  loss: 94.84   (RE: 62.62, KL: 32.22)
--> Early stopping: 2/50 (BEST: 94.93)

->model saved<-
beta: 1.0
Epoch: 137/2000, Time elapsed: 18.89s
* Train loss: 91.21   (RE: 59.26, KL: 31.95)
o Val.  loss: 94.96   (RE: 62.86, KL: 32.10)
--> Early stopping: 0/50 (BEST: 94.84)

beta: 1.0
Epoch: 138/2000, Time elapsed: 19.73s
* Train loss: 91.16   (RE: 59.26, KL: 31.89)
o Val.  loss: 94.94   (RE: 62.83, KL: 32.11)
--> Early stopping: 1/50 (BEST: 94.84)

beta: 1.0
Epoch: 139/2000, Time elapsed: 21.50s
* Train loss: 91.13   (RE: 59.29, KL: 31.84)
o Val.  loss: 94.76   (RE: 62.69, KL: 32.07)
--> Early stopping: 2/50 (BEST: 94.84)

->model saved<-
beta: 1.0
Epoch: 140/2000, Time elapsed: 18.57s
* Train loss: 91.03   (RE: 59.21, KL: 31.82)
o Val.  loss: 94.85   (RE: 62.65, KL: 32.20)
--> Early stopping: 0/50 (BEST: 94.76)

beta: 1.0
Epoch: 141/2000, Time elapsed: 20.08s
* Train loss: 90.98   (RE: 59.22, KL: 31.77)
o Val.  loss: 94.68   (RE: 62.75, KL: 31.93)
--> Early stopping: 1/50 (BEST: 94.76)

->model saved<-
beta: 1.0
Epoch: 142/2000, Time elapsed: 20.22s
* Train loss: 90.92   (RE: 59.19, KL: 31.73)
o Val.  loss: 94.60   (RE: 62.78, KL: 31.83)
--> Early stopping: 0/50 (BEST: 94.68)

->model saved<-
beta: 1.0
Epoch: 143/2000, Time elapsed: 20.34s
* Train loss: 90.85   (RE: 59.15, KL: 31.71)
o Val.  loss: 94.74   (RE: 62.82, KL: 31.92)
--> Early stopping: 0/50 (BEST: 94.60)

beta: 1.0
Epoch: 144/2000, Time elapsed: 19.71s
* Train loss: 90.77   (RE: 59.15, KL: 31.62)
o Val.  loss: 94.57   (RE: 62.95, KL: 31.62)
--> Early stopping: 1/50 (BEST: 94.60)

->model saved<-
beta: 1.0
Epoch: 145/2000, Time elapsed: 20.34s
* Train loss: 90.73   (RE: 59.15, KL: 31.57)
o Val.  loss: 94.58   (RE: 62.76, KL: 31.82)
--> Early stopping: 0/50 (BEST: 94.57)

beta: 1.0
Epoch: 146/2000, Time elapsed: 18.77s
* Train loss: 90.66   (RE: 59.12, KL: 31.54)
o Val.  loss: 94.59   (RE: 62.90, KL: 31.69)
--> Early stopping: 1/50 (BEST: 94.57)

beta: 1.0
Epoch: 147/2000, Time elapsed: 19.90s
* Train loss: 90.63   (RE: 59.11, KL: 31.52)
o Val.  loss: 94.47   (RE: 62.74, KL: 31.73)
--> Early stopping: 2/50 (BEST: 94.57)

->model saved<-
beta: 1.0
Epoch: 148/2000, Time elapsed: 18.28s
* Train loss: 90.58   (RE: 59.12, KL: 31.46)
o Val.  loss: 94.39   (RE: 62.66, KL: 31.72)
--> Early stopping: 0/50 (BEST: 94.47)

->model saved<-
beta: 1.0
Epoch: 149/2000, Time elapsed: 20.04s
* Train loss: 90.55   (RE: 59.12, KL: 31.43)
o Val.  loss: 94.41   (RE: 62.68, KL: 31.73)
--> Early stopping: 0/50 (BEST: 94.39)

beta: 1.0
Epoch: 150/2000, Time elapsed: 20.85s
* Train loss: 90.46   (RE: 59.07, KL: 31.39)
o Val.  loss: 94.46   (RE: 62.68, KL: 31.79)
--> Early stopping: 1/50 (BEST: 94.39)

beta: 1.0
Epoch: 151/2000, Time elapsed: 19.05s
* Train loss: 90.44   (RE: 59.05, KL: 31.39)
o Val.  loss: 94.40   (RE: 63.12, KL: 31.28)
--> Early stopping: 2/50 (BEST: 94.39)

beta: 1.0
Epoch: 152/2000, Time elapsed: 18.97s
* Train loss: 90.35   (RE: 59.03, KL: 31.32)
o Val.  loss: 94.43   (RE: 62.67, KL: 31.76)
--> Early stopping: 3/50 (BEST: 94.39)

beta: 1.0
Epoch: 153/2000, Time elapsed: 20.13s
* Train loss: 90.32   (RE: 59.04, KL: 31.27)
o Val.  loss: 94.43   (RE: 62.93, KL: 31.50)
--> Early stopping: 4/50 (BEST: 94.39)

beta: 1.0
Epoch: 154/2000, Time elapsed: 18.29s
* Train loss: 90.26   (RE: 59.04, KL: 31.22)
o Val.  loss: 94.22   (RE: 62.47, KL: 31.75)
--> Early stopping: 5/50 (BEST: 94.39)

->model saved<-
beta: 1.0
Epoch: 155/2000, Time elapsed: 20.50s
* Train loss: 90.21   (RE: 59.01, KL: 31.20)
o Val.  loss: 94.16   (RE: 62.71, KL: 31.45)
--> Early stopping: 0/50 (BEST: 94.22)

->model saved<-
beta: 1.0
Epoch: 156/2000, Time elapsed: 20.00s
* Train loss: 90.17   (RE: 58.96, KL: 31.20)
o Val.  loss: 94.17   (RE: 62.81, KL: 31.35)
--> Early stopping: 0/50 (BEST: 94.16)

beta: 1.0
Epoch: 157/2000, Time elapsed: 18.57s
* Train loss: 90.11   (RE: 58.97, KL: 31.15)
o Val.  loss: 94.21   (RE: 62.59, KL: 31.62)
--> Early stopping: 1/50 (BEST: 94.16)

beta: 1.0
Epoch: 158/2000, Time elapsed: 19.50s
* Train loss: 90.09   (RE: 58.96, KL: 31.13)
o Val.  loss: 94.33   (RE: 62.66, KL: 31.66)
--> Early stopping: 2/50 (BEST: 94.16)

beta: 1.0
Epoch: 159/2000, Time elapsed: 18.85s
* Train loss: 90.00   (RE: 58.90, KL: 31.10)
o Val.  loss: 94.09   (RE: 62.78, KL: 31.31)
--> Early stopping: 3/50 (BEST: 94.16)

->model saved<-
beta: 1.0
Epoch: 160/2000, Time elapsed: 18.38s
* Train loss: 89.97   (RE: 58.92, KL: 31.05)
o Val.  loss: 94.06   (RE: 62.34, KL: 31.72)
--> Early stopping: 0/50 (BEST: 94.09)

->model saved<-
beta: 1.0
Epoch: 161/2000, Time elapsed: 18.51s
* Train loss: 89.92   (RE: 58.89, KL: 31.03)
o Val.  loss: 93.91   (RE: 62.91, KL: 31.00)
--> Early stopping: 0/50 (BEST: 94.06)

->model saved<-
beta: 1.0
Epoch: 162/2000, Time elapsed: 17.98s
* Train loss: 89.88   (RE: 58.88, KL: 30.99)
o Val.  loss: 94.11   (RE: 62.80, KL: 31.31)
--> Early stopping: 0/50 (BEST: 93.91)

beta: 1.0
Epoch: 163/2000, Time elapsed: 18.69s
* Train loss: 89.83   (RE: 58.84, KL: 30.98)
o Val.  loss: 94.05   (RE: 62.92, KL: 31.13)
--> Early stopping: 1/50 (BEST: 93.91)

beta: 1.0
Epoch: 164/2000, Time elapsed: 18.68s
* Train loss: 89.76   (RE: 58.82, KL: 30.94)
o Val.  loss: 94.04   (RE: 62.65, KL: 31.39)
--> Early stopping: 2/50 (BEST: 93.91)

beta: 1.0
Epoch: 165/2000, Time elapsed: 18.59s
* Train loss: 89.72   (RE: 58.80, KL: 30.92)
o Val.  loss: 93.93   (RE: 62.84, KL: 31.09)
--> Early stopping: 3/50 (BEST: 93.91)

beta: 1.0
Epoch: 166/2000, Time elapsed: 18.89s
* Train loss: 89.71   (RE: 58.80, KL: 30.91)
o Val.  loss: 93.99   (RE: 62.79, KL: 31.19)
--> Early stopping: 4/50 (BEST: 93.91)

beta: 1.0
Epoch: 167/2000, Time elapsed: 19.22s
* Train loss: 89.68   (RE: 58.77, KL: 30.90)
o Val.  loss: 93.93   (RE: 62.89, KL: 31.04)
--> Early stopping: 5/50 (BEST: 93.91)

beta: 1.0
Epoch: 168/2000, Time elapsed: 19.22s
* Train loss: 89.58   (RE: 58.72, KL: 30.86)
o Val.  loss: 93.84   (RE: 62.84, KL: 31.00)
--> Early stopping: 6/50 (BEST: 93.91)

->model saved<-
beta: 1.0
Epoch: 169/2000, Time elapsed: 19.14s
* Train loss: 89.57   (RE: 58.72, KL: 30.84)
o Val.  loss: 93.84   (RE: 62.74, KL: 31.10)
--> Early stopping: 0/50 (BEST: 93.84)

beta: 1.0
Epoch: 170/2000, Time elapsed: 18.96s
* Train loss: 89.53   (RE: 58.70, KL: 30.83)
o Val.  loss: 93.85   (RE: 62.82, KL: 31.02)
--> Early stopping: 1/50 (BEST: 93.84)

beta: 1.0
Epoch: 171/2000, Time elapsed: 19.08s
* Train loss: 89.49   (RE: 58.67, KL: 30.82)
o Val.  loss: 93.89   (RE: 62.90, KL: 30.98)
--> Early stopping: 2/50 (BEST: 93.84)

beta: 1.0
Epoch: 172/2000, Time elapsed: 18.56s
* Train loss: 89.39   (RE: 58.68, KL: 30.71)
o Val.  loss: 93.85   (RE: 62.95, KL: 30.90)
--> Early stopping: 3/50 (BEST: 93.84)

beta: 1.0
Epoch: 173/2000, Time elapsed: 18.57s
* Train loss: 89.38   (RE: 58.65, KL: 30.74)
o Val.  loss: 93.68   (RE: 62.49, KL: 31.18)
--> Early stopping: 4/50 (BEST: 93.84)

->model saved<-
beta: 1.0
Epoch: 174/2000, Time elapsed: 18.82s
* Train loss: 89.33   (RE: 58.63, KL: 30.70)
o Val.  loss: 93.78   (RE: 62.44, KL: 31.34)
--> Early stopping: 0/50 (BEST: 93.68)

beta: 1.0
Epoch: 175/2000, Time elapsed: 18.46s
* Train loss: 89.34   (RE: 58.62, KL: 30.71)
o Val.  loss: 93.68   (RE: 62.80, KL: 30.88)
--> Early stopping: 1/50 (BEST: 93.68)

beta: 1.0
Epoch: 176/2000, Time elapsed: 17.83s
* Train loss: 89.25   (RE: 58.59, KL: 30.66)
o Val.  loss: 93.73   (RE: 62.79, KL: 30.93)
--> Early stopping: 2/50 (BEST: 93.68)

beta: 1.0
Epoch: 177/2000, Time elapsed: 19.25s
* Train loss: 89.23   (RE: 58.56, KL: 30.66)
o Val.  loss: 93.79   (RE: 62.92, KL: 30.87)
--> Early stopping: 3/50 (BEST: 93.68)

beta: 1.0
Epoch: 178/2000, Time elapsed: 18.75s
* Train loss: 89.21   (RE: 58.55, KL: 30.66)
o Val.  loss: 93.56   (RE: 62.79, KL: 30.77)
--> Early stopping: 4/50 (BEST: 93.68)

->model saved<-
beta: 1.0
Epoch: 179/2000, Time elapsed: 19.09s
* Train loss: 89.15   (RE: 58.55, KL: 30.60)
o Val.  loss: 93.66   (RE: 62.82, KL: 30.84)
--> Early stopping: 0/50 (BEST: 93.56)

beta: 1.0
Epoch: 180/2000, Time elapsed: 18.53s
* Train loss: 89.12   (RE: 58.50, KL: 30.62)
o Val.  loss: 93.73   (RE: 62.85, KL: 30.87)
--> Early stopping: 1/50 (BEST: 93.56)

beta: 1.0
Epoch: 181/2000, Time elapsed: 19.28s
* Train loss: 89.06   (RE: 58.49, KL: 30.57)
o Val.  loss: 93.59   (RE: 62.85, KL: 30.74)
--> Early stopping: 2/50 (BEST: 93.56)

beta: 1.0
Epoch: 182/2000, Time elapsed: 19.49s
* Train loss: 89.02   (RE: 58.47, KL: 30.55)
o Val.  loss: 93.79   (RE: 62.79, KL: 31.00)
--> Early stopping: 3/50 (BEST: 93.56)

beta: 1.0
Epoch: 183/2000, Time elapsed: 17.85s
* Train loss: 89.03   (RE: 58.46, KL: 30.57)
o Val.  loss: 93.45   (RE: 62.66, KL: 30.79)
--> Early stopping: 4/50 (BEST: 93.56)

->model saved<-
beta: 1.0
Epoch: 184/2000, Time elapsed: 18.05s
* Train loss: 88.95   (RE: 58.42, KL: 30.53)
o Val.  loss: 93.60   (RE: 62.74, KL: 30.86)
--> Early stopping: 0/50 (BEST: 93.45)

beta: 1.0
Epoch: 185/2000, Time elapsed: 19.47s
* Train loss: 88.89   (RE: 58.38, KL: 30.51)
o Val.  loss: 93.58   (RE: 62.69, KL: 30.89)
--> Early stopping: 1/50 (BEST: 93.45)

beta: 1.0
Epoch: 186/2000, Time elapsed: 19.28s
* Train loss: 88.86   (RE: 58.34, KL: 30.52)
o Val.  loss: 93.51   (RE: 62.70, KL: 30.81)
--> Early stopping: 2/50 (BEST: 93.45)

beta: 1.0
Epoch: 187/2000, Time elapsed: 18.74s
* Train loss: 88.86   (RE: 58.37, KL: 30.49)
o Val.  loss: 93.52   (RE: 62.71, KL: 30.81)
--> Early stopping: 3/50 (BEST: 93.45)

beta: 1.0
Epoch: 188/2000, Time elapsed: 18.61s
* Train loss: 88.79   (RE: 58.30, KL: 30.49)
o Val.  loss: 93.49   (RE: 62.78, KL: 30.71)
--> Early stopping: 4/50 (BEST: 93.45)

beta: 1.0
Epoch: 189/2000, Time elapsed: 18.22s
* Train loss: 88.77   (RE: 58.31, KL: 30.46)
o Val.  loss: 93.49   (RE: 62.73, KL: 30.75)
--> Early stopping: 5/50 (BEST: 93.45)

beta: 1.0
Epoch: 190/2000, Time elapsed: 19.04s
* Train loss: 88.77   (RE: 58.30, KL: 30.47)
o Val.  loss: 93.46   (RE: 62.87, KL: 30.59)
--> Early stopping: 6/50 (BEST: 93.45)

beta: 1.0
Epoch: 191/2000, Time elapsed: 18.51s
* Train loss: 88.69   (RE: 58.24, KL: 30.45)
o Val.  loss: 93.44   (RE: 62.53, KL: 30.91)
--> Early stopping: 7/50 (BEST: 93.45)

->model saved<-
beta: 1.0
Epoch: 192/2000, Time elapsed: 19.11s
* Train loss: 88.66   (RE: 58.24, KL: 30.42)
o Val.  loss: 93.48   (RE: 62.68, KL: 30.79)
--> Early stopping: 0/50 (BEST: 93.44)

beta: 1.0
Epoch: 193/2000, Time elapsed: 18.09s
* Train loss: 88.63   (RE: 58.22, KL: 30.41)
o Val.  loss: 93.44   (RE: 62.79, KL: 30.64)
--> Early stopping: 1/50 (BEST: 93.44)

->model saved<-
beta: 1.0
Epoch: 194/2000, Time elapsed: 18.51s
* Train loss: 88.61   (RE: 58.19, KL: 30.42)
o Val.  loss: 93.42   (RE: 62.53, KL: 30.89)
--> Early stopping: 0/50 (BEST: 93.44)

->model saved<-
beta: 1.0
Epoch: 195/2000, Time elapsed: 17.69s
* Train loss: 88.55   (RE: 58.15, KL: 30.40)
o Val.  loss: 93.39   (RE: 62.84, KL: 30.55)
--> Early stopping: 0/50 (BEST: 93.42)

->model saved<-
beta: 1.0
Epoch: 196/2000, Time elapsed: 17.89s
* Train loss: 88.54   (RE: 58.17, KL: 30.38)
o Val.  loss: 93.38   (RE: 62.54, KL: 30.84)
--> Early stopping: 0/50 (BEST: 93.39)

->model saved<-
beta: 1.0
Epoch: 197/2000, Time elapsed: 19.30s
* Train loss: 88.49   (RE: 58.10, KL: 30.39)
o Val.  loss: 93.38   (RE: 62.58, KL: 30.80)
--> Early stopping: 0/50 (BEST: 93.38)

beta: 1.0
Epoch: 198/2000, Time elapsed: 18.75s
* Train loss: 88.50   (RE: 58.12, KL: 30.38)
o Val.  loss: 93.43   (RE: 62.69, KL: 30.73)
--> Early stopping: 1/50 (BEST: 93.38)

beta: 1.0
Epoch: 199/2000, Time elapsed: 18.27s
* Train loss: 88.45   (RE: 58.10, KL: 30.35)
o Val.  loss: 93.34   (RE: 62.57, KL: 30.77)
--> Early stopping: 2/50 (BEST: 93.38)

->model saved<-
beta: 1.0
Epoch: 200/2000, Time elapsed: 18.87s
* Train loss: 88.41   (RE: 58.06, KL: 30.35)
o Val.  loss: 93.38   (RE: 62.61, KL: 30.77)
--> Early stopping: 0/50 (BEST: 93.34)

beta: 1.0
Epoch: 201/2000, Time elapsed: 19.00s
* Train loss: 88.38   (RE: 58.02, KL: 30.36)
o Val.  loss: 93.21   (RE: 62.76, KL: 30.46)
--> Early stopping: 1/50 (BEST: 93.34)

->model saved<-
beta: 1.0
Epoch: 202/2000, Time elapsed: 18.93s
* Train loss: 88.32   (RE: 58.00, KL: 30.31)
o Val.  loss: 93.38   (RE: 62.65, KL: 30.73)
--> Early stopping: 0/50 (BEST: 93.21)

beta: 1.0
Epoch: 203/2000, Time elapsed: 19.23s
* Train loss: 88.28   (RE: 57.97, KL: 30.31)
o Val.  loss: 93.36   (RE: 62.70, KL: 30.66)
--> Early stopping: 1/50 (BEST: 93.21)

beta: 1.0
Epoch: 204/2000, Time elapsed: 18.72s
* Train loss: 88.26   (RE: 57.96, KL: 30.30)
o Val.  loss: 93.40   (RE: 62.53, KL: 30.88)
--> Early stopping: 2/50 (BEST: 93.21)

beta: 1.0
Epoch: 205/2000, Time elapsed: 18.64s
* Train loss: 88.25   (RE: 57.95, KL: 30.30)
o Val.  loss: 93.42   (RE: 62.55, KL: 30.88)
--> Early stopping: 3/50 (BEST: 93.21)

beta: 1.0
Epoch: 206/2000, Time elapsed: 16.62s
* Train loss: 88.22   (RE: 57.92, KL: 30.30)
o Val.  loss: 93.26   (RE: 62.60, KL: 30.67)
--> Early stopping: 4/50 (BEST: 93.21)

beta: 1.0
Epoch: 207/2000, Time elapsed: 18.43s
* Train loss: 88.19   (RE: 57.91, KL: 30.27)
o Val.  loss: 93.38   (RE: 62.74, KL: 30.64)
--> Early stopping: 5/50 (BEST: 93.21)

beta: 1.0
Epoch: 208/2000, Time elapsed: 18.84s
* Train loss: 88.15   (RE: 57.88, KL: 30.27)
o Val.  loss: 93.22   (RE: 62.56, KL: 30.66)
--> Early stopping: 6/50 (BEST: 93.21)

beta: 1.0
Epoch: 209/2000, Time elapsed: 18.95s
* Train loss: 88.11   (RE: 57.87, KL: 30.24)
o Val.  loss: 93.34   (RE: 62.69, KL: 30.65)
--> Early stopping: 7/50 (BEST: 93.21)

beta: 1.0
Epoch: 210/2000, Time elapsed: 18.78s
* Train loss: 88.12   (RE: 57.85, KL: 30.27)
o Val.  loss: 93.22   (RE: 62.71, KL: 30.52)
--> Early stopping: 8/50 (BEST: 93.21)

beta: 1.0
Epoch: 211/2000, Time elapsed: 18.95s
* Train loss: 88.06   (RE: 57.81, KL: 30.25)
o Val.  loss: 93.35   (RE: 62.80, KL: 30.55)
--> Early stopping: 9/50 (BEST: 93.21)

beta: 1.0
Epoch: 212/2000, Time elapsed: 19.05s
* Train loss: 88.05   (RE: 57.82, KL: 30.23)
o Val.  loss: 93.33   (RE: 62.63, KL: 30.70)
--> Early stopping: 10/50 (BEST: 93.21)

beta: 1.0
Epoch: 213/2000, Time elapsed: 18.98s
* Train loss: 88.04   (RE: 57.79, KL: 30.25)
o Val.  loss: 93.18   (RE: 62.72, KL: 30.46)
--> Early stopping: 11/50 (BEST: 93.21)

->model saved<-
beta: 1.0
Epoch: 214/2000, Time elapsed: 19.37s
* Train loss: 87.96   (RE: 57.76, KL: 30.20)
o Val.  loss: 93.38   (RE: 62.89, KL: 30.50)
--> Early stopping: 0/50 (BEST: 93.18)

beta: 1.0
Epoch: 215/2000, Time elapsed: 18.98s
* Train loss: 87.94   (RE: 57.71, KL: 30.22)
o Val.  loss: 93.24   (RE: 62.60, KL: 30.63)
--> Early stopping: 1/50 (BEST: 93.18)

beta: 1.0
Epoch: 216/2000, Time elapsed: 19.13s
* Train loss: 87.94   (RE: 57.71, KL: 30.23)
o Val.  loss: 93.17   (RE: 62.83, KL: 30.34)
--> Early stopping: 2/50 (BEST: 93.18)

->model saved<-
beta: 1.0
Epoch: 217/2000, Time elapsed: 18.59s
* Train loss: 87.87   (RE: 57.68, KL: 30.19)
o Val.  loss: 93.20   (RE: 62.82, KL: 30.38)
--> Early stopping: 0/50 (BEST: 93.17)

beta: 1.0
Epoch: 218/2000, Time elapsed: 17.83s
* Train loss: 87.88   (RE: 57.69, KL: 30.19)
o Val.  loss: 93.42   (RE: 63.01, KL: 30.41)
--> Early stopping: 1/50 (BEST: 93.17)

beta: 1.0
Epoch: 219/2000, Time elapsed: 18.15s
* Train loss: 87.85   (RE: 57.66, KL: 30.19)
o Val.  loss: 93.41   (RE: 62.90, KL: 30.51)
--> Early stopping: 2/50 (BEST: 93.17)

beta: 1.0
Epoch: 220/2000, Time elapsed: 18.73s
* Train loss: 87.83   (RE: 57.65, KL: 30.18)
o Val.  loss: 93.19   (RE: 62.65, KL: 30.55)
--> Early stopping: 3/50 (BEST: 93.17)

beta: 1.0
Epoch: 221/2000, Time elapsed: 17.22s
* Train loss: 87.80   (RE: 57.62, KL: 30.18)
o Val.  loss: 93.30   (RE: 62.82, KL: 30.49)
--> Early stopping: 4/50 (BEST: 93.17)

beta: 1.0
Epoch: 222/2000, Time elapsed: 18.56s
* Train loss: 87.78   (RE: 57.61, KL: 30.17)
o Val.  loss: 93.24   (RE: 62.48, KL: 30.76)
--> Early stopping: 5/50 (BEST: 93.17)

beta: 1.0
Epoch: 223/2000, Time elapsed: 20.07s
* Train loss: 87.74   (RE: 57.58, KL: 30.16)
o Val.  loss: 93.18   (RE: 62.77, KL: 30.41)
--> Early stopping: 6/50 (BEST: 93.17)

beta: 1.0
Epoch: 224/2000, Time elapsed: 19.50s
* Train loss: 87.73   (RE: 57.58, KL: 30.15)
o Val.  loss: 93.18   (RE: 62.59, KL: 30.59)
--> Early stopping: 7/50 (BEST: 93.17)

beta: 1.0
Epoch: 225/2000, Time elapsed: 19.75s
* Train loss: 87.68   (RE: 57.55, KL: 30.14)
o Val.  loss: 93.26   (RE: 62.92, KL: 30.34)
--> Early stopping: 8/50 (BEST: 93.17)

beta: 1.0
Epoch: 226/2000, Time elapsed: 18.08s
* Train loss: 87.67   (RE: 57.54, KL: 30.12)
o Val.  loss: 93.13   (RE: 62.89, KL: 30.24)
--> Early stopping: 9/50 (BEST: 93.17)

->model saved<-
beta: 1.0
Epoch: 227/2000, Time elapsed: 19.21s
* Train loss: 87.65   (RE: 57.50, KL: 30.14)
o Val.  loss: 93.26   (RE: 62.74, KL: 30.52)
--> Early stopping: 0/50 (BEST: 93.13)

beta: 1.0
Epoch: 228/2000, Time elapsed: 18.57s
* Train loss: 87.61   (RE: 57.47, KL: 30.14)
o Val.  loss: 93.27   (RE: 62.60, KL: 30.67)
--> Early stopping: 1/50 (BEST: 93.13)

beta: 1.0
Epoch: 229/2000, Time elapsed: 19.61s
* Train loss: 87.60   (RE: 57.48, KL: 30.12)
o Val.  loss: 93.25   (RE: 62.62, KL: 30.64)
--> Early stopping: 2/50 (BEST: 93.13)

beta: 1.0
Epoch: 230/2000, Time elapsed: 18.36s
* Train loss: 87.58   (RE: 57.45, KL: 30.12)
o Val.  loss: 93.16   (RE: 62.84, KL: 30.31)
--> Early stopping: 3/50 (BEST: 93.13)

beta: 1.0
Epoch: 231/2000, Time elapsed: 18.33s
* Train loss: 87.55   (RE: 57.44, KL: 30.10)
o Val.  loss: 93.22   (RE: 62.67, KL: 30.55)
--> Early stopping: 4/50 (BEST: 93.13)

beta: 1.0
Epoch: 232/2000, Time elapsed: 18.58s
* Train loss: 87.53   (RE: 57.42, KL: 30.10)
o Val.  loss: 93.22   (RE: 62.68, KL: 30.54)
--> Early stopping: 5/50 (BEST: 93.13)

beta: 1.0
Epoch: 233/2000, Time elapsed: 19.19s
* Train loss: 87.52   (RE: 57.42, KL: 30.10)
o Val.  loss: 93.24   (RE: 62.66, KL: 30.58)
--> Early stopping: 6/50 (BEST: 93.13)

beta: 1.0
Epoch: 234/2000, Time elapsed: 18.37s
* Train loss: 87.47   (RE: 57.37, KL: 30.10)
o Val.  loss: 93.30   (RE: 62.73, KL: 30.57)
--> Early stopping: 7/50 (BEST: 93.13)

beta: 1.0
Epoch: 235/2000, Time elapsed: 18.52s
* Train loss: 87.46   (RE: 57.38, KL: 30.08)
o Val.  loss: 93.32   (RE: 62.91, KL: 30.41)
--> Early stopping: 8/50 (BEST: 93.13)

beta: 1.0
Epoch: 236/2000, Time elapsed: 19.87s
* Train loss: 87.42   (RE: 57.35, KL: 30.08)
o Val.  loss: 93.18   (RE: 62.83, KL: 30.35)
--> Early stopping: 9/50 (BEST: 93.13)

beta: 1.0
Epoch: 237/2000, Time elapsed: 19.07s
* Train loss: 87.37   (RE: 57.31, KL: 30.06)
o Val.  loss: 93.13   (RE: 62.69, KL: 30.44)
--> Early stopping: 10/50 (BEST: 93.13)

->model saved<-
beta: 1.0
Epoch: 238/2000, Time elapsed: 18.07s
* Train loss: 87.37   (RE: 57.28, KL: 30.09)
o Val.  loss: 93.35   (RE: 62.85, KL: 30.50)
--> Early stopping: 0/50 (BEST: 93.13)

beta: 1.0
Epoch: 239/2000, Time elapsed: 18.36s
* Train loss: 87.38   (RE: 57.32, KL: 30.05)
o Val.  loss: 93.25   (RE: 62.63, KL: 30.62)
--> Early stopping: 1/50 (BEST: 93.13)

beta: 1.0
Epoch: 240/2000, Time elapsed: 19.02s
* Train loss: 87.35   (RE: 57.27, KL: 30.08)
o Val.  loss: 93.19   (RE: 62.72, KL: 30.47)
--> Early stopping: 2/50 (BEST: 93.13)

beta: 1.0
Epoch: 241/2000, Time elapsed: 18.82s
* Train loss: 87.32   (RE: 57.26, KL: 30.06)
o Val.  loss: 93.25   (RE: 62.81, KL: 30.44)
--> Early stopping: 3/50 (BEST: 93.13)

beta: 1.0
Epoch: 242/2000, Time elapsed: 16.50s
* Train loss: 87.28   (RE: 57.23, KL: 30.05)
o Val.  loss: 93.13   (RE: 62.82, KL: 30.31)
--> Early stopping: 4/50 (BEST: 93.13)

->model saved<-
beta: 1.0
Epoch: 243/2000, Time elapsed: 18.95s
* Train loss: 87.28   (RE: 57.23, KL: 30.05)
o Val.  loss: 93.13   (RE: 62.82, KL: 30.31)
--> Early stopping: 0/50 (BEST: 93.13)

beta: 1.0
Epoch: 244/2000, Time elapsed: 18.96s
* Train loss: 87.23   (RE: 57.19, KL: 30.04)
o Val.  loss: 93.27   (RE: 62.68, KL: 30.60)
--> Early stopping: 1/50 (BEST: 93.13)

beta: 1.0
Epoch: 245/2000, Time elapsed: 19.42s
* Train loss: 87.21   (RE: 57.17, KL: 30.04)
o Val.  loss: 93.25   (RE: 62.76, KL: 30.49)
--> Early stopping: 2/50 (BEST: 93.13)

beta: 1.0
Epoch: 246/2000, Time elapsed: 19.44s
* Train loss: 87.21   (RE: 57.19, KL: 30.02)
o Val.  loss: 93.31   (RE: 62.65, KL: 30.66)
--> Early stopping: 3/50 (BEST: 93.13)

beta: 1.0
Epoch: 247/2000, Time elapsed: 19.25s
* Train loss: 87.17   (RE: 57.14, KL: 30.03)
o Val.  loss: 93.16   (RE: 62.81, KL: 30.35)
--> Early stopping: 4/50 (BEST: 93.13)

beta: 1.0
Epoch: 248/2000, Time elapsed: 18.81s
* Train loss: 87.17   (RE: 57.14, KL: 30.03)
o Val.  loss: 93.15   (RE: 62.76, KL: 30.39)
--> Early stopping: 5/50 (BEST: 93.13)

beta: 1.0
Epoch: 249/2000, Time elapsed: 18.62s
* Train loss: 87.13   (RE: 57.12, KL: 30.01)
o Val.  loss: 93.14   (RE: 62.73, KL: 30.41)
--> Early stopping: 6/50 (BEST: 93.13)

beta: 1.0
Epoch: 250/2000, Time elapsed: 19.00s
* Train loss: 87.13   (RE: 57.13, KL: 30.01)
o Val.  loss: 93.31   (RE: 62.76, KL: 30.55)
--> Early stopping: 7/50 (BEST: 93.13)

beta: 1.0
Epoch: 251/2000, Time elapsed: 19.25s
* Train loss: 87.08   (RE: 57.08, KL: 30.00)
o Val.  loss: 93.17   (RE: 62.78, KL: 30.38)
--> Early stopping: 8/50 (BEST: 93.13)

beta: 1.0
Epoch: 252/2000, Time elapsed: 19.91s
* Train loss: 87.06   (RE: 57.07, KL: 29.99)
o Val.  loss: 93.26   (RE: 62.66, KL: 30.60)
--> Early stopping: 9/50 (BEST: 93.13)

beta: 1.0
Epoch: 253/2000, Time elapsed: 18.91s
* Train loss: 87.03   (RE: 57.05, KL: 29.98)
o Val.  loss: 93.10   (RE: 62.74, KL: 30.36)
--> Early stopping: 10/50 (BEST: 93.13)

->model saved<-
beta: 1.0
Epoch: 254/2000, Time elapsed: 19.35s
* Train loss: 87.00   (RE: 57.01, KL: 29.98)
o Val.  loss: 93.22   (RE: 62.85, KL: 30.36)
--> Early stopping: 0/50 (BEST: 93.10)

beta: 1.0
Epoch: 255/2000, Time elapsed: 19.24s
* Train loss: 87.01   (RE: 57.02, KL: 29.99)
o Val.  loss: 93.36   (RE: 62.91, KL: 30.45)
--> Early stopping: 1/50 (BEST: 93.10)

beta: 1.0
Epoch: 256/2000, Time elapsed: 19.37s
* Train loss: 86.99   (RE: 57.02, KL: 29.96)
o Val.  loss: 93.14   (RE: 62.67, KL: 30.47)
--> Early stopping: 2/50 (BEST: 93.10)

beta: 1.0
Epoch: 257/2000, Time elapsed: 18.00s
* Train loss: 86.97   (RE: 56.97, KL: 29.99)
o Val.  loss: 93.15   (RE: 62.72, KL: 30.43)
--> Early stopping: 3/50 (BEST: 93.10)

beta: 1.0
Epoch: 258/2000, Time elapsed: 19.07s
* Train loss: 86.93   (RE: 56.94, KL: 29.99)
o Val.  loss: 93.26   (RE: 62.81, KL: 30.45)
--> Early stopping: 4/50 (BEST: 93.10)

beta: 1.0
Epoch: 259/2000, Time elapsed: 17.93s
* Train loss: 86.92   (RE: 56.97, KL: 29.95)
o Val.  loss: 93.25   (RE: 62.59, KL: 30.66)
--> Early stopping: 5/50 (BEST: 93.10)

beta: 1.0
Epoch: 260/2000, Time elapsed: 19.01s
* Train loss: 86.89   (RE: 56.92, KL: 29.98)
o Val.  loss: 93.16   (RE: 62.66, KL: 30.50)
--> Early stopping: 6/50 (BEST: 93.10)

beta: 1.0
Epoch: 261/2000, Time elapsed: 18.71s
* Train loss: 86.86   (RE: 56.90, KL: 29.96)
o Val.  loss: 93.29   (RE: 62.83, KL: 30.45)
--> Early stopping: 7/50 (BEST: 93.10)

beta: 1.0
Epoch: 262/2000, Time elapsed: 18.87s
* Train loss: 86.86   (RE: 56.91, KL: 29.95)
o Val.  loss: 93.10   (RE: 62.67, KL: 30.44)
--> Early stopping: 8/50 (BEST: 93.10)

beta: 1.0
Epoch: 263/2000, Time elapsed: 18.76s
* Train loss: 86.82   (RE: 56.88, KL: 29.94)
o Val.  loss: 93.08   (RE: 62.67, KL: 30.40)
--> Early stopping: 9/50 (BEST: 93.10)

->model saved<-
beta: 1.0
Epoch: 264/2000, Time elapsed: 17.64s
* Train loss: 86.81   (RE: 56.88, KL: 29.93)
o Val.  loss: 93.34   (RE: 62.91, KL: 30.43)
--> Early stopping: 0/50 (BEST: 93.08)

beta: 1.0
Epoch: 265/2000, Time elapsed: 18.52s
* Train loss: 86.79   (RE: 56.83, KL: 29.95)
o Val.  loss: 93.31   (RE: 62.69, KL: 30.62)
--> Early stopping: 1/50 (BEST: 93.08)

beta: 1.0
Epoch: 266/2000, Time elapsed: 18.88s
* Train loss: 86.79   (RE: 56.83, KL: 29.96)
o Val.  loss: 93.17   (RE: 62.72, KL: 30.44)
--> Early stopping: 2/50 (BEST: 93.08)

beta: 1.0
Epoch: 267/2000, Time elapsed: 19.32s
* Train loss: 86.76   (RE: 56.83, KL: 29.93)
o Val.  loss: 93.27   (RE: 62.73, KL: 30.54)
--> Early stopping: 3/50 (BEST: 93.08)

beta: 1.0
Epoch: 268/2000, Time elapsed: 18.16s
* Train loss: 86.72   (RE: 56.79, KL: 29.92)
o Val.  loss: 93.26   (RE: 62.78, KL: 30.47)
--> Early stopping: 4/50 (BEST: 93.08)

beta: 1.0
Epoch: 269/2000, Time elapsed: 18.81s
* Train loss: 86.72   (RE: 56.79, KL: 29.94)
o Val.  loss: 93.21   (RE: 62.73, KL: 30.48)
--> Early stopping: 5/50 (BEST: 93.08)

beta: 1.0
Epoch: 270/2000, Time elapsed: 17.48s
* Train loss: 86.71   (RE: 56.79, KL: 29.93)
o Val.  loss: 93.28   (RE: 62.76, KL: 30.52)
--> Early stopping: 6/50 (BEST: 93.08)

beta: 1.0
Epoch: 271/2000, Time elapsed: 17.51s
* Train loss: 86.69   (RE: 56.75, KL: 29.93)
o Val.  loss: 93.30   (RE: 62.92, KL: 30.37)
--> Early stopping: 7/50 (BEST: 93.08)

beta: 1.0
Epoch: 272/2000, Time elapsed: 17.54s
* Train loss: 86.63   (RE: 56.75, KL: 29.88)
o Val.  loss: 93.18   (RE: 62.89, KL: 30.29)
--> Early stopping: 8/50 (BEST: 93.08)

beta: 1.0
Epoch: 273/2000, Time elapsed: 18.74s
* Train loss: 86.61   (RE: 56.73, KL: 29.88)
o Val.  loss: 93.29   (RE: 62.85, KL: 30.45)
--> Early stopping: 9/50 (BEST: 93.08)

beta: 1.0
Epoch: 274/2000, Time elapsed: 19.42s
* Train loss: 86.59   (RE: 56.72, KL: 29.87)
o Val.  loss: 93.25   (RE: 62.82, KL: 30.43)
--> Early stopping: 10/50 (BEST: 93.08)

beta: 1.0
Epoch: 275/2000, Time elapsed: 19.02s
* Train loss: 86.61   (RE: 56.69, KL: 29.92)
o Val.  loss: 93.17   (RE: 62.77, KL: 30.39)
--> Early stopping: 11/50 (BEST: 93.08)

beta: 1.0
Epoch: 276/2000, Time elapsed: 19.12s
* Train loss: 86.57   (RE: 56.68, KL: 29.89)
o Val.  loss: 93.22   (RE: 62.84, KL: 30.38)
--> Early stopping: 12/50 (BEST: 93.08)

beta: 1.0
Epoch: 277/2000, Time elapsed: 17.99s
* Train loss: 86.57   (RE: 56.68, KL: 29.89)
o Val.  loss: 93.25   (RE: 62.74, KL: 30.51)
--> Early stopping: 13/50 (BEST: 93.08)

beta: 1.0
Epoch: 278/2000, Time elapsed: 18.88s
* Train loss: 86.54   (RE: 56.65, KL: 29.89)
o Val.  loss: 93.34   (RE: 62.85, KL: 30.50)
--> Early stopping: 14/50 (BEST: 93.08)

beta: 1.0
Epoch: 279/2000, Time elapsed: 19.29s
* Train loss: 86.52   (RE: 56.66, KL: 29.86)
o Val.  loss: 93.18   (RE: 62.82, KL: 30.36)
--> Early stopping: 15/50 (BEST: 93.08)

beta: 1.0
Epoch: 280/2000, Time elapsed: 18.78s
* Train loss: 86.54   (RE: 56.64, KL: 29.90)
o Val.  loss: 93.41   (RE: 62.89, KL: 30.52)
--> Early stopping: 16/50 (BEST: 93.08)

beta: 1.0
Epoch: 281/2000, Time elapsed: 19.04s
* Train loss: 86.53   (RE: 56.61, KL: 29.92)
o Val.  loss: 93.36   (RE: 62.98, KL: 30.38)
--> Early stopping: 17/50 (BEST: 93.08)

beta: 1.0
Epoch: 282/2000, Time elapsed: 19.26s
* Train loss: 86.46   (RE: 56.58, KL: 29.88)
o Val.  loss: 93.34   (RE: 62.96, KL: 30.38)
--> Early stopping: 18/50 (BEST: 93.08)

beta: 1.0
Epoch: 283/2000, Time elapsed: 18.54s
* Train loss: 86.50   (RE: 56.60, KL: 29.90)
o Val.  loss: 93.25   (RE: 62.87, KL: 30.38)
--> Early stopping: 19/50 (BEST: 93.08)

beta: 1.0
Epoch: 284/2000, Time elapsed: 18.77s
* Train loss: 86.45   (RE: 56.57, KL: 29.89)
o Val.  loss: 93.25   (RE: 62.86, KL: 30.39)
--> Early stopping: 20/50 (BEST: 93.08)

beta: 1.0
Epoch: 285/2000, Time elapsed: 18.74s
* Train loss: 86.42   (RE: 56.55, KL: 29.87)
o Val.  loss: 93.29   (RE: 62.97, KL: 30.32)
--> Early stopping: 21/50 (BEST: 93.08)

beta: 1.0
Epoch: 286/2000, Time elapsed: 18.56s
* Train loss: 86.41   (RE: 56.55, KL: 29.87)
o Val.  loss: 93.25   (RE: 62.91, KL: 30.35)
--> Early stopping: 22/50 (BEST: 93.08)

beta: 1.0
Epoch: 287/2000, Time elapsed: 18.08s
* Train loss: 86.37   (RE: 56.52, KL: 29.85)
o Val.  loss: 93.25   (RE: 62.88, KL: 30.38)
--> Early stopping: 23/50 (BEST: 93.08)

beta: 1.0
Epoch: 288/2000, Time elapsed: 18.97s
* Train loss: 86.40   (RE: 56.52, KL: 29.87)
o Val.  loss: 93.24   (RE: 62.80, KL: 30.44)
--> Early stopping: 24/50 (BEST: 93.08)

beta: 1.0
Epoch: 289/2000, Time elapsed: 17.89s
* Train loss: 86.35   (RE: 56.46, KL: 29.89)
o Val.  loss: 93.35   (RE: 63.12, KL: 30.23)
--> Early stopping: 25/50 (BEST: 93.08)

beta: 1.0
Epoch: 290/2000, Time elapsed: 18.88s
* Train loss: 86.30   (RE: 56.46, KL: 29.84)
o Val.  loss: 93.22   (RE: 62.96, KL: 30.26)
--> Early stopping: 26/50 (BEST: 93.08)

beta: 1.0
Epoch: 291/2000, Time elapsed: 19.04s
* Train loss: 86.30   (RE: 56.43, KL: 29.87)
o Val.  loss: 93.26   (RE: 62.83, KL: 30.43)
--> Early stopping: 27/50 (BEST: 93.08)

beta: 1.0
Epoch: 292/2000, Time elapsed: 18.95s
* Train loss: 86.28   (RE: 56.41, KL: 29.87)
o Val.  loss: 93.15   (RE: 62.77, KL: 30.38)
--> Early stopping: 28/50 (BEST: 93.08)

beta: 1.0
Epoch: 293/2000, Time elapsed: 19.44s
* Train loss: 86.28   (RE: 56.42, KL: 29.85)
o Val.  loss: 93.26   (RE: 62.86, KL: 30.40)
--> Early stopping: 29/50 (BEST: 93.08)

beta: 1.0
Epoch: 294/2000, Time elapsed: 19.40s
* Train loss: 86.26   (RE: 56.42, KL: 29.84)
o Val.  loss: 93.33   (RE: 62.96, KL: 30.36)
--> Early stopping: 30/50 (BEST: 93.08)

beta: 1.0
Epoch: 295/2000, Time elapsed: 19.91s
* Train loss: 86.25   (RE: 56.39, KL: 29.86)
o Val.  loss: 93.25   (RE: 62.95, KL: 30.30)
--> Early stopping: 31/50 (BEST: 93.08)

beta: 1.0
Epoch: 296/2000, Time elapsed: 19.38s
* Train loss: 86.22   (RE: 56.37, KL: 29.85)
o Val.  loss: 93.31   (RE: 62.90, KL: 30.41)
--> Early stopping: 32/50 (BEST: 93.08)

beta: 1.0
Epoch: 297/2000, Time elapsed: 19.55s
* Train loss: 86.20   (RE: 56.35, KL: 29.84)
o Val.  loss: 93.40   (RE: 63.18, KL: 30.22)
--> Early stopping: 33/50 (BEST: 93.08)

beta: 1.0
Epoch: 298/2000, Time elapsed: 19.40s
* Train loss: 86.20   (RE: 56.35, KL: 29.85)
o Val.  loss: 93.34   (RE: 62.92, KL: 30.42)
--> Early stopping: 34/50 (BEST: 93.08)

beta: 1.0
Epoch: 299/2000, Time elapsed: 19.28s
* Train loss: 86.18   (RE: 56.33, KL: 29.85)
o Val.  loss: 93.23   (RE: 62.94, KL: 30.30)
--> Early stopping: 35/50 (BEST: 93.08)

beta: 1.0
Epoch: 300/2000, Time elapsed: 19.18s
* Train loss: 86.14   (RE: 56.31, KL: 29.83)
o Val.  loss: 93.31   (RE: 62.82, KL: 30.49)
--> Early stopping: 36/50 (BEST: 93.08)

beta: 1.0
Epoch: 301/2000, Time elapsed: 18.78s
* Train loss: 86.15   (RE: 56.30, KL: 29.85)
o Val.  loss: 93.46   (RE: 62.90, KL: 30.56)
--> Early stopping: 37/50 (BEST: 93.08)

beta: 1.0
Epoch: 302/2000, Time elapsed: 19.10s
* Train loss: 86.13   (RE: 56.28, KL: 29.85)
o Val.  loss: 93.27   (RE: 62.82, KL: 30.44)
--> Early stopping: 38/50 (BEST: 93.08)

beta: 1.0
Epoch: 303/2000, Time elapsed: 18.83s
* Train loss: 86.13   (RE: 56.31, KL: 29.82)
o Val.  loss: 93.36   (RE: 62.90, KL: 30.46)
--> Early stopping: 39/50 (BEST: 93.08)

beta: 1.0
Epoch: 304/2000, Time elapsed: 18.82s
* Train loss: 86.08   (RE: 56.25, KL: 29.82)
o Val.  loss: 93.32   (RE: 62.98, KL: 30.35)
--> Early stopping: 40/50 (BEST: 93.08)

beta: 1.0
Epoch: 305/2000, Time elapsed: 19.32s
* Train loss: 86.05   (RE: 56.22, KL: 29.83)
o Val.  loss: 93.30   (RE: 63.00, KL: 30.30)
--> Early stopping: 41/50 (BEST: 93.08)

beta: 1.0
Epoch: 306/2000, Time elapsed: 19.26s
* Train loss: 86.08   (RE: 56.21, KL: 29.87)
o Val.  loss: 93.36   (RE: 62.97, KL: 30.38)
--> Early stopping: 42/50 (BEST: 93.08)

beta: 1.0
Epoch: 307/2000, Time elapsed: 19.48s
* Train loss: 86.05   (RE: 56.21, KL: 29.84)
o Val.  loss: 93.40   (RE: 62.85, KL: 30.55)
--> Early stopping: 43/50 (BEST: 93.08)

beta: 1.0
Epoch: 308/2000, Time elapsed: 18.27s
* Train loss: 85.99   (RE: 56.16, KL: 29.83)
o Val.  loss: 93.25   (RE: 62.83, KL: 30.42)
--> Early stopping: 44/50 (BEST: 93.08)

beta: 1.0
Epoch: 309/2000, Time elapsed: 19.26s
* Train loss: 86.01   (RE: 56.16, KL: 29.85)
o Val.  loss: 93.38   (RE: 63.00, KL: 30.38)
--> Early stopping: 45/50 (BEST: 93.08)

beta: 1.0
Epoch: 310/2000, Time elapsed: 19.91s
* Train loss: 86.01   (RE: 56.17, KL: 29.84)
o Val.  loss: 93.31   (RE: 62.82, KL: 30.49)
--> Early stopping: 46/50 (BEST: 93.08)

beta: 1.0
Epoch: 311/2000, Time elapsed: 19.52s
* Train loss: 85.95   (RE: 56.14, KL: 29.81)
o Val.  loss: 93.34   (RE: 62.94, KL: 30.40)
--> Early stopping: 47/50 (BEST: 93.08)

beta: 1.0
Epoch: 312/2000, Time elapsed: 18.99s
* Train loss: 85.95   (RE: 56.09, KL: 29.85)
o Val.  loss: 93.37   (RE: 62.88, KL: 30.49)
--> Early stopping: 48/50 (BEST: 93.08)

beta: 1.0
Epoch: 313/2000, Time elapsed: 19.42s
* Train loss: 85.94   (RE: 56.11, KL: 29.83)
o Val.  loss: 93.42   (RE: 63.12, KL: 30.30)
--> Early stopping: 49/50 (BEST: 93.08)

beta: 1.0
Epoch: 314/2000, Time elapsed: 18.93s
* Train loss: 85.94   (RE: 56.12, KL: 29.82)
o Val.  loss: 93.35   (RE: 62.84, KL: 30.51)
--> Early stopping: 50/50 (BEST: 93.08)

Test lower-bound value 92.36 in time: 0.21s
Train lower-bound value 0.00 in time: 0.00s
0.00%
1.00%
2.00%
3.00%
4.00%
5.00%
6.00%
7.00%
8.00%
9.00%
10.00%
11.00%
12.00%
13.00%
14.00%
15.00%
16.00%
17.00%
18.00%
19.00%
20.00%
21.00%
22.00%
23.00%
24.00%
25.00%
26.00%
27.00%
28.00%
29.00%
30.00%
31.00%
32.00%
33.00%
34.00%
35.00%
36.00%
37.00%
38.00%
39.00%
40.00%
41.00%
42.00%
43.00%
44.00%
45.00%
46.00%
47.00%
48.00%
49.00%
50.00%
51.00%
52.00%
53.00%
54.00%
55.00%
56.00%
57.00%
58.00%
59.00%
60.00%
61.00%
62.00%
63.00%
64.00%
65.00%
66.00%
67.00%
68.00%
69.00%
70.00%
71.00%
72.00%
73.00%
74.00%
75.00%
76.00%
77.00%
78.00%
79.00%
80.00%
81.00%
82.00%
83.00%
84.00%
85.00%
86.00%
87.00%
88.00%
89.00%
90.00%
91.00%
92.00%
93.00%
94.00%
95.00%
96.00%
97.00%
98.00%
99.00%
Test log_likelihood value 85.89 in time: 909.51s
Train log_likelihood value 0.00 in time: 0.00s
FINAL EVALUATION ON TEST SET
LogL (TEST): 85.89
LogL (TRAIN): 0.00
ELBO (TEST): 92.36
ELBO (TRAIN): 0.00
Loss: 92.28
RE: 62.11
KL: 30.17
 Training finished in 116.06 minutes. Log saved to: snapshots/2026-01-21 20:21:10_static_mnist_hvae_2level_standard_z1_40_seed69/eval_results/runtime.txt
-=-=-=-=-=-=-=-=-=-=-=-=-=-=-=-=-=-=-=-=-=-=-=-=-=-=-=-=-=-=-=-=-=-=-=-=-=-=-=-=-=-=-=-=-=-=-=-=-=-=-=-=-=-=-=-
