load data
create model
Namespace(batch_size=100, test_batch_size=100, epochs=2000, lr=0.0005, early_stopping_epochs=50, warmup=100, no_cuda=False, seed=420, z1_size=40, z2_size=40, input_size=[1, 28, 28], activation=None, number_components=500, pseudoinputs_mean=0.05, pseudoinputs_std=0.01, use_training_data_init=False, model_name='hvae_2level', prior='vampprior', weighted=True, input_type='binary', flow_layers=8, flow_hidden_dim=128, S=5000, MB=100, dataset_name='static_mnist', dynamic_binarization=False, cuda=True, model_signature='2026-01-22 02:18:54')
perform experiment
beta: 0.01
/root/vae_vampprior/models/Model.py:41: UserWarning: The torch.cuda.*DtypeTensor constructors are no longer recommended. It's best to use methods such as torch.tensor(data, dtype=*, device='cuda') to create tensors. (Triggered internally at /pytorch/torch/csrc/tensor/python_tensor.cpp:78.)
  eps = torch.cuda.FloatTensor(std.size()).normal_()
/root/vae_vampprior/utils/optimizer.py:75: UserWarning: This overload of add_ is deprecated:
	add_(Number alpha, Tensor other)
Consider using one of the following signatures instead:
	add_(Tensor other, *, Number alpha = 1) (Triggered internally at /pytorch/torch/csrc/utils/python_arg_parser.cpp:1805.)
  exp_avg.mul_(beta1).add_(1 - beta1, grad)
Epoch: 1/2000, Time elapsed: 23.56s
* Train loss: 108.20   (RE: 106.36, KL: 183.58)
o Val.  loss: 251.03   (RE: 59.51, KL: 191.52)
--> Early stopping: 0/50 (BEST: 100000.00)

->model saved<-
beta: 0.02
Epoch: 2/2000, Time elapsed: 23.77s
* Train loss: 55.03   (RE: 51.24, KL: 189.60)
o Val.  loss: 235.19   (RE: 46.19, KL: 189.00)
--> Early stopping: 0/50 (BEST: 251.03)

->model saved<-
beta: 0.03
Epoch: 3/2000, Time elapsed: 23.95s
* Train loss: 48.04   (RE: 42.68, KL: 178.52)
o Val.  loss: 214.69   (RE: 41.58, KL: 173.11)
--> Early stopping: 0/50 (BEST: 235.19)

->model saved<-
beta: 0.04
Epoch: 4/2000, Time elapsed: 23.49s
* Train loss: 45.96   (RE: 39.35, KL: 165.44)
o Val.  loss: 203.07   (RE: 39.54, KL: 163.53)
--> Early stopping: 0/50 (BEST: 214.69)

->model saved<-
beta: 0.05
Epoch: 5/2000, Time elapsed: 24.07s
* Train loss: 45.27   (RE: 37.55, KL: 154.32)
o Val.  loss: 188.03   (RE: 38.63, KL: 149.39)
--> Early stopping: 0/50 (BEST: 203.07)

->model saved<-
beta: 0.06
Epoch: 6/2000, Time elapsed: 23.38s
* Train loss: 44.98   (RE: 36.62, KL: 139.28)
o Val.  loss: 175.25   (RE: 38.01, KL: 137.24)
--> Early stopping: 0/50 (BEST: 188.03)

->model saved<-
beta: 0.07
Epoch: 7/2000, Time elapsed: 23.77s
* Train loss: 44.98   (RE: 35.70, KL: 132.63)
o Val.  loss: 169.12   (RE: 37.36, KL: 131.75)
--> Early stopping: 0/50 (BEST: 175.25)

->model saved<-
beta: 0.08
Epoch: 8/2000, Time elapsed: 23.65s
* Train loss: 45.23   (RE: 35.01, KL: 127.75)
o Val.  loss: 164.11   (RE: 36.90, KL: 127.21)
--> Early stopping: 0/50 (BEST: 169.12)

->model saved<-
beta: 0.09
Epoch: 9/2000, Time elapsed: 23.49s
* Train loss: 45.59   (RE: 34.49, KL: 123.35)
o Val.  loss: 160.63   (RE: 36.72, KL: 123.91)
--> Early stopping: 0/50 (BEST: 164.11)

->model saved<-
beta: 0.1
Epoch: 10/2000, Time elapsed: 23.28s
* Train loss: 46.10   (RE: 34.15, KL: 119.55)
o Val.  loss: 155.73   (RE: 36.84, KL: 118.89)
--> Early stopping: 0/50 (BEST: 160.63)

->model saved<-
beta: 0.11
Epoch: 11/2000, Time elapsed: 24.76s
* Train loss: 46.64   (RE: 33.86, KL: 116.10)
o Val.  loss: 152.35   (RE: 36.79, KL: 115.57)
--> Early stopping: 0/50 (BEST: 155.73)

->model saved<-
beta: 0.12
Epoch: 12/2000, Time elapsed: 23.90s
* Train loss: 47.22   (RE: 33.67, KL: 112.94)
o Val.  loss: 149.12   (RE: 36.94, KL: 112.18)
--> Early stopping: 0/50 (BEST: 152.35)

->model saved<-
beta: 0.13
Epoch: 13/2000, Time elapsed: 23.71s
* Train loss: 47.86   (RE: 33.56, KL: 110.02)
o Val.  loss: 146.28   (RE: 36.81, KL: 109.47)
--> Early stopping: 0/50 (BEST: 149.12)

->model saved<-
beta: 0.14
Epoch: 14/2000, Time elapsed: 23.32s
* Train loss: 48.51   (RE: 33.49, KL: 107.31)
o Val.  loss: 143.08   (RE: 37.01, KL: 106.06)
--> Early stopping: 0/50 (BEST: 146.28)

->model saved<-
beta: 0.15
Epoch: 15/2000, Time elapsed: 23.25s
* Train loss: 49.18   (RE: 33.46, KL: 104.82)
o Val.  loss: 140.98   (RE: 37.08, KL: 103.90)
--> Early stopping: 0/50 (BEST: 143.08)

->model saved<-
beta: 0.16
Epoch: 16/2000, Time elapsed: 24.01s
* Train loss: 49.87   (RE: 33.48, KL: 102.43)
o Val.  loss: 139.60   (RE: 37.19, KL: 102.41)
--> Early stopping: 0/50 (BEST: 140.98)

->model saved<-
beta: 0.17
Epoch: 17/2000, Time elapsed: 24.58s
* Train loss: 50.57   (RE: 33.53, KL: 100.28)
o Val.  loss: 137.51   (RE: 37.12, KL: 100.39)
--> Early stopping: 0/50 (BEST: 139.60)

->model saved<-
beta: 0.18
Epoch: 18/2000, Time elapsed: 23.82s
* Train loss: 51.26   (RE: 33.58, KL: 98.22)
o Val.  loss: 135.52   (RE: 37.53, KL: 97.99)
--> Early stopping: 0/50 (BEST: 137.51)

->model saved<-
beta: 0.19
Epoch: 19/2000, Time elapsed: 23.30s
* Train loss: 51.99   (RE: 33.71, KL: 96.17)
o Val.  loss: 134.32   (RE: 37.37, KL: 96.95)
--> Early stopping: 0/50 (BEST: 135.52)

->model saved<-
beta: 0.2
Epoch: 20/2000, Time elapsed: 24.14s
* Train loss: 52.66   (RE: 33.80, KL: 94.34)
o Val.  loss: 132.37   (RE: 37.66, KL: 94.71)
--> Early stopping: 0/50 (BEST: 134.32)

->model saved<-
beta: 0.21
Epoch: 21/2000, Time elapsed: 23.77s
* Train loss: 53.35   (RE: 33.92, KL: 92.56)
o Val.  loss: 130.39   (RE: 38.15, KL: 92.24)
--> Early stopping: 0/50 (BEST: 132.37)

->model saved<-
beta: 0.22
Epoch: 22/2000, Time elapsed: 23.06s
* Train loss: 54.05   (RE: 34.09, KL: 90.75)
o Val.  loss: 129.74   (RE: 38.15, KL: 91.59)
--> Early stopping: 0/50 (BEST: 130.39)

->model saved<-
beta: 0.23
Epoch: 23/2000, Time elapsed: 23.44s
* Train loss: 54.74   (RE: 34.24, KL: 89.14)
o Val.  loss: 128.44   (RE: 38.22, KL: 90.22)
--> Early stopping: 0/50 (BEST: 129.74)

->model saved<-
beta: 0.24
Epoch: 24/2000, Time elapsed: 23.54s
* Train loss: 55.44   (RE: 34.42, KL: 87.58)
o Val.  loss: 126.61   (RE: 38.51, KL: 88.09)
--> Early stopping: 0/50 (BEST: 128.44)

->model saved<-
beta: 0.25
Epoch: 25/2000, Time elapsed: 23.57s
* Train loss: 56.11   (RE: 34.60, KL: 86.04)
o Val.  loss: 124.99   (RE: 38.95, KL: 86.03)
--> Early stopping: 0/50 (BEST: 126.61)

->model saved<-
beta: 0.26
Epoch: 26/2000, Time elapsed: 23.74s
* Train loss: 56.77   (RE: 34.79, KL: 84.55)
o Val.  loss: 123.76   (RE: 38.98, KL: 84.79)
--> Early stopping: 0/50 (BEST: 124.99)

->model saved<-
beta: 0.27
Epoch: 27/2000, Time elapsed: 24.36s
* Train loss: 57.43   (RE: 34.99, KL: 83.14)
o Val.  loss: 123.26   (RE: 39.19, KL: 84.07)
--> Early stopping: 0/50 (BEST: 123.76)

->model saved<-
beta: 0.28
Epoch: 28/2000, Time elapsed: 23.82s
* Train loss: 58.10   (RE: 35.20, KL: 81.78)
o Val.  loss: 122.22   (RE: 39.49, KL: 82.73)
--> Early stopping: 0/50 (BEST: 123.26)

->model saved<-
beta: 0.29
Epoch: 29/2000, Time elapsed: 23.56s
* Train loss: 58.75   (RE: 35.43, KL: 80.43)
o Val.  loss: 121.11   (RE: 39.76, KL: 81.35)
--> Early stopping: 0/50 (BEST: 122.22)

->model saved<-
beta: 0.3
Epoch: 30/2000, Time elapsed: 22.98s
* Train loss: 59.42   (RE: 35.66, KL: 79.20)
o Val.  loss: 119.56   (RE: 40.15, KL: 79.40)
--> Early stopping: 0/50 (BEST: 121.11)

->model saved<-
beta: 0.31
Epoch: 31/2000, Time elapsed: 23.19s
* Train loss: 60.03   (RE: 35.88, KL: 77.91)
o Val.  loss: 119.31   (RE: 40.18, KL: 79.14)
--> Early stopping: 0/50 (BEST: 119.56)

->model saved<-
beta: 0.32
Epoch: 32/2000, Time elapsed: 24.39s
* Train loss: 60.70   (RE: 36.13, KL: 76.76)
o Val.  loss: 117.85   (RE: 40.50, KL: 77.36)
--> Early stopping: 0/50 (BEST: 119.31)

->model saved<-
beta: 0.33
Epoch: 33/2000, Time elapsed: 23.74s
* Train loss: 61.31   (RE: 36.39, KL: 75.51)
o Val.  loss: 117.32   (RE: 40.75, KL: 76.57)
--> Early stopping: 0/50 (BEST: 117.85)

->model saved<-
beta: 0.34
Epoch: 34/2000, Time elapsed: 24.06s
* Train loss: 61.95   (RE: 36.64, KL: 74.45)
o Val.  loss: 116.26   (RE: 41.01, KL: 75.25)
--> Early stopping: 0/50 (BEST: 117.32)

->model saved<-
beta: 0.35
Epoch: 35/2000, Time elapsed: 23.85s
* Train loss: 62.53   (RE: 36.88, KL: 73.28)
o Val.  loss: 115.50   (RE: 41.28, KL: 74.22)
--> Early stopping: 0/50 (BEST: 116.26)

->model saved<-
beta: 0.36
Epoch: 36/2000, Time elapsed: 24.12s
* Train loss: 63.17   (RE: 37.17, KL: 72.22)
o Val.  loss: 115.23   (RE: 41.32, KL: 73.91)
--> Early stopping: 0/50 (BEST: 115.50)

->model saved<-
beta: 0.37
Epoch: 37/2000, Time elapsed: 23.44s
* Train loss: 63.76   (RE: 37.41, KL: 71.21)
o Val.  loss: 113.92   (RE: 41.99, KL: 71.93)
--> Early stopping: 0/50 (BEST: 115.23)

->model saved<-
beta: 0.38
Epoch: 38/2000, Time elapsed: 23.85s
* Train loss: 64.37   (RE: 37.70, KL: 70.19)
o Val.  loss: 113.32   (RE: 41.94, KL: 71.38)
--> Early stopping: 0/50 (BEST: 113.92)

->model saved<-
beta: 0.39
Epoch: 39/2000, Time elapsed: 23.64s
* Train loss: 64.96   (RE: 37.97, KL: 69.22)
o Val.  loss: 112.19   (RE: 42.54, KL: 69.65)
--> Early stopping: 0/50 (BEST: 113.32)

->model saved<-
beta: 0.4
Epoch: 40/2000, Time elapsed: 23.56s
* Train loss: 65.56   (RE: 38.27, KL: 68.23)
o Val.  loss: 111.78   (RE: 42.67, KL: 69.11)
--> Early stopping: 0/50 (BEST: 112.19)

->model saved<-
beta: 0.41
Epoch: 41/2000, Time elapsed: 23.51s
* Train loss: 66.14   (RE: 38.55, KL: 67.29)
o Val.  loss: 110.84   (RE: 43.10, KL: 67.74)
--> Early stopping: 0/50 (BEST: 111.78)

->model saved<-
beta: 0.42
Epoch: 42/2000, Time elapsed: 23.06s
* Train loss: 66.71   (RE: 38.84, KL: 66.35)
o Val.  loss: 110.33   (RE: 43.53, KL: 66.80)
--> Early stopping: 0/50 (BEST: 110.84)

->model saved<-
beta: 0.43
Epoch: 43/2000, Time elapsed: 24.66s
* Train loss: 67.28   (RE: 39.14, KL: 65.44)
o Val.  loss: 109.96   (RE: 43.33, KL: 66.63)
--> Early stopping: 0/50 (BEST: 110.33)

->model saved<-
beta: 0.44
Epoch: 44/2000, Time elapsed: 23.59s
* Train loss: 67.85   (RE: 39.43, KL: 64.60)
o Val.  loss: 109.35   (RE: 43.69, KL: 65.65)
--> Early stopping: 0/50 (BEST: 109.96)

->model saved<-
beta: 0.45
Epoch: 45/2000, Time elapsed: 23.61s
* Train loss: 68.37   (RE: 39.71, KL: 63.68)
o Val.  loss: 108.71   (RE: 43.81, KL: 64.89)
--> Early stopping: 0/50 (BEST: 109.35)

->model saved<-
beta: 0.46
Epoch: 46/2000, Time elapsed: 24.40s
* Train loss: 68.95   (RE: 40.04, KL: 62.84)
o Val.  loss: 107.90   (RE: 44.49, KL: 63.41)
--> Early stopping: 0/50 (BEST: 108.71)

->model saved<-
beta: 0.47
Epoch: 47/2000, Time elapsed: 24.11s
* Train loss: 69.51   (RE: 40.34, KL: 62.06)
o Val.  loss: 107.47   (RE: 44.81, KL: 62.66)
--> Early stopping: 0/50 (BEST: 107.90)

->model saved<-
beta: 0.48
Epoch: 48/2000, Time elapsed: 24.97s
* Train loss: 70.01   (RE: 40.62, KL: 61.24)
o Val.  loss: 106.99   (RE: 44.93, KL: 62.06)
--> Early stopping: 0/50 (BEST: 107.47)

->model saved<-
beta: 0.49
Epoch: 49/2000, Time elapsed: 24.62s
* Train loss: 70.53   (RE: 40.92, KL: 60.43)
o Val.  loss: 106.77   (RE: 45.20, KL: 61.56)
--> Early stopping: 0/50 (BEST: 106.99)

->model saved<-
beta: 0.5
Epoch: 50/2000, Time elapsed: 24.51s
* Train loss: 71.08   (RE: 41.25, KL: 59.65)
o Val.  loss: 106.19   (RE: 45.62, KL: 60.57)
--> Early stopping: 0/50 (BEST: 106.77)

->model saved<-
beta: 0.51
Epoch: 51/2000, Time elapsed: 25.16s
* Train loss: 71.57   (RE: 41.55, KL: 58.88)
o Val.  loss: 105.70   (RE: 45.84, KL: 59.86)
--> Early stopping: 0/50 (BEST: 106.19)

->model saved<-
beta: 0.52
Epoch: 52/2000, Time elapsed: 24.95s
* Train loss: 72.09   (RE: 41.84, KL: 58.17)
o Val.  loss: 104.94   (RE: 46.09, KL: 58.85)
--> Early stopping: 0/50 (BEST: 105.70)

->model saved<-
beta: 0.53
Epoch: 53/2000, Time elapsed: 24.86s
* Train loss: 72.60   (RE: 42.13, KL: 57.49)
o Val.  loss: 104.53   (RE: 46.90, KL: 57.62)
--> Early stopping: 0/50 (BEST: 104.94)

->model saved<-
beta: 0.54
Epoch: 54/2000, Time elapsed: 24.55s
* Train loss: 73.08   (RE: 42.48, KL: 56.66)
o Val.  loss: 104.10   (RE: 46.98, KL: 57.12)
--> Early stopping: 0/50 (BEST: 104.53)

->model saved<-
beta: 0.55
Epoch: 55/2000, Time elapsed: 24.41s
* Train loss: 73.59   (RE: 42.77, KL: 56.03)
o Val.  loss: 103.98   (RE: 47.00, KL: 56.98)
--> Early stopping: 0/50 (BEST: 104.10)

->model saved<-
beta: 0.56
Epoch: 56/2000, Time elapsed: 22.53s
* Train loss: 74.06   (RE: 43.10, KL: 55.29)
o Val.  loss: 103.42   (RE: 47.49, KL: 55.93)
--> Early stopping: 0/50 (BEST: 103.98)

->model saved<-
beta: 0.57
Epoch: 57/2000, Time elapsed: 23.75s
* Train loss: 74.55   (RE: 43.43, KL: 54.59)
o Val.  loss: 102.87   (RE: 47.77, KL: 55.10)
--> Early stopping: 0/50 (BEST: 103.42)

->model saved<-
beta: 0.58
Epoch: 58/2000, Time elapsed: 24.48s
* Train loss: 75.03   (RE: 43.75, KL: 53.94)
o Val.  loss: 102.76   (RE: 47.81, KL: 54.95)
--> Early stopping: 0/50 (BEST: 102.87)

->model saved<-
beta: 0.59
Epoch: 59/2000, Time elapsed: 24.56s
* Train loss: 75.49   (RE: 44.08, KL: 53.24)
o Val.  loss: 102.57   (RE: 48.30, KL: 54.27)
--> Early stopping: 0/50 (BEST: 102.76)

->model saved<-
beta: 0.6
Epoch: 60/2000, Time elapsed: 24.30s
* Train loss: 75.97   (RE: 44.38, KL: 52.65)
o Val.  loss: 102.13   (RE: 48.48, KL: 53.65)
--> Early stopping: 0/50 (BEST: 102.57)

->model saved<-
beta: 0.61
Epoch: 61/2000, Time elapsed: 23.71s
* Train loss: 76.41   (RE: 44.71, KL: 51.97)
o Val.  loss: 101.74   (RE: 48.68, KL: 53.06)
--> Early stopping: 0/50 (BEST: 102.13)

->model saved<-
beta: 0.62
Epoch: 62/2000, Time elapsed: 24.47s
* Train loss: 76.89   (RE: 45.04, KL: 51.37)
o Val.  loss: 101.22   (RE: 49.62, KL: 51.60)
--> Early stopping: 0/50 (BEST: 101.74)

->model saved<-
beta: 0.63
Epoch: 63/2000, Time elapsed: 23.98s
* Train loss: 77.35   (RE: 45.40, KL: 50.72)
o Val.  loss: 101.19   (RE: 49.49, KL: 51.69)
--> Early stopping: 0/50 (BEST: 101.22)

->model saved<-
beta: 0.64
Epoch: 64/2000, Time elapsed: 23.65s
* Train loss: 77.79   (RE: 45.71, KL: 50.13)
o Val.  loss: 100.61   (RE: 50.01, KL: 50.60)
--> Early stopping: 0/50 (BEST: 101.19)

->model saved<-
beta: 0.65
Epoch: 65/2000, Time elapsed: 23.99s
* Train loss: 78.19   (RE: 46.00, KL: 49.52)
o Val.  loss: 100.33   (RE: 50.28, KL: 50.04)
--> Early stopping: 0/50 (BEST: 100.61)

->model saved<-
beta: 0.66
Epoch: 66/2000, Time elapsed: 24.45s
* Train loss: 78.65   (RE: 46.35, KL: 48.94)
o Val.  loss: 100.26   (RE: 50.54, KL: 49.71)
--> Early stopping: 0/50 (BEST: 100.33)

->model saved<-
beta: 0.67
Epoch: 67/2000, Time elapsed: 24.16s
* Train loss: 79.08   (RE: 46.67, KL: 48.37)
o Val.  loss: 99.75   (RE: 50.97, KL: 48.78)
--> Early stopping: 0/50 (BEST: 100.26)

->model saved<-
beta: 0.68
Epoch: 68/2000, Time elapsed: 24.04s
* Train loss: 79.45   (RE: 46.97, KL: 47.77)
o Val.  loss: 99.72   (RE: 50.93, KL: 48.79)
--> Early stopping: 0/50 (BEST: 99.75)

->model saved<-
beta: 0.69
Epoch: 69/2000, Time elapsed: 24.24s
* Train loss: 79.90   (RE: 47.29, KL: 47.26)
o Val.  loss: 99.63   (RE: 51.13, KL: 48.49)
--> Early stopping: 0/50 (BEST: 99.72)

->model saved<-
beta: 0.7
Epoch: 70/2000, Time elapsed: 23.82s
* Train loss: 80.28   (RE: 47.63, KL: 46.65)
o Val.  loss: 99.00   (RE: 51.81, KL: 47.19)
--> Early stopping: 0/50 (BEST: 99.63)

->model saved<-
beta: 0.71
Epoch: 71/2000, Time elapsed: 24.56s
* Train loss: 80.75   (RE: 48.00, KL: 46.13)
o Val.  loss: 98.69   (RE: 52.20, KL: 46.49)
--> Early stopping: 0/50 (BEST: 99.00)

->model saved<-
beta: 0.72
Epoch: 72/2000, Time elapsed: 23.65s
* Train loss: 81.11   (RE: 48.28, KL: 45.60)
o Val.  loss: 98.67   (RE: 52.44, KL: 46.23)
--> Early stopping: 0/50 (BEST: 98.69)

->model saved<-
beta: 0.73
Epoch: 73/2000, Time elapsed: 22.73s
* Train loss: 81.55   (RE: 48.64, KL: 45.08)
o Val.  loss: 98.35   (RE: 52.51, KL: 45.84)
--> Early stopping: 0/50 (BEST: 98.67)

->model saved<-
beta: 0.74
Epoch: 74/2000, Time elapsed: 24.07s
* Train loss: 81.88   (RE: 48.92, KL: 44.55)
o Val.  loss: 98.21   (RE: 53.12, KL: 45.08)
--> Early stopping: 0/50 (BEST: 98.35)

->model saved<-
beta: 0.75
Epoch: 75/2000, Time elapsed: 24.83s
* Train loss: 82.30   (RE: 49.28, KL: 44.03)
o Val.  loss: 97.88   (RE: 53.36, KL: 44.51)
--> Early stopping: 0/50 (BEST: 98.21)

->model saved<-
beta: 0.76
Epoch: 76/2000, Time elapsed: 24.49s
* Train loss: 82.68   (RE: 49.60, KL: 43.53)
o Val.  loss: 97.79   (RE: 53.74, KL: 44.05)
--> Early stopping: 0/50 (BEST: 97.88)

->model saved<-
beta: 0.77
Epoch: 77/2000, Time elapsed: 24.41s
* Train loss: 83.06   (RE: 49.92, KL: 43.05)
o Val.  loss: 97.30   (RE: 54.35, KL: 42.95)
--> Early stopping: 0/50 (BEST: 97.79)

->model saved<-
beta: 0.78
Epoch: 78/2000, Time elapsed: 24.01s
* Train loss: 83.43   (RE: 50.27, KL: 42.52)
o Val.  loss: 97.30   (RE: 54.39, KL: 42.91)
--> Early stopping: 0/50 (BEST: 97.30)

beta: 0.79
Epoch: 79/2000, Time elapsed: 22.75s
* Train loss: 83.81   (RE: 50.57, KL: 42.07)
o Val.  loss: 97.14   (RE: 54.46, KL: 42.67)
--> Early stopping: 0/50 (BEST: 97.30)

->model saved<-
beta: 0.8
Epoch: 80/2000, Time elapsed: 24.37s
* Train loss: 84.17   (RE: 50.89, KL: 41.60)
o Val.  loss: 97.40   (RE: 54.51, KL: 42.90)
--> Early stopping: 0/50 (BEST: 97.14)

beta: 0.81
Epoch: 81/2000, Time elapsed: 23.18s
* Train loss: 84.54   (RE: 51.21, KL: 41.14)
o Val.  loss: 96.86   (RE: 55.22, KL: 41.63)
--> Early stopping: 0/50 (BEST: 97.14)

->model saved<-
beta: 0.82
Epoch: 82/2000, Time elapsed: 23.66s
* Train loss: 84.88   (RE: 51.52, KL: 40.68)
o Val.  loss: 96.65   (RE: 55.59, KL: 41.06)
--> Early stopping: 0/50 (BEST: 96.86)

->model saved<-
beta: 0.83
Epoch: 83/2000, Time elapsed: 23.63s
* Train loss: 85.22   (RE: 51.87, KL: 40.17)
o Val.  loss: 96.41   (RE: 56.06, KL: 40.35)
--> Early stopping: 0/50 (BEST: 96.65)

->model saved<-
beta: 0.84
Epoch: 84/2000, Time elapsed: 23.66s
* Train loss: 85.61   (RE: 52.22, KL: 39.75)
o Val.  loss: 96.45   (RE: 55.99, KL: 40.45)
--> Early stopping: 0/50 (BEST: 96.41)

beta: 0.85
Epoch: 85/2000, Time elapsed: 24.71s
* Train loss: 85.94   (RE: 52.52, KL: 39.32)
o Val.  loss: 96.20   (RE: 56.50, KL: 39.71)
--> Early stopping: 0/50 (BEST: 96.41)

->model saved<-
beta: 0.86
Epoch: 86/2000, Time elapsed: 24.42s
* Train loss: 86.29   (RE: 52.86, KL: 38.87)
o Val.  loss: 96.24   (RE: 56.53, KL: 39.70)
--> Early stopping: 0/50 (BEST: 96.20)

beta: 0.87
Epoch: 87/2000, Time elapsed: 24.04s
* Train loss: 86.59   (RE: 53.14, KL: 38.45)
o Val.  loss: 95.93   (RE: 56.71, KL: 39.22)
--> Early stopping: 0/50 (BEST: 96.20)

->model saved<-
beta: 0.88
Epoch: 88/2000, Time elapsed: 24.51s
* Train loss: 86.92   (RE: 53.48, KL: 38.00)
o Val.  loss: 95.75   (RE: 56.93, KL: 38.82)
--> Early stopping: 0/50 (BEST: 95.93)

->model saved<-
beta: 0.89
Epoch: 89/2000, Time elapsed: 23.87s
* Train loss: 87.25   (RE: 53.78, KL: 37.60)
o Val.  loss: 95.51   (RE: 57.71, KL: 37.80)
--> Early stopping: 0/50 (BEST: 95.75)

->model saved<-
beta: 0.9
Epoch: 90/2000, Time elapsed: 24.37s
* Train loss: 87.55   (RE: 54.09, KL: 37.18)
o Val.  loss: 95.54   (RE: 57.95, KL: 37.59)
--> Early stopping: 0/50 (BEST: 95.51)

beta: 0.91
Epoch: 91/2000, Time elapsed: 25.54s
* Train loss: 87.88   (RE: 54.43, KL: 36.75)
o Val.  loss: 95.38   (RE: 57.84, KL: 37.54)
--> Early stopping: 0/50 (BEST: 95.51)

->model saved<-
beta: 0.92
Epoch: 92/2000, Time elapsed: 24.41s
* Train loss: 88.18   (RE: 54.71, KL: 36.38)
o Val.  loss: 95.38   (RE: 58.21, KL: 37.17)
--> Early stopping: 0/50 (BEST: 95.38)

beta: 0.93
Epoch: 93/2000, Time elapsed: 24.74s
* Train loss: 88.50   (RE: 55.03, KL: 35.99)
o Val.  loss: 95.20   (RE: 58.31, KL: 36.89)
--> Early stopping: 0/50 (BEST: 95.38)

->model saved<-
beta: 0.94
Epoch: 94/2000, Time elapsed: 24.26s
* Train loss: 88.80   (RE: 55.33, KL: 35.61)
o Val.  loss: 94.95   (RE: 58.91, KL: 36.04)
--> Early stopping: 0/50 (BEST: 95.20)

->model saved<-
beta: 0.95
Epoch: 95/2000, Time elapsed: 24.51s
* Train loss: 89.06   (RE: 55.59, KL: 35.23)
o Val.  loss: 94.96   (RE: 59.14, KL: 35.82)
--> Early stopping: 0/50 (BEST: 94.95)

beta: 0.96
Epoch: 96/2000, Time elapsed: 25.10s
* Train loss: 89.37   (RE: 55.89, KL: 34.87)
o Val.  loss: 94.86   (RE: 59.58, KL: 35.28)
--> Early stopping: 0/50 (BEST: 94.95)

->model saved<-
beta: 0.97
Epoch: 97/2000, Time elapsed: 24.35s
* Train loss: 89.63   (RE: 56.18, KL: 34.48)
o Val.  loss: 94.56   (RE: 59.83, KL: 34.72)
--> Early stopping: 0/50 (BEST: 94.86)

->model saved<-
beta: 0.98
Epoch: 98/2000, Time elapsed: 24.79s
* Train loss: 89.95   (RE: 56.51, KL: 34.12)
o Val.  loss: 94.58   (RE: 59.90, KL: 34.68)
--> Early stopping: 0/50 (BEST: 94.56)

beta: 0.99
Epoch: 99/2000, Time elapsed: 24.52s
* Train loss: 90.27   (RE: 56.82, KL: 33.79)
o Val.  loss: 94.60   (RE: 60.53, KL: 34.07)
--> Early stopping: 0/50 (BEST: 94.56)

beta: 1.0
Epoch: 100/2000, Time elapsed: 24.93s
* Train loss: 90.53   (RE: 57.08, KL: 33.45)
o Val.  loss: 94.36   (RE: 60.40, KL: 33.96)
--> Early stopping: 0/50 (BEST: 94.56)

->model saved<-
beta: 1.0
Epoch: 101/2000, Time elapsed: 25.10s
* Train loss: 90.45   (RE: 57.19, KL: 33.26)
o Val.  loss: 94.28   (RE: 60.18, KL: 34.10)
--> Early stopping: 0/50 (BEST: 94.36)

->model saved<-
beta: 1.0
Epoch: 102/2000, Time elapsed: 24.40s
* Train loss: 90.37   (RE: 57.24, KL: 33.12)
o Val.  loss: 94.42   (RE: 60.86, KL: 33.56)
--> Early stopping: 0/50 (BEST: 94.28)

beta: 1.0
Epoch: 103/2000, Time elapsed: 23.54s
* Train loss: 90.33   (RE: 57.32, KL: 33.01)
o Val.  loss: 94.32   (RE: 60.74, KL: 33.58)
--> Early stopping: 1/50 (BEST: 94.28)

beta: 1.0
Epoch: 104/2000, Time elapsed: 24.41s
* Train loss: 90.29   (RE: 57.39, KL: 32.90)
o Val.  loss: 94.20   (RE: 60.98, KL: 33.23)
--> Early stopping: 2/50 (BEST: 94.28)

->model saved<-
beta: 1.0
Epoch: 105/2000, Time elapsed: 23.89s
* Train loss: 90.19   (RE: 57.40, KL: 32.79)
o Val.  loss: 94.26   (RE: 60.82, KL: 33.44)
--> Early stopping: 0/50 (BEST: 94.20)

beta: 1.0
Epoch: 106/2000, Time elapsed: 23.87s
* Train loss: 90.15   (RE: 57.43, KL: 32.72)
o Val.  loss: 94.08   (RE: 60.93, KL: 33.16)
--> Early stopping: 1/50 (BEST: 94.20)

->model saved<-
beta: 1.0
Epoch: 107/2000, Time elapsed: 20.74s
* Train loss: 90.10   (RE: 57.49, KL: 32.61)
o Val.  loss: 94.06   (RE: 60.68, KL: 33.38)
--> Early stopping: 0/50 (BEST: 94.08)

->model saved<-
beta: 1.0
Epoch: 108/2000, Time elapsed: 23.48s
* Train loss: 90.04   (RE: 57.50, KL: 32.54)
o Val.  loss: 94.11   (RE: 60.79, KL: 33.33)
--> Early stopping: 0/50 (BEST: 94.06)

beta: 1.0
Epoch: 109/2000, Time elapsed: 22.24s
* Train loss: 89.97   (RE: 57.49, KL: 32.48)
o Val.  loss: 94.01   (RE: 60.55, KL: 33.45)
--> Early stopping: 1/50 (BEST: 94.06)

->model saved<-
beta: 1.0
Epoch: 110/2000, Time elapsed: 23.29s
* Train loss: 89.93   (RE: 57.55, KL: 32.38)
o Val.  loss: 93.86   (RE: 60.61, KL: 33.24)
--> Early stopping: 0/50 (BEST: 94.01)

->model saved<-
beta: 1.0
Epoch: 111/2000, Time elapsed: 24.59s
* Train loss: 89.87   (RE: 57.56, KL: 32.32)
o Val.  loss: 93.84   (RE: 61.05, KL: 32.79)
--> Early stopping: 0/50 (BEST: 93.86)

->model saved<-
beta: 1.0
Epoch: 112/2000, Time elapsed: 24.77s
* Train loss: 89.81   (RE: 57.58, KL: 32.23)
o Val.  loss: 94.02   (RE: 61.08, KL: 32.94)
--> Early stopping: 0/50 (BEST: 93.84)

beta: 1.0
Epoch: 113/2000, Time elapsed: 24.61s
* Train loss: 89.75   (RE: 57.56, KL: 32.19)
o Val.  loss: 93.79   (RE: 60.77, KL: 33.02)
--> Early stopping: 1/50 (BEST: 93.84)

->model saved<-
beta: 1.0
Epoch: 114/2000, Time elapsed: 23.92s
* Train loss: 89.69   (RE: 57.59, KL: 32.10)
o Val.  loss: 93.78   (RE: 61.07, KL: 32.70)
--> Early stopping: 0/50 (BEST: 93.79)

->model saved<-
beta: 1.0
Epoch: 115/2000, Time elapsed: 23.87s
* Train loss: 89.67   (RE: 57.63, KL: 32.04)
o Val.  loss: 93.68   (RE: 60.92, KL: 32.76)
--> Early stopping: 0/50 (BEST: 93.78)

->model saved<-
beta: 1.0
Epoch: 116/2000, Time elapsed: 24.64s
* Train loss: 89.57   (RE: 57.57, KL: 32.00)
o Val.  loss: 93.77   (RE: 61.31, KL: 32.46)
--> Early stopping: 0/50 (BEST: 93.68)

beta: 1.0
Epoch: 117/2000, Time elapsed: 21.65s
* Train loss: 89.51   (RE: 57.59, KL: 31.92)
o Val.  loss: 93.58   (RE: 61.09, KL: 32.49)
--> Early stopping: 1/50 (BEST: 93.68)

->model saved<-
beta: 1.0
Epoch: 118/2000, Time elapsed: 24.05s
* Train loss: 89.48   (RE: 57.59, KL: 31.88)
o Val.  loss: 93.43   (RE: 61.16, KL: 32.27)
--> Early stopping: 0/50 (BEST: 93.58)

->model saved<-
beta: 1.0
Epoch: 119/2000, Time elapsed: 23.26s
* Train loss: 89.44   (RE: 57.61, KL: 31.83)
o Val.  loss: 93.46   (RE: 61.20, KL: 32.26)
--> Early stopping: 0/50 (BEST: 93.43)

beta: 1.0
Epoch: 120/2000, Time elapsed: 23.62s
* Train loss: 89.37   (RE: 57.59, KL: 31.78)
o Val.  loss: 93.47   (RE: 61.23, KL: 32.24)
--> Early stopping: 1/50 (BEST: 93.43)

beta: 1.0
Epoch: 121/2000, Time elapsed: 23.99s
* Train loss: 89.35   (RE: 57.59, KL: 31.76)
o Val.  loss: 93.40   (RE: 61.04, KL: 32.35)
--> Early stopping: 2/50 (BEST: 93.43)

->model saved<-
beta: 1.0
Epoch: 122/2000, Time elapsed: 22.82s
* Train loss: 89.29   (RE: 57.61, KL: 31.68)
o Val.  loss: 93.50   (RE: 61.28, KL: 32.22)
--> Early stopping: 0/50 (BEST: 93.40)

beta: 1.0
Epoch: 123/2000, Time elapsed: 23.24s
* Train loss: 89.23   (RE: 57.61, KL: 31.62)
o Val.  loss: 93.38   (RE: 61.08, KL: 32.31)
--> Early stopping: 1/50 (BEST: 93.40)

->model saved<-
beta: 1.0
Epoch: 124/2000, Time elapsed: 22.63s
* Train loss: 89.16   (RE: 57.59, KL: 31.57)
o Val.  loss: 93.25   (RE: 60.94, KL: 32.32)
--> Early stopping: 0/50 (BEST: 93.38)

->model saved<-
beta: 1.0
Epoch: 125/2000, Time elapsed: 24.37s
* Train loss: 89.13   (RE: 57.59, KL: 31.54)
o Val.  loss: 93.24   (RE: 61.20, KL: 32.03)
--> Early stopping: 0/50 (BEST: 93.25)

->model saved<-
beta: 1.0
Epoch: 126/2000, Time elapsed: 23.89s
* Train loss: 89.06   (RE: 57.58, KL: 31.48)
o Val.  loss: 93.24   (RE: 61.13, KL: 32.11)
--> Early stopping: 0/50 (BEST: 93.24)

beta: 1.0
Epoch: 127/2000, Time elapsed: 23.67s
* Train loss: 89.02   (RE: 57.58, KL: 31.44)
o Val.  loss: 93.20   (RE: 61.20, KL: 32.01)
--> Early stopping: 1/50 (BEST: 93.24)

->model saved<-
beta: 1.0
Epoch: 128/2000, Time elapsed: 22.99s
* Train loss: 88.96   (RE: 57.57, KL: 31.39)
o Val.  loss: 93.24   (RE: 61.30, KL: 31.94)
--> Early stopping: 0/50 (BEST: 93.20)

beta: 1.0
Epoch: 129/2000, Time elapsed: 23.70s
* Train loss: 88.93   (RE: 57.56, KL: 31.37)
o Val.  loss: 93.07   (RE: 61.34, KL: 31.73)
--> Early stopping: 1/50 (BEST: 93.20)

->model saved<-
beta: 1.0
Epoch: 130/2000, Time elapsed: 23.48s
* Train loss: 88.87   (RE: 57.56, KL: 31.31)
o Val.  loss: 93.09   (RE: 61.01, KL: 32.08)
--> Early stopping: 0/50 (BEST: 93.07)

beta: 1.0
Epoch: 131/2000, Time elapsed: 23.94s
* Train loss: 88.85   (RE: 57.58, KL: 31.27)
o Val.  loss: 93.09   (RE: 61.28, KL: 31.81)
--> Early stopping: 1/50 (BEST: 93.07)

beta: 1.0
Epoch: 132/2000, Time elapsed: 24.01s
* Train loss: 88.80   (RE: 57.55, KL: 31.25)
o Val.  loss: 93.10   (RE: 61.34, KL: 31.76)
--> Early stopping: 2/50 (BEST: 93.07)

beta: 1.0
Epoch: 133/2000, Time elapsed: 23.62s
* Train loss: 88.73   (RE: 57.55, KL: 31.18)
o Val.  loss: 93.14   (RE: 61.08, KL: 32.06)
--> Early stopping: 3/50 (BEST: 93.07)

beta: 1.0
Epoch: 134/2000, Time elapsed: 23.75s
* Train loss: 88.70   (RE: 57.52, KL: 31.18)
o Val.  loss: 92.89   (RE: 61.51, KL: 31.38)
--> Early stopping: 4/50 (BEST: 93.07)

->model saved<-
beta: 1.0
Epoch: 135/2000, Time elapsed: 23.89s
* Train loss: 88.64   (RE: 57.53, KL: 31.11)
o Val.  loss: 92.91   (RE: 61.17, KL: 31.74)
--> Early stopping: 0/50 (BEST: 92.89)

beta: 1.0
Epoch: 136/2000, Time elapsed: 23.15s
* Train loss: 88.61   (RE: 57.53, KL: 31.08)
o Val.  loss: 93.00   (RE: 61.50, KL: 31.50)
--> Early stopping: 1/50 (BEST: 92.89)

beta: 1.0
Epoch: 137/2000, Time elapsed: 24.32s
* Train loss: 88.60   (RE: 57.51, KL: 31.09)
o Val.  loss: 92.84   (RE: 61.14, KL: 31.70)
--> Early stopping: 2/50 (BEST: 92.89)

->model saved<-
beta: 1.0
Epoch: 138/2000, Time elapsed: 24.01s
* Train loss: 88.55   (RE: 57.52, KL: 31.03)
o Val.  loss: 92.89   (RE: 61.23, KL: 31.66)
--> Early stopping: 0/50 (BEST: 92.84)

beta: 1.0
Epoch: 139/2000, Time elapsed: 24.74s
* Train loss: 88.47   (RE: 57.48, KL: 30.99)
o Val.  loss: 92.87   (RE: 61.55, KL: 31.32)
--> Early stopping: 1/50 (BEST: 92.84)

beta: 1.0
Epoch: 140/2000, Time elapsed: 24.86s
* Train loss: 88.45   (RE: 57.51, KL: 30.95)
o Val.  loss: 92.81   (RE: 61.38, KL: 31.43)
--> Early stopping: 2/50 (BEST: 92.84)

->model saved<-
beta: 1.0
Epoch: 141/2000, Time elapsed: 23.09s
* Train loss: 88.42   (RE: 57.48, KL: 30.94)
o Val.  loss: 92.78   (RE: 61.32, KL: 31.45)
--> Early stopping: 0/50 (BEST: 92.81)

->model saved<-
beta: 1.0
Epoch: 142/2000, Time elapsed: 22.66s
* Train loss: 88.35   (RE: 57.45, KL: 30.90)
o Val.  loss: 92.76   (RE: 61.30, KL: 31.45)
--> Early stopping: 0/50 (BEST: 92.78)

->model saved<-
beta: 1.0
Epoch: 143/2000, Time elapsed: 22.69s
* Train loss: 88.33   (RE: 57.41, KL: 30.92)
o Val.  loss: 92.72   (RE: 61.68, KL: 31.04)
--> Early stopping: 0/50 (BEST: 92.76)

->model saved<-
beta: 1.0
Epoch: 144/2000, Time elapsed: 23.26s
* Train loss: 88.29   (RE: 57.44, KL: 30.85)
o Val.  loss: 92.82   (RE: 61.30, KL: 31.52)
--> Early stopping: 0/50 (BEST: 92.72)

beta: 1.0
Epoch: 145/2000, Time elapsed: 22.88s
* Train loss: 88.26   (RE: 57.42, KL: 30.84)
o Val.  loss: 92.70   (RE: 60.97, KL: 31.73)
--> Early stopping: 1/50 (BEST: 92.72)

->model saved<-
beta: 1.0
Epoch: 146/2000, Time elapsed: 21.64s
* Train loss: 88.21   (RE: 57.43, KL: 30.79)
o Val.  loss: 92.66   (RE: 61.41, KL: 31.25)
--> Early stopping: 0/50 (BEST: 92.70)

->model saved<-
beta: 1.0
Epoch: 147/2000, Time elapsed: 22.33s
* Train loss: 88.19   (RE: 57.42, KL: 30.78)
o Val.  loss: 92.66   (RE: 61.10, KL: 31.56)
--> Early stopping: 0/50 (BEST: 92.66)

->model saved<-
beta: 1.0
Epoch: 148/2000, Time elapsed: 22.45s
* Train loss: 88.18   (RE: 57.40, KL: 30.77)
o Val.  loss: 92.53   (RE: 61.29, KL: 31.24)
--> Early stopping: 0/50 (BEST: 92.66)

->model saved<-
beta: 1.0
Epoch: 149/2000, Time elapsed: 22.63s
* Train loss: 88.10   (RE: 57.38, KL: 30.72)
o Val.  loss: 92.62   (RE: 61.30, KL: 31.32)
--> Early stopping: 0/50 (BEST: 92.53)

beta: 1.0
Epoch: 150/2000, Time elapsed: 22.17s
* Train loss: 88.06   (RE: 57.37, KL: 30.69)
o Val.  loss: 92.60   (RE: 61.26, KL: 31.34)
--> Early stopping: 1/50 (BEST: 92.53)

beta: 1.0
Epoch: 151/2000, Time elapsed: 22.37s
* Train loss: 88.00   (RE: 57.34, KL: 30.65)
o Val.  loss: 92.47   (RE: 61.47, KL: 31.00)
--> Early stopping: 2/50 (BEST: 92.53)

->model saved<-
beta: 1.0
Epoch: 152/2000, Time elapsed: 22.83s
* Train loss: 87.96   (RE: 57.32, KL: 30.64)
o Val.  loss: 92.53   (RE: 61.41, KL: 31.12)
--> Early stopping: 0/50 (BEST: 92.47)

beta: 1.0
Epoch: 153/2000, Time elapsed: 22.38s
* Train loss: 87.96   (RE: 57.33, KL: 30.63)
o Val.  loss: 92.63   (RE: 61.46, KL: 31.17)
--> Early stopping: 1/50 (BEST: 92.47)

beta: 1.0
Epoch: 154/2000, Time elapsed: 21.32s
* Train loss: 87.89   (RE: 57.30, KL: 30.59)
o Val.  loss: 92.54   (RE: 61.08, KL: 31.46)
--> Early stopping: 2/50 (BEST: 92.47)

beta: 1.0
Epoch: 155/2000, Time elapsed: 22.91s
* Train loss: 87.85   (RE: 57.28, KL: 30.57)
o Val.  loss: 92.44   (RE: 61.23, KL: 31.22)
--> Early stopping: 3/50 (BEST: 92.47)

->model saved<-
beta: 1.0
Epoch: 156/2000, Time elapsed: 22.52s
* Train loss: 87.83   (RE: 57.27, KL: 30.56)
o Val.  loss: 92.33   (RE: 61.40, KL: 30.93)
--> Early stopping: 0/50 (BEST: 92.44)

->model saved<-
beta: 1.0
Epoch: 157/2000, Time elapsed: 22.13s
* Train loss: 87.78   (RE: 57.25, KL: 30.54)
o Val.  loss: 92.58   (RE: 61.27, KL: 31.31)
--> Early stopping: 0/50 (BEST: 92.33)

beta: 1.0
Epoch: 158/2000, Time elapsed: 22.83s
* Train loss: 87.77   (RE: 57.26, KL: 30.50)
o Val.  loss: 92.40   (RE: 61.30, KL: 31.09)
--> Early stopping: 1/50 (BEST: 92.33)

beta: 1.0
Epoch: 159/2000, Time elapsed: 22.73s
* Train loss: 87.72   (RE: 57.24, KL: 30.48)
o Val.  loss: 92.39   (RE: 61.38, KL: 31.01)
--> Early stopping: 2/50 (BEST: 92.33)

beta: 1.0
Epoch: 160/2000, Time elapsed: 22.60s
* Train loss: 87.66   (RE: 57.20, KL: 30.46)
o Val.  loss: 92.43   (RE: 61.27, KL: 31.16)
--> Early stopping: 3/50 (BEST: 92.33)

beta: 1.0
Epoch: 161/2000, Time elapsed: 22.54s
* Train loss: 87.68   (RE: 57.20, KL: 30.48)
o Val.  loss: 92.26   (RE: 61.12, KL: 31.14)
--> Early stopping: 4/50 (BEST: 92.33)

->model saved<-
beta: 1.0
Epoch: 162/2000, Time elapsed: 24.27s
* Train loss: 87.61   (RE: 57.17, KL: 30.43)
o Val.  loss: 92.38   (RE: 61.39, KL: 30.99)
--> Early stopping: 0/50 (BEST: 92.26)

beta: 1.0
Epoch: 163/2000, Time elapsed: 24.82s
* Train loss: 87.58   (RE: 57.18, KL: 30.39)
o Val.  loss: 92.39   (RE: 61.47, KL: 30.92)
--> Early stopping: 1/50 (BEST: 92.26)

beta: 1.0
Epoch: 164/2000, Time elapsed: 23.88s
* Train loss: 87.55   (RE: 57.15, KL: 30.41)
o Val.  loss: 92.26   (RE: 61.31, KL: 30.96)
--> Early stopping: 2/50 (BEST: 92.26)

beta: 1.0
Epoch: 165/2000, Time elapsed: 24.11s
* Train loss: 87.54   (RE: 57.15, KL: 30.39)
o Val.  loss: 92.36   (RE: 61.15, KL: 31.21)
--> Early stopping: 3/50 (BEST: 92.26)

beta: 1.0
Epoch: 166/2000, Time elapsed: 22.12s
* Train loss: 87.48   (RE: 57.12, KL: 30.36)
o Val.  loss: 92.29   (RE: 61.39, KL: 30.90)
--> Early stopping: 4/50 (BEST: 92.26)

beta: 1.0
Epoch: 167/2000, Time elapsed: 22.83s
* Train loss: 87.46   (RE: 57.14, KL: 30.32)
o Val.  loss: 92.38   (RE: 61.23, KL: 31.15)
--> Early stopping: 5/50 (BEST: 92.26)

beta: 1.0
Epoch: 168/2000, Time elapsed: 22.36s
* Train loss: 87.40   (RE: 57.08, KL: 30.32)
o Val.  loss: 92.14   (RE: 61.22, KL: 30.92)
--> Early stopping: 6/50 (BEST: 92.26)

->model saved<-
beta: 1.0
Epoch: 169/2000, Time elapsed: 20.65s
* Train loss: 87.37   (RE: 57.08, KL: 30.29)
o Val.  loss: 92.38   (RE: 61.18, KL: 31.20)
--> Early stopping: 0/50 (BEST: 92.14)

beta: 1.0
Epoch: 170/2000, Time elapsed: 22.85s
* Train loss: 87.34   (RE: 57.03, KL: 30.30)
o Val.  loss: 92.18   (RE: 61.11, KL: 31.07)
--> Early stopping: 1/50 (BEST: 92.14)

beta: 1.0
Epoch: 171/2000, Time elapsed: 23.40s
* Train loss: 87.29   (RE: 57.02, KL: 30.27)
o Val.  loss: 92.26   (RE: 61.20, KL: 31.06)
--> Early stopping: 2/50 (BEST: 92.14)

beta: 1.0
Epoch: 172/2000, Time elapsed: 22.72s
* Train loss: 87.27   (RE: 57.03, KL: 30.25)
o Val.  loss: 92.15   (RE: 61.28, KL: 30.87)
--> Early stopping: 3/50 (BEST: 92.14)

beta: 1.0
Epoch: 173/2000, Time elapsed: 22.30s
* Train loss: 87.24   (RE: 57.01, KL: 30.23)
o Val.  loss: 92.11   (RE: 61.38, KL: 30.74)
--> Early stopping: 4/50 (BEST: 92.14)

->model saved<-
beta: 1.0
Epoch: 174/2000, Time elapsed: 21.55s
* Train loss: 87.23   (RE: 56.99, KL: 30.24)
o Val.  loss: 92.24   (RE: 61.03, KL: 31.21)
--> Early stopping: 0/50 (BEST: 92.11)

beta: 1.0
Epoch: 175/2000, Time elapsed: 22.56s
* Train loss: 87.18   (RE: 56.99, KL: 30.19)
o Val.  loss: 92.17   (RE: 61.22, KL: 30.95)
--> Early stopping: 1/50 (BEST: 92.11)

beta: 1.0
Epoch: 176/2000, Time elapsed: 22.17s
* Train loss: 87.16   (RE: 56.96, KL: 30.20)
o Val.  loss: 92.18   (RE: 61.23, KL: 30.96)
--> Early stopping: 2/50 (BEST: 92.11)

beta: 1.0
Epoch: 177/2000, Time elapsed: 22.94s
* Train loss: 87.13   (RE: 56.95, KL: 30.18)
o Val.  loss: 92.15   (RE: 61.45, KL: 30.70)
--> Early stopping: 3/50 (BEST: 92.11)

beta: 1.0
Epoch: 178/2000, Time elapsed: 22.60s
* Train loss: 87.08   (RE: 56.94, KL: 30.14)
o Val.  loss: 92.20   (RE: 61.46, KL: 30.74)
--> Early stopping: 4/50 (BEST: 92.11)

beta: 1.0
Epoch: 179/2000, Time elapsed: 22.52s
* Train loss: 87.06   (RE: 56.92, KL: 30.14)
o Val.  loss: 92.04   (RE: 61.20, KL: 30.84)
--> Early stopping: 5/50 (BEST: 92.11)

->model saved<-
beta: 1.0
Epoch: 180/2000, Time elapsed: 22.69s
* Train loss: 87.04   (RE: 56.90, KL: 30.13)
o Val.  loss: 92.12   (RE: 61.34, KL: 30.78)
--> Early stopping: 0/50 (BEST: 92.04)

beta: 1.0
Epoch: 181/2000, Time elapsed: 22.97s
* Train loss: 87.00   (RE: 56.89, KL: 30.11)
o Val.  loss: 92.07   (RE: 61.08, KL: 30.99)
--> Early stopping: 1/50 (BEST: 92.04)

beta: 1.0
Epoch: 182/2000, Time elapsed: 22.61s
* Train loss: 86.96   (RE: 56.87, KL: 30.09)
o Val.  loss: 92.09   (RE: 61.37, KL: 30.72)
--> Early stopping: 2/50 (BEST: 92.04)

beta: 1.0
Epoch: 183/2000, Time elapsed: 22.78s
* Train loss: 86.93   (RE: 56.83, KL: 30.10)
o Val.  loss: 92.01   (RE: 61.36, KL: 30.66)
--> Early stopping: 3/50 (BEST: 92.04)

->model saved<-
beta: 1.0
Epoch: 184/2000, Time elapsed: 22.54s
* Train loss: 86.88   (RE: 56.83, KL: 30.05)
o Val.  loss: 92.10   (RE: 61.42, KL: 30.68)
--> Early stopping: 0/50 (BEST: 92.01)

beta: 1.0
Epoch: 185/2000, Time elapsed: 22.77s
* Train loss: 86.88   (RE: 56.82, KL: 30.07)
o Val.  loss: 92.13   (RE: 61.40, KL: 30.73)
--> Early stopping: 1/50 (BEST: 92.01)

beta: 1.0
Epoch: 186/2000, Time elapsed: 22.57s
* Train loss: 86.84   (RE: 56.79, KL: 30.05)
o Val.  loss: 92.03   (RE: 61.23, KL: 30.80)
--> Early stopping: 2/50 (BEST: 92.01)

beta: 1.0
Epoch: 187/2000, Time elapsed: 23.38s
* Train loss: 86.85   (RE: 56.80, KL: 30.05)
o Val.  loss: 92.12   (RE: 61.36, KL: 30.77)
--> Early stopping: 3/50 (BEST: 92.01)

beta: 1.0
Epoch: 188/2000, Time elapsed: 22.89s
* Train loss: 86.79   (RE: 56.76, KL: 30.03)
o Val.  loss: 92.05   (RE: 61.49, KL: 30.55)
--> Early stopping: 4/50 (BEST: 92.01)

beta: 1.0
Epoch: 189/2000, Time elapsed: 22.49s
* Train loss: 86.79   (RE: 56.77, KL: 30.02)
o Val.  loss: 91.94   (RE: 61.30, KL: 30.64)
--> Early stopping: 5/50 (BEST: 92.01)

->model saved<-
beta: 1.0
Epoch: 190/2000, Time elapsed: 22.66s
* Train loss: 86.75   (RE: 56.75, KL: 30.00)
o Val.  loss: 91.91   (RE: 61.28, KL: 30.63)
--> Early stopping: 0/50 (BEST: 91.94)

->model saved<-
beta: 1.0
Epoch: 191/2000, Time elapsed: 22.70s
* Train loss: 86.72   (RE: 56.71, KL: 30.02)
o Val.  loss: 91.97   (RE: 61.25, KL: 30.72)
--> Early stopping: 0/50 (BEST: 91.91)

beta: 1.0
Epoch: 192/2000, Time elapsed: 19.87s
* Train loss: 86.70   (RE: 56.71, KL: 29.99)
o Val.  loss: 92.08   (RE: 61.30, KL: 30.77)
--> Early stopping: 1/50 (BEST: 91.91)

beta: 1.0
Epoch: 193/2000, Time elapsed: 22.62s
* Train loss: 86.64   (RE: 56.68, KL: 29.96)
o Val.  loss: 91.95   (RE: 61.36, KL: 30.59)
--> Early stopping: 2/50 (BEST: 91.91)

beta: 1.0
Epoch: 194/2000, Time elapsed: 21.80s
* Train loss: 86.64   (RE: 56.70, KL: 29.94)
o Val.  loss: 92.13   (RE: 61.47, KL: 30.66)
--> Early stopping: 3/50 (BEST: 91.91)

beta: 1.0
Epoch: 195/2000, Time elapsed: 22.82s
* Train loss: 86.60   (RE: 56.63, KL: 29.96)
o Val.  loss: 91.92   (RE: 61.08, KL: 30.84)
--> Early stopping: 4/50 (BEST: 91.91)

beta: 1.0
Epoch: 196/2000, Time elapsed: 22.69s
* Train loss: 86.57   (RE: 56.65, KL: 29.92)
o Val.  loss: 91.88   (RE: 61.49, KL: 30.39)
--> Early stopping: 5/50 (BEST: 91.91)

->model saved<-
beta: 1.0
Epoch: 197/2000, Time elapsed: 22.71s
* Train loss: 86.54   (RE: 56.60, KL: 29.94)
o Val.  loss: 92.06   (RE: 61.30, KL: 30.76)
--> Early stopping: 0/50 (BEST: 91.88)

beta: 1.0
Epoch: 198/2000, Time elapsed: 22.57s
* Train loss: 86.52   (RE: 56.61, KL: 29.92)
o Val.  loss: 91.89   (RE: 61.47, KL: 30.42)
--> Early stopping: 1/50 (BEST: 91.88)

beta: 1.0
Epoch: 199/2000, Time elapsed: 22.72s
* Train loss: 86.51   (RE: 56.61, KL: 29.91)
o Val.  loss: 91.96   (RE: 61.37, KL: 30.59)
--> Early stopping: 2/50 (BEST: 91.88)

beta: 1.0
Epoch: 200/2000, Time elapsed: 20.64s
* Train loss: 86.45   (RE: 56.56, KL: 29.89)
o Val.  loss: 91.92   (RE: 61.26, KL: 30.66)
--> Early stopping: 3/50 (BEST: 91.88)

beta: 1.0
Epoch: 201/2000, Time elapsed: 20.44s
* Train loss: 86.46   (RE: 56.54, KL: 29.91)
o Val.  loss: 91.87   (RE: 61.30, KL: 30.57)
--> Early stopping: 4/50 (BEST: 91.88)

->model saved<-
beta: 1.0
Epoch: 202/2000, Time elapsed: 22.74s
* Train loss: 86.42   (RE: 56.53, KL: 29.89)
o Val.  loss: 91.85   (RE: 61.26, KL: 30.59)
--> Early stopping: 0/50 (BEST: 91.87)

->model saved<-
beta: 1.0
Epoch: 203/2000, Time elapsed: 23.00s
* Train loss: 86.40   (RE: 56.53, KL: 29.87)
o Val.  loss: 92.03   (RE: 61.53, KL: 30.50)
--> Early stopping: 0/50 (BEST: 91.85)

beta: 1.0
Epoch: 204/2000, Time elapsed: 20.65s
* Train loss: 86.35   (RE: 56.49, KL: 29.87)
o Val.  loss: 91.81   (RE: 61.22, KL: 30.59)
--> Early stopping: 1/50 (BEST: 91.85)

->model saved<-
beta: 1.0
Epoch: 205/2000, Time elapsed: 22.96s
* Train loss: 86.34   (RE: 56.48, KL: 29.87)
o Val.  loss: 91.94   (RE: 61.29, KL: 30.65)
--> Early stopping: 0/50 (BEST: 91.81)

beta: 1.0
Epoch: 206/2000, Time elapsed: 22.99s
* Train loss: 86.33   (RE: 56.47, KL: 29.86)
o Val.  loss: 91.93   (RE: 61.18, KL: 30.76)
--> Early stopping: 1/50 (BEST: 91.81)

beta: 1.0
Epoch: 207/2000, Time elapsed: 23.01s
* Train loss: 86.29   (RE: 56.45, KL: 29.84)
o Val.  loss: 91.92   (RE: 61.23, KL: 30.69)
--> Early stopping: 2/50 (BEST: 91.81)

beta: 1.0
Epoch: 208/2000, Time elapsed: 23.38s
* Train loss: 86.28   (RE: 56.46, KL: 29.82)
o Val.  loss: 91.94   (RE: 61.21, KL: 30.73)
--> Early stopping: 3/50 (BEST: 91.81)

beta: 1.0
Epoch: 209/2000, Time elapsed: 23.78s
* Train loss: 86.25   (RE: 56.42, KL: 29.83)
o Val.  loss: 91.76   (RE: 61.00, KL: 30.76)
--> Early stopping: 4/50 (BEST: 91.81)

->model saved<-
beta: 1.0
Epoch: 210/2000, Time elapsed: 23.09s
* Train loss: 86.21   (RE: 56.39, KL: 29.82)
o Val.  loss: 91.93   (RE: 61.75, KL: 30.17)
--> Early stopping: 0/50 (BEST: 91.76)

beta: 1.0
Epoch: 211/2000, Time elapsed: 20.85s
* Train loss: 86.21   (RE: 56.41, KL: 29.80)
o Val.  loss: 91.89   (RE: 61.29, KL: 30.61)
--> Early stopping: 1/50 (BEST: 91.76)

beta: 1.0
Epoch: 212/2000, Time elapsed: 19.35s
* Train loss: 86.16   (RE: 56.38, KL: 29.78)
o Val.  loss: 91.85   (RE: 61.26, KL: 30.59)
--> Early stopping: 2/50 (BEST: 91.76)

beta: 1.0
Epoch: 213/2000, Time elapsed: 22.79s
* Train loss: 86.15   (RE: 56.36, KL: 29.78)
o Val.  loss: 91.80   (RE: 61.07, KL: 30.73)
--> Early stopping: 3/50 (BEST: 91.76)

beta: 1.0
Epoch: 214/2000, Time elapsed: 22.71s
* Train loss: 86.11   (RE: 56.33, KL: 29.78)
o Val.  loss: 91.89   (RE: 61.70, KL: 30.20)
--> Early stopping: 4/50 (BEST: 91.76)

beta: 1.0
Epoch: 215/2000, Time elapsed: 22.79s
* Train loss: 86.07   (RE: 56.31, KL: 29.76)
o Val.  loss: 91.95   (RE: 61.31, KL: 30.65)
--> Early stopping: 5/50 (BEST: 91.76)

beta: 1.0
Epoch: 216/2000, Time elapsed: 22.50s
* Train loss: 86.11   (RE: 56.32, KL: 29.79)
o Val.  loss: 91.88   (RE: 61.42, KL: 30.46)
--> Early stopping: 6/50 (BEST: 91.76)

beta: 1.0
Epoch: 217/2000, Time elapsed: 22.74s
* Train loss: 86.08   (RE: 56.30, KL: 29.78)
o Val.  loss: 91.92   (RE: 61.12, KL: 30.79)
--> Early stopping: 7/50 (BEST: 91.76)

beta: 1.0
Epoch: 218/2000, Time elapsed: 22.65s
* Train loss: 86.04   (RE: 56.28, KL: 29.76)
o Val.  loss: 91.85   (RE: 61.42, KL: 30.43)
--> Early stopping: 8/50 (BEST: 91.76)

beta: 1.0
Epoch: 219/2000, Time elapsed: 22.80s
* Train loss: 86.03   (RE: 56.27, KL: 29.76)
o Val.  loss: 91.87   (RE: 61.55, KL: 30.32)
--> Early stopping: 9/50 (BEST: 91.76)

beta: 1.0
Epoch: 220/2000, Time elapsed: 22.48s
* Train loss: 85.97   (RE: 56.24, KL: 29.73)
o Val.  loss: 91.94   (RE: 61.38, KL: 30.57)
--> Early stopping: 10/50 (BEST: 91.76)

beta: 1.0
Epoch: 221/2000, Time elapsed: 22.81s
* Train loss: 85.98   (RE: 56.24, KL: 29.73)
o Val.  loss: 91.75   (RE: 61.18, KL: 30.58)
--> Early stopping: 11/50 (BEST: 91.76)

->model saved<-
beta: 1.0
Epoch: 222/2000, Time elapsed: 23.08s
* Train loss: 85.94   (RE: 56.18, KL: 29.76)
o Val.  loss: 91.97   (RE: 61.62, KL: 30.36)
--> Early stopping: 0/50 (BEST: 91.75)

beta: 1.0
Epoch: 223/2000, Time elapsed: 21.87s
* Train loss: 85.91   (RE: 56.21, KL: 29.70)
o Val.  loss: 91.74   (RE: 61.22, KL: 30.52)
--> Early stopping: 1/50 (BEST: 91.75)

->model saved<-
beta: 1.0
Epoch: 224/2000, Time elapsed: 22.35s
* Train loss: 85.89   (RE: 56.20, KL: 29.70)
o Val.  loss: 91.78   (RE: 61.44, KL: 30.34)
--> Early stopping: 0/50 (BEST: 91.74)

beta: 1.0
Epoch: 225/2000, Time elapsed: 22.10s
* Train loss: 85.86   (RE: 56.14, KL: 29.71)
o Val.  loss: 91.83   (RE: 61.29, KL: 30.54)
--> Early stopping: 1/50 (BEST: 91.74)

beta: 1.0
Epoch: 226/2000, Time elapsed: 20.28s
* Train loss: 85.83   (RE: 56.14, KL: 29.69)
o Val.  loss: 91.86   (RE: 61.29, KL: 30.57)
--> Early stopping: 2/50 (BEST: 91.74)

beta: 1.0
Epoch: 227/2000, Time elapsed: 22.42s
* Train loss: 85.85   (RE: 56.16, KL: 29.69)
o Val.  loss: 91.86   (RE: 61.39, KL: 30.47)
--> Early stopping: 3/50 (BEST: 91.74)

beta: 1.0
Epoch: 228/2000, Time elapsed: 22.72s
* Train loss: 85.80   (RE: 56.11, KL: 29.69)
o Val.  loss: 91.75   (RE: 61.13, KL: 30.62)
--> Early stopping: 4/50 (BEST: 91.74)

beta: 1.0
Epoch: 229/2000, Time elapsed: 22.54s
* Train loss: 85.80   (RE: 56.11, KL: 29.69)
o Val.  loss: 91.76   (RE: 61.35, KL: 30.41)
--> Early stopping: 5/50 (BEST: 91.74)

beta: 1.0
Epoch: 230/2000, Time elapsed: 23.17s
* Train loss: 85.77   (RE: 56.12, KL: 29.66)
o Val.  loss: 91.84   (RE: 61.35, KL: 30.49)
--> Early stopping: 6/50 (BEST: 91.74)

beta: 1.0
Epoch: 231/2000, Time elapsed: 22.50s
* Train loss: 85.76   (RE: 56.09, KL: 29.67)
o Val.  loss: 91.87   (RE: 61.30, KL: 30.57)
--> Early stopping: 7/50 (BEST: 91.74)

beta: 1.0
Epoch: 232/2000, Time elapsed: 22.59s
* Train loss: 85.70   (RE: 56.06, KL: 29.65)
o Val.  loss: 91.88   (RE: 61.12, KL: 30.77)
--> Early stopping: 8/50 (BEST: 91.74)

beta: 1.0
Epoch: 233/2000, Time elapsed: 22.96s
* Train loss: 85.71   (RE: 56.05, KL: 29.65)
o Val.  loss: 91.77   (RE: 61.18, KL: 30.59)
--> Early stopping: 9/50 (BEST: 91.74)

beta: 1.0
Epoch: 234/2000, Time elapsed: 22.34s
* Train loss: 85.68   (RE: 56.03, KL: 29.65)
o Val.  loss: 91.82   (RE: 61.47, KL: 30.35)
--> Early stopping: 10/50 (BEST: 91.74)

beta: 1.0
Epoch: 235/2000, Time elapsed: 23.01s
* Train loss: 85.66   (RE: 56.00, KL: 29.66)
o Val.  loss: 91.77   (RE: 61.24, KL: 30.52)
--> Early stopping: 11/50 (BEST: 91.74)

beta: 1.0
Epoch: 236/2000, Time elapsed: 22.61s
* Train loss: 85.63   (RE: 55.97, KL: 29.66)
o Val.  loss: 91.77   (RE: 61.23, KL: 30.53)
--> Early stopping: 12/50 (BEST: 91.74)

beta: 1.0
Epoch: 237/2000, Time elapsed: 22.54s
* Train loss: 85.62   (RE: 55.99, KL: 29.63)
o Val.  loss: 91.69   (RE: 61.35, KL: 30.34)
--> Early stopping: 13/50 (BEST: 91.74)

->model saved<-
beta: 1.0
Epoch: 238/2000, Time elapsed: 22.61s
* Train loss: 85.57   (RE: 55.95, KL: 29.62)
o Val.  loss: 91.75   (RE: 61.38, KL: 30.37)
--> Early stopping: 0/50 (BEST: 91.69)

beta: 1.0
Epoch: 239/2000, Time elapsed: 19.20s
* Train loss: 85.55   (RE: 55.95, KL: 29.60)
o Val.  loss: 91.78   (RE: 61.25, KL: 30.54)
--> Early stopping: 1/50 (BEST: 91.69)

beta: 1.0
Epoch: 240/2000, Time elapsed: 23.32s
* Train loss: 85.53   (RE: 55.92, KL: 29.62)
o Val.  loss: 91.68   (RE: 61.43, KL: 30.24)
--> Early stopping: 2/50 (BEST: 91.69)

->model saved<-
beta: 1.0
Epoch: 241/2000, Time elapsed: 22.53s
* Train loss: 85.54   (RE: 55.93, KL: 29.61)
o Val.  loss: 91.77   (RE: 61.45, KL: 30.32)
--> Early stopping: 0/50 (BEST: 91.68)

beta: 1.0
Epoch: 242/2000, Time elapsed: 22.65s
* Train loss: 85.52   (RE: 55.91, KL: 29.61)
o Val.  loss: 91.73   (RE: 61.39, KL: 30.34)
--> Early stopping: 1/50 (BEST: 91.68)

beta: 1.0
Epoch: 243/2000, Time elapsed: 22.67s
* Train loss: 85.51   (RE: 55.92, KL: 29.59)
o Val.  loss: 91.73   (RE: 61.49, KL: 30.24)
--> Early stopping: 2/50 (BEST: 91.68)

beta: 1.0
Epoch: 244/2000, Time elapsed: 22.76s
* Train loss: 85.47   (RE: 55.88, KL: 29.59)
o Val.  loss: 91.70   (RE: 61.39, KL: 30.31)
--> Early stopping: 3/50 (BEST: 91.68)

beta: 1.0
Epoch: 245/2000, Time elapsed: 23.20s
* Train loss: 85.46   (RE: 55.86, KL: 29.60)
o Val.  loss: 91.75   (RE: 61.25, KL: 30.49)
--> Early stopping: 4/50 (BEST: 91.68)

beta: 1.0
Epoch: 246/2000, Time elapsed: 23.18s
* Train loss: 85.44   (RE: 55.84, KL: 29.61)
o Val.  loss: 91.74   (RE: 61.37, KL: 30.37)
--> Early stopping: 5/50 (BEST: 91.68)

beta: 1.0
Epoch: 247/2000, Time elapsed: 23.10s
* Train loss: 85.42   (RE: 55.82, KL: 29.60)
o Val.  loss: 91.76   (RE: 61.28, KL: 30.48)
--> Early stopping: 6/50 (BEST: 91.68)

beta: 1.0
Epoch: 248/2000, Time elapsed: 22.66s
* Train loss: 85.38   (RE: 55.82, KL: 29.56)
o Val.  loss: 91.80   (RE: 61.22, KL: 30.58)
--> Early stopping: 7/50 (BEST: 91.68)

beta: 1.0
Epoch: 249/2000, Time elapsed: 22.70s
* Train loss: 85.37   (RE: 55.81, KL: 29.56)
o Val.  loss: 91.66   (RE: 61.38, KL: 30.27)
--> Early stopping: 8/50 (BEST: 91.68)

->model saved<-
beta: 1.0
Epoch: 250/2000, Time elapsed: 22.81s
* Train loss: 85.37   (RE: 55.80, KL: 29.57)
o Val.  loss: 91.71   (RE: 61.44, KL: 30.27)
--> Early stopping: 0/50 (BEST: 91.66)

beta: 1.0
Epoch: 251/2000, Time elapsed: 22.72s
* Train loss: 85.37   (RE: 55.79, KL: 29.59)
o Val.  loss: 91.68   (RE: 61.35, KL: 30.33)
--> Early stopping: 1/50 (BEST: 91.66)

beta: 1.0
Epoch: 252/2000, Time elapsed: 22.36s
* Train loss: 85.31   (RE: 55.75, KL: 29.56)
o Val.  loss: 91.68   (RE: 61.48, KL: 30.20)
--> Early stopping: 2/50 (BEST: 91.66)

beta: 1.0
Epoch: 253/2000, Time elapsed: 22.79s
* Train loss: 85.30   (RE: 55.75, KL: 29.55)
o Val.  loss: 91.73   (RE: 61.17, KL: 30.56)
--> Early stopping: 3/50 (BEST: 91.66)

beta: 1.0
Epoch: 254/2000, Time elapsed: 22.50s
* Train loss: 85.28   (RE: 55.72, KL: 29.55)
o Val.  loss: 91.68   (RE: 61.28, KL: 30.40)
--> Early stopping: 4/50 (BEST: 91.66)

beta: 1.0
Epoch: 255/2000, Time elapsed: 22.70s
* Train loss: 85.27   (RE: 55.71, KL: 29.56)
o Val.  loss: 91.78   (RE: 61.30, KL: 30.48)
--> Early stopping: 5/50 (BEST: 91.66)

beta: 1.0
Epoch: 256/2000, Time elapsed: 22.98s
* Train loss: 85.25   (RE: 55.71, KL: 29.54)
o Val.  loss: 91.78   (RE: 61.28, KL: 30.51)
--> Early stopping: 6/50 (BEST: 91.66)

beta: 1.0
Epoch: 257/2000, Time elapsed: 22.53s
* Train loss: 85.22   (RE: 55.66, KL: 29.56)
o Val.  loss: 91.66   (RE: 61.50, KL: 30.16)
--> Early stopping: 7/50 (BEST: 91.66)

beta: 1.0
Epoch: 258/2000, Time elapsed: 22.78s
* Train loss: 85.20   (RE: 55.65, KL: 29.55)
o Val.  loss: 91.73   (RE: 61.53, KL: 30.20)
--> Early stopping: 8/50 (BEST: 91.66)

beta: 1.0
Epoch: 259/2000, Time elapsed: 22.59s
* Train loss: 85.21   (RE: 55.66, KL: 29.54)
o Val.  loss: 91.61   (RE: 61.41, KL: 30.19)
--> Early stopping: 9/50 (BEST: 91.66)

->model saved<-
beta: 1.0
Epoch: 260/2000, Time elapsed: 22.78s
* Train loss: 85.18   (RE: 55.65, KL: 29.53)
o Val.  loss: 91.70   (RE: 61.41, KL: 30.29)
--> Early stopping: 0/50 (BEST: 91.61)

beta: 1.0
Epoch: 261/2000, Time elapsed: 21.57s
* Train loss: 85.15   (RE: 55.64, KL: 29.52)
o Val.  loss: 91.78   (RE: 61.34, KL: 30.45)
--> Early stopping: 1/50 (BEST: 91.61)

beta: 1.0
Epoch: 262/2000, Time elapsed: 22.99s
* Train loss: 85.15   (RE: 55.63, KL: 29.52)
o Val.  loss: 91.74   (RE: 61.52, KL: 30.22)
--> Early stopping: 2/50 (BEST: 91.61)

beta: 1.0
Epoch: 263/2000, Time elapsed: 22.66s
* Train loss: 85.13   (RE: 55.60, KL: 29.53)
o Val.  loss: 91.60   (RE: 61.18, KL: 30.42)
--> Early stopping: 3/50 (BEST: 91.61)

->model saved<-
beta: 1.0
Epoch: 264/2000, Time elapsed: 22.62s
* Train loss: 85.08   (RE: 55.57, KL: 29.51)
o Val.  loss: 91.80   (RE: 61.32, KL: 30.49)
--> Early stopping: 0/50 (BEST: 91.60)

beta: 1.0
Epoch: 265/2000, Time elapsed: 22.55s
* Train loss: 85.09   (RE: 55.56, KL: 29.53)
o Val.  loss: 91.81   (RE: 61.39, KL: 30.42)
--> Early stopping: 1/50 (BEST: 91.60)

beta: 1.0
Epoch: 266/2000, Time elapsed: 22.48s
* Train loss: 85.05   (RE: 55.52, KL: 29.52)
o Val.  loss: 91.65   (RE: 61.45, KL: 30.20)
--> Early stopping: 2/50 (BEST: 91.60)

beta: 1.0
Epoch: 267/2000, Time elapsed: 22.59s
* Train loss: 85.03   (RE: 55.52, KL: 29.52)
o Val.  loss: 91.71   (RE: 61.58, KL: 30.13)
--> Early stopping: 3/50 (BEST: 91.60)

beta: 1.0
Epoch: 268/2000, Time elapsed: 22.75s
* Train loss: 85.05   (RE: 55.53, KL: 29.52)
o Val.  loss: 91.78   (RE: 61.47, KL: 30.31)
--> Early stopping: 4/50 (BEST: 91.60)

beta: 1.0
Epoch: 269/2000, Time elapsed: 22.47s
* Train loss: 85.03   (RE: 55.53, KL: 29.50)
o Val.  loss: 91.84   (RE: 61.33, KL: 30.51)
--> Early stopping: 5/50 (BEST: 91.60)

beta: 1.0
Epoch: 270/2000, Time elapsed: 22.61s
* Train loss: 85.01   (RE: 55.52, KL: 29.49)
o Val.  loss: 91.84   (RE: 61.41, KL: 30.43)
--> Early stopping: 6/50 (BEST: 91.60)

beta: 1.0
Epoch: 271/2000, Time elapsed: 22.53s
* Train loss: 85.00   (RE: 55.51, KL: 29.49)
o Val.  loss: 91.74   (RE: 61.42, KL: 30.31)
--> Early stopping: 7/50 (BEST: 91.60)

beta: 1.0
Epoch: 272/2000, Time elapsed: 22.87s
* Train loss: 84.96   (RE: 55.48, KL: 29.48)
o Val.  loss: 91.80   (RE: 61.41, KL: 30.39)
--> Early stopping: 8/50 (BEST: 91.60)

beta: 1.0
Epoch: 273/2000, Time elapsed: 22.56s
* Train loss: 84.95   (RE: 55.45, KL: 29.50)
o Val.  loss: 91.67   (RE: 61.41, KL: 30.26)
--> Early stopping: 9/50 (BEST: 91.60)

beta: 1.0
Epoch: 274/2000, Time elapsed: 22.58s
* Train loss: 84.91   (RE: 55.42, KL: 29.50)
o Val.  loss: 91.88   (RE: 61.60, KL: 30.28)
--> Early stopping: 10/50 (BEST: 91.60)

beta: 1.0
Epoch: 275/2000, Time elapsed: 22.81s
* Train loss: 84.90   (RE: 55.42, KL: 29.49)
o Val.  loss: 91.68   (RE: 61.53, KL: 30.14)
--> Early stopping: 11/50 (BEST: 91.60)

beta: 1.0
Epoch: 276/2000, Time elapsed: 22.56s
* Train loss: 84.87   (RE: 55.40, KL: 29.47)
o Val.  loss: 91.77   (RE: 61.49, KL: 30.28)
--> Early stopping: 12/50 (BEST: 91.60)

beta: 1.0
Epoch: 277/2000, Time elapsed: 22.53s
* Train loss: 84.85   (RE: 55.39, KL: 29.46)
o Val.  loss: 91.81   (RE: 61.34, KL: 30.47)
--> Early stopping: 13/50 (BEST: 91.60)

beta: 1.0
Epoch: 278/2000, Time elapsed: 22.79s
* Train loss: 84.86   (RE: 55.37, KL: 29.50)
o Val.  loss: 91.72   (RE: 61.54, KL: 30.18)
--> Early stopping: 14/50 (BEST: 91.60)

beta: 1.0
Epoch: 279/2000, Time elapsed: 22.51s
* Train loss: 84.84   (RE: 55.39, KL: 29.45)
o Val.  loss: 91.80   (RE: 61.65, KL: 30.15)
--> Early stopping: 15/50 (BEST: 91.60)

beta: 1.0
Epoch: 280/2000, Time elapsed: 24.39s
* Train loss: 84.84   (RE: 55.40, KL: 29.44)
o Val.  loss: 91.67   (RE: 61.44, KL: 30.23)
--> Early stopping: 16/50 (BEST: 91.60)

beta: 1.0
Epoch: 281/2000, Time elapsed: 24.53s
* Train loss: 84.82   (RE: 55.36, KL: 29.46)
o Val.  loss: 91.76   (RE: 61.46, KL: 30.31)
--> Early stopping: 17/50 (BEST: 91.60)

beta: 1.0
Epoch: 282/2000, Time elapsed: 24.35s
* Train loss: 84.77   (RE: 55.31, KL: 29.46)
o Val.  loss: 91.67   (RE: 61.52, KL: 30.15)
--> Early stopping: 18/50 (BEST: 91.60)

beta: 1.0
Epoch: 283/2000, Time elapsed: 24.40s
* Train loss: 84.80   (RE: 55.34, KL: 29.46)
o Val.  loss: 91.59   (RE: 61.47, KL: 30.11)
--> Early stopping: 19/50 (BEST: 91.60)

->model saved<-
beta: 1.0
Epoch: 284/2000, Time elapsed: 24.77s
* Train loss: 84.77   (RE: 55.30, KL: 29.47)
o Val.  loss: 91.78   (RE: 61.46, KL: 30.33)
--> Early stopping: 0/50 (BEST: 91.59)

beta: 1.0
Epoch: 285/2000, Time elapsed: 22.82s
* Train loss: 84.75   (RE: 55.31, KL: 29.44)
o Val.  loss: 91.76   (RE: 61.53, KL: 30.23)
--> Early stopping: 1/50 (BEST: 91.59)

beta: 1.0
Epoch: 286/2000, Time elapsed: 22.52s
* Train loss: 84.73   (RE: 55.29, KL: 29.44)
o Val.  loss: 91.68   (RE: 61.34, KL: 30.34)
--> Early stopping: 2/50 (BEST: 91.59)

beta: 1.0
Epoch: 287/2000, Time elapsed: 22.79s
* Train loss: 84.69   (RE: 55.25, KL: 29.44)
o Val.  loss: 92.01   (RE: 61.18, KL: 30.84)
--> Early stopping: 3/50 (BEST: 91.59)

beta: 1.0
Epoch: 288/2000, Time elapsed: 22.83s
* Train loss: 84.71   (RE: 55.25, KL: 29.46)
o Val.  loss: 91.72   (RE: 61.37, KL: 30.35)
--> Early stopping: 4/50 (BEST: 91.59)

beta: 1.0
Epoch: 289/2000, Time elapsed: 23.35s
* Train loss: 84.71   (RE: 55.26, KL: 29.44)
o Val.  loss: 91.83   (RE: 61.45, KL: 30.38)
--> Early stopping: 5/50 (BEST: 91.59)

beta: 1.0
Epoch: 290/2000, Time elapsed: 22.43s
* Train loss: 84.69   (RE: 55.21, KL: 29.47)
o Val.  loss: 91.74   (RE: 61.44, KL: 30.30)
--> Early stopping: 6/50 (BEST: 91.59)

beta: 1.0
Epoch: 291/2000, Time elapsed: 22.38s
* Train loss: 84.64   (RE: 55.20, KL: 29.44)
o Val.  loss: 91.73   (RE: 61.52, KL: 30.21)
--> Early stopping: 7/50 (BEST: 91.59)

beta: 1.0
Epoch: 292/2000, Time elapsed: 20.62s
* Train loss: 84.64   (RE: 55.21, KL: 29.43)
o Val.  loss: 91.90   (RE: 61.25, KL: 30.65)
--> Early stopping: 8/50 (BEST: 91.59)

beta: 1.0
Epoch: 293/2000, Time elapsed: 22.53s
* Train loss: 84.65   (RE: 55.20, KL: 29.45)
o Val.  loss: 91.79   (RE: 61.45, KL: 30.34)
--> Early stopping: 9/50 (BEST: 91.59)

beta: 1.0
Epoch: 294/2000, Time elapsed: 22.92s
* Train loss: 84.62   (RE: 55.17, KL: 29.45)
o Val.  loss: 91.68   (RE: 61.37, KL: 30.31)
--> Early stopping: 10/50 (BEST: 91.59)

beta: 1.0
Epoch: 295/2000, Time elapsed: 22.44s
* Train loss: 84.59   (RE: 55.15, KL: 29.45)
o Val.  loss: 91.84   (RE: 61.47, KL: 30.36)
--> Early stopping: 11/50 (BEST: 91.59)

beta: 1.0
Epoch: 296/2000, Time elapsed: 22.12s
* Train loss: 84.60   (RE: 55.14, KL: 29.46)
o Val.  loss: 91.92   (RE: 61.64, KL: 30.28)
--> Early stopping: 12/50 (BEST: 91.59)

beta: 1.0
Epoch: 297/2000, Time elapsed: 22.58s
* Train loss: 84.55   (RE: 55.13, KL: 29.42)
o Val.  loss: 91.85   (RE: 61.45, KL: 30.40)
--> Early stopping: 13/50 (BEST: 91.59)

beta: 1.0
Epoch: 298/2000, Time elapsed: 22.63s
* Train loss: 84.55   (RE: 55.13, KL: 29.42)
o Val.  loss: 91.92   (RE: 61.60, KL: 30.32)
--> Early stopping: 14/50 (BEST: 91.59)

beta: 1.0
Epoch: 299/2000, Time elapsed: 22.56s
* Train loss: 84.56   (RE: 55.13, KL: 29.43)
o Val.  loss: 91.80   (RE: 61.15, KL: 30.65)
--> Early stopping: 15/50 (BEST: 91.59)

beta: 1.0
Epoch: 300/2000, Time elapsed: 22.60s
* Train loss: 84.52   (RE: 55.08, KL: 29.44)
o Val.  loss: 91.81   (RE: 61.48, KL: 30.33)
--> Early stopping: 16/50 (BEST: 91.59)

beta: 1.0
Epoch: 301/2000, Time elapsed: 22.83s
* Train loss: 84.50   (RE: 55.07, KL: 29.42)
o Val.  loss: 91.92   (RE: 61.27, KL: 30.65)
--> Early stopping: 17/50 (BEST: 91.59)

beta: 1.0
Epoch: 302/2000, Time elapsed: 22.86s
* Train loss: 84.48   (RE: 55.07, KL: 29.41)
o Val.  loss: 91.92   (RE: 61.49, KL: 30.43)
--> Early stopping: 18/50 (BEST: 91.59)

beta: 1.0
Epoch: 303/2000, Time elapsed: 22.21s
* Train loss: 84.48   (RE: 55.05, KL: 29.43)
o Val.  loss: 91.77   (RE: 61.44, KL: 30.32)
--> Early stopping: 19/50 (BEST: 91.59)

beta: 1.0
Epoch: 304/2000, Time elapsed: 22.74s
* Train loss: 84.46   (RE: 55.07, KL: 29.40)
o Val.  loss: 91.79   (RE: 61.47, KL: 30.32)
--> Early stopping: 20/50 (BEST: 91.59)

beta: 1.0
Epoch: 305/2000, Time elapsed: 23.17s
* Train loss: 84.44   (RE: 55.03, KL: 29.41)
o Val.  loss: 91.76   (RE: 61.55, KL: 30.21)
--> Early stopping: 21/50 (BEST: 91.59)

beta: 1.0
Epoch: 306/2000, Time elapsed: 22.61s
* Train loss: 84.43   (RE: 55.02, KL: 29.41)
o Val.  loss: 91.91   (RE: 61.54, KL: 30.37)
--> Early stopping: 22/50 (BEST: 91.59)

beta: 1.0
Epoch: 307/2000, Time elapsed: 22.54s
* Train loss: 84.43   (RE: 55.03, KL: 29.41)
o Val.  loss: 91.90   (RE: 61.56, KL: 30.34)
--> Early stopping: 23/50 (BEST: 91.59)

beta: 1.0
Epoch: 308/2000, Time elapsed: 22.78s
* Train loss: 84.39   (RE: 54.99, KL: 29.39)
o Val.  loss: 91.80   (RE: 61.50, KL: 30.31)
--> Early stopping: 24/50 (BEST: 91.59)

beta: 1.0
Epoch: 309/2000, Time elapsed: 22.42s
* Train loss: 84.39   (RE: 54.97, KL: 29.42)
o Val.  loss: 91.90   (RE: 61.47, KL: 30.43)
--> Early stopping: 25/50 (BEST: 91.59)

beta: 1.0
Epoch: 310/2000, Time elapsed: 22.24s
* Train loss: 84.35   (RE: 54.96, KL: 29.39)
o Val.  loss: 91.89   (RE: 61.36, KL: 30.53)
--> Early stopping: 26/50 (BEST: 91.59)

beta: 1.0
Epoch: 311/2000, Time elapsed: 22.64s
* Train loss: 84.37   (RE: 54.96, KL: 29.42)
o Val.  loss: 91.82   (RE: 61.49, KL: 30.33)
--> Early stopping: 27/50 (BEST: 91.59)

beta: 1.0
Epoch: 312/2000, Time elapsed: 23.06s
* Train loss: 84.36   (RE: 54.93, KL: 29.42)
o Val.  loss: 92.02   (RE: 61.83, KL: 30.19)
--> Early stopping: 28/50 (BEST: 91.59)

beta: 1.0
Epoch: 313/2000, Time elapsed: 22.64s
* Train loss: 84.32   (RE: 54.92, KL: 29.40)
o Val.  loss: 91.88   (RE: 61.51, KL: 30.37)
--> Early stopping: 29/50 (BEST: 91.59)

beta: 1.0
Epoch: 314/2000, Time elapsed: 22.59s
* Train loss: 84.33   (RE: 54.94, KL: 29.39)
o Val.  loss: 91.91   (RE: 61.37, KL: 30.54)
--> Early stopping: 30/50 (BEST: 91.59)

beta: 1.0
Epoch: 315/2000, Time elapsed: 23.11s
* Train loss: 84.32   (RE: 54.92, KL: 29.40)
o Val.  loss: 91.90   (RE: 61.69, KL: 30.21)
--> Early stopping: 31/50 (BEST: 91.59)

beta: 1.0
Epoch: 316/2000, Time elapsed: 22.78s
* Train loss: 84.31   (RE: 54.92, KL: 29.39)
o Val.  loss: 91.88   (RE: 61.47, KL: 30.41)
--> Early stopping: 32/50 (BEST: 91.59)

beta: 1.0
Epoch: 317/2000, Time elapsed: 22.72s
* Train loss: 84.28   (RE: 54.89, KL: 29.39)
o Val.  loss: 91.95   (RE: 61.43, KL: 30.52)
--> Early stopping: 33/50 (BEST: 91.59)

beta: 1.0
Epoch: 318/2000, Time elapsed: 23.10s
* Train loss: 84.27   (RE: 54.88, KL: 29.39)
o Val.  loss: 91.75   (RE: 61.62, KL: 30.13)
--> Early stopping: 34/50 (BEST: 91.59)

beta: 1.0
Epoch: 319/2000, Time elapsed: 22.95s
* Train loss: 84.26   (RE: 54.88, KL: 29.38)
o Val.  loss: 91.85   (RE: 61.50, KL: 30.35)
--> Early stopping: 35/50 (BEST: 91.59)

beta: 1.0
Epoch: 320/2000, Time elapsed: 22.84s
* Train loss: 84.22   (RE: 54.83, KL: 29.39)
o Val.  loss: 92.01   (RE: 61.67, KL: 30.34)
--> Early stopping: 36/50 (BEST: 91.59)

beta: 1.0
Epoch: 321/2000, Time elapsed: 22.71s
* Train loss: 84.24   (RE: 54.84, KL: 29.40)
o Val.  loss: 91.96   (RE: 61.59, KL: 30.37)
--> Early stopping: 37/50 (BEST: 91.59)

beta: 1.0
Epoch: 322/2000, Time elapsed: 23.09s
* Train loss: 84.22   (RE: 54.82, KL: 29.41)
o Val.  loss: 91.87   (RE: 61.36, KL: 30.51)
--> Early stopping: 38/50 (BEST: 91.59)

beta: 1.0
Epoch: 323/2000, Time elapsed: 22.42s
* Train loss: 84.22   (RE: 54.82, KL: 29.40)
o Val.  loss: 91.83   (RE: 61.43, KL: 30.39)
--> Early stopping: 39/50 (BEST: 91.59)

beta: 1.0
Epoch: 324/2000, Time elapsed: 22.38s
* Train loss: 84.18   (RE: 54.76, KL: 29.42)
o Val.  loss: 92.09   (RE: 61.69, KL: 30.40)
--> Early stopping: 40/50 (BEST: 91.59)

beta: 1.0
Epoch: 325/2000, Time elapsed: 22.61s
* Train loss: 84.18   (RE: 54.82, KL: 29.36)
o Val.  loss: 91.98   (RE: 61.59, KL: 30.39)
--> Early stopping: 41/50 (BEST: 91.59)

beta: 1.0
Epoch: 326/2000, Time elapsed: 22.86s
* Train loss: 84.16   (RE: 54.78, KL: 29.38)
o Val.  loss: 91.85   (RE: 61.39, KL: 30.46)
--> Early stopping: 42/50 (BEST: 91.59)

beta: 1.0
Epoch: 327/2000, Time elapsed: 22.73s
* Train loss: 84.15   (RE: 54.78, KL: 29.37)
o Val.  loss: 92.07   (RE: 61.58, KL: 30.49)
--> Early stopping: 43/50 (BEST: 91.59)

beta: 1.0
Epoch: 328/2000, Time elapsed: 21.03s
* Train loss: 84.15   (RE: 54.76, KL: 29.39)
o Val.  loss: 92.13   (RE: 61.53, KL: 30.60)
--> Early stopping: 44/50 (BEST: 91.59)

beta: 1.0
Epoch: 329/2000, Time elapsed: 22.57s
* Train loss: 84.11   (RE: 54.75, KL: 29.36)
o Val.  loss: 91.86   (RE: 61.45, KL: 30.41)
--> Early stopping: 45/50 (BEST: 91.59)

beta: 1.0
Epoch: 330/2000, Time elapsed: 22.79s
* Train loss: 84.09   (RE: 54.75, KL: 29.34)
o Val.  loss: 92.01   (RE: 61.40, KL: 30.61)
--> Early stopping: 46/50 (BEST: 91.59)

beta: 1.0
Epoch: 331/2000, Time elapsed: 22.84s
* Train loss: 84.10   (RE: 54.72, KL: 29.38)
o Val.  loss: 91.96   (RE: 61.65, KL: 30.31)
--> Early stopping: 47/50 (BEST: 91.59)

beta: 1.0
Epoch: 332/2000, Time elapsed: 23.06s
* Train loss: 84.07   (RE: 54.71, KL: 29.36)
o Val.  loss: 91.97   (RE: 61.47, KL: 30.49)
--> Early stopping: 48/50 (BEST: 91.59)

beta: 1.0
Epoch: 333/2000, Time elapsed: 24.07s
* Train loss: 84.08   (RE: 54.71, KL: 29.36)
o Val.  loss: 91.92   (RE: 61.51, KL: 30.41)
--> Early stopping: 49/50 (BEST: 91.59)

beta: 1.0
Epoch: 334/2000, Time elapsed: 23.81s
* Train loss: 84.06   (RE: 54.68, KL: 29.38)
o Val.  loss: 91.87   (RE: 61.57, KL: 30.30)
--> Early stopping: 50/50 (BEST: 91.59)

Test lower-bound value 90.82 in time: 0.36s
Train lower-bound value 0.00 in time: 0.00s
0.00%
1.00%
2.00%
3.00%
4.00%
5.00%
6.00%
7.00%
8.00%
9.00%
10.00%
11.00%
12.00%
13.00%
14.00%
15.00%
16.00%
17.00%
18.00%
19.00%
20.00%
21.00%
22.00%
23.00%
24.00%
25.00%
26.00%
27.00%
28.00%
29.00%
30.00%
31.00%
32.00%
33.00%
34.00%
35.00%
36.00%
37.00%
38.00%
39.00%
40.00%
41.00%
42.00%
43.00%
44.00%
45.00%
46.00%
47.00%
48.00%
49.00%
50.00%
51.00%
52.00%
53.00%
54.00%
55.00%
56.00%
57.00%
58.00%
59.00%
60.00%
61.00%
62.00%
63.00%
64.00%
65.00%
66.00%
67.00%
68.00%
69.00%
70.00%
71.00%
72.00%
73.00%
74.00%
75.00%
76.00%
77.00%
78.00%
79.00%
80.00%
81.00%
82.00%
83.00%
84.00%
85.00%
86.00%
87.00%
88.00%
89.00%
90.00%
91.00%
92.00%
93.00%
94.00%
95.00%
96.00%
97.00%
98.00%
99.00%
Test log_likelihood value 84.74 in time: 1147.66s
Train log_likelihood value 0.00 in time: 0.00s
FINAL EVALUATION ON TEST SET
LogL (TEST): 84.74
LogL (TRAIN): 0.00
ELBO (TEST): 90.82
ELBO (TRAIN): 0.00
Loss: 90.80
RE: 60.83
KL: 29.97
 Training finished in 148.32 minutes. Log saved to: snapshots/2026-01-22 02:18:54_static_mnist_hvae_2level_vampprior_K500_weightedTrue_z1_40_seed420/eval_results/runtime.txt
-=-=-=-=-=-=-=-=-=-=-=-=-=-=-=-=-=-=-=-=-=-=-=-=-=-=-=-=-=-=-=-=-=-=-=-=-=-=-=-=-=-=-=-=-=-=-=-=-=-=-=-=-=-=-=-
