load data
create model
Namespace(batch_size=100, test_batch_size=100, epochs=2000, lr=0.0005, early_stopping_epochs=50, warmup=100, no_cuda=False, seed=69, z1_size=40, z2_size=40, input_size=[1, 28, 28], activation=None, number_components=500, pseudoinputs_mean=0.05, pseudoinputs_std=0.01, use_training_data_init=False, model_name='hvae_2level', prior='flowprior', weighted=True, input_type='binary', flow_layers=8, flow_hidden_dim=128, S=5000, MB=100, dataset_name='static_mnist', dynamic_binarization=False, cuda=True, model_signature='2026-01-21 22:29:33')
perform experiment
beta: 0.01
/root/vae_vampprior/models/Model.py:41: UserWarning: The torch.cuda.*DtypeTensor constructors are no longer recommended. It's best to use methods such as torch.tensor(data, dtype=*, device='cuda') to create tensors. (Triggered internally at /pytorch/torch/csrc/tensor/python_tensor.cpp:78.)
  eps = torch.cuda.FloatTensor(std.size()).normal_()
/root/vae_vampprior/utils/optimizer.py:75: UserWarning: This overload of add_ is deprecated:
	add_(Number alpha, Tensor other)
Consider using one of the following signatures instead:
	add_(Tensor other, *, Number alpha = 1) (Triggered internally at /pytorch/torch/csrc/utils/python_arg_parser.cpp:1805.)
  exp_avg.mul_(beta1).add_(1 - beta1, grad)
Epoch: 1/2000, Time elapsed: 40.39s
* Train loss: 108.13   (RE: 106.36, KL: 176.91)
o Val.  loss: 249.38   (RE: 59.51, KL: 189.86)
--> Early stopping: 0/50 (BEST: 100000.00)

->model saved<-
beta: 0.02
Epoch: 2/2000, Time elapsed: 40.42s
* Train loss: 54.86   (RE: 51.08, KL: 188.89)
o Val.  loss: 235.95   (RE: 45.91, KL: 190.04)
--> Early stopping: 0/50 (BEST: 249.38)

->model saved<-
beta: 0.03
Epoch: 3/2000, Time elapsed: 40.45s
* Train loss: 47.86   (RE: 42.53, KL: 177.81)
o Val.  loss: 215.36   (RE: 41.52, KL: 173.84)
--> Early stopping: 0/50 (BEST: 235.95)

->model saved<-
beta: 0.04
Epoch: 4/2000, Time elapsed: 40.38s
* Train loss: 45.82   (RE: 39.19, KL: 165.72)
o Val.  loss: 200.88   (RE: 39.53, KL: 161.36)
--> Early stopping: 0/50 (BEST: 215.36)

->model saved<-
beta: 0.05
Epoch: 5/2000, Time elapsed: 40.88s
* Train loss: 45.11   (RE: 37.59, KL: 150.43)
o Val.  loss: 185.52   (RE: 38.48, KL: 147.04)
--> Early stopping: 0/50 (BEST: 200.88)

->model saved<-
beta: 0.06
Epoch: 6/2000, Time elapsed: 40.65s
* Train loss: 44.88   (RE: 36.56, KL: 138.62)
o Val.  loss: 176.00   (RE: 37.91, KL: 138.10)
--> Early stopping: 0/50 (BEST: 185.52)

->model saved<-
beta: 0.07
Epoch: 7/2000, Time elapsed: 40.91s
* Train loss: 44.95   (RE: 35.68, KL: 132.40)
o Val.  loss: 169.40   (RE: 37.55, KL: 131.85)
--> Early stopping: 0/50 (BEST: 176.00)

->model saved<-
beta: 0.08
Epoch: 8/2000, Time elapsed: 40.05s
* Train loss: 45.19   (RE: 35.02, KL: 127.20)
o Val.  loss: 163.23   (RE: 37.22, KL: 126.02)
--> Early stopping: 0/50 (BEST: 169.40)

->model saved<-
beta: 0.09
Epoch: 9/2000, Time elapsed: 40.99s
* Train loss: 45.59   (RE: 34.54, KL: 122.72)
o Val.  loss: 159.17   (RE: 36.93, KL: 122.24)
--> Early stopping: 0/50 (BEST: 163.23)

->model saved<-
beta: 0.1
Epoch: 10/2000, Time elapsed: 40.49s
* Train loss: 46.07   (RE: 34.20, KL: 118.71)
o Val.  loss: 154.75   (RE: 36.99, KL: 117.76)
--> Early stopping: 0/50 (BEST: 159.17)

->model saved<-
beta: 0.11
Epoch: 11/2000, Time elapsed: 40.87s
* Train loss: 46.62   (RE: 33.94, KL: 115.19)
o Val.  loss: 152.37   (RE: 36.76, KL: 115.61)
--> Early stopping: 0/50 (BEST: 154.75)

->model saved<-
beta: 0.12
Epoch: 12/2000, Time elapsed: 39.47s
* Train loss: 47.17   (RE: 33.75, KL: 111.86)
o Val.  loss: 149.60   (RE: 36.66, KL: 112.94)
--> Early stopping: 0/50 (BEST: 152.37)

->model saved<-
beta: 0.13
Epoch: 13/2000, Time elapsed: 40.62s
* Train loss: 47.78   (RE: 33.63, KL: 108.89)
o Val.  loss: 145.77   (RE: 36.77, KL: 109.00)
--> Early stopping: 0/50 (BEST: 149.60)

->model saved<-
beta: 0.14
Epoch: 14/2000, Time elapsed: 38.92s
* Train loss: 48.42   (RE: 33.57, KL: 106.11)
o Val.  loss: 143.75   (RE: 36.97, KL: 106.77)
--> Early stopping: 0/50 (BEST: 145.77)

->model saved<-
beta: 0.15
Epoch: 15/2000, Time elapsed: 40.01s
* Train loss: 49.07   (RE: 33.54, KL: 103.50)
o Val.  loss: 141.36   (RE: 37.01, KL: 104.35)
--> Early stopping: 0/50 (BEST: 143.75)

->model saved<-
beta: 0.16
Epoch: 16/2000, Time elapsed: 41.20s
* Train loss: 49.72   (RE: 33.55, KL: 101.06)
o Val.  loss: 138.99   (RE: 36.97, KL: 102.02)
--> Early stopping: 0/50 (BEST: 141.36)

->model saved<-
beta: 0.17
Epoch: 17/2000, Time elapsed: 40.71s
* Train loss: 50.38   (RE: 33.59, KL: 98.78)
o Val.  loss: 136.56   (RE: 37.25, KL: 99.31)
--> Early stopping: 0/50 (BEST: 138.99)

->model saved<-
beta: 0.18
Epoch: 18/2000, Time elapsed: 40.68s
* Train loss: 51.06   (RE: 33.66, KL: 96.63)
o Val.  loss: 134.70   (RE: 37.50, KL: 97.20)
--> Early stopping: 0/50 (BEST: 136.56)

->model saved<-
beta: 0.19
Epoch: 19/2000, Time elapsed: 40.22s
* Train loss: 51.69   (RE: 33.72, KL: 94.57)
o Val.  loss: 133.04   (RE: 37.57, KL: 95.46)
--> Early stopping: 0/50 (BEST: 134.70)

->model saved<-
beta: 0.2
Epoch: 20/2000, Time elapsed: 41.33s
* Train loss: 52.36   (RE: 33.82, KL: 92.70)
o Val.  loss: 130.96   (RE: 37.89, KL: 93.07)
--> Early stopping: 0/50 (BEST: 133.04)

->model saved<-
beta: 0.21
Epoch: 21/2000, Time elapsed: 39.69s
* Train loss: 53.03   (RE: 33.96, KL: 90.81)
o Val.  loss: 130.69   (RE: 37.74, KL: 92.95)
--> Early stopping: 0/50 (BEST: 130.96)

->model saved<-
beta: 0.22
Epoch: 22/2000, Time elapsed: 39.10s
* Train loss: 53.68   (RE: 34.07, KL: 89.10)
o Val.  loss: 127.72   (RE: 38.31, KL: 89.42)
--> Early stopping: 0/50 (BEST: 130.69)

->model saved<-
beta: 0.23
Epoch: 23/2000, Time elapsed: 40.95s
* Train loss: 54.35   (RE: 34.25, KL: 87.37)
o Val.  loss: 126.74   (RE: 38.44, KL: 88.30)
--> Early stopping: 0/50 (BEST: 127.72)

->model saved<-
beta: 0.24
Epoch: 24/2000, Time elapsed: 40.44s
* Train loss: 54.96   (RE: 34.37, KL: 85.81)
o Val.  loss: 124.95   (RE: 38.71, KL: 86.25)
--> Early stopping: 0/50 (BEST: 126.74)

->model saved<-
beta: 0.25
Epoch: 25/2000, Time elapsed: 39.58s
* Train loss: 55.61   (RE: 34.56, KL: 84.20)
o Val.  loss: 124.13   (RE: 38.78, KL: 85.35)
--> Early stopping: 0/50 (BEST: 124.95)

->model saved<-
beta: 0.26
Epoch: 26/2000, Time elapsed: 40.21s
* Train loss: 56.26   (RE: 34.75, KL: 82.74)
o Val.  loss: 123.48   (RE: 38.95, KL: 84.52)
--> Early stopping: 0/50 (BEST: 124.13)

->model saved<-
beta: 0.27
Epoch: 27/2000, Time elapsed: 40.28s
* Train loss: 56.88   (RE: 34.91, KL: 81.35)
o Val.  loss: 122.08   (RE: 39.23, KL: 82.85)
--> Early stopping: 0/50 (BEST: 123.48)

->model saved<-
beta: 0.28
Epoch: 28/2000, Time elapsed: 40.61s
* Train loss: 57.52   (RE: 35.14, KL: 79.94)
o Val.  loss: 121.32   (RE: 39.25, KL: 82.07)
--> Early stopping: 0/50 (BEST: 122.08)

->model saved<-
beta: 0.29
Epoch: 29/2000, Time elapsed: 40.44s
* Train loss: 58.14   (RE: 35.33, KL: 78.66)
o Val.  loss: 119.16   (RE: 39.76, KL: 79.40)
--> Early stopping: 0/50 (BEST: 121.32)

->model saved<-
beta: 0.3
Epoch: 30/2000, Time elapsed: 40.45s
* Train loss: 58.73   (RE: 35.52, KL: 77.36)
o Val.  loss: 118.64   (RE: 40.05, KL: 78.59)
--> Early stopping: 0/50 (BEST: 119.16)

->model saved<-
beta: 0.31
Epoch: 31/2000, Time elapsed: 41.09s
* Train loss: 59.37   (RE: 35.76, KL: 76.16)
o Val.  loss: 118.39   (RE: 39.99, KL: 78.40)
--> Early stopping: 0/50 (BEST: 118.64)

->model saved<-
beta: 0.32
Epoch: 32/2000, Time elapsed: 40.21s
* Train loss: 59.95   (RE: 35.97, KL: 74.95)
o Val.  loss: 116.21   (RE: 40.57, KL: 75.65)
--> Early stopping: 0/50 (BEST: 118.39)

->model saved<-
beta: 0.33
Epoch: 33/2000, Time elapsed: 41.14s
* Train loss: 60.55   (RE: 36.21, KL: 73.76)
o Val.  loss: 116.37   (RE: 40.45, KL: 75.91)
--> Early stopping: 0/50 (BEST: 116.21)

beta: 0.34
Epoch: 34/2000, Time elapsed: 40.45s
* Train loss: 61.14   (RE: 36.44, KL: 72.65)
o Val.  loss: 115.48   (RE: 40.68, KL: 74.80)
--> Early stopping: 0/50 (BEST: 116.21)

->model saved<-
beta: 0.35
Epoch: 35/2000, Time elapsed: 40.77s
* Train loss: 61.74   (RE: 36.68, KL: 71.59)
o Val.  loss: 114.20   (RE: 41.26, KL: 72.94)
--> Early stopping: 0/50 (BEST: 115.48)

->model saved<-
beta: 0.36
Epoch: 36/2000, Time elapsed: 40.90s
* Train loss: 62.33   (RE: 36.94, KL: 70.54)
o Val.  loss: 113.41   (RE: 41.33, KL: 72.08)
--> Early stopping: 0/50 (BEST: 114.20)

->model saved<-
beta: 0.37
Epoch: 37/2000, Time elapsed: 40.62s
* Train loss: 62.90   (RE: 37.19, KL: 69.47)
o Val.  loss: 112.83   (RE: 41.57, KL: 71.26)
--> Early stopping: 0/50 (BEST: 113.41)

->model saved<-
beta: 0.38
Epoch: 38/2000, Time elapsed: 40.33s
* Train loss: 63.48   (RE: 37.43, KL: 68.55)
o Val.  loss: 111.68   (RE: 41.83, KL: 69.85)
--> Early stopping: 0/50 (BEST: 112.83)

->model saved<-
beta: 0.39
Epoch: 39/2000, Time elapsed: 38.82s
* Train loss: 64.03   (RE: 37.69, KL: 67.53)
o Val.  loss: 110.55   (RE: 42.39, KL: 68.16)
--> Early stopping: 0/50 (BEST: 111.68)

->model saved<-
beta: 0.4
Epoch: 40/2000, Time elapsed: 40.98s
* Train loss: 64.58   (RE: 37.94, KL: 66.61)
o Val.  loss: 110.38   (RE: 42.56, KL: 67.81)
--> Early stopping: 0/50 (BEST: 110.55)

->model saved<-
beta: 0.41
Epoch: 41/2000, Time elapsed: 40.84s
* Train loss: 65.10   (RE: 38.20, KL: 65.62)
o Val.  loss: 109.97   (RE: 42.56, KL: 67.41)
--> Early stopping: 0/50 (BEST: 110.38)

->model saved<-
beta: 0.42
Epoch: 42/2000, Time elapsed: 38.81s
* Train loss: 65.67   (RE: 38.47, KL: 64.77)
o Val.  loss: 109.37   (RE: 42.78, KL: 66.59)
--> Early stopping: 0/50 (BEST: 109.97)

->model saved<-
beta: 0.43
Epoch: 43/2000, Time elapsed: 40.10s
* Train loss: 66.22   (RE: 38.75, KL: 63.88)
o Val.  loss: 108.33   (RE: 43.31, KL: 65.02)
--> Early stopping: 0/50 (BEST: 109.37)

->model saved<-
beta: 0.44
Epoch: 44/2000, Time elapsed: 41.01s
* Train loss: 66.73   (RE: 39.00, KL: 63.03)
o Val.  loss: 107.57   (RE: 43.62, KL: 63.95)
--> Early stopping: 0/50 (BEST: 108.33)

->model saved<-
beta: 0.45
Epoch: 45/2000, Time elapsed: 40.89s
* Train loss: 67.26   (RE: 39.26, KL: 62.22)
o Val.  loss: 107.46   (RE: 43.77, KL: 63.69)
--> Early stopping: 0/50 (BEST: 107.57)

->model saved<-
beta: 0.46
Epoch: 46/2000, Time elapsed: 41.29s
* Train loss: 67.77   (RE: 39.53, KL: 61.37)
o Val.  loss: 106.78   (RE: 44.28, KL: 62.50)
--> Early stopping: 0/50 (BEST: 107.46)

->model saved<-
beta: 0.47
Epoch: 47/2000, Time elapsed: 41.70s
* Train loss: 68.30   (RE: 39.83, KL: 60.58)
o Val.  loss: 106.13   (RE: 44.62, KL: 61.51)
--> Early stopping: 0/50 (BEST: 106.78)

->model saved<-
beta: 0.48
Epoch: 48/2000, Time elapsed: 40.93s
* Train loss: 68.80   (RE: 40.12, KL: 59.76)
o Val.  loss: 105.63   (RE: 44.70, KL: 60.93)
--> Early stopping: 0/50 (BEST: 106.13)

->model saved<-
beta: 0.49
Epoch: 49/2000, Time elapsed: 40.15s
* Train loss: 69.33   (RE: 40.40, KL: 59.05)
o Val.  loss: 105.37   (RE: 45.00, KL: 60.37)
--> Early stopping: 0/50 (BEST: 105.63)

->model saved<-
beta: 0.5
Epoch: 50/2000, Time elapsed: 40.56s
* Train loss: 69.88   (RE: 40.73, KL: 58.30)
o Val.  loss: 104.58   (RE: 45.39, KL: 59.20)
--> Early stopping: 0/50 (BEST: 105.37)

->model saved<-
beta: 0.51
Epoch: 51/2000, Time elapsed: 40.96s
* Train loss: 70.36   (RE: 41.00, KL: 57.56)
o Val.  loss: 104.36   (RE: 45.28, KL: 59.07)
--> Early stopping: 0/50 (BEST: 104.58)

->model saved<-
beta: 0.52
Epoch: 52/2000, Time elapsed: 40.61s
* Train loss: 70.85   (RE: 41.27, KL: 56.88)
o Val.  loss: 103.98   (RE: 45.61, KL: 58.37)
--> Early stopping: 0/50 (BEST: 104.36)

->model saved<-
beta: 0.53
Epoch: 53/2000, Time elapsed: 40.89s
* Train loss: 71.30   (RE: 41.53, KL: 56.17)
o Val.  loss: 103.47   (RE: 46.05, KL: 57.42)
--> Early stopping: 0/50 (BEST: 103.98)

->model saved<-
beta: 0.54
Epoch: 54/2000, Time elapsed: 40.37s
* Train loss: 71.79   (RE: 41.84, KL: 55.47)
o Val.  loss: 103.26   (RE: 45.95, KL: 57.31)
--> Early stopping: 0/50 (BEST: 103.47)

->model saved<-
beta: 0.55
Epoch: 55/2000, Time elapsed: 40.16s
* Train loss: 72.27   (RE: 42.13, KL: 54.79)
o Val.  loss: 102.71   (RE: 46.61, KL: 56.10)
--> Early stopping: 0/50 (BEST: 103.26)

->model saved<-
beta: 0.56
Epoch: 56/2000, Time elapsed: 40.98s
* Train loss: 72.74   (RE: 42.42, KL: 54.14)
o Val.  loss: 102.18   (RE: 46.96, KL: 55.22)
--> Early stopping: 0/50 (BEST: 102.71)

->model saved<-
beta: 0.57
Epoch: 57/2000, Time elapsed: 39.93s
* Train loss: 73.23   (RE: 42.73, KL: 53.50)
o Val.  loss: 101.65   (RE: 47.11, KL: 54.54)
--> Early stopping: 0/50 (BEST: 102.18)

->model saved<-
beta: 0.58
Epoch: 58/2000, Time elapsed: 40.85s
* Train loss: 73.67   (RE: 43.03, KL: 52.82)
o Val.  loss: 101.62   (RE: 47.15, KL: 54.47)
--> Early stopping: 0/50 (BEST: 101.65)

->model saved<-
beta: 0.59
Epoch: 59/2000, Time elapsed: 41.16s
* Train loss: 74.14   (RE: 43.32, KL: 52.24)
o Val.  loss: 101.03   (RE: 47.87, KL: 53.15)
--> Early stopping: 0/50 (BEST: 101.62)

->model saved<-
beta: 0.6
Epoch: 60/2000, Time elapsed: 40.96s
* Train loss: 74.54   (RE: 43.59, KL: 51.59)
o Val.  loss: 100.88   (RE: 48.28, KL: 52.60)
--> Early stopping: 0/50 (BEST: 101.03)

->model saved<-
beta: 0.61
Epoch: 61/2000, Time elapsed: 41.25s
* Train loss: 75.03   (RE: 43.90, KL: 51.03)
o Val.  loss: 100.62   (RE: 48.37, KL: 52.26)
--> Early stopping: 0/50 (BEST: 100.88)

->model saved<-
beta: 0.62
Epoch: 62/2000, Time elapsed: 41.23s
* Train loss: 75.47   (RE: 44.21, KL: 50.42)
o Val.  loss: 100.22   (RE: 48.62, KL: 51.60)
--> Early stopping: 0/50 (BEST: 100.62)

->model saved<-
beta: 0.63
Epoch: 63/2000, Time elapsed: 41.17s
* Train loss: 75.89   (RE: 44.50, KL: 49.83)
o Val.  loss: 99.96   (RE: 48.65, KL: 51.31)
--> Early stopping: 0/50 (BEST: 100.22)

->model saved<-
beta: 0.64
Epoch: 64/2000, Time elapsed: 41.01s
* Train loss: 76.33   (RE: 44.80, KL: 49.26)
o Val.  loss: 99.48   (RE: 49.14, KL: 50.34)
--> Early stopping: 0/50 (BEST: 99.96)

->model saved<-
beta: 0.65
Epoch: 65/2000, Time elapsed: 40.85s
* Train loss: 76.75   (RE: 45.10, KL: 48.70)
o Val.  loss: 99.36   (RE: 49.00, KL: 50.36)
--> Early stopping: 0/50 (BEST: 99.48)

->model saved<-
beta: 0.66
Epoch: 66/2000, Time elapsed: 40.89s
* Train loss: 77.18   (RE: 45.41, KL: 48.14)
o Val.  loss: 98.81   (RE: 49.63, KL: 49.17)
--> Early stopping: 0/50 (BEST: 99.36)

->model saved<-
beta: 0.67
Epoch: 67/2000, Time elapsed: 40.53s
* Train loss: 77.58   (RE: 45.70, KL: 47.58)
o Val.  loss: 98.63   (RE: 50.00, KL: 48.62)
--> Early stopping: 0/50 (BEST: 98.81)

->model saved<-
beta: 0.68
Epoch: 68/2000, Time elapsed: 40.07s
* Train loss: 77.99   (RE: 45.97, KL: 47.08)
o Val.  loss: 98.63   (RE: 50.17, KL: 48.46)
--> Early stopping: 0/50 (BEST: 98.63)

beta: 0.69
Epoch: 69/2000, Time elapsed: 38.17s
* Train loss: 78.39   (RE: 46.29, KL: 46.53)
o Val.  loss: 98.12   (RE: 50.53, KL: 47.59)
--> Early stopping: 0/50 (BEST: 98.63)

->model saved<-
beta: 0.7
Epoch: 70/2000, Time elapsed: 40.57s
* Train loss: 78.81   (RE: 46.60, KL: 46.02)
o Val.  loss: 98.06   (RE: 50.91, KL: 47.14)
--> Early stopping: 0/50 (BEST: 98.12)

->model saved<-
beta: 0.71
Epoch: 71/2000, Time elapsed: 39.82s
* Train loss: 79.25   (RE: 46.92, KL: 45.54)
o Val.  loss: 97.63   (RE: 51.10, KL: 46.53)
--> Early stopping: 0/50 (BEST: 98.06)

->model saved<-
beta: 0.72
Epoch: 72/2000, Time elapsed: 40.69s
* Train loss: 79.61   (RE: 47.18, KL: 45.04)
o Val.  loss: 97.41   (RE: 51.37, KL: 46.04)
--> Early stopping: 0/50 (BEST: 97.63)

->model saved<-
beta: 0.73
Epoch: 73/2000, Time elapsed: 39.97s
* Train loss: 79.98   (RE: 47.47, KL: 44.52)
o Val.  loss: 97.30   (RE: 51.51, KL: 45.78)
--> Early stopping: 0/50 (BEST: 97.41)

->model saved<-
beta: 0.74
Epoch: 74/2000, Time elapsed: 39.29s
* Train loss: 80.38   (RE: 47.79, KL: 44.05)
o Val.  loss: 96.84   (RE: 52.14, KL: 44.70)
--> Early stopping: 0/50 (BEST: 97.30)

->model saved<-
beta: 0.75
Epoch: 75/2000, Time elapsed: 39.69s
* Train loss: 80.76   (RE: 48.09, KL: 43.56)
o Val.  loss: 96.98   (RE: 52.12, KL: 44.86)
--> Early stopping: 0/50 (BEST: 96.84)

beta: 0.76
Epoch: 76/2000, Time elapsed: 39.33s
* Train loss: 81.11   (RE: 48.37, KL: 43.08)
o Val.  loss: 96.60   (RE: 52.60, KL: 44.00)
--> Early stopping: 0/50 (BEST: 96.84)

->model saved<-
beta: 0.77
Epoch: 77/2000, Time elapsed: 40.66s
* Train loss: 81.51   (RE: 48.69, KL: 42.62)
o Val.  loss: 96.49   (RE: 52.83, KL: 43.66)
--> Early stopping: 0/50 (BEST: 96.60)

->model saved<-
beta: 0.78
Epoch: 78/2000, Time elapsed: 39.86s
* Train loss: 81.84   (RE: 48.98, KL: 42.13)
o Val.  loss: 96.24   (RE: 53.25, KL: 42.99)
--> Early stopping: 0/50 (BEST: 96.49)

->model saved<-
beta: 0.79
Epoch: 79/2000, Time elapsed: 39.03s
* Train loss: 82.24   (RE: 49.30, KL: 41.69)
o Val.  loss: 96.14   (RE: 53.21, KL: 42.92)
--> Early stopping: 0/50 (BEST: 96.24)

->model saved<-
beta: 0.8
Epoch: 80/2000, Time elapsed: 40.79s
* Train loss: 82.62   (RE: 49.58, KL: 41.29)
o Val.  loss: 95.81   (RE: 53.42, KL: 42.39)
--> Early stopping: 0/50 (BEST: 96.14)

->model saved<-
beta: 0.81
Epoch: 81/2000, Time elapsed: 40.37s
* Train loss: 82.98   (RE: 49.91, KL: 40.83)
o Val.  loss: 95.87   (RE: 53.98, KL: 41.89)
--> Early stopping: 0/50 (BEST: 95.81)

beta: 0.82
Epoch: 82/2000, Time elapsed: 39.55s
* Train loss: 83.33   (RE: 50.20, KL: 40.41)
o Val.  loss: 95.59   (RE: 53.78, KL: 41.81)
--> Early stopping: 0/50 (BEST: 95.81)

->model saved<-
beta: 0.83
Epoch: 83/2000, Time elapsed: 40.32s
* Train loss: 83.64   (RE: 50.45, KL: 39.99)
o Val.  loss: 95.22   (RE: 54.67, KL: 40.55)
--> Early stopping: 0/50 (BEST: 95.59)

->model saved<-
beta: 0.84
Epoch: 84/2000, Time elapsed: 39.83s
* Train loss: 84.01   (RE: 50.76, KL: 39.58)
o Val.  loss: 95.10   (RE: 55.07, KL: 40.04)
--> Early stopping: 0/50 (BEST: 95.22)

->model saved<-
beta: 0.85
Epoch: 85/2000, Time elapsed: 40.46s
* Train loss: 84.35   (RE: 51.05, KL: 39.18)
o Val.  loss: 95.14   (RE: 54.82, KL: 40.32)
--> Early stopping: 0/50 (BEST: 95.10)

beta: 0.86
Epoch: 86/2000, Time elapsed: 40.47s
* Train loss: 84.68   (RE: 51.33, KL: 38.78)
o Val.  loss: 94.99   (RE: 55.22, KL: 39.77)
--> Early stopping: 0/50 (BEST: 95.10)

->model saved<-
beta: 0.87
Epoch: 87/2000, Time elapsed: 40.42s
* Train loss: 85.02   (RE: 51.63, KL: 38.38)
o Val.  loss: 94.82   (RE: 55.29, KL: 39.54)
--> Early stopping: 0/50 (BEST: 94.99)

->model saved<-
beta: 0.88
Epoch: 88/2000, Time elapsed: 39.14s
* Train loss: 85.30   (RE: 51.89, KL: 37.96)
o Val.  loss: 94.45   (RE: 55.87, KL: 38.58)
--> Early stopping: 0/50 (BEST: 94.82)

->model saved<-
beta: 0.89
Epoch: 89/2000, Time elapsed: 40.15s
* Train loss: 85.70   (RE: 52.22, KL: 37.62)
o Val.  loss: 94.49   (RE: 56.21, KL: 38.28)
--> Early stopping: 0/50 (BEST: 94.45)

beta: 0.9
Epoch: 90/2000, Time elapsed: 40.50s
* Train loss: 85.99   (RE: 52.50, KL: 37.21)
o Val.  loss: 94.51   (RE: 56.56, KL: 37.95)
--> Early stopping: 0/50 (BEST: 94.45)

beta: 0.91
Epoch: 91/2000, Time elapsed: 40.69s
* Train loss: 86.33   (RE: 52.80, KL: 36.85)
o Val.  loss: 94.38   (RE: 56.73, KL: 37.65)
--> Early stopping: 0/50 (BEST: 94.45)

->model saved<-
beta: 0.92
Epoch: 92/2000, Time elapsed: 40.68s
* Train loss: 86.64   (RE: 53.06, KL: 36.51)
o Val.  loss: 94.26   (RE: 57.00, KL: 37.26)
--> Early stopping: 0/50 (BEST: 94.38)

->model saved<-
beta: 0.93
Epoch: 93/2000, Time elapsed: 41.30s
* Train loss: 86.93   (RE: 53.35, KL: 36.11)
o Val.  loss: 93.95   (RE: 57.35, KL: 36.60)
--> Early stopping: 0/50 (BEST: 94.26)

->model saved<-
beta: 0.94
Epoch: 94/2000, Time elapsed: 39.93s
* Train loss: 87.26   (RE: 53.63, KL: 35.78)
o Val.  loss: 94.09   (RE: 57.60, KL: 36.49)
--> Early stopping: 0/50 (BEST: 93.95)

beta: 0.95
Epoch: 95/2000, Time elapsed: 40.83s
* Train loss: 87.57   (RE: 53.91, KL: 35.42)
o Val.  loss: 94.10   (RE: 57.20, KL: 36.90)
--> Early stopping: 0/50 (BEST: 93.95)

beta: 0.96
Epoch: 96/2000, Time elapsed: 41.03s
* Train loss: 87.90   (RE: 54.19, KL: 35.11)
o Val.  loss: 93.69   (RE: 58.08, KL: 35.61)
--> Early stopping: 0/50 (BEST: 93.95)

->model saved<-
beta: 0.97
Epoch: 97/2000, Time elapsed: 40.88s
* Train loss: 88.18   (RE: 54.47, KL: 34.75)
o Val.  loss: 93.59   (RE: 58.20, KL: 35.38)
--> Early stopping: 0/50 (BEST: 93.69)

->model saved<-
beta: 0.98
Epoch: 98/2000, Time elapsed: 40.78s
* Train loss: 88.47   (RE: 54.74, KL: 34.41)
o Val.  loss: 93.63   (RE: 58.37, KL: 35.27)
--> Early stopping: 0/50 (BEST: 93.59)

beta: 0.99
Epoch: 99/2000, Time elapsed: 41.21s
* Train loss: 88.78   (RE: 55.03, KL: 34.09)
o Val.  loss: 93.55   (RE: 58.46, KL: 35.08)
--> Early stopping: 0/50 (BEST: 93.59)

->model saved<-
beta: 1.0
Epoch: 100/2000, Time elapsed: 40.91s
* Train loss: 89.03   (RE: 55.27, KL: 33.76)
o Val.  loss: 93.49   (RE: 58.81, KL: 34.68)
--> Early stopping: 0/50 (BEST: 93.55)

->model saved<-
beta: 1.0
Epoch: 101/2000, Time elapsed: 40.66s
* Train loss: 88.99   (RE: 55.40, KL: 33.60)
o Val.  loss: 93.43   (RE: 59.01, KL: 34.42)
--> Early stopping: 0/50 (BEST: 93.49)

->model saved<-
beta: 1.0
Epoch: 102/2000, Time elapsed: 39.70s
* Train loss: 88.92   (RE: 55.46, KL: 33.46)
o Val.  loss: 93.47   (RE: 59.26, KL: 34.21)
--> Early stopping: 0/50 (BEST: 93.43)

beta: 1.0
Epoch: 103/2000, Time elapsed: 41.34s
* Train loss: 88.85   (RE: 55.48, KL: 33.37)
o Val.  loss: 93.33   (RE: 59.23, KL: 34.09)
--> Early stopping: 1/50 (BEST: 93.43)

->model saved<-
beta: 1.0
Epoch: 104/2000, Time elapsed: 41.12s
* Train loss: 88.82   (RE: 55.53, KL: 33.29)
o Val.  loss: 93.17   (RE: 59.27, KL: 33.90)
--> Early stopping: 0/50 (BEST: 93.33)

->model saved<-
beta: 1.0
Epoch: 105/2000, Time elapsed: 40.64s
* Train loss: 88.77   (RE: 55.61, KL: 33.16)
o Val.  loss: 93.18   (RE: 59.29, KL: 33.89)
--> Early stopping: 0/50 (BEST: 93.17)

beta: 1.0
Epoch: 106/2000, Time elapsed: 41.10s
* Train loss: 88.71   (RE: 55.64, KL: 33.07)
o Val.  loss: 93.10   (RE: 59.22, KL: 33.88)
--> Early stopping: 1/50 (BEST: 93.17)

->model saved<-
beta: 1.0
Epoch: 107/2000, Time elapsed: 41.83s
* Train loss: 88.66   (RE: 55.65, KL: 33.01)
o Val.  loss: 93.12   (RE: 59.12, KL: 34.00)
--> Early stopping: 0/50 (BEST: 93.10)

beta: 1.0
Epoch: 108/2000, Time elapsed: 41.86s
* Train loss: 88.57   (RE: 55.65, KL: 32.92)
o Val.  loss: 92.99   (RE: 59.04, KL: 33.95)
--> Early stopping: 1/50 (BEST: 93.10)

->model saved<-
beta: 1.0
Epoch: 109/2000, Time elapsed: 41.03s
* Train loss: 88.57   (RE: 55.68, KL: 32.89)
o Val.  loss: 93.09   (RE: 59.48, KL: 33.61)
--> Early stopping: 0/50 (BEST: 92.99)

beta: 1.0
Epoch: 110/2000, Time elapsed: 41.91s
* Train loss: 88.52   (RE: 55.72, KL: 32.80)
o Val.  loss: 93.03   (RE: 59.30, KL: 33.73)
--> Early stopping: 1/50 (BEST: 92.99)

beta: 1.0
Epoch: 111/2000, Time elapsed: 41.31s
* Train loss: 88.42   (RE: 55.71, KL: 32.72)
o Val.  loss: 92.89   (RE: 59.22, KL: 33.67)
--> Early stopping: 2/50 (BEST: 92.99)

->model saved<-
beta: 1.0
Epoch: 112/2000, Time elapsed: 42.11s
* Train loss: 88.43   (RE: 55.74, KL: 32.69)
o Val.  loss: 93.01   (RE: 59.22, KL: 33.79)
--> Early stopping: 0/50 (BEST: 92.89)

beta: 1.0
Epoch: 113/2000, Time elapsed: 42.41s
* Train loss: 88.38   (RE: 55.72, KL: 32.66)
o Val.  loss: 92.65   (RE: 59.21, KL: 33.44)
--> Early stopping: 1/50 (BEST: 92.89)

->model saved<-
beta: 1.0
Epoch: 114/2000, Time elapsed: 41.82s
* Train loss: 88.31   (RE: 55.74, KL: 32.57)
o Val.  loss: 92.74   (RE: 59.48, KL: 33.26)
--> Early stopping: 0/50 (BEST: 92.65)

beta: 1.0
Epoch: 115/2000, Time elapsed: 41.07s
* Train loss: 88.29   (RE: 55.74, KL: 32.54)
o Val.  loss: 92.75   (RE: 59.54, KL: 33.22)
--> Early stopping: 1/50 (BEST: 92.65)

beta: 1.0
Epoch: 116/2000, Time elapsed: 42.14s
* Train loss: 88.22   (RE: 55.75, KL: 32.47)
o Val.  loss: 92.89   (RE: 59.50, KL: 33.39)
--> Early stopping: 2/50 (BEST: 92.65)

beta: 1.0
Epoch: 117/2000, Time elapsed: 41.71s
* Train loss: 88.15   (RE: 55.73, KL: 32.42)
o Val.  loss: 92.56   (RE: 59.35, KL: 33.21)
--> Early stopping: 3/50 (BEST: 92.65)

->model saved<-
beta: 1.0
Epoch: 118/2000, Time elapsed: 41.26s
* Train loss: 88.14   (RE: 55.76, KL: 32.38)
o Val.  loss: 92.63   (RE: 59.67, KL: 32.96)
--> Early stopping: 0/50 (BEST: 92.56)

beta: 1.0
Epoch: 119/2000, Time elapsed: 42.83s
* Train loss: 88.10   (RE: 55.75, KL: 32.35)
o Val.  loss: 92.48   (RE: 59.40, KL: 33.08)
--> Early stopping: 1/50 (BEST: 92.56)

->model saved<-
beta: 1.0
Epoch: 120/2000, Time elapsed: 41.47s
* Train loss: 88.07   (RE: 55.80, KL: 32.27)
o Val.  loss: 92.62   (RE: 59.31, KL: 33.31)
--> Early stopping: 0/50 (BEST: 92.48)

beta: 1.0
Epoch: 121/2000, Time elapsed: 41.71s
* Train loss: 87.99   (RE: 55.75, KL: 32.25)
o Val.  loss: 92.57   (RE: 59.82, KL: 32.76)
--> Early stopping: 1/50 (BEST: 92.48)

beta: 1.0
Epoch: 122/2000, Time elapsed: 41.89s
* Train loss: 87.97   (RE: 55.78, KL: 32.19)
o Val.  loss: 92.50   (RE: 59.62, KL: 32.88)
--> Early stopping: 2/50 (BEST: 92.48)

beta: 1.0
Epoch: 123/2000, Time elapsed: 41.73s
* Train loss: 87.93   (RE: 55.78, KL: 32.15)
o Val.  loss: 92.44   (RE: 59.63, KL: 32.82)
--> Early stopping: 3/50 (BEST: 92.48)

->model saved<-
beta: 1.0
Epoch: 124/2000, Time elapsed: 41.94s
* Train loss: 87.87   (RE: 55.76, KL: 32.11)
o Val.  loss: 92.51   (RE: 59.38, KL: 33.13)
--> Early stopping: 0/50 (BEST: 92.44)

beta: 1.0
Epoch: 125/2000, Time elapsed: 41.98s
* Train loss: 87.85   (RE: 55.75, KL: 32.09)
o Val.  loss: 92.28   (RE: 59.58, KL: 32.71)
--> Early stopping: 1/50 (BEST: 92.44)

->model saved<-
beta: 1.0
Epoch: 126/2000, Time elapsed: 42.03s
* Train loss: 87.81   (RE: 55.74, KL: 32.07)
o Val.  loss: 92.35   (RE: 59.51, KL: 32.84)
--> Early stopping: 0/50 (BEST: 92.28)

beta: 1.0
Epoch: 127/2000, Time elapsed: 41.48s
* Train loss: 87.76   (RE: 55.75, KL: 32.01)
o Val.  loss: 92.44   (RE: 59.82, KL: 32.62)
--> Early stopping: 1/50 (BEST: 92.28)

beta: 1.0
Epoch: 128/2000, Time elapsed: 41.94s
* Train loss: 87.70   (RE: 55.75, KL: 31.96)
o Val.  loss: 92.41   (RE: 59.66, KL: 32.76)
--> Early stopping: 2/50 (BEST: 92.28)

beta: 1.0
Epoch: 129/2000, Time elapsed: 42.70s
* Train loss: 87.70   (RE: 55.75, KL: 31.95)
o Val.  loss: 92.44   (RE: 59.62, KL: 32.82)
--> Early stopping: 3/50 (BEST: 92.28)

beta: 1.0
Epoch: 130/2000, Time elapsed: 41.50s
* Train loss: 87.65   (RE: 55.76, KL: 31.89)
o Val.  loss: 92.36   (RE: 59.38, KL: 32.97)
--> Early stopping: 4/50 (BEST: 92.28)

beta: 1.0
Epoch: 131/2000, Time elapsed: 39.95s
* Train loss: 87.60   (RE: 55.72, KL: 31.88)
o Val.  loss: 92.31   (RE: 59.58, KL: 32.73)
--> Early stopping: 5/50 (BEST: 92.28)

beta: 1.0
Epoch: 132/2000, Time elapsed: 39.40s
* Train loss: 87.59   (RE: 55.73, KL: 31.85)
o Val.  loss: 92.26   (RE: 59.68, KL: 32.58)
--> Early stopping: 6/50 (BEST: 92.28)

->model saved<-
beta: 1.0
Epoch: 133/2000, Time elapsed: 41.49s
* Train loss: 87.54   (RE: 55.70, KL: 31.84)
o Val.  loss: 92.21   (RE: 59.49, KL: 32.72)
--> Early stopping: 0/50 (BEST: 92.26)

->model saved<-
beta: 1.0
Epoch: 134/2000, Time elapsed: 40.84s
* Train loss: 87.49   (RE: 55.70, KL: 31.79)
o Val.  loss: 92.25   (RE: 59.63, KL: 32.62)
--> Early stopping: 0/50 (BEST: 92.21)

beta: 1.0
Epoch: 135/2000, Time elapsed: 41.69s
* Train loss: 87.45   (RE: 55.71, KL: 31.73)
o Val.  loss: 92.32   (RE: 59.73, KL: 32.59)
--> Early stopping: 1/50 (BEST: 92.21)

beta: 1.0
Epoch: 136/2000, Time elapsed: 40.06s
* Train loss: 87.42   (RE: 55.69, KL: 31.73)
o Val.  loss: 92.11   (RE: 59.67, KL: 32.44)
--> Early stopping: 2/50 (BEST: 92.21)

->model saved<-
beta: 1.0
Epoch: 137/2000, Time elapsed: 41.05s
* Train loss: 87.38   (RE: 55.68, KL: 31.69)
o Val.  loss: 92.12   (RE: 59.58, KL: 32.54)
--> Early stopping: 0/50 (BEST: 92.11)

beta: 1.0
Epoch: 138/2000, Time elapsed: 42.03s
* Train loss: 87.38   (RE: 55.68, KL: 31.71)
o Val.  loss: 92.15   (RE: 59.74, KL: 32.41)
--> Early stopping: 1/50 (BEST: 92.11)

beta: 1.0
Epoch: 139/2000, Time elapsed: 42.73s
* Train loss: 87.33   (RE: 55.67, KL: 31.66)
o Val.  loss: 92.04   (RE: 59.66, KL: 32.38)
--> Early stopping: 2/50 (BEST: 92.11)

->model saved<-
beta: 1.0
Epoch: 140/2000, Time elapsed: 41.46s
* Train loss: 87.30   (RE: 55.65, KL: 31.65)
o Val.  loss: 92.09   (RE: 59.71, KL: 32.37)
--> Early stopping: 0/50 (BEST: 92.04)

beta: 1.0
Epoch: 141/2000, Time elapsed: 41.19s
* Train loss: 87.26   (RE: 55.66, KL: 31.60)
o Val.  loss: 92.08   (RE: 59.64, KL: 32.44)
--> Early stopping: 1/50 (BEST: 92.04)

beta: 1.0
Epoch: 142/2000, Time elapsed: 43.00s
* Train loss: 87.25   (RE: 55.65, KL: 31.60)
o Val.  loss: 92.17   (RE: 59.78, KL: 32.38)
--> Early stopping: 2/50 (BEST: 92.04)

beta: 1.0
Epoch: 143/2000, Time elapsed: 40.98s
* Train loss: 87.18   (RE: 55.65, KL: 31.53)
o Val.  loss: 92.14   (RE: 59.78, KL: 32.35)
--> Early stopping: 3/50 (BEST: 92.04)

beta: 1.0
Epoch: 144/2000, Time elapsed: 41.09s
* Train loss: 87.13   (RE: 55.60, KL: 31.53)
o Val.  loss: 91.98   (RE: 59.92, KL: 32.06)
--> Early stopping: 4/50 (BEST: 92.04)

->model saved<-
beta: 1.0
Epoch: 145/2000, Time elapsed: 42.79s
* Train loss: 87.11   (RE: 55.58, KL: 31.53)
o Val.  loss: 92.06   (RE: 59.79, KL: 32.27)
--> Early stopping: 0/50 (BEST: 91.98)

beta: 1.0
Epoch: 146/2000, Time elapsed: 40.76s
* Train loss: 87.08   (RE: 55.59, KL: 31.49)
o Val.  loss: 91.86   (RE: 59.62, KL: 32.24)
--> Early stopping: 1/50 (BEST: 91.98)

->model saved<-
beta: 1.0
Epoch: 147/2000, Time elapsed: 41.66s
* Train loss: 87.06   (RE: 55.55, KL: 31.50)
o Val.  loss: 91.97   (RE: 59.68, KL: 32.28)
--> Early stopping: 0/50 (BEST: 91.86)

beta: 1.0
Epoch: 148/2000, Time elapsed: 41.49s
* Train loss: 87.03   (RE: 55.57, KL: 31.46)
o Val.  loss: 92.03   (RE: 59.78, KL: 32.25)
--> Early stopping: 1/50 (BEST: 91.86)

beta: 1.0
Epoch: 149/2000, Time elapsed: 41.41s
* Train loss: 87.00   (RE: 55.58, KL: 31.42)
o Val.  loss: 91.87   (RE: 59.66, KL: 32.22)
--> Early stopping: 2/50 (BEST: 91.86)

beta: 1.0
Epoch: 150/2000, Time elapsed: 41.91s
* Train loss: 86.98   (RE: 55.57, KL: 31.41)
o Val.  loss: 92.04   (RE: 59.68, KL: 32.36)
--> Early stopping: 3/50 (BEST: 91.86)

beta: 1.0
Epoch: 151/2000, Time elapsed: 40.42s
* Train loss: 86.93   (RE: 55.57, KL: 31.37)
o Val.  loss: 91.85   (RE: 59.80, KL: 32.05)
--> Early stopping: 4/50 (BEST: 91.86)

->model saved<-
beta: 1.0
Epoch: 152/2000, Time elapsed: 41.65s
* Train loss: 86.92   (RE: 55.55, KL: 31.37)
o Val.  loss: 91.81   (RE: 59.84, KL: 31.97)
--> Early stopping: 0/50 (BEST: 91.85)

->model saved<-
beta: 1.0
Epoch: 153/2000, Time elapsed: 41.36s
* Train loss: 86.83   (RE: 55.50, KL: 31.33)
o Val.  loss: 91.88   (RE: 59.90, KL: 31.98)
--> Early stopping: 0/50 (BEST: 91.81)

beta: 1.0
Epoch: 154/2000, Time elapsed: 41.57s
* Train loss: 86.81   (RE: 55.50, KL: 31.31)
o Val.  loss: 91.81   (RE: 59.46, KL: 32.35)
--> Early stopping: 1/50 (BEST: 91.81)

->model saved<-
beta: 1.0
Epoch: 155/2000, Time elapsed: 42.16s
* Train loss: 86.82   (RE: 55.48, KL: 31.34)
o Val.  loss: 91.78   (RE: 59.50, KL: 32.28)
--> Early stopping: 0/50 (BEST: 91.81)

->model saved<-
beta: 1.0
Epoch: 156/2000, Time elapsed: 41.45s
* Train loss: 86.75   (RE: 55.47, KL: 31.28)
o Val.  loss: 91.97   (RE: 59.66, KL: 32.31)
--> Early stopping: 0/50 (BEST: 91.78)

beta: 1.0
Epoch: 157/2000, Time elapsed: 41.38s
* Train loss: 86.75   (RE: 55.49, KL: 31.26)
o Val.  loss: 91.96   (RE: 59.60, KL: 32.36)
--> Early stopping: 1/50 (BEST: 91.78)

beta: 1.0
Epoch: 158/2000, Time elapsed: 41.93s
* Train loss: 86.73   (RE: 55.46, KL: 31.27)
o Val.  loss: 91.87   (RE: 59.74, KL: 32.13)
--> Early stopping: 2/50 (BEST: 91.78)

beta: 1.0
Epoch: 159/2000, Time elapsed: 41.49s
* Train loss: 86.69   (RE: 55.44, KL: 31.25)
o Val.  loss: 91.80   (RE: 59.76, KL: 32.05)
--> Early stopping: 3/50 (BEST: 91.78)

beta: 1.0
Epoch: 160/2000, Time elapsed: 41.34s
* Train loss: 86.64   (RE: 55.43, KL: 31.21)
o Val.  loss: 91.80   (RE: 59.61, KL: 32.19)
--> Early stopping: 4/50 (BEST: 91.78)

beta: 1.0
Epoch: 161/2000, Time elapsed: 40.95s
* Train loss: 86.61   (RE: 55.42, KL: 31.20)
o Val.  loss: 91.75   (RE: 59.79, KL: 31.96)
--> Early stopping: 5/50 (BEST: 91.78)

->model saved<-
beta: 1.0
Epoch: 162/2000, Time elapsed: 39.70s
* Train loss: 86.60   (RE: 55.41, KL: 31.19)
o Val.  loss: 91.72   (RE: 59.78, KL: 31.94)
--> Early stopping: 0/50 (BEST: 91.75)

->model saved<-
beta: 1.0
Epoch: 163/2000, Time elapsed: 40.86s
* Train loss: 86.59   (RE: 55.40, KL: 31.19)
o Val.  loss: 91.70   (RE: 60.01, KL: 31.69)
--> Early stopping: 0/50 (BEST: 91.72)

->model saved<-
beta: 1.0
Epoch: 164/2000, Time elapsed: 40.91s
* Train loss: 86.52   (RE: 55.38, KL: 31.14)
o Val.  loss: 91.80   (RE: 59.61, KL: 32.18)
--> Early stopping: 0/50 (BEST: 91.70)

beta: 1.0
Epoch: 165/2000, Time elapsed: 40.72s
* Train loss: 86.53   (RE: 55.37, KL: 31.16)
o Val.  loss: 91.76   (RE: 59.79, KL: 31.97)
--> Early stopping: 1/50 (BEST: 91.70)

beta: 1.0
Epoch: 166/2000, Time elapsed: 40.46s
* Train loss: 86.48   (RE: 55.35, KL: 31.13)
o Val.  loss: 91.71   (RE: 59.76, KL: 31.95)
--> Early stopping: 2/50 (BEST: 91.70)

beta: 1.0
Epoch: 167/2000, Time elapsed: 40.77s
* Train loss: 86.48   (RE: 55.34, KL: 31.13)
o Val.  loss: 91.72   (RE: 59.93, KL: 31.78)
--> Early stopping: 3/50 (BEST: 91.70)

beta: 1.0
Epoch: 168/2000, Time elapsed: 40.60s
* Train loss: 86.43   (RE: 55.34, KL: 31.09)
o Val.  loss: 91.69   (RE: 59.76, KL: 31.93)
--> Early stopping: 4/50 (BEST: 91.70)

->model saved<-
beta: 1.0
Epoch: 169/2000, Time elapsed: 39.33s
* Train loss: 86.40   (RE: 55.31, KL: 31.09)
o Val.  loss: 91.81   (RE: 59.84, KL: 31.97)
--> Early stopping: 0/50 (BEST: 91.69)

beta: 1.0
Epoch: 170/2000, Time elapsed: 40.59s
* Train loss: 86.37   (RE: 55.31, KL: 31.06)
o Val.  loss: 91.76   (RE: 59.68, KL: 32.08)
--> Early stopping: 1/50 (BEST: 91.69)

beta: 1.0
Epoch: 171/2000, Time elapsed: 40.62s
* Train loss: 86.37   (RE: 55.30, KL: 31.06)
o Val.  loss: 91.60   (RE: 59.95, KL: 31.66)
--> Early stopping: 2/50 (BEST: 91.69)

->model saved<-
beta: 1.0
Epoch: 172/2000, Time elapsed: 41.61s
* Train loss: 86.30   (RE: 55.26, KL: 31.04)
o Val.  loss: 91.58   (RE: 59.89, KL: 31.70)
--> Early stopping: 0/50 (BEST: 91.60)

->model saved<-
beta: 1.0
Epoch: 173/2000, Time elapsed: 42.02s
* Train loss: 86.31   (RE: 55.26, KL: 31.05)
o Val.  loss: 91.81   (RE: 59.77, KL: 32.05)
--> Early stopping: 0/50 (BEST: 91.58)

beta: 1.0
Epoch: 174/2000, Time elapsed: 41.06s
* Train loss: 86.27   (RE: 55.25, KL: 31.02)
o Val.  loss: 91.78   (RE: 59.58, KL: 32.20)
--> Early stopping: 1/50 (BEST: 91.58)

beta: 1.0
Epoch: 175/2000, Time elapsed: 41.61s
* Train loss: 86.23   (RE: 55.22, KL: 31.01)
o Val.  loss: 91.69   (RE: 59.72, KL: 31.97)
--> Early stopping: 2/50 (BEST: 91.58)

beta: 1.0
Epoch: 176/2000, Time elapsed: 42.30s
* Train loss: 86.20   (RE: 55.20, KL: 31.00)
o Val.  loss: 91.79   (RE: 59.91, KL: 31.88)
--> Early stopping: 3/50 (BEST: 91.58)

beta: 1.0
Epoch: 177/2000, Time elapsed: 41.50s
* Train loss: 86.19   (RE: 55.21, KL: 30.98)
o Val.  loss: 91.71   (RE: 60.02, KL: 31.70)
--> Early stopping: 4/50 (BEST: 91.58)

beta: 1.0
Epoch: 178/2000, Time elapsed: 42.09s
* Train loss: 86.15   (RE: 55.18, KL: 30.97)
o Val.  loss: 91.54   (RE: 59.68, KL: 31.86)
--> Early stopping: 5/50 (BEST: 91.58)

->model saved<-
beta: 1.0
Epoch: 179/2000, Time elapsed: 41.88s
* Train loss: 86.16   (RE: 55.19, KL: 30.97)
o Val.  loss: 91.53   (RE: 59.60, KL: 31.93)
--> Early stopping: 0/50 (BEST: 91.54)

->model saved<-
beta: 1.0
Epoch: 180/2000, Time elapsed: 41.62s
* Train loss: 86.13   (RE: 55.16, KL: 30.97)
o Val.  loss: 91.63   (RE: 59.82, KL: 31.81)
--> Early stopping: 0/50 (BEST: 91.53)

beta: 1.0
Epoch: 181/2000, Time elapsed: 41.68s
* Train loss: 86.10   (RE: 55.15, KL: 30.95)
o Val.  loss: 91.74   (RE: 59.74, KL: 32.01)
--> Early stopping: 1/50 (BEST: 91.53)

beta: 1.0
Epoch: 182/2000, Time elapsed: 41.78s
* Train loss: 86.05   (RE: 55.12, KL: 30.93)
o Val.  loss: 91.60   (RE: 59.79, KL: 31.81)
--> Early stopping: 2/50 (BEST: 91.53)

beta: 1.0
Epoch: 183/2000, Time elapsed: 41.41s
* Train loss: 86.06   (RE: 55.13, KL: 30.93)
o Val.  loss: 91.68   (RE: 59.75, KL: 31.93)
--> Early stopping: 3/50 (BEST: 91.53)

beta: 1.0
Epoch: 184/2000, Time elapsed: 41.58s
* Train loss: 86.03   (RE: 55.11, KL: 30.92)
o Val.  loss: 91.70   (RE: 59.83, KL: 31.87)
--> Early stopping: 4/50 (BEST: 91.53)

beta: 1.0
Epoch: 185/2000, Time elapsed: 41.27s
* Train loss: 85.97   (RE: 55.08, KL: 30.90)
o Val.  loss: 91.68   (RE: 59.76, KL: 31.91)
--> Early stopping: 5/50 (BEST: 91.53)

beta: 1.0
Epoch: 186/2000, Time elapsed: 41.01s
* Train loss: 85.95   (RE: 55.06, KL: 30.89)
o Val.  loss: 91.62   (RE: 59.60, KL: 32.02)
--> Early stopping: 6/50 (BEST: 91.53)

beta: 1.0
Epoch: 187/2000, Time elapsed: 40.47s
* Train loss: 85.93   (RE: 55.07, KL: 30.86)
o Val.  loss: 91.66   (RE: 59.92, KL: 31.73)
--> Early stopping: 7/50 (BEST: 91.53)

beta: 1.0
Epoch: 188/2000, Time elapsed: 40.98s
* Train loss: 85.93   (RE: 55.05, KL: 30.88)
o Val.  loss: 91.68   (RE: 59.70, KL: 31.99)
--> Early stopping: 8/50 (BEST: 91.53)

beta: 1.0
Epoch: 189/2000, Time elapsed: 40.72s
* Train loss: 85.90   (RE: 55.05, KL: 30.85)
o Val.  loss: 91.54   (RE: 59.86, KL: 31.67)
--> Early stopping: 9/50 (BEST: 91.53)

beta: 1.0
Epoch: 190/2000, Time elapsed: 41.99s
* Train loss: 85.87   (RE: 55.01, KL: 30.86)
o Val.  loss: 91.54   (RE: 59.91, KL: 31.64)
--> Early stopping: 10/50 (BEST: 91.53)

beta: 1.0
Epoch: 191/2000, Time elapsed: 41.01s
* Train loss: 85.87   (RE: 55.00, KL: 30.87)
o Val.  loss: 91.62   (RE: 59.86, KL: 31.75)
--> Early stopping: 11/50 (BEST: 91.53)

beta: 1.0
Epoch: 192/2000, Time elapsed: 40.74s
* Train loss: 85.85   (RE: 55.00, KL: 30.85)
o Val.  loss: 91.61   (RE: 59.57, KL: 32.04)
--> Early stopping: 12/50 (BEST: 91.53)

beta: 1.0
Epoch: 193/2000, Time elapsed: 41.69s
* Train loss: 85.80   (RE: 54.97, KL: 30.83)
o Val.  loss: 91.48   (RE: 59.59, KL: 31.89)
--> Early stopping: 13/50 (BEST: 91.53)

->model saved<-
beta: 1.0
Epoch: 194/2000, Time elapsed: 41.21s
* Train loss: 85.78   (RE: 54.94, KL: 30.84)
o Val.  loss: 91.63   (RE: 59.44, KL: 32.19)
--> Early stopping: 0/50 (BEST: 91.48)

beta: 1.0
Epoch: 195/2000, Time elapsed: 41.37s
* Train loss: 85.75   (RE: 54.92, KL: 30.83)
o Val.  loss: 91.63   (RE: 59.83, KL: 31.80)
--> Early stopping: 1/50 (BEST: 91.48)

beta: 1.0
Epoch: 196/2000, Time elapsed: 42.07s
* Train loss: 85.76   (RE: 54.92, KL: 30.84)
o Val.  loss: 91.48   (RE: 59.76, KL: 31.72)
--> Early stopping: 2/50 (BEST: 91.48)

beta: 1.0
Epoch: 197/2000, Time elapsed: 41.88s
* Train loss: 85.73   (RE: 54.93, KL: 30.80)
o Val.  loss: 91.59   (RE: 59.62, KL: 31.97)
--> Early stopping: 3/50 (BEST: 91.48)

beta: 1.0
Epoch: 198/2000, Time elapsed: 41.79s
* Train loss: 85.72   (RE: 54.91, KL: 30.80)
o Val.  loss: 91.68   (RE: 59.69, KL: 31.99)
--> Early stopping: 4/50 (BEST: 91.48)

beta: 1.0
Epoch: 199/2000, Time elapsed: 42.14s
* Train loss: 85.67   (RE: 54.87, KL: 30.80)
o Val.  loss: 91.48   (RE: 60.08, KL: 31.40)
--> Early stopping: 5/50 (BEST: 91.48)

beta: 1.0
Epoch: 200/2000, Time elapsed: 42.60s
* Train loss: 85.66   (RE: 54.90, KL: 30.76)
o Val.  loss: 91.59   (RE: 59.68, KL: 31.90)
--> Early stopping: 6/50 (BEST: 91.48)

beta: 1.0
Epoch: 201/2000, Time elapsed: 41.31s
* Train loss: 85.61   (RE: 54.83, KL: 30.78)
o Val.  loss: 91.51   (RE: 59.65, KL: 31.86)
--> Early stopping: 7/50 (BEST: 91.48)

beta: 1.0
Epoch: 202/2000, Time elapsed: 41.96s
* Train loss: 85.63   (RE: 54.85, KL: 30.78)
o Val.  loss: 91.60   (RE: 59.69, KL: 31.91)
--> Early stopping: 8/50 (BEST: 91.48)

beta: 1.0
Epoch: 203/2000, Time elapsed: 41.15s
* Train loss: 85.59   (RE: 54.83, KL: 30.76)
o Val.  loss: 91.64   (RE: 59.69, KL: 31.95)
--> Early stopping: 9/50 (BEST: 91.48)

beta: 1.0
Epoch: 204/2000, Time elapsed: 41.55s
* Train loss: 85.59   (RE: 54.83, KL: 30.77)
o Val.  loss: 91.74   (RE: 59.74, KL: 31.99)
--> Early stopping: 10/50 (BEST: 91.48)

beta: 1.0
Epoch: 205/2000, Time elapsed: 41.56s
* Train loss: 85.55   (RE: 54.79, KL: 30.75)
o Val.  loss: 91.81   (RE: 59.57, KL: 32.24)
--> Early stopping: 11/50 (BEST: 91.48)

beta: 1.0
Epoch: 206/2000, Time elapsed: 41.44s
* Train loss: 85.55   (RE: 54.77, KL: 30.78)
o Val.  loss: 91.57   (RE: 59.66, KL: 31.92)
--> Early stopping: 12/50 (BEST: 91.48)

beta: 1.0
Epoch: 207/2000, Time elapsed: 40.98s
* Train loss: 85.50   (RE: 54.74, KL: 30.75)
o Val.  loss: 91.53   (RE: 59.76, KL: 31.77)
--> Early stopping: 13/50 (BEST: 91.48)

beta: 1.0
Epoch: 208/2000, Time elapsed: 41.19s
* Train loss: 85.48   (RE: 54.75, KL: 30.73)
o Val.  loss: 91.60   (RE: 59.81, KL: 31.79)
--> Early stopping: 14/50 (BEST: 91.48)

beta: 1.0
Epoch: 209/2000, Time elapsed: 41.27s
* Train loss: 85.45   (RE: 54.71, KL: 30.73)
o Val.  loss: 91.61   (RE: 59.65, KL: 31.96)
--> Early stopping: 15/50 (BEST: 91.48)

beta: 1.0
Epoch: 210/2000, Time elapsed: 39.43s
* Train loss: 85.43   (RE: 54.68, KL: 30.75)
o Val.  loss: 91.52   (RE: 59.68, KL: 31.84)
--> Early stopping: 16/50 (BEST: 91.48)

beta: 1.0
Epoch: 211/2000, Time elapsed: 40.16s
* Train loss: 85.40   (RE: 54.69, KL: 30.72)
o Val.  loss: 91.68   (RE: 59.88, KL: 31.80)
--> Early stopping: 17/50 (BEST: 91.48)

beta: 1.0
Epoch: 212/2000, Time elapsed: 42.54s
* Train loss: 85.41   (RE: 54.70, KL: 30.71)
o Val.  loss: 91.55   (RE: 59.84, KL: 31.71)
--> Early stopping: 18/50 (BEST: 91.48)

beta: 1.0
Epoch: 213/2000, Time elapsed: 41.57s
* Train loss: 85.38   (RE: 54.66, KL: 30.72)
o Val.  loss: 91.56   (RE: 59.97, KL: 31.60)
--> Early stopping: 19/50 (BEST: 91.48)

beta: 1.0
Epoch: 214/2000, Time elapsed: 41.16s
* Train loss: 85.38   (RE: 54.67, KL: 30.71)
o Val.  loss: 91.49   (RE: 59.90, KL: 31.59)
--> Early stopping: 20/50 (BEST: 91.48)

beta: 1.0
Epoch: 215/2000, Time elapsed: 41.74s
* Train loss: 85.33   (RE: 54.65, KL: 30.68)
o Val.  loss: 91.81   (RE: 59.78, KL: 32.03)
--> Early stopping: 21/50 (BEST: 91.48)

beta: 1.0
Epoch: 216/2000, Time elapsed: 39.51s
* Train loss: 85.36   (RE: 54.66, KL: 30.70)
o Val.  loss: 91.58   (RE: 59.99, KL: 31.59)
--> Early stopping: 22/50 (BEST: 91.48)

beta: 1.0
Epoch: 217/2000, Time elapsed: 41.91s
* Train loss: 85.31   (RE: 54.61, KL: 30.70)
o Val.  loss: 91.70   (RE: 59.78, KL: 31.92)
--> Early stopping: 23/50 (BEST: 91.48)

beta: 1.0
Epoch: 218/2000, Time elapsed: 40.91s
* Train loss: 85.30   (RE: 54.62, KL: 30.68)
o Val.  loss: 91.64   (RE: 60.03, KL: 31.61)
--> Early stopping: 24/50 (BEST: 91.48)

beta: 1.0
Epoch: 219/2000, Time elapsed: 42.25s
* Train loss: 85.28   (RE: 54.60, KL: 30.68)
o Val.  loss: 91.61   (RE: 59.70, KL: 31.91)
--> Early stopping: 25/50 (BEST: 91.48)

beta: 1.0
Epoch: 220/2000, Time elapsed: 41.85s
* Train loss: 85.23   (RE: 54.56, KL: 30.67)
o Val.  loss: 91.66   (RE: 59.58, KL: 32.08)
--> Early stopping: 26/50 (BEST: 91.48)

beta: 1.0
Epoch: 221/2000, Time elapsed: 41.92s
* Train loss: 85.24   (RE: 54.59, KL: 30.65)
o Val.  loss: 91.49   (RE: 59.74, KL: 31.75)
--> Early stopping: 27/50 (BEST: 91.48)

beta: 1.0
Epoch: 222/2000, Time elapsed: 41.53s
* Train loss: 85.18   (RE: 54.52, KL: 30.66)
o Val.  loss: 91.54   (RE: 59.77, KL: 31.77)
--> Early stopping: 28/50 (BEST: 91.48)

beta: 1.0
Epoch: 223/2000, Time elapsed: 42.91s
* Train loss: 85.19   (RE: 54.54, KL: 30.65)
o Val.  loss: 91.39   (RE: 59.88, KL: 31.51)
--> Early stopping: 29/50 (BEST: 91.48)

->model saved<-
beta: 1.0
Epoch: 224/2000, Time elapsed: 40.55s
* Train loss: 85.18   (RE: 54.52, KL: 30.66)
o Val.  loss: 91.56   (RE: 59.60, KL: 31.96)
--> Early stopping: 0/50 (BEST: 91.39)

beta: 1.0
Epoch: 225/2000, Time elapsed: 41.69s
* Train loss: 85.15   (RE: 54.51, KL: 30.65)
o Val.  loss: 91.52   (RE: 59.98, KL: 31.54)
--> Early stopping: 1/50 (BEST: 91.39)

beta: 1.0
Epoch: 226/2000, Time elapsed: 42.00s
* Train loss: 85.15   (RE: 54.48, KL: 30.67)
o Val.  loss: 91.57   (RE: 60.03, KL: 31.54)
--> Early stopping: 2/50 (BEST: 91.39)

beta: 1.0
Epoch: 227/2000, Time elapsed: 41.32s
* Train loss: 85.12   (RE: 54.49, KL: 30.62)
o Val.  loss: 91.57   (RE: 59.79, KL: 31.79)
--> Early stopping: 3/50 (BEST: 91.39)

beta: 1.0
Epoch: 228/2000, Time elapsed: 40.83s
* Train loss: 85.09   (RE: 54.45, KL: 30.64)
o Val.  loss: 91.62   (RE: 60.00, KL: 31.62)
--> Early stopping: 4/50 (BEST: 91.39)

beta: 1.0
Epoch: 229/2000, Time elapsed: 42.66s
* Train loss: 85.09   (RE: 54.45, KL: 30.63)
o Val.  loss: 91.70   (RE: 59.73, KL: 31.97)
--> Early stopping: 5/50 (BEST: 91.39)

beta: 1.0
Epoch: 230/2000, Time elapsed: 42.20s
* Train loss: 85.04   (RE: 54.41, KL: 30.63)
o Val.  loss: 91.66   (RE: 59.91, KL: 31.74)
--> Early stopping: 6/50 (BEST: 91.39)

beta: 1.0
Epoch: 231/2000, Time elapsed: 41.98s
* Train loss: 85.03   (RE: 54.45, KL: 30.58)
o Val.  loss: 91.56   (RE: 59.69, KL: 31.88)
--> Early stopping: 7/50 (BEST: 91.39)

beta: 1.0
Epoch: 232/2000, Time elapsed: 41.29s
* Train loss: 85.01   (RE: 54.37, KL: 30.64)
o Val.  loss: 91.65   (RE: 59.90, KL: 31.74)
--> Early stopping: 8/50 (BEST: 91.39)

beta: 1.0
Epoch: 233/2000, Time elapsed: 42.57s
* Train loss: 85.01   (RE: 54.41, KL: 30.61)
o Val.  loss: 91.55   (RE: 59.68, KL: 31.87)
--> Early stopping: 9/50 (BEST: 91.39)

beta: 1.0
Epoch: 234/2000, Time elapsed: 41.56s
* Train loss: 85.01   (RE: 54.37, KL: 30.64)
o Val.  loss: 91.55   (RE: 59.95, KL: 31.60)
--> Early stopping: 10/50 (BEST: 91.39)

beta: 1.0
Epoch: 235/2000, Time elapsed: 41.76s
* Train loss: 84.96   (RE: 54.35, KL: 30.60)
o Val.  loss: 91.60   (RE: 60.04, KL: 31.56)
--> Early stopping: 11/50 (BEST: 91.39)

beta: 1.0
Epoch: 236/2000, Time elapsed: 41.62s
* Train loss: 84.97   (RE: 54.36, KL: 30.61)
o Val.  loss: 91.53   (RE: 59.77, KL: 31.76)
--> Early stopping: 12/50 (BEST: 91.39)

beta: 1.0
Epoch: 237/2000, Time elapsed: 42.23s
* Train loss: 84.93   (RE: 54.32, KL: 30.62)
o Val.  loss: 91.43   (RE: 59.81, KL: 31.62)
--> Early stopping: 13/50 (BEST: 91.39)

beta: 1.0
Epoch: 238/2000, Time elapsed: 41.53s
* Train loss: 84.92   (RE: 54.29, KL: 30.62)
o Val.  loss: 91.60   (RE: 59.86, KL: 31.74)
--> Early stopping: 14/50 (BEST: 91.39)

beta: 1.0
Epoch: 239/2000, Time elapsed: 42.07s
* Train loss: 84.89   (RE: 54.32, KL: 30.58)
o Val.  loss: 91.49   (RE: 59.78, KL: 31.71)
--> Early stopping: 15/50 (BEST: 91.39)

beta: 1.0
Epoch: 240/2000, Time elapsed: 40.68s
* Train loss: 84.88   (RE: 54.31, KL: 30.57)
o Val.  loss: 91.62   (RE: 59.74, KL: 31.89)
--> Early stopping: 16/50 (BEST: 91.39)

beta: 1.0
Epoch: 241/2000, Time elapsed: 41.92s
* Train loss: 84.86   (RE: 54.27, KL: 30.59)
o Val.  loss: 91.65   (RE: 60.12, KL: 31.53)
--> Early stopping: 17/50 (BEST: 91.39)

beta: 1.0
Epoch: 242/2000, Time elapsed: 42.48s
* Train loss: 84.87   (RE: 54.29, KL: 30.58)
o Val.  loss: 91.46   (RE: 59.96, KL: 31.50)
--> Early stopping: 18/50 (BEST: 91.39)

beta: 1.0
Epoch: 243/2000, Time elapsed: 41.24s
* Train loss: 84.80   (RE: 54.23, KL: 30.57)
o Val.  loss: 91.56   (RE: 59.88, KL: 31.68)
--> Early stopping: 19/50 (BEST: 91.39)

beta: 1.0
Epoch: 244/2000, Time elapsed: 43.38s
* Train loss: 84.83   (RE: 54.23, KL: 30.61)
o Val.  loss: 91.41   (RE: 59.91, KL: 31.50)
--> Early stopping: 20/50 (BEST: 91.39)

beta: 1.0
Epoch: 245/2000, Time elapsed: 41.99s
* Train loss: 84.83   (RE: 54.24, KL: 30.60)
o Val.  loss: 91.54   (RE: 60.07, KL: 31.47)
--> Early stopping: 21/50 (BEST: 91.39)

beta: 1.0
Epoch: 246/2000, Time elapsed: 41.27s
* Train loss: 84.78   (RE: 54.23, KL: 30.55)
o Val.  loss: 91.52   (RE: 59.95, KL: 31.57)
--> Early stopping: 22/50 (BEST: 91.39)

beta: 1.0
Epoch: 247/2000, Time elapsed: 40.83s
* Train loss: 84.74   (RE: 54.18, KL: 30.56)
o Val.  loss: 91.51   (RE: 59.99, KL: 31.52)
--> Early stopping: 23/50 (BEST: 91.39)

beta: 1.0
Epoch: 248/2000, Time elapsed: 41.71s
* Train loss: 84.79   (RE: 54.21, KL: 30.58)
o Val.  loss: 91.63   (RE: 59.94, KL: 31.68)
--> Early stopping: 24/50 (BEST: 91.39)

beta: 1.0
Epoch: 249/2000, Time elapsed: 42.90s
* Train loss: 84.74   (RE: 54.18, KL: 30.56)
o Val.  loss: 91.57   (RE: 59.90, KL: 31.67)
--> Early stopping: 25/50 (BEST: 91.39)

beta: 1.0
Epoch: 250/2000, Time elapsed: 41.87s
* Train loss: 84.69   (RE: 54.15, KL: 30.54)
o Val.  loss: 91.62   (RE: 60.05, KL: 31.57)
--> Early stopping: 26/50 (BEST: 91.39)

beta: 1.0
Epoch: 251/2000, Time elapsed: 41.00s
* Train loss: 84.69   (RE: 54.13, KL: 30.57)
o Val.  loss: 91.50   (RE: 59.71, KL: 31.79)
--> Early stopping: 27/50 (BEST: 91.39)

beta: 1.0
Epoch: 252/2000, Time elapsed: 41.65s
* Train loss: 84.69   (RE: 54.14, KL: 30.55)
o Val.  loss: 91.57   (RE: 59.98, KL: 31.59)
--> Early stopping: 28/50 (BEST: 91.39)

beta: 1.0
Epoch: 253/2000, Time elapsed: 41.81s
* Train loss: 84.67   (RE: 54.13, KL: 30.54)
o Val.  loss: 91.47   (RE: 59.98, KL: 31.50)
--> Early stopping: 29/50 (BEST: 91.39)

beta: 1.0
Epoch: 254/2000, Time elapsed: 41.30s
* Train loss: 84.63   (RE: 54.07, KL: 30.56)
o Val.  loss: 91.66   (RE: 59.93, KL: 31.72)
--> Early stopping: 30/50 (BEST: 91.39)

beta: 1.0
Epoch: 255/2000, Time elapsed: 41.39s
* Train loss: 84.62   (RE: 54.07, KL: 30.55)
o Val.  loss: 91.62   (RE: 59.93, KL: 31.69)
--> Early stopping: 31/50 (BEST: 91.39)

beta: 1.0
Epoch: 256/2000, Time elapsed: 41.54s
* Train loss: 84.59   (RE: 54.07, KL: 30.52)
o Val.  loss: 91.53   (RE: 59.93, KL: 31.60)
--> Early stopping: 32/50 (BEST: 91.39)

beta: 1.0
Epoch: 257/2000, Time elapsed: 41.40s
* Train loss: 84.62   (RE: 54.08, KL: 30.54)
o Val.  loss: 91.62   (RE: 60.00, KL: 31.62)
--> Early stopping: 33/50 (BEST: 91.39)

beta: 1.0
Epoch: 258/2000, Time elapsed: 41.60s
* Train loss: 84.55   (RE: 54.04, KL: 30.51)
o Val.  loss: 91.64   (RE: 60.05, KL: 31.59)
--> Early stopping: 34/50 (BEST: 91.39)

beta: 1.0
Epoch: 259/2000, Time elapsed: 42.00s
* Train loss: 84.57   (RE: 54.02, KL: 30.55)
o Val.  loss: 91.52   (RE: 59.86, KL: 31.66)
--> Early stopping: 35/50 (BEST: 91.39)

beta: 1.0
Epoch: 260/2000, Time elapsed: 42.60s
* Train loss: 84.55   (RE: 54.03, KL: 30.52)
o Val.  loss: 91.63   (RE: 59.93, KL: 31.69)
--> Early stopping: 36/50 (BEST: 91.39)

beta: 1.0
Epoch: 261/2000, Time elapsed: 40.97s
* Train loss: 84.55   (RE: 54.03, KL: 30.52)
o Val.  loss: 91.64   (RE: 59.89, KL: 31.75)
--> Early stopping: 37/50 (BEST: 91.39)

beta: 1.0
Epoch: 262/2000, Time elapsed: 41.07s
* Train loss: 84.52   (RE: 54.02, KL: 30.50)
o Val.  loss: 91.63   (RE: 59.91, KL: 31.72)
--> Early stopping: 38/50 (BEST: 91.39)

beta: 1.0
Epoch: 263/2000, Time elapsed: 40.48s
* Train loss: 84.50   (RE: 53.97, KL: 30.53)
o Val.  loss: 91.70   (RE: 60.10, KL: 31.60)
--> Early stopping: 39/50 (BEST: 91.39)

beta: 1.0
Epoch: 264/2000, Time elapsed: 41.95s
* Train loss: 84.48   (RE: 53.96, KL: 30.52)
o Val.  loss: 91.54   (RE: 60.04, KL: 31.50)
--> Early stopping: 40/50 (BEST: 91.39)

beta: 1.0
Epoch: 265/2000, Time elapsed: 42.75s
* Train loss: 84.45   (RE: 53.96, KL: 30.49)
o Val.  loss: 91.58   (RE: 60.09, KL: 31.49)
--> Early stopping: 41/50 (BEST: 91.39)

beta: 1.0
Epoch: 266/2000, Time elapsed: 41.23s
* Train loss: 84.44   (RE: 53.96, KL: 30.48)
o Val.  loss: 91.70   (RE: 60.01, KL: 31.69)
--> Early stopping: 42/50 (BEST: 91.39)

beta: 1.0
Epoch: 267/2000, Time elapsed: 41.12s
* Train loss: 84.46   (RE: 53.93, KL: 30.52)
o Val.  loss: 91.79   (RE: 60.07, KL: 31.72)
--> Early stopping: 43/50 (BEST: 91.39)

beta: 1.0
Epoch: 268/2000, Time elapsed: 41.82s
* Train loss: 84.40   (RE: 53.89, KL: 30.51)
o Val.  loss: 91.80   (RE: 59.67, KL: 32.13)
--> Early stopping: 44/50 (BEST: 91.39)

beta: 1.0
Epoch: 269/2000, Time elapsed: 41.74s
* Train loss: 84.44   (RE: 53.90, KL: 30.53)
o Val.  loss: 91.77   (RE: 59.88, KL: 31.89)
--> Early stopping: 45/50 (BEST: 91.39)

beta: 1.0
Epoch: 270/2000, Time elapsed: 42.41s
* Train loss: 84.42   (RE: 53.92, KL: 30.49)
o Val.  loss: 91.79   (RE: 59.91, KL: 31.88)
--> Early stopping: 46/50 (BEST: 91.39)

beta: 1.0
Epoch: 271/2000, Time elapsed: 40.70s
* Train loss: 84.36   (RE: 53.84, KL: 30.51)
o Val.  loss: 91.66   (RE: 60.10, KL: 31.56)
--> Early stopping: 47/50 (BEST: 91.39)

beta: 1.0
Epoch: 272/2000, Time elapsed: 42.44s
* Train loss: 84.38   (RE: 53.86, KL: 30.51)
o Val.  loss: 91.63   (RE: 59.96, KL: 31.67)
--> Early stopping: 48/50 (BEST: 91.39)

beta: 1.0
Epoch: 273/2000, Time elapsed: 40.65s
* Train loss: 84.35   (RE: 53.84, KL: 30.51)
o Val.  loss: 91.78   (RE: 60.14, KL: 31.64)
--> Early stopping: 49/50 (BEST: 91.39)

beta: 1.0
Epoch: 274/2000, Time elapsed: 41.35s
* Train loss: 84.33   (RE: 53.83, KL: 30.50)
o Val.  loss: 91.68   (RE: 60.14, KL: 31.54)
--> Early stopping: 50/50 (BEST: 91.39)

Test lower-bound value 90.64 in time: 0.60s
Train lower-bound value 0.00 in time: 0.00s
0.00%
1.00%
2.00%
3.00%
4.00%
5.00%
6.00%
7.00%
8.00%
9.00%
10.00%
11.00%
12.00%
13.00%
14.00%
15.00%
16.00%
17.00%
18.00%
19.00%
20.00%
21.00%
22.00%
23.00%
24.00%
25.00%
26.00%
27.00%
28.00%
29.00%
30.00%
31.00%
32.00%
33.00%
34.00%
35.00%
36.00%
37.00%
38.00%
39.00%
40.00%
41.00%
42.00%
43.00%
44.00%
45.00%
46.00%
47.00%
48.00%
49.00%
50.00%
51.00%
52.00%
53.00%
54.00%
55.00%
56.00%
57.00%
58.00%
59.00%
60.00%
61.00%
62.00%
63.00%
64.00%
65.00%
66.00%
67.00%
68.00%
69.00%
70.00%
71.00%
72.00%
73.00%
74.00%
75.00%
76.00%
77.00%
78.00%
79.00%
80.00%
81.00%
82.00%
83.00%
84.00%
85.00%
86.00%
87.00%
88.00%
89.00%
90.00%
91.00%
92.00%
93.00%
94.00%
95.00%
96.00%
97.00%
98.00%
99.00%
Test log_likelihood value 84.48 in time: 2476.61s
Train log_likelihood value 0.00 in time: 0.00s
FINAL EVALUATION ON TEST SET
LogL (TEST): 84.48
LogL (TRAIN): 0.00
ELBO (TEST): 90.64
ELBO (TRAIN): 0.00
Loss: 90.71
RE: 59.35
KL: 31.36
 Training finished in 229.13 minutes. Log saved to: snapshots/2026-01-21 22:29:33_static_mnist_hvae_2level_flowprior_L8_H128_z1_40_seed69/eval_results/runtime.txt
-=-=-=-=-=-=-=-=-=-=-=-=-=-=-=-=-=-=-=-=-=-=-=-=-=-=-=-=-=-=-=-=-=-=-=-=-=-=-=-=-=-=-=-=-=-=-=-=-=-=-=-=-=-=-=-
