load data
create model
Namespace(batch_size=100, test_batch_size=100, epochs=2000, lr=0.0005, early_stopping_epochs=50, warmup=100, no_cuda=False, seed=420, z1_size=40, z2_size=40, input_size=[1, 28, 28], activation=None, number_components=500, pseudoinputs_mean=0.05, pseudoinputs_std=0.01, use_training_data_init=False, model_name='hvae_2level', prior='flowprior', weighted=True, input_type='binary', flow_layers=8, flow_hidden_dim=128, S=5000, MB=100, dataset_name='static_mnist', dynamic_binarization=False, cuda=True, model_signature='2026-01-22 04:27:06')
perform experiment
beta: 0.01
/root/vae_vampprior/models/Model.py:41: UserWarning: The torch.cuda.*DtypeTensor constructors are no longer recommended. It's best to use methods such as torch.tensor(data, dtype=*, device='cuda') to create tensors. (Triggered internally at /pytorch/torch/csrc/tensor/python_tensor.cpp:78.)
  eps = torch.cuda.FloatTensor(std.size()).normal_()
/root/vae_vampprior/utils/optimizer.py:75: UserWarning: This overload of add_ is deprecated:
	add_(Number alpha, Tensor other)
Consider using one of the following signatures instead:
	add_(Tensor other, *, Number alpha = 1) (Triggered internally at /pytorch/torch/csrc/utils/python_arg_parser.cpp:1805.)
  exp_avg.mul_(beta1).add_(1 - beta1, grad)
Epoch: 1/2000, Time elapsed: 41.93s
* Train loss: 108.40   (RE: 106.65, KL: 174.79)
o Val.  loss: 246.41   (RE: 59.81, KL: 186.61)
--> Early stopping: 0/50 (BEST: 100000.00)

->model saved<-
beta: 0.02
Epoch: 2/2000, Time elapsed: 42.05s
* Train loss: 55.04   (RE: 51.30, KL: 187.16)
o Val.  loss: 235.05   (RE: 46.33, KL: 188.72)
--> Early stopping: 0/50 (BEST: 246.41)

->model saved<-
beta: 0.03
Epoch: 3/2000, Time elapsed: 40.09s
* Train loss: 48.11   (RE: 42.77, KL: 177.92)
o Val.  loss: 214.89   (RE: 41.83, KL: 173.06)
--> Early stopping: 0/50 (BEST: 235.05)

->model saved<-
beta: 0.04
Epoch: 4/2000, Time elapsed: 40.62s
* Train loss: 45.97   (RE: 39.35, KL: 165.44)
o Val.  loss: 202.64   (RE: 39.63, KL: 163.02)
--> Early stopping: 0/50 (BEST: 214.89)

->model saved<-
beta: 0.05
Epoch: 5/2000, Time elapsed: 40.83s
* Train loss: 45.21   (RE: 37.50, KL: 154.21)
o Val.  loss: 187.98   (RE: 38.54, KL: 149.44)
--> Early stopping: 0/50 (BEST: 202.64)

->model saved<-
beta: 0.06
Epoch: 6/2000, Time elapsed: 40.66s
* Train loss: 44.91   (RE: 36.54, KL: 139.55)
o Val.  loss: 176.25   (RE: 37.82, KL: 138.43)
--> Early stopping: 0/50 (BEST: 187.98)

->model saved<-
beta: 0.07
Epoch: 7/2000, Time elapsed: 40.98s
* Train loss: 44.88   (RE: 35.62, KL: 132.26)
o Val.  loss: 169.27   (RE: 37.38, KL: 131.89)
--> Early stopping: 0/50 (BEST: 176.25)

->model saved<-
beta: 0.08
Epoch: 8/2000, Time elapsed: 40.68s
* Train loss: 45.11   (RE: 34.95, KL: 127.02)
o Val.  loss: 162.62   (RE: 37.13, KL: 125.49)
--> Early stopping: 0/50 (BEST: 169.27)

->model saved<-
beta: 0.09
Epoch: 9/2000, Time elapsed: 40.84s
* Train loss: 45.48   (RE: 34.45, KL: 122.53)
o Val.  loss: 158.98   (RE: 36.82, KL: 122.17)
--> Early stopping: 0/50 (BEST: 162.62)

->model saved<-
beta: 0.1
Epoch: 10/2000, Time elapsed: 40.49s
* Train loss: 45.95   (RE: 34.08, KL: 118.63)
o Val.  loss: 154.39   (RE: 36.80, KL: 117.59)
--> Early stopping: 0/50 (BEST: 158.98)

->model saved<-
beta: 0.11
Epoch: 11/2000, Time elapsed: 40.83s
* Train loss: 46.47   (RE: 33.82, KL: 114.94)
o Val.  loss: 152.37   (RE: 36.40, KL: 115.97)
--> Early stopping: 0/50 (BEST: 154.39)

->model saved<-
beta: 0.12
Epoch: 12/2000, Time elapsed: 40.87s
* Train loss: 47.05   (RE: 33.65, KL: 111.63)
o Val.  loss: 148.67   (RE: 36.61, KL: 112.06)
--> Early stopping: 0/50 (BEST: 152.37)

->model saved<-
beta: 0.13
Epoch: 13/2000, Time elapsed: 40.87s
* Train loss: 47.65   (RE: 33.53, KL: 108.61)
o Val.  loss: 146.19   (RE: 36.55, KL: 109.64)
--> Early stopping: 0/50 (BEST: 148.67)

->model saved<-
beta: 0.14
Epoch: 14/2000, Time elapsed: 40.20s
* Train loss: 48.26   (RE: 33.43, KL: 105.90)
o Val.  loss: 142.76   (RE: 36.81, KL: 105.96)
--> Early stopping: 0/50 (BEST: 146.19)

->model saved<-
beta: 0.15
Epoch: 15/2000, Time elapsed: 40.58s
* Train loss: 48.88   (RE: 33.38, KL: 103.31)
o Val.  loss: 140.10   (RE: 36.91, KL: 103.19)
--> Early stopping: 0/50 (BEST: 142.76)

->model saved<-
beta: 0.16
Epoch: 16/2000, Time elapsed: 39.79s
* Train loss: 49.54   (RE: 33.41, KL: 100.81)
o Val.  loss: 138.27   (RE: 37.11, KL: 101.16)
--> Early stopping: 0/50 (BEST: 140.10)

->model saved<-
beta: 0.17
Epoch: 17/2000, Time elapsed: 38.53s
* Train loss: 50.17   (RE: 33.42, KL: 98.56)
o Val.  loss: 135.99   (RE: 37.24, KL: 98.75)
--> Early stopping: 0/50 (BEST: 138.27)

->model saved<-
beta: 0.18
Epoch: 18/2000, Time elapsed: 39.19s
* Train loss: 50.88   (RE: 33.51, KL: 96.51)
o Val.  loss: 134.15   (RE: 37.20, KL: 96.95)
--> Early stopping: 0/50 (BEST: 135.99)

->model saved<-
beta: 0.19
Epoch: 19/2000, Time elapsed: 40.79s
* Train loss: 51.51   (RE: 33.58, KL: 94.39)
o Val.  loss: 132.49   (RE: 37.29, KL: 95.19)
--> Early stopping: 0/50 (BEST: 134.15)

->model saved<-
beta: 0.2
Epoch: 20/2000, Time elapsed: 39.64s
* Train loss: 52.16   (RE: 33.66, KL: 92.51)
o Val.  loss: 130.33   (RE: 37.65, KL: 92.68)
--> Early stopping: 0/50 (BEST: 132.49)

->model saved<-
beta: 0.21
Epoch: 21/2000, Time elapsed: 38.16s
* Train loss: 52.84   (RE: 33.79, KL: 90.70)
o Val.  loss: 128.86   (RE: 37.78, KL: 91.08)
--> Early stopping: 0/50 (BEST: 130.33)

->model saved<-
beta: 0.22
Epoch: 22/2000, Time elapsed: 37.43s
* Train loss: 53.52   (RE: 33.94, KL: 88.97)
o Val.  loss: 127.93   (RE: 37.94, KL: 90.00)
--> Early stopping: 0/50 (BEST: 128.86)

->model saved<-
beta: 0.23
Epoch: 23/2000, Time elapsed: 36.99s
* Train loss: 54.15   (RE: 34.08, KL: 87.27)
o Val.  loss: 125.90   (RE: 38.18, KL: 87.72)
--> Early stopping: 0/50 (BEST: 127.93)

->model saved<-
beta: 0.24
Epoch: 24/2000, Time elapsed: 38.80s
* Train loss: 54.79   (RE: 34.24, KL: 85.60)
o Val.  loss: 124.21   (RE: 38.60, KL: 85.61)
--> Early stopping: 0/50 (BEST: 125.90)

->model saved<-
beta: 0.25
Epoch: 25/2000, Time elapsed: 40.12s
* Train loss: 55.44   (RE: 34.42, KL: 84.08)
o Val.  loss: 123.52   (RE: 38.77, KL: 84.76)
--> Early stopping: 0/50 (BEST: 124.21)

->model saved<-
beta: 0.26
Epoch: 26/2000, Time elapsed: 40.38s
* Train loss: 56.10   (RE: 34.62, KL: 82.65)
o Val.  loss: 122.15   (RE: 38.91, KL: 83.24)
--> Early stopping: 0/50 (BEST: 123.52)

->model saved<-
beta: 0.27
Epoch: 27/2000, Time elapsed: 39.92s
* Train loss: 56.74   (RE: 34.80, KL: 81.23)
o Val.  loss: 121.73   (RE: 38.99, KL: 82.73)
--> Early stopping: 0/50 (BEST: 122.15)

->model saved<-
beta: 0.28
Epoch: 28/2000, Time elapsed: 40.01s
* Train loss: 57.35   (RE: 34.99, KL: 79.85)
o Val.  loss: 120.53   (RE: 39.27, KL: 81.25)
--> Early stopping: 0/50 (BEST: 121.73)

->model saved<-
beta: 0.29
Epoch: 29/2000, Time elapsed: 40.32s
* Train loss: 58.00   (RE: 35.21, KL: 78.60)
o Val.  loss: 119.05   (RE: 39.54, KL: 79.51)
--> Early stopping: 0/50 (BEST: 120.53)

->model saved<-
beta: 0.3
Epoch: 30/2000, Time elapsed: 40.73s
* Train loss: 58.58   (RE: 35.41, KL: 77.23)
o Val.  loss: 117.84   (RE: 39.91, KL: 77.92)
--> Early stopping: 0/50 (BEST: 119.05)

->model saved<-
beta: 0.31
Epoch: 31/2000, Time elapsed: 42.41s
* Train loss: 59.21   (RE: 35.64, KL: 76.05)
o Val.  loss: 117.21   (RE: 40.01, KL: 77.20)
--> Early stopping: 0/50 (BEST: 117.84)

->model saved<-
beta: 0.32
Epoch: 32/2000, Time elapsed: 40.97s
* Train loss: 59.81   (RE: 35.86, KL: 74.83)
o Val.  loss: 115.76   (RE: 40.43, KL: 75.32)
--> Early stopping: 0/50 (BEST: 117.21)

->model saved<-
beta: 0.33
Epoch: 33/2000, Time elapsed: 42.07s
* Train loss: 60.45   (RE: 36.13, KL: 73.69)
o Val.  loss: 115.35   (RE: 40.44, KL: 74.91)
--> Early stopping: 0/50 (BEST: 115.76)

->model saved<-
beta: 0.34
Epoch: 34/2000, Time elapsed: 40.79s
* Train loss: 61.01   (RE: 36.36, KL: 72.52)
o Val.  loss: 114.79   (RE: 40.59, KL: 74.20)
--> Early stopping: 0/50 (BEST: 115.35)

->model saved<-
beta: 0.35
Epoch: 35/2000, Time elapsed: 41.80s
* Train loss: 61.62   (RE: 36.62, KL: 71.44)
o Val.  loss: 113.73   (RE: 41.09, KL: 72.64)
--> Early stopping: 0/50 (BEST: 114.79)

->model saved<-
beta: 0.36
Epoch: 36/2000, Time elapsed: 41.06s
* Train loss: 62.20   (RE: 36.85, KL: 70.41)
o Val.  loss: 113.11   (RE: 41.24, KL: 71.87)
--> Early stopping: 0/50 (BEST: 113.73)

->model saved<-
beta: 0.37
Epoch: 37/2000, Time elapsed: 42.15s
* Train loss: 62.78   (RE: 37.12, KL: 69.34)
o Val.  loss: 112.05   (RE: 41.51, KL: 70.54)
--> Early stopping: 0/50 (BEST: 113.11)

->model saved<-
beta: 0.38
Epoch: 38/2000, Time elapsed: 41.83s
* Train loss: 63.35   (RE: 37.36, KL: 68.37)
o Val.  loss: 111.89   (RE: 41.49, KL: 70.40)
--> Early stopping: 0/50 (BEST: 112.05)

->model saved<-
beta: 0.39
Epoch: 39/2000, Time elapsed: 41.50s
* Train loss: 63.91   (RE: 37.61, KL: 67.42)
o Val.  loss: 110.55   (RE: 42.10, KL: 68.44)
--> Early stopping: 0/50 (BEST: 111.89)

->model saved<-
beta: 0.4
Epoch: 40/2000, Time elapsed: 42.39s
* Train loss: 64.46   (RE: 37.86, KL: 66.50)
o Val.  loss: 110.23   (RE: 41.94, KL: 68.30)
--> Early stopping: 0/50 (BEST: 110.55)

->model saved<-
beta: 0.41
Epoch: 41/2000, Time elapsed: 41.94s
* Train loss: 65.01   (RE: 38.13, KL: 65.56)
o Val.  loss: 109.13   (RE: 42.73, KL: 66.41)
--> Early stopping: 0/50 (BEST: 110.23)

->model saved<-
beta: 0.42
Epoch: 42/2000, Time elapsed: 41.99s
* Train loss: 65.55   (RE: 38.40, KL: 64.65)
o Val.  loss: 108.58   (RE: 43.06, KL: 65.53)
--> Early stopping: 0/50 (BEST: 109.13)

->model saved<-
beta: 0.43
Epoch: 43/2000, Time elapsed: 41.85s
* Train loss: 66.10   (RE: 38.67, KL: 63.79)
o Val.  loss: 108.28   (RE: 43.16, KL: 65.12)
--> Early stopping: 0/50 (BEST: 108.58)

->model saved<-
beta: 0.44
Epoch: 44/2000, Time elapsed: 40.80s
* Train loss: 66.62   (RE: 38.96, KL: 62.88)
o Val.  loss: 107.85   (RE: 43.35, KL: 64.51)
--> Early stopping: 0/50 (BEST: 108.28)

->model saved<-
beta: 0.45
Epoch: 45/2000, Time elapsed: 41.72s
* Train loss: 67.19   (RE: 39.23, KL: 62.13)
o Val.  loss: 106.92   (RE: 43.77, KL: 63.15)
--> Early stopping: 0/50 (BEST: 107.85)

->model saved<-
beta: 0.46
Epoch: 46/2000, Time elapsed: 40.61s
* Train loss: 67.68   (RE: 39.51, KL: 61.24)
o Val.  loss: 106.75   (RE: 44.31, KL: 62.44)
--> Early stopping: 0/50 (BEST: 106.92)

->model saved<-
beta: 0.47
Epoch: 47/2000, Time elapsed: 39.69s
* Train loss: 68.22   (RE: 39.78, KL: 60.51)
o Val.  loss: 106.00   (RE: 44.25, KL: 61.75)
--> Early stopping: 0/50 (BEST: 106.75)

->model saved<-
beta: 0.48
Epoch: 48/2000, Time elapsed: 42.66s
* Train loss: 68.71   (RE: 40.05, KL: 59.71)
o Val.  loss: 105.30   (RE: 44.63, KL: 60.67)
--> Early stopping: 0/50 (BEST: 106.00)

->model saved<-
beta: 0.49
Epoch: 49/2000, Time elapsed: 42.33s
* Train loss: 69.22   (RE: 40.35, KL: 58.91)
o Val.  loss: 105.00   (RE: 44.85, KL: 60.16)
--> Early stopping: 0/50 (BEST: 105.30)

->model saved<-
beta: 0.5
Epoch: 50/2000, Time elapsed: 40.54s
* Train loss: 69.74   (RE: 40.63, KL: 58.21)
o Val.  loss: 104.33   (RE: 45.19, KL: 59.14)
--> Early stopping: 0/50 (BEST: 105.00)

->model saved<-
beta: 0.51
Epoch: 51/2000, Time elapsed: 40.84s
* Train loss: 70.22   (RE: 40.92, KL: 57.47)
o Val.  loss: 104.04   (RE: 45.39, KL: 58.65)
--> Early stopping: 0/50 (BEST: 104.33)

->model saved<-
beta: 0.52
Epoch: 52/2000, Time elapsed: 40.05s
* Train loss: 70.71   (RE: 41.20, KL: 56.75)
o Val.  loss: 103.48   (RE: 45.51, KL: 57.97)
--> Early stopping: 0/50 (BEST: 104.04)

->model saved<-
beta: 0.53
Epoch: 53/2000, Time elapsed: 39.88s
* Train loss: 71.22   (RE: 41.51, KL: 56.07)
o Val.  loss: 102.98   (RE: 46.35, KL: 56.62)
--> Early stopping: 0/50 (BEST: 103.48)

->model saved<-
beta: 0.54
Epoch: 54/2000, Time elapsed: 39.48s
* Train loss: 71.69   (RE: 41.79, KL: 55.38)
o Val.  loss: 102.67   (RE: 46.26, KL: 56.40)
--> Early stopping: 0/50 (BEST: 102.98)

->model saved<-
beta: 0.55
Epoch: 55/2000, Time elapsed: 38.52s
* Train loss: 72.16   (RE: 42.08, KL: 54.70)
o Val.  loss: 102.40   (RE: 46.12, KL: 56.28)
--> Early stopping: 0/50 (BEST: 102.67)

->model saved<-
beta: 0.56
Epoch: 56/2000, Time elapsed: 39.70s
* Train loss: 72.64   (RE: 42.37, KL: 54.06)
o Val.  loss: 101.83   (RE: 46.73, KL: 55.10)
--> Early stopping: 0/50 (BEST: 102.40)

->model saved<-
beta: 0.57
Epoch: 57/2000, Time elapsed: 39.67s
* Train loss: 73.10   (RE: 42.68, KL: 53.37)
o Val.  loss: 101.08   (RE: 47.25, KL: 53.83)
--> Early stopping: 0/50 (BEST: 101.83)

->model saved<-
beta: 0.58
Epoch: 58/2000, Time elapsed: 37.81s
* Train loss: 73.53   (RE: 42.95, KL: 52.73)
o Val.  loss: 101.45   (RE: 47.22, KL: 54.23)
--> Early stopping: 0/50 (BEST: 101.08)

beta: 0.59
Epoch: 59/2000, Time elapsed: 38.81s
* Train loss: 74.00   (RE: 43.26, KL: 52.09)
o Val.  loss: 100.75   (RE: 47.53, KL: 53.21)
--> Early stopping: 0/50 (BEST: 101.08)

->model saved<-
beta: 0.6
Epoch: 60/2000, Time elapsed: 39.03s
* Train loss: 74.43   (RE: 43.54, KL: 51.48)
o Val.  loss: 100.60   (RE: 47.80, KL: 52.79)
--> Early stopping: 0/50 (BEST: 100.75)

->model saved<-
beta: 0.61
Epoch: 61/2000, Time elapsed: 38.97s
* Train loss: 74.90   (RE: 43.86, KL: 50.89)
o Val.  loss: 100.03   (RE: 48.07, KL: 51.96)
--> Early stopping: 0/50 (BEST: 100.60)

->model saved<-
beta: 0.62
Epoch: 62/2000, Time elapsed: 38.70s
* Train loss: 75.35   (RE: 44.13, KL: 50.37)
o Val.  loss: 99.70   (RE: 48.64, KL: 51.06)
--> Early stopping: 0/50 (BEST: 100.03)

->model saved<-
beta: 0.63
Epoch: 63/2000, Time elapsed: 39.29s
* Train loss: 75.79   (RE: 44.46, KL: 49.74)
o Val.  loss: 99.49   (RE: 48.78, KL: 50.71)
--> Early stopping: 0/50 (BEST: 99.70)

->model saved<-
beta: 0.64
Epoch: 64/2000, Time elapsed: 39.51s
* Train loss: 76.20   (RE: 44.73, KL: 49.17)
o Val.  loss: 99.08   (RE: 48.92, KL: 50.16)
--> Early stopping: 0/50 (BEST: 99.49)

->model saved<-
beta: 0.65
Epoch: 65/2000, Time elapsed: 39.48s
* Train loss: 76.62   (RE: 45.01, KL: 48.62)
o Val.  loss: 98.84   (RE: 49.45, KL: 49.39)
--> Early stopping: 0/50 (BEST: 99.08)

->model saved<-
beta: 0.66
Epoch: 66/2000, Time elapsed: 39.79s
* Train loss: 77.07   (RE: 45.32, KL: 48.11)
o Val.  loss: 98.89   (RE: 49.24, KL: 49.64)
--> Early stopping: 0/50 (BEST: 98.84)

beta: 0.67
Epoch: 67/2000, Time elapsed: 39.99s
* Train loss: 77.48   (RE: 45.64, KL: 47.52)
o Val.  loss: 98.30   (RE: 50.17, KL: 48.12)
--> Early stopping: 0/50 (BEST: 98.84)

->model saved<-
beta: 0.68
Epoch: 68/2000, Time elapsed: 39.28s
* Train loss: 77.88   (RE: 45.93, KL: 46.98)
o Val.  loss: 97.95   (RE: 50.19, KL: 47.76)
--> Early stopping: 0/50 (BEST: 98.30)

->model saved<-
beta: 0.69
Epoch: 69/2000, Time elapsed: 39.08s
* Train loss: 78.29   (RE: 46.23, KL: 46.46)
o Val.  loss: 97.95   (RE: 50.41, KL: 47.54)
--> Early stopping: 0/50 (BEST: 97.95)

->model saved<-
beta: 0.7
Epoch: 70/2000, Time elapsed: 39.70s
* Train loss: 78.69   (RE: 46.52, KL: 45.95)
o Val.  loss: 97.54   (RE: 50.61, KL: 46.93)
--> Early stopping: 0/50 (BEST: 97.95)

->model saved<-
beta: 0.71
Epoch: 71/2000, Time elapsed: 39.59s
* Train loss: 79.09   (RE: 46.85, KL: 45.41)
o Val.  loss: 97.51   (RE: 51.20, KL: 46.32)
--> Early stopping: 0/50 (BEST: 97.54)

->model saved<-
beta: 0.72
Epoch: 72/2000, Time elapsed: 39.59s
* Train loss: 79.46   (RE: 47.11, KL: 44.93)
o Val.  loss: 97.52   (RE: 51.00, KL: 46.52)
--> Early stopping: 0/50 (BEST: 97.51)

beta: 0.73
Epoch: 73/2000, Time elapsed: 39.60s
* Train loss: 79.88   (RE: 47.43, KL: 44.45)
o Val.  loss: 97.10   (RE: 51.38, KL: 45.72)
--> Early stopping: 0/50 (BEST: 97.51)

->model saved<-
beta: 0.74
Epoch: 74/2000, Time elapsed: 39.64s
* Train loss: 80.25   (RE: 47.70, KL: 43.99)
o Val.  loss: 96.91   (RE: 51.95, KL: 44.96)
--> Early stopping: 0/50 (BEST: 97.10)

->model saved<-
beta: 0.75
Epoch: 75/2000, Time elapsed: 39.06s
* Train loss: 80.62   (RE: 48.01, KL: 43.49)
o Val.  loss: 96.54   (RE: 52.22, KL: 44.31)
--> Early stopping: 0/50 (BEST: 96.91)

->model saved<-
beta: 0.76
Epoch: 76/2000, Time elapsed: 39.26s
* Train loss: 81.04   (RE: 48.32, KL: 43.05)
o Val.  loss: 96.42   (RE: 52.59, KL: 43.83)
--> Early stopping: 0/50 (BEST: 96.54)

->model saved<-
beta: 0.77
Epoch: 77/2000, Time elapsed: 39.79s
* Train loss: 81.38   (RE: 48.62, KL: 42.55)
o Val.  loss: 96.12   (RE: 52.91, KL: 43.21)
--> Early stopping: 0/50 (BEST: 96.42)

->model saved<-
beta: 0.78
Epoch: 78/2000, Time elapsed: 39.54s
* Train loss: 81.76   (RE: 48.92, KL: 42.10)
o Val.  loss: 95.92   (RE: 53.02, KL: 42.90)
--> Early stopping: 0/50 (BEST: 96.12)

->model saved<-
beta: 0.79
Epoch: 79/2000, Time elapsed: 39.97s
* Train loss: 82.12   (RE: 49.23, KL: 41.64)
o Val.  loss: 95.91   (RE: 53.11, KL: 42.80)
--> Early stopping: 0/50 (BEST: 95.92)

->model saved<-
beta: 0.8
Epoch: 80/2000, Time elapsed: 39.74s
* Train loss: 82.50   (RE: 49.52, KL: 41.23)
o Val.  loss: 95.79   (RE: 53.20, KL: 42.59)
--> Early stopping: 0/50 (BEST: 95.91)

->model saved<-
beta: 0.81
Epoch: 81/2000, Time elapsed: 39.38s
* Train loss: 82.87   (RE: 49.83, KL: 40.79)
o Val.  loss: 95.37   (RE: 53.69, KL: 41.68)
--> Early stopping: 0/50 (BEST: 95.79)

->model saved<-
beta: 0.82
Epoch: 82/2000, Time elapsed: 39.55s
* Train loss: 83.20   (RE: 50.11, KL: 40.35)
o Val.  loss: 95.45   (RE: 53.99, KL: 41.45)
--> Early stopping: 0/50 (BEST: 95.37)

beta: 0.83
Epoch: 83/2000, Time elapsed: 40.68s
* Train loss: 83.54   (RE: 50.40, KL: 39.93)
o Val.  loss: 95.13   (RE: 54.29, KL: 40.84)
--> Early stopping: 0/50 (BEST: 95.37)

->model saved<-
beta: 0.84
Epoch: 84/2000, Time elapsed: 39.14s
* Train loss: 83.89   (RE: 50.70, KL: 39.51)
o Val.  loss: 95.07   (RE: 54.65, KL: 40.42)
--> Early stopping: 0/50 (BEST: 95.13)

->model saved<-
beta: 0.85
Epoch: 85/2000, Time elapsed: 39.69s
* Train loss: 84.24   (RE: 50.98, KL: 39.13)
o Val.  loss: 94.85   (RE: 54.88, KL: 39.97)
--> Early stopping: 0/50 (BEST: 95.07)

->model saved<-
beta: 0.86
Epoch: 86/2000, Time elapsed: 39.33s
* Train loss: 84.57   (RE: 51.29, KL: 38.69)
o Val.  loss: 94.87   (RE: 55.16, KL: 39.71)
--> Early stopping: 0/50 (BEST: 94.85)

beta: 0.87
Epoch: 87/2000, Time elapsed: 39.63s
* Train loss: 84.87   (RE: 51.58, KL: 38.27)
o Val.  loss: 94.69   (RE: 55.40, KL: 39.30)
--> Early stopping: 0/50 (BEST: 94.85)

->model saved<-
beta: 0.88
Epoch: 88/2000, Time elapsed: 39.63s
* Train loss: 85.24   (RE: 51.85, KL: 37.93)
o Val.  loss: 94.46   (RE: 55.52, KL: 38.94)
--> Early stopping: 0/50 (BEST: 94.69)

->model saved<-
beta: 0.89
Epoch: 89/2000, Time elapsed: 39.74s
* Train loss: 85.55   (RE: 52.12, KL: 37.56)
o Val.  loss: 94.29   (RE: 56.11, KL: 38.18)
--> Early stopping: 0/50 (BEST: 94.46)

->model saved<-
beta: 0.9
Epoch: 90/2000, Time elapsed: 39.26s
* Train loss: 85.88   (RE: 52.43, KL: 37.17)
o Val.  loss: 94.17   (RE: 56.32, KL: 37.85)
--> Early stopping: 0/50 (BEST: 94.29)

->model saved<-
beta: 0.91
Epoch: 91/2000, Time elapsed: 39.70s
* Train loss: 86.18   (RE: 52.71, KL: 36.78)
o Val.  loss: 94.09   (RE: 56.16, KL: 37.93)
--> Early stopping: 0/50 (BEST: 94.17)

->model saved<-
beta: 0.92
Epoch: 92/2000, Time elapsed: 39.46s
* Train loss: 86.51   (RE: 52.99, KL: 36.44)
o Val.  loss: 93.98   (RE: 56.51, KL: 37.47)
--> Early stopping: 0/50 (BEST: 94.09)

->model saved<-
beta: 0.93
Epoch: 93/2000, Time elapsed: 39.81s
* Train loss: 86.83   (RE: 53.28, KL: 36.08)
o Val.  loss: 93.95   (RE: 57.00, KL: 36.95)
--> Early stopping: 0/50 (BEST: 93.98)

->model saved<-
beta: 0.94
Epoch: 94/2000, Time elapsed: 39.74s
* Train loss: 87.14   (RE: 53.55, KL: 35.74)
o Val.  loss: 93.73   (RE: 57.23, KL: 36.51)
--> Early stopping: 0/50 (BEST: 93.95)

->model saved<-
beta: 0.95
Epoch: 95/2000, Time elapsed: 39.57s
* Train loss: 87.42   (RE: 53.80, KL: 35.39)
o Val.  loss: 93.60   (RE: 57.49, KL: 36.11)
--> Early stopping: 0/50 (BEST: 93.73)

->model saved<-
beta: 0.96
Epoch: 96/2000, Time elapsed: 39.44s
* Train loss: 87.75   (RE: 54.09, KL: 35.06)
o Val.  loss: 93.77   (RE: 57.58, KL: 36.20)
--> Early stopping: 0/50 (BEST: 93.60)

beta: 0.97
Epoch: 97/2000, Time elapsed: 39.40s
* Train loss: 88.06   (RE: 54.38, KL: 34.72)
o Val.  loss: 93.44   (RE: 58.25, KL: 35.19)
--> Early stopping: 0/50 (BEST: 93.60)

->model saved<-
beta: 0.98
Epoch: 98/2000, Time elapsed: 39.77s
* Train loss: 88.29   (RE: 54.63, KL: 34.35)
o Val.  loss: 93.39   (RE: 58.42, KL: 34.97)
--> Early stopping: 0/50 (BEST: 93.44)

->model saved<-
beta: 0.99
Epoch: 99/2000, Time elapsed: 38.85s
* Train loss: 88.65   (RE: 54.92, KL: 34.07)
o Val.  loss: 93.30   (RE: 58.45, KL: 34.85)
--> Early stopping: 0/50 (BEST: 93.39)

->model saved<-
beta: 1.0
Epoch: 100/2000, Time elapsed: 39.26s
* Train loss: 88.89   (RE: 55.18, KL: 33.71)
o Val.  loss: 93.35   (RE: 59.08, KL: 34.27)
--> Early stopping: 0/50 (BEST: 93.30)

beta: 1.0
Epoch: 101/2000, Time elapsed: 39.37s
* Train loss: 88.85   (RE: 55.29, KL: 33.55)
o Val.  loss: 93.20   (RE: 58.86, KL: 34.34)
--> Early stopping: 1/50 (BEST: 93.30)

->model saved<-
beta: 1.0
Epoch: 102/2000, Time elapsed: 39.25s
* Train loss: 88.83   (RE: 55.37, KL: 33.46)
o Val.  loss: 93.08   (RE: 59.04, KL: 34.04)
--> Early stopping: 0/50 (BEST: 93.20)

->model saved<-
beta: 1.0
Epoch: 103/2000, Time elapsed: 39.50s
* Train loss: 88.74   (RE: 55.44, KL: 33.30)
o Val.  loss: 93.20   (RE: 59.13, KL: 34.07)
--> Early stopping: 0/50 (BEST: 93.08)

beta: 1.0
Epoch: 104/2000, Time elapsed: 39.18s
* Train loss: 88.70   (RE: 55.49, KL: 33.21)
o Val.  loss: 93.04   (RE: 59.06, KL: 33.98)
--> Early stopping: 1/50 (BEST: 93.08)

->model saved<-
beta: 1.0
Epoch: 105/2000, Time elapsed: 38.81s
* Train loss: 88.64   (RE: 55.52, KL: 33.12)
o Val.  loss: 93.01   (RE: 59.13, KL: 33.88)
--> Early stopping: 0/50 (BEST: 93.04)

->model saved<-
beta: 1.0
Epoch: 106/2000, Time elapsed: 39.55s
* Train loss: 88.59   (RE: 55.56, KL: 33.03)
o Val.  loss: 92.98   (RE: 59.36, KL: 33.61)
--> Early stopping: 0/50 (BEST: 93.01)

->model saved<-
beta: 1.0
Epoch: 107/2000, Time elapsed: 39.46s
* Train loss: 88.52   (RE: 55.55, KL: 32.98)
o Val.  loss: 92.99   (RE: 58.99, KL: 34.00)
--> Early stopping: 0/50 (BEST: 92.98)

beta: 1.0
Epoch: 108/2000, Time elapsed: 39.58s
* Train loss: 88.52   (RE: 55.61, KL: 32.91)
o Val.  loss: 93.00   (RE: 59.26, KL: 33.74)
--> Early stopping: 1/50 (BEST: 92.98)

beta: 1.0
Epoch: 109/2000, Time elapsed: 37.39s
* Train loss: 88.44   (RE: 55.60, KL: 32.83)
o Val.  loss: 92.84   (RE: 59.09, KL: 33.75)
--> Early stopping: 2/50 (BEST: 92.98)

->model saved<-
beta: 1.0
Epoch: 110/2000, Time elapsed: 38.94s
* Train loss: 88.41   (RE: 55.64, KL: 32.77)
o Val.  loss: 92.76   (RE: 59.04, KL: 33.72)
--> Early stopping: 0/50 (BEST: 92.84)

->model saved<-
beta: 1.0
Epoch: 111/2000, Time elapsed: 39.78s
* Train loss: 88.34   (RE: 55.64, KL: 32.70)
o Val.  loss: 92.64   (RE: 59.29, KL: 33.35)
--> Early stopping: 0/50 (BEST: 92.76)

->model saved<-
beta: 1.0
Epoch: 112/2000, Time elapsed: 38.59s
* Train loss: 88.29   (RE: 55.66, KL: 32.63)
o Val.  loss: 92.67   (RE: 59.34, KL: 33.33)
--> Early stopping: 0/50 (BEST: 92.64)

beta: 1.0
Epoch: 113/2000, Time elapsed: 39.12s
* Train loss: 88.25   (RE: 55.67, KL: 32.58)
o Val.  loss: 92.60   (RE: 59.40, KL: 33.21)
--> Early stopping: 1/50 (BEST: 92.64)

->model saved<-
beta: 1.0
Epoch: 114/2000, Time elapsed: 37.91s
* Train loss: 88.19   (RE: 55.67, KL: 32.52)
o Val.  loss: 92.75   (RE: 59.41, KL: 33.34)
--> Early stopping: 0/50 (BEST: 92.60)

beta: 1.0
Epoch: 115/2000, Time elapsed: 38.42s
* Train loss: 88.15   (RE: 55.69, KL: 32.47)
o Val.  loss: 92.74   (RE: 59.29, KL: 33.45)
--> Early stopping: 1/50 (BEST: 92.60)

beta: 1.0
Epoch: 116/2000, Time elapsed: 38.14s
* Train loss: 88.11   (RE: 55.68, KL: 32.43)
o Val.  loss: 92.42   (RE: 59.51, KL: 32.91)
--> Early stopping: 2/50 (BEST: 92.60)

->model saved<-
beta: 1.0
Epoch: 117/2000, Time elapsed: 39.32s
* Train loss: 88.07   (RE: 55.70, KL: 32.37)
o Val.  loss: 92.63   (RE: 59.30, KL: 33.33)
--> Early stopping: 0/50 (BEST: 92.42)

beta: 1.0
Epoch: 118/2000, Time elapsed: 40.60s
* Train loss: 88.02   (RE: 55.67, KL: 32.35)
o Val.  loss: 92.52   (RE: 59.43, KL: 33.09)
--> Early stopping: 1/50 (BEST: 92.42)

beta: 1.0
Epoch: 119/2000, Time elapsed: 40.07s
* Train loss: 87.97   (RE: 55.68, KL: 32.28)
o Val.  loss: 92.38   (RE: 59.41, KL: 32.97)
--> Early stopping: 2/50 (BEST: 92.42)

->model saved<-
beta: 1.0
Epoch: 120/2000, Time elapsed: 38.79s
* Train loss: 87.97   (RE: 55.70, KL: 32.27)
o Val.  loss: 92.48   (RE: 59.55, KL: 32.93)
--> Early stopping: 0/50 (BEST: 92.38)

beta: 1.0
Epoch: 121/2000, Time elapsed: 39.89s
* Train loss: 87.93   (RE: 55.71, KL: 32.22)
o Val.  loss: 92.49   (RE: 59.06, KL: 33.43)
--> Early stopping: 1/50 (BEST: 92.38)

beta: 1.0
Epoch: 122/2000, Time elapsed: 39.76s
* Train loss: 87.85   (RE: 55.68, KL: 32.17)
o Val.  loss: 92.46   (RE: 59.44, KL: 33.02)
--> Early stopping: 2/50 (BEST: 92.38)

beta: 1.0
Epoch: 123/2000, Time elapsed: 40.32s
* Train loss: 87.80   (RE: 55.69, KL: 32.11)
o Val.  loss: 92.55   (RE: 59.46, KL: 33.09)
--> Early stopping: 3/50 (BEST: 92.38)

beta: 1.0
Epoch: 124/2000, Time elapsed: 40.22s
* Train loss: 87.77   (RE: 55.69, KL: 32.08)
o Val.  loss: 92.45   (RE: 59.45, KL: 33.00)
--> Early stopping: 4/50 (BEST: 92.38)

beta: 1.0
Epoch: 125/2000, Time elapsed: 39.48s
* Train loss: 87.75   (RE: 55.66, KL: 32.09)
o Val.  loss: 92.25   (RE: 59.27, KL: 32.98)
--> Early stopping: 5/50 (BEST: 92.38)

->model saved<-
beta: 1.0
Epoch: 126/2000, Time elapsed: 38.95s
* Train loss: 87.68   (RE: 55.68, KL: 32.00)
o Val.  loss: 92.21   (RE: 59.76, KL: 32.45)
--> Early stopping: 0/50 (BEST: 92.25)

->model saved<-
beta: 1.0
Epoch: 127/2000, Time elapsed: 39.08s
* Train loss: 87.64   (RE: 55.66, KL: 31.98)
o Val.  loss: 92.19   (RE: 59.96, KL: 32.22)
--> Early stopping: 0/50 (BEST: 92.21)

->model saved<-
beta: 1.0
Epoch: 128/2000, Time elapsed: 38.64s
* Train loss: 87.64   (RE: 55.66, KL: 31.97)
o Val.  loss: 92.30   (RE: 59.47, KL: 32.82)
--> Early stopping: 0/50 (BEST: 92.19)

beta: 1.0
Epoch: 129/2000, Time elapsed: 37.74s
* Train loss: 87.62   (RE: 55.68, KL: 31.93)
o Val.  loss: 92.27   (RE: 59.51, KL: 32.76)
--> Early stopping: 1/50 (BEST: 92.19)

beta: 1.0
Epoch: 130/2000, Time elapsed: 37.10s
* Train loss: 87.56   (RE: 55.65, KL: 31.92)
o Val.  loss: 92.21   (RE: 59.40, KL: 32.82)
--> Early stopping: 2/50 (BEST: 92.19)

beta: 1.0
Epoch: 131/2000, Time elapsed: 38.66s
* Train loss: 87.50   (RE: 55.67, KL: 31.84)
o Val.  loss: 92.19   (RE: 59.60, KL: 32.60)
--> Early stopping: 3/50 (BEST: 92.19)

beta: 1.0
Epoch: 132/2000, Time elapsed: 39.78s
* Train loss: 87.45   (RE: 55.63, KL: 31.82)
o Val.  loss: 92.25   (RE: 59.63, KL: 32.62)
--> Early stopping: 4/50 (BEST: 92.19)

beta: 1.0
Epoch: 133/2000, Time elapsed: 39.57s
* Train loss: 87.41   (RE: 55.63, KL: 31.79)
o Val.  loss: 92.12   (RE: 59.59, KL: 32.53)
--> Early stopping: 5/50 (BEST: 92.19)

->model saved<-
beta: 1.0
Epoch: 134/2000, Time elapsed: 40.00s
* Train loss: 87.41   (RE: 55.62, KL: 31.79)
o Val.  loss: 92.29   (RE: 59.49, KL: 32.80)
--> Early stopping: 0/50 (BEST: 92.12)

beta: 1.0
Epoch: 135/2000, Time elapsed: 39.93s
* Train loss: 87.34   (RE: 55.62, KL: 31.73)
o Val.  loss: 92.07   (RE: 59.42, KL: 32.65)
--> Early stopping: 1/50 (BEST: 92.12)

->model saved<-
beta: 1.0
Epoch: 136/2000, Time elapsed: 39.00s
* Train loss: 87.35   (RE: 55.62, KL: 31.73)
o Val.  loss: 92.23   (RE: 59.53, KL: 32.71)
--> Early stopping: 0/50 (BEST: 92.07)

beta: 1.0
Epoch: 137/2000, Time elapsed: 39.04s
* Train loss: 87.29   (RE: 55.61, KL: 31.67)
o Val.  loss: 91.99   (RE: 59.49, KL: 32.50)
--> Early stopping: 1/50 (BEST: 92.07)

->model saved<-
beta: 1.0
Epoch: 138/2000, Time elapsed: 40.06s
* Train loss: 87.27   (RE: 55.59, KL: 31.68)
o Val.  loss: 92.19   (RE: 59.80, KL: 32.39)
--> Early stopping: 0/50 (BEST: 91.99)

beta: 1.0
Epoch: 139/2000, Time elapsed: 39.96s
* Train loss: 87.24   (RE: 55.59, KL: 31.65)
o Val.  loss: 91.98   (RE: 59.65, KL: 32.33)
--> Early stopping: 1/50 (BEST: 91.99)

->model saved<-
beta: 1.0
Epoch: 140/2000, Time elapsed: 40.21s
* Train loss: 87.19   (RE: 55.57, KL: 31.61)
o Val.  loss: 92.05   (RE: 59.72, KL: 32.33)
--> Early stopping: 0/50 (BEST: 91.98)

beta: 1.0
Epoch: 141/2000, Time elapsed: 39.38s
* Train loss: 87.16   (RE: 55.57, KL: 31.58)
o Val.  loss: 92.12   (RE: 59.55, KL: 32.57)
--> Early stopping: 1/50 (BEST: 91.98)

beta: 1.0
Epoch: 142/2000, Time elapsed: 39.74s
* Train loss: 87.11   (RE: 55.53, KL: 31.58)
o Val.  loss: 91.86   (RE: 59.58, KL: 32.28)
--> Early stopping: 2/50 (BEST: 91.98)

->model saved<-
beta: 1.0
Epoch: 143/2000, Time elapsed: 39.63s
* Train loss: 87.09   (RE: 55.53, KL: 31.56)
o Val.  loss: 92.03   (RE: 59.60, KL: 32.43)
--> Early stopping: 0/50 (BEST: 91.86)

beta: 1.0
Epoch: 144/2000, Time elapsed: 39.79s
* Train loss: 87.08   (RE: 55.54, KL: 31.54)
o Val.  loss: 92.00   (RE: 59.51, KL: 32.49)
--> Early stopping: 1/50 (BEST: 91.86)

beta: 1.0
Epoch: 145/2000, Time elapsed: 39.56s
* Train loss: 87.04   (RE: 55.53, KL: 31.50)
o Val.  loss: 91.89   (RE: 59.35, KL: 32.54)
--> Early stopping: 2/50 (BEST: 91.86)

beta: 1.0
Epoch: 146/2000, Time elapsed: 39.92s
* Train loss: 87.02   (RE: 55.53, KL: 31.49)
o Val.  loss: 91.86   (RE: 59.62, KL: 32.23)
--> Early stopping: 3/50 (BEST: 91.86)

->model saved<-
beta: 1.0
Epoch: 147/2000, Time elapsed: 40.02s
* Train loss: 86.96   (RE: 55.51, KL: 31.45)
o Val.  loss: 91.90   (RE: 59.49, KL: 32.41)
--> Early stopping: 0/50 (BEST: 91.86)

beta: 1.0
Epoch: 148/2000, Time elapsed: 40.01s
* Train loss: 86.96   (RE: 55.52, KL: 31.45)
o Val.  loss: 91.76   (RE: 59.51, KL: 32.25)
--> Early stopping: 1/50 (BEST: 91.86)

->model saved<-
beta: 1.0
Epoch: 149/2000, Time elapsed: 39.20s
* Train loss: 86.87   (RE: 55.48, KL: 31.39)
o Val.  loss: 91.84   (RE: 59.72, KL: 32.12)
--> Early stopping: 0/50 (BEST: 91.76)

beta: 1.0
Epoch: 150/2000, Time elapsed: 36.71s
* Train loss: 86.88   (RE: 55.48, KL: 31.40)
o Val.  loss: 91.79   (RE: 59.51, KL: 32.28)
--> Early stopping: 1/50 (BEST: 91.76)

beta: 1.0
Epoch: 151/2000, Time elapsed: 39.27s
* Train loss: 86.83   (RE: 55.43, KL: 31.40)
o Val.  loss: 91.87   (RE: 59.76, KL: 32.11)
--> Early stopping: 2/50 (BEST: 91.76)

beta: 1.0
Epoch: 152/2000, Time elapsed: 39.77s
* Train loss: 86.80   (RE: 55.42, KL: 31.38)
o Val.  loss: 91.79   (RE: 59.71, KL: 32.08)
--> Early stopping: 3/50 (BEST: 91.76)

beta: 1.0
Epoch: 153/2000, Time elapsed: 39.84s
* Train loss: 86.80   (RE: 55.45, KL: 31.36)
o Val.  loss: 91.96   (RE: 59.76, KL: 32.20)
--> Early stopping: 4/50 (BEST: 91.76)

beta: 1.0
Epoch: 154/2000, Time elapsed: 39.69s
* Train loss: 86.75   (RE: 55.44, KL: 31.31)
o Val.  loss: 91.99   (RE: 59.77, KL: 32.23)
--> Early stopping: 5/50 (BEST: 91.76)

beta: 1.0
Epoch: 155/2000, Time elapsed: 39.73s
* Train loss: 86.71   (RE: 55.41, KL: 31.30)
o Val.  loss: 91.61   (RE: 59.48, KL: 32.13)
--> Early stopping: 6/50 (BEST: 91.76)

->model saved<-
beta: 1.0
Epoch: 156/2000, Time elapsed: 39.80s
* Train loss: 86.67   (RE: 55.39, KL: 31.28)
o Val.  loss: 91.79   (RE: 59.79, KL: 32.00)
--> Early stopping: 0/50 (BEST: 91.61)

beta: 1.0
Epoch: 157/2000, Time elapsed: 39.49s
* Train loss: 86.65   (RE: 55.38, KL: 31.28)
o Val.  loss: 91.83   (RE: 59.78, KL: 32.05)
--> Early stopping: 1/50 (BEST: 91.61)

beta: 1.0
Epoch: 158/2000, Time elapsed: 40.46s
* Train loss: 86.63   (RE: 55.40, KL: 31.23)
o Val.  loss: 91.92   (RE: 59.47, KL: 32.45)
--> Early stopping: 2/50 (BEST: 91.61)

beta: 1.0
Epoch: 159/2000, Time elapsed: 39.62s
* Train loss: 86.61   (RE: 55.36, KL: 31.25)
o Val.  loss: 91.71   (RE: 59.69, KL: 32.02)
--> Early stopping: 3/50 (BEST: 91.61)

beta: 1.0
Epoch: 160/2000, Time elapsed: 39.67s
* Train loss: 86.57   (RE: 55.36, KL: 31.21)
o Val.  loss: 91.86   (RE: 59.64, KL: 32.22)
--> Early stopping: 4/50 (BEST: 91.61)

beta: 1.0
Epoch: 161/2000, Time elapsed: 38.55s
* Train loss: 86.52   (RE: 55.34, KL: 31.17)
o Val.  loss: 91.69   (RE: 59.64, KL: 32.04)
--> Early stopping: 5/50 (BEST: 91.61)

beta: 1.0
Epoch: 162/2000, Time elapsed: 39.80s
* Train loss: 86.51   (RE: 55.33, KL: 31.18)
o Val.  loss: 91.81   (RE: 59.93, KL: 31.87)
--> Early stopping: 6/50 (BEST: 91.61)

beta: 1.0
Epoch: 163/2000, Time elapsed: 40.40s
* Train loss: 86.47   (RE: 55.32, KL: 31.15)
o Val.  loss: 91.78   (RE: 59.66, KL: 32.12)
--> Early stopping: 7/50 (BEST: 91.61)

beta: 1.0
Epoch: 164/2000, Time elapsed: 40.60s
* Train loss: 86.45   (RE: 55.30, KL: 31.15)
o Val.  loss: 91.65   (RE: 59.78, KL: 31.88)
--> Early stopping: 8/50 (BEST: 91.61)

beta: 1.0
Epoch: 165/2000, Time elapsed: 39.47s
* Train loss: 86.43   (RE: 55.31, KL: 31.12)
o Val.  loss: 91.52   (RE: 59.62, KL: 31.90)
--> Early stopping: 9/50 (BEST: 91.61)

->model saved<-
beta: 1.0
Epoch: 166/2000, Time elapsed: 38.78s
* Train loss: 86.41   (RE: 55.27, KL: 31.14)
o Val.  loss: 91.74   (RE: 59.61, KL: 32.13)
--> Early stopping: 0/50 (BEST: 91.52)

beta: 1.0
Epoch: 167/2000, Time elapsed: 38.69s
* Train loss: 86.40   (RE: 55.26, KL: 31.14)
o Val.  loss: 91.61   (RE: 59.54, KL: 32.07)
--> Early stopping: 1/50 (BEST: 91.52)

beta: 1.0
Epoch: 168/2000, Time elapsed: 37.12s
* Train loss: 86.36   (RE: 55.27, KL: 31.10)
o Val.  loss: 91.55   (RE: 59.35, KL: 32.20)
--> Early stopping: 2/50 (BEST: 91.52)

beta: 1.0
Epoch: 169/2000, Time elapsed: 37.58s
* Train loss: 86.32   (RE: 55.25, KL: 31.07)
o Val.  loss: 91.66   (RE: 59.81, KL: 31.85)
--> Early stopping: 3/50 (BEST: 91.52)

beta: 1.0
Epoch: 170/2000, Time elapsed: 37.44s
* Train loss: 86.29   (RE: 55.22, KL: 31.07)
o Val.  loss: 91.62   (RE: 59.84, KL: 31.78)
--> Early stopping: 4/50 (BEST: 91.52)

beta: 1.0
Epoch: 171/2000, Time elapsed: 38.25s
* Train loss: 86.29   (RE: 55.20, KL: 31.09)
o Val.  loss: 91.60   (RE: 59.66, KL: 31.93)
--> Early stopping: 5/50 (BEST: 91.52)

beta: 1.0
Epoch: 172/2000, Time elapsed: 39.26s
* Train loss: 86.25   (RE: 55.21, KL: 31.04)
o Val.  loss: 91.63   (RE: 59.87, KL: 31.76)
--> Early stopping: 6/50 (BEST: 91.52)

beta: 1.0
Epoch: 173/2000, Time elapsed: 39.67s
* Train loss: 86.25   (RE: 55.18, KL: 31.07)
o Val.  loss: 91.62   (RE: 59.82, KL: 31.80)
--> Early stopping: 7/50 (BEST: 91.52)

beta: 1.0
Epoch: 174/2000, Time elapsed: 39.67s
* Train loss: 86.21   (RE: 55.18, KL: 31.03)
o Val.  loss: 91.61   (RE: 59.57, KL: 32.04)
--> Early stopping: 8/50 (BEST: 91.52)

beta: 1.0
Epoch: 175/2000, Time elapsed: 40.60s
* Train loss: 86.19   (RE: 55.18, KL: 31.00)
o Val.  loss: 91.56   (RE: 59.75, KL: 31.80)
--> Early stopping: 9/50 (BEST: 91.52)

beta: 1.0
Epoch: 176/2000, Time elapsed: 40.32s
* Train loss: 86.16   (RE: 55.14, KL: 31.02)
o Val.  loss: 91.66   (RE: 59.79, KL: 31.87)
--> Early stopping: 10/50 (BEST: 91.52)

beta: 1.0
Epoch: 177/2000, Time elapsed: 40.59s
* Train loss: 86.12   (RE: 55.12, KL: 31.00)
o Val.  loss: 91.60   (RE: 59.75, KL: 31.85)
--> Early stopping: 11/50 (BEST: 91.52)

beta: 1.0
Epoch: 178/2000, Time elapsed: 40.15s
* Train loss: 86.10   (RE: 55.12, KL: 30.97)
o Val.  loss: 91.68   (RE: 59.61, KL: 32.07)
--> Early stopping: 12/50 (BEST: 91.52)

beta: 1.0
Epoch: 179/2000, Time elapsed: 38.53s
* Train loss: 86.07   (RE: 55.11, KL: 30.97)
o Val.  loss: 91.79   (RE: 59.89, KL: 31.90)
--> Early stopping: 13/50 (BEST: 91.52)

beta: 1.0
Epoch: 180/2000, Time elapsed: 37.77s
* Train loss: 86.04   (RE: 55.07, KL: 30.97)
o Val.  loss: 91.64   (RE: 59.88, KL: 31.76)
--> Early stopping: 14/50 (BEST: 91.52)

beta: 1.0
Epoch: 181/2000, Time elapsed: 39.89s
* Train loss: 86.03   (RE: 55.08, KL: 30.95)
o Val.  loss: 91.59   (RE: 59.64, KL: 31.96)
--> Early stopping: 15/50 (BEST: 91.52)

beta: 1.0
Epoch: 182/2000, Time elapsed: 38.05s
* Train loss: 86.04   (RE: 55.09, KL: 30.95)
o Val.  loss: 91.63   (RE: 59.58, KL: 32.04)
--> Early stopping: 16/50 (BEST: 91.52)

beta: 1.0
Epoch: 183/2000, Time elapsed: 38.27s
* Train loss: 85.98   (RE: 55.03, KL: 30.95)
o Val.  loss: 91.51   (RE: 59.90, KL: 31.60)
--> Early stopping: 17/50 (BEST: 91.52)

->model saved<-
beta: 1.0
Epoch: 184/2000, Time elapsed: 39.63s
* Train loss: 85.96   (RE: 55.06, KL: 30.89)
o Val.  loss: 91.63   (RE: 59.55, KL: 32.08)
--> Early stopping: 0/50 (BEST: 91.51)

beta: 1.0
Epoch: 185/2000, Time elapsed: 38.12s
* Train loss: 85.94   (RE: 55.03, KL: 30.91)
o Val.  loss: 91.69   (RE: 59.65, KL: 32.04)
--> Early stopping: 1/50 (BEST: 91.51)

beta: 1.0
Epoch: 186/2000, Time elapsed: 39.19s
* Train loss: 85.95   (RE: 55.02, KL: 30.93)
o Val.  loss: 91.64   (RE: 59.70, KL: 31.94)
--> Early stopping: 2/50 (BEST: 91.51)

beta: 1.0
Epoch: 187/2000, Time elapsed: 39.37s
* Train loss: 85.87   (RE: 55.01, KL: 30.86)
o Val.  loss: 91.57   (RE: 59.85, KL: 31.73)
--> Early stopping: 3/50 (BEST: 91.51)

beta: 1.0
Epoch: 188/2000, Time elapsed: 39.25s
* Train loss: 85.88   (RE: 55.02, KL: 30.86)
o Val.  loss: 91.71   (RE: 59.83, KL: 31.88)
--> Early stopping: 4/50 (BEST: 91.51)

beta: 1.0
Epoch: 189/2000, Time elapsed: 39.47s
* Train loss: 85.88   (RE: 55.03, KL: 30.85)
o Val.  loss: 91.69   (RE: 59.63, KL: 32.06)
--> Early stopping: 5/50 (BEST: 91.51)

beta: 1.0
Epoch: 190/2000, Time elapsed: 39.75s
* Train loss: 85.80   (RE: 54.96, KL: 30.83)
o Val.  loss: 91.48   (RE: 59.67, KL: 31.81)
--> Early stopping: 6/50 (BEST: 91.51)

->model saved<-
beta: 1.0
Epoch: 191/2000, Time elapsed: 40.20s
* Train loss: 85.80   (RE: 54.95, KL: 30.85)
o Val.  loss: 91.54   (RE: 59.56, KL: 31.99)
--> Early stopping: 0/50 (BEST: 91.48)

beta: 1.0
Epoch: 192/2000, Time elapsed: 39.94s
* Train loss: 85.77   (RE: 54.91, KL: 30.86)
o Val.  loss: 91.56   (RE: 59.97, KL: 31.60)
--> Early stopping: 1/50 (BEST: 91.48)

beta: 1.0
Epoch: 193/2000, Time elapsed: 40.69s
* Train loss: 85.76   (RE: 54.93, KL: 30.83)
o Val.  loss: 91.45   (RE: 59.64, KL: 31.81)
--> Early stopping: 2/50 (BEST: 91.48)

->model saved<-
beta: 1.0
Epoch: 194/2000, Time elapsed: 39.80s
* Train loss: 85.72   (RE: 54.91, KL: 30.82)
o Val.  loss: 91.56   (RE: 59.72, KL: 31.84)
--> Early stopping: 0/50 (BEST: 91.45)

beta: 1.0
Epoch: 195/2000, Time elapsed: 40.64s
* Train loss: 85.66   (RE: 54.86, KL: 30.80)
o Val.  loss: 91.59   (RE: 59.98, KL: 31.60)
--> Early stopping: 1/50 (BEST: 91.45)

beta: 1.0
Epoch: 196/2000, Time elapsed: 38.99s
* Train loss: 85.70   (RE: 54.87, KL: 30.82)
o Val.  loss: 91.71   (RE: 59.61, KL: 32.10)
--> Early stopping: 2/50 (BEST: 91.45)

beta: 1.0
Epoch: 197/2000, Time elapsed: 39.40s
* Train loss: 85.69   (RE: 54.87, KL: 30.82)
o Val.  loss: 91.64   (RE: 59.68, KL: 31.97)
--> Early stopping: 3/50 (BEST: 91.45)

beta: 1.0
Epoch: 198/2000, Time elapsed: 39.22s
* Train loss: 85.67   (RE: 54.86, KL: 30.80)
o Val.  loss: 91.48   (RE: 59.51, KL: 31.96)
--> Early stopping: 4/50 (BEST: 91.45)

beta: 1.0
Epoch: 199/2000, Time elapsed: 37.98s
* Train loss: 85.64   (RE: 54.86, KL: 30.78)
o Val.  loss: 91.59   (RE: 59.73, KL: 31.86)
--> Early stopping: 5/50 (BEST: 91.45)

beta: 1.0
Epoch: 200/2000, Time elapsed: 38.68s
* Train loss: 85.60   (RE: 54.83, KL: 30.77)
o Val.  loss: 91.66   (RE: 59.79, KL: 31.87)
--> Early stopping: 6/50 (BEST: 91.45)

beta: 1.0
Epoch: 201/2000, Time elapsed: 39.44s
* Train loss: 85.57   (RE: 54.80, KL: 30.77)
o Val.  loss: 91.46   (RE: 59.70, KL: 31.76)
--> Early stopping: 7/50 (BEST: 91.45)

beta: 1.0
Epoch: 202/2000, Time elapsed: 39.09s
* Train loss: 85.56   (RE: 54.79, KL: 30.77)
o Val.  loss: 91.38   (RE: 59.92, KL: 31.46)
--> Early stopping: 8/50 (BEST: 91.45)

->model saved<-
beta: 1.0
Epoch: 203/2000, Time elapsed: 40.29s
* Train loss: 85.55   (RE: 54.79, KL: 30.76)
o Val.  loss: 91.51   (RE: 60.09, KL: 31.42)
--> Early stopping: 0/50 (BEST: 91.38)

beta: 1.0
Epoch: 204/2000, Time elapsed: 40.35s
* Train loss: 85.53   (RE: 54.79, KL: 30.74)
o Val.  loss: 91.54   (RE: 59.72, KL: 31.82)
--> Early stopping: 1/50 (BEST: 91.38)

beta: 1.0
Epoch: 205/2000, Time elapsed: 40.22s
* Train loss: 85.52   (RE: 54.76, KL: 30.75)
o Val.  loss: 91.66   (RE: 59.79, KL: 31.86)
--> Early stopping: 2/50 (BEST: 91.38)

beta: 1.0
Epoch: 206/2000, Time elapsed: 40.17s
* Train loss: 85.46   (RE: 54.73, KL: 30.73)
o Val.  loss: 91.39   (RE: 59.69, KL: 31.70)
--> Early stopping: 3/50 (BEST: 91.38)

beta: 1.0
Epoch: 207/2000, Time elapsed: 40.75s
* Train loss: 85.45   (RE: 54.74, KL: 30.71)
o Val.  loss: 91.58   (RE: 59.94, KL: 31.64)
--> Early stopping: 4/50 (BEST: 91.38)

beta: 1.0
Epoch: 208/2000, Time elapsed: 39.39s
* Train loss: 85.44   (RE: 54.72, KL: 30.72)
o Val.  loss: 91.53   (RE: 59.86, KL: 31.67)
--> Early stopping: 5/50 (BEST: 91.38)

beta: 1.0
Epoch: 209/2000, Time elapsed: 38.68s
* Train loss: 85.41   (RE: 54.70, KL: 30.71)
o Val.  loss: 91.66   (RE: 59.64, KL: 32.02)
--> Early stopping: 6/50 (BEST: 91.38)

beta: 1.0
Epoch: 210/2000, Time elapsed: 39.84s
* Train loss: 85.40   (RE: 54.68, KL: 30.72)
o Val.  loss: 91.57   (RE: 59.71, KL: 31.87)
--> Early stopping: 7/50 (BEST: 91.38)

beta: 1.0
Epoch: 211/2000, Time elapsed: 39.31s
* Train loss: 85.38   (RE: 54.68, KL: 30.70)
o Val.  loss: 91.74   (RE: 59.76, KL: 31.98)
--> Early stopping: 8/50 (BEST: 91.38)

beta: 1.0
Epoch: 212/2000, Time elapsed: 39.27s
* Train loss: 85.35   (RE: 54.65, KL: 30.70)
o Val.  loss: 91.57   (RE: 59.73, KL: 31.84)
--> Early stopping: 9/50 (BEST: 91.38)

beta: 1.0
Epoch: 213/2000, Time elapsed: 39.02s
* Train loss: 85.33   (RE: 54.65, KL: 30.67)
o Val.  loss: 91.55   (RE: 59.87, KL: 31.68)
--> Early stopping: 10/50 (BEST: 91.38)

beta: 1.0
Epoch: 214/2000, Time elapsed: 38.88s
* Train loss: 85.33   (RE: 54.66, KL: 30.67)
o Val.  loss: 91.39   (RE: 59.63, KL: 31.76)
--> Early stopping: 11/50 (BEST: 91.38)

beta: 1.0
Epoch: 215/2000, Time elapsed: 39.09s
* Train loss: 85.27   (RE: 54.61, KL: 30.65)
o Val.  loss: 91.44   (RE: 59.76, KL: 31.67)
--> Early stopping: 12/50 (BEST: 91.38)

beta: 1.0
Epoch: 216/2000, Time elapsed: 39.40s
* Train loss: 85.27   (RE: 54.59, KL: 30.68)
o Val.  loss: 91.48   (RE: 60.06, KL: 31.42)
--> Early stopping: 13/50 (BEST: 91.38)

beta: 1.0
Epoch: 217/2000, Time elapsed: 39.77s
* Train loss: 85.25   (RE: 54.61, KL: 30.64)
o Val.  loss: 91.54   (RE: 59.76, KL: 31.78)
--> Early stopping: 14/50 (BEST: 91.38)

beta: 1.0
Epoch: 218/2000, Time elapsed: 39.09s
* Train loss: 85.25   (RE: 54.60, KL: 30.65)
o Val.  loss: 91.65   (RE: 59.89, KL: 31.76)
--> Early stopping: 15/50 (BEST: 91.38)

beta: 1.0
Epoch: 219/2000, Time elapsed: 40.94s
* Train loss: 85.23   (RE: 54.59, KL: 30.64)
o Val.  loss: 91.61   (RE: 59.99, KL: 31.62)
--> Early stopping: 16/50 (BEST: 91.38)

beta: 1.0
Epoch: 220/2000, Time elapsed: 40.25s
* Train loss: 85.18   (RE: 54.56, KL: 30.62)
o Val.  loss: 91.53   (RE: 59.73, KL: 31.80)
--> Early stopping: 17/50 (BEST: 91.38)

beta: 1.0
Epoch: 221/2000, Time elapsed: 40.34s
* Train loss: 85.20   (RE: 54.55, KL: 30.64)
o Val.  loss: 91.55   (RE: 59.67, KL: 31.88)
--> Early stopping: 18/50 (BEST: 91.38)

beta: 1.0
Epoch: 222/2000, Time elapsed: 38.54s
* Train loss: 85.15   (RE: 54.52, KL: 30.63)
o Val.  loss: 91.44   (RE: 60.02, KL: 31.42)
--> Early stopping: 19/50 (BEST: 91.38)

beta: 1.0
Epoch: 223/2000, Time elapsed: 39.86s
* Train loss: 85.16   (RE: 54.52, KL: 30.65)
o Val.  loss: 91.39   (RE: 59.87, KL: 31.52)
--> Early stopping: 20/50 (BEST: 91.38)

beta: 1.0
Epoch: 224/2000, Time elapsed: 39.61s
* Train loss: 85.10   (RE: 54.50, KL: 30.61)
o Val.  loss: 91.62   (RE: 59.69, KL: 31.92)
--> Early stopping: 21/50 (BEST: 91.38)

beta: 1.0
Epoch: 225/2000, Time elapsed: 36.06s
* Train loss: 85.11   (RE: 54.49, KL: 30.62)
o Val.  loss: 91.72   (RE: 60.05, KL: 31.67)
--> Early stopping: 22/50 (BEST: 91.38)

beta: 1.0
Epoch: 226/2000, Time elapsed: 36.65s
* Train loss: 85.11   (RE: 54.47, KL: 30.64)
o Val.  loss: 91.57   (RE: 59.93, KL: 31.64)
--> Early stopping: 23/50 (BEST: 91.38)

beta: 1.0
Epoch: 227/2000, Time elapsed: 34.58s
* Train loss: 85.06   (RE: 54.46, KL: 30.60)
o Val.  loss: 91.45   (RE: 60.02, KL: 31.43)
--> Early stopping: 24/50 (BEST: 91.38)

beta: 1.0
Epoch: 228/2000, Time elapsed: 34.39s
* Train loss: 85.06   (RE: 54.43, KL: 30.63)
o Val.  loss: 91.54   (RE: 59.79, KL: 31.75)
--> Early stopping: 25/50 (BEST: 91.38)

beta: 1.0
Epoch: 229/2000, Time elapsed: 34.67s
* Train loss: 85.03   (RE: 54.43, KL: 30.60)
o Val.  loss: 91.50   (RE: 59.85, KL: 31.65)
--> Early stopping: 26/50 (BEST: 91.38)

beta: 1.0
Epoch: 230/2000, Time elapsed: 36.69s
* Train loss: 85.03   (RE: 54.41, KL: 30.61)
o Val.  loss: 91.53   (RE: 59.79, KL: 31.74)
--> Early stopping: 27/50 (BEST: 91.38)

beta: 1.0
Epoch: 231/2000, Time elapsed: 36.61s
* Train loss: 85.00   (RE: 54.41, KL: 30.59)
o Val.  loss: 91.52   (RE: 59.73, KL: 31.79)
--> Early stopping: 28/50 (BEST: 91.38)

beta: 1.0
Epoch: 232/2000, Time elapsed: 34.21s
* Train loss: 84.99   (RE: 54.40, KL: 30.59)
o Val.  loss: 91.41   (RE: 59.69, KL: 31.71)
--> Early stopping: 29/50 (BEST: 91.38)

beta: 1.0
Epoch: 233/2000, Time elapsed: 36.24s
* Train loss: 84.98   (RE: 54.40, KL: 30.58)
o Val.  loss: 91.49   (RE: 59.99, KL: 31.49)
--> Early stopping: 30/50 (BEST: 91.38)

beta: 1.0
Epoch: 234/2000, Time elapsed: 33.51s
* Train loss: 84.95   (RE: 54.39, KL: 30.56)
o Val.  loss: 91.54   (RE: 59.96, KL: 31.58)
--> Early stopping: 31/50 (BEST: 91.38)

beta: 1.0
Epoch: 235/2000, Time elapsed: 36.67s
* Train loss: 84.93   (RE: 54.34, KL: 30.59)
o Val.  loss: 91.46   (RE: 59.72, KL: 31.74)
--> Early stopping: 32/50 (BEST: 91.38)

beta: 1.0
Epoch: 236/2000, Time elapsed: 37.53s
* Train loss: 84.92   (RE: 54.34, KL: 30.58)
o Val.  loss: 91.60   (RE: 60.05, KL: 31.55)
--> Early stopping: 33/50 (BEST: 91.38)

beta: 1.0
Epoch: 237/2000, Time elapsed: 38.00s
* Train loss: 84.89   (RE: 54.35, KL: 30.54)
o Val.  loss: 91.51   (RE: 59.81, KL: 31.70)
--> Early stopping: 34/50 (BEST: 91.38)

beta: 1.0
Epoch: 238/2000, Time elapsed: 37.93s
* Train loss: 84.86   (RE: 54.34, KL: 30.53)
o Val.  loss: 91.58   (RE: 59.91, KL: 31.66)
--> Early stopping: 35/50 (BEST: 91.38)

beta: 1.0
Epoch: 239/2000, Time elapsed: 37.52s
* Train loss: 84.85   (RE: 54.29, KL: 30.56)
o Val.  loss: 91.57   (RE: 59.85, KL: 31.73)
--> Early stopping: 36/50 (BEST: 91.38)

beta: 1.0
Epoch: 240/2000, Time elapsed: 38.15s
* Train loss: 84.83   (RE: 54.28, KL: 30.55)
o Val.  loss: 91.42   (RE: 59.83, KL: 31.59)
--> Early stopping: 37/50 (BEST: 91.38)

beta: 1.0
Epoch: 241/2000, Time elapsed: 37.41s
* Train loss: 84.81   (RE: 54.28, KL: 30.53)
o Val.  loss: 91.44   (RE: 59.99, KL: 31.45)
--> Early stopping: 38/50 (BEST: 91.38)

beta: 1.0
Epoch: 242/2000, Time elapsed: 38.52s
* Train loss: 84.81   (RE: 54.25, KL: 30.56)
o Val.  loss: 91.64   (RE: 60.12, KL: 31.51)
--> Early stopping: 39/50 (BEST: 91.38)

beta: 1.0
Epoch: 243/2000, Time elapsed: 39.44s
* Train loss: 84.80   (RE: 54.27, KL: 30.53)
o Val.  loss: 91.43   (RE: 60.03, KL: 31.40)
--> Early stopping: 40/50 (BEST: 91.38)

beta: 1.0
Epoch: 244/2000, Time elapsed: 42.10s
* Train loss: 84.76   (RE: 54.21, KL: 30.55)
o Val.  loss: 91.58   (RE: 59.78, KL: 31.81)
--> Early stopping: 41/50 (BEST: 91.38)

beta: 1.0
Epoch: 245/2000, Time elapsed: 40.46s
* Train loss: 84.74   (RE: 54.20, KL: 30.54)
o Val.  loss: 91.47   (RE: 60.02, KL: 31.45)
--> Early stopping: 42/50 (BEST: 91.38)

beta: 1.0
Epoch: 246/2000, Time elapsed: 41.58s
* Train loss: 84.73   (RE: 54.20, KL: 30.52)
o Val.  loss: 91.46   (RE: 59.89, KL: 31.56)
--> Early stopping: 43/50 (BEST: 91.38)

beta: 1.0
Epoch: 247/2000, Time elapsed: 40.79s
* Train loss: 84.72   (RE: 54.19, KL: 30.53)
o Val.  loss: 91.63   (RE: 60.05, KL: 31.58)
--> Early stopping: 44/50 (BEST: 91.38)

beta: 1.0
Epoch: 248/2000, Time elapsed: 41.78s
* Train loss: 84.70   (RE: 54.19, KL: 30.51)
o Val.  loss: 91.55   (RE: 59.67, KL: 31.88)
--> Early stopping: 45/50 (BEST: 91.38)

beta: 1.0
Epoch: 249/2000, Time elapsed: 42.92s
* Train loss: 84.68   (RE: 54.16, KL: 30.52)
o Val.  loss: 91.52   (RE: 59.91, KL: 31.61)
--> Early stopping: 46/50 (BEST: 91.38)

beta: 1.0
Epoch: 250/2000, Time elapsed: 42.22s
* Train loss: 84.66   (RE: 54.14, KL: 30.52)
o Val.  loss: 91.41   (RE: 59.90, KL: 31.52)
--> Early stopping: 47/50 (BEST: 91.38)

beta: 1.0
Epoch: 251/2000, Time elapsed: 41.37s
* Train loss: 84.66   (RE: 54.15, KL: 30.51)
o Val.  loss: 91.60   (RE: 59.78, KL: 31.82)
--> Early stopping: 48/50 (BEST: 91.38)

beta: 1.0
Epoch: 252/2000, Time elapsed: 40.78s
* Train loss: 84.62   (RE: 54.12, KL: 30.50)
o Val.  loss: 91.62   (RE: 59.95, KL: 31.67)
--> Early stopping: 49/50 (BEST: 91.38)

beta: 1.0
Epoch: 253/2000, Time elapsed: 41.60s
* Train loss: 84.63   (RE: 54.10, KL: 30.53)
o Val.  loss: 91.58   (RE: 60.00, KL: 31.58)
--> Early stopping: 50/50 (BEST: 91.38)

Test lower-bound value 90.73 in time: 0.77s
Train lower-bound value 0.00 in time: 0.00s
0.00%
1.00%
2.00%
3.00%
4.00%
5.00%
6.00%
7.00%
8.00%
9.00%
10.00%
11.00%
12.00%
13.00%
14.00%
15.00%
16.00%
17.00%
18.00%
19.00%
20.00%
21.00%
22.00%
23.00%
24.00%
25.00%
26.00%
27.00%
28.00%
29.00%
30.00%
31.00%
32.00%
33.00%
34.00%
35.00%
36.00%
37.00%
38.00%
39.00%
40.00%
41.00%
42.00%
43.00%
44.00%
45.00%
46.00%
47.00%
48.00%
49.00%
50.00%
51.00%
52.00%
53.00%
54.00%
55.00%
56.00%
57.00%
58.00%
59.00%
60.00%
61.00%
62.00%
63.00%
64.00%
65.00%
66.00%
67.00%
68.00%
69.00%
70.00%
71.00%
72.00%
73.00%
74.00%
75.00%
76.00%
77.00%
78.00%
79.00%
80.00%
81.00%
82.00%
83.00%
84.00%
85.00%
86.00%
87.00%
88.00%
89.00%
90.00%
91.00%
92.00%
93.00%
94.00%
95.00%
96.00%
97.00%
98.00%
99.00%
Test log_likelihood value 84.48 in time: 2641.21s
Train log_likelihood value 0.00 in time: 0.00s
FINAL EVALUATION ON TEST SET
LogL (TEST): 84.48
LogL (TRAIN): 0.00
ELBO (TEST): 90.73
ELBO (TRAIN): 0.00
Loss: 90.77
RE: 59.33
KL: 31.44
✅ Training finished in 210.90 minutes. Log saved to: snapshots/2026-01-22 04:27:06_static_mnist_hvae_2level_flowprior_L8_H128_z1_40_seed420/eval_results/runtime.txt
-=-=-=-=-=-=-=-=-=-=-=-=-=-=-=-=-=-=-=-=-=-=-=-=-=-=-=-=-=-=-=-=-=-=-=-=-=-=-=-=-=-=-=-=-=-=-=-=-=-=-=-=-=-=-=-
